标题,来源,时间,问题,回答
咨询,cc*** (江苏),2008-06-25 11:02,我是江苏考生分数为349+33物理B+化学B请问可否填报贵校？,请将自己的分数和一本线按照７５０分制换算，若高出３０分以上则把握较大。
口试,ji***oshen1 (江苏),2008-06-25 10:56,报贵校外语专业是否需要面试、口试？,只需要贵省高招办组织的外语口试成绩。
录取几率,li***ng (天津),2008-06-25 10:54,我是天津市理科考生，成绩高出一本线75分，第一志愿填报贵校，且服从调剂，有多大几率被录取?什么时间开始录取?谢谢老师.,分数不错，但录取分数现在还无法预测，还请参考我校往年录取情况，可以与当年一本线做比较。
老师您好！,js*** (江苏),2008-06-25 10:53,我是今年江苏文科考生，总分399（365+34附加分），英语108（总120），选测为历史A，政治A+，请问老师，能否被贵校录取？谢谢！怎么与老师联系？我的电话：13866889219,分数不错，但录取分数现在还无法预测，还请参考我校往年录取情况，可以与当年一本线做比较。
咨询,ji***oshen1 (江苏),2008-06-25 10:53,我是江苏０８文科考生，总分３３６，附加分３４。我想报考贵校外语专业，我的英语是１０５分（满分１２０），选修A+B+。请问贵校能否根据单科成绩特招？或有优惠政策？请问贵校今年在江苏招生，排名3万1千多的考生是否有希望？谢谢！,[请把自己的成绩和一本线按照750分制换算，换算后比一本线高30分以上把握较大，我校不设单科特招，参加我校自主选拔录取测试，经我校审核确定获录取加分优惠的上海考生，投档进我校后，加相应分值参与专业录取；确定为“自荐生”的考生，投档进我校后，加5分参与专业录取；凡第一专业志愿填报阿拉伯语、希伯莱语、越南语、乌克兰语专业的上海考生，投档进我校后，享受加5分的优惠，此项加分仅对第一专业志愿有效；我校认可市教委、考试院有关加分和优先录取的政策，但对于加分值大于20分的，我校录取时一律认作20分。我校录取分数段在江苏一般为1万至2万名以内。
咨询,li***5 (贵州),2008-06-25 10:53,我是贵州理科考试，今年高考成绩595(含10分加分)，今年一本521，我的分数报贵校行吗?,录取分数现在还无法预测，还请参考我校往年录取情况，可以与当年一本线做比较。
分数问题,58*** (广西),2008-06-25 10:49,我是广西理科考生，高考分542分，重点线501分这样的分上贵校希望大吗?谢谢!,录取分数现在还无法预测，还请参考我校往年录取情况，可以与当年一本线做比较。
紧急！,ji***oshen1 (江苏),2008-06-25 10:49,我是江苏０８文科考生，总分３３６，附加分３４。我想报考贵校外语专业，我的英语是１０５分（满分１２０），选修A+B+。刚才有提问过，但是不太明白。1请问我的总分会不会太低？2请问贵校能否根据单科成绩特招？或有优惠政策？3关于参考往年录取分数线，能否再具体一点，怎样参考，或参考哪些方面？4请问贵校今年在江苏招生，排名3万1千多的考生是否有希望？谢谢！麻烦回答一下。,已作过回答，请参考前面的答案
ask,ji***oshen1 (江苏),2008-06-25 10:45,我是江苏０８文科考生，总分３３６，附加分３４。我想报考贵校外语专业，我的英语是１０５分（满分１２０），选修A+B+。刚才有提问过，但是不太明白。1请问我的总分会不会太低？2请问贵校能否根据单科成绩特招？或有优惠政策？3关于参考往年录取分数线，能否再具体一点，怎样参考，或参考哪些方面？4请问贵校今年在江苏招生，排名3万1千多的考生是否有希望？谢谢！,已作过回答，请参考前面的答案。
老师您好,yj*** (广西),2008-06-25 10:44,我是广西考生，考了601分，广西一本线528分，超了73分，排名134位，请问报考上外怎么样？热门专业录取得到吗？,分数不错，但录取分数现在还无法预测，还请参考我校往年录取情况，可以与当年一本线做比较。为确保考生权利、尊重考生报考志向，我校在专业录取时，以分数优先，不设专业志愿级差分，因此建议你在填报专业志愿时大可将自己最喜欢、向往的专业放在第一专业。
咨询,90*** (福建),2008-06-25 10:39,我是福建文科考生约高分数线30分报考贵校录取的机会如何?另贵校在福建这三年来在福建是否有第一志愿不满的现象?,录取分数现在还无法预测，还请参考我校往年录取情况，可以与当年一本线做比较。
ask,ji***oshen1 (江苏),2008-06-25 10:39,我是江苏０８文科考生，总分３３６，附加分３４。我想报考贵校外语专业，我的英语是１０５分（满分１２０），选修A+B+。刚才有提问过，但是不太明白。1请问我的总分会不会太低？2请问贵校能否根据单科成绩特招？或有优惠政策？3关于参考往年录取分数线，能否再具体一点，怎样参考，或参考哪些方面？4请问贵校今年在江苏招生，排名3万1千多的考生是否有希望？谢谢！,[请把自己的成绩和一本线按照750分制换算，换算后比一本线高30分以上把握较大，我校不设单科特招，参加我校自主选拔录取测试，经我校审核确定获录取加分优惠的上海考生，投档进我校后，加相应分值参与专业录取；确定为“自荐生”的考生，投档进我校后，加5分参与专业录取；凡第一专业志愿填报阿拉伯语、希伯莱语、越南语、乌克兰语专业的上海考生，投档进我校后，享受加5分的优惠，此项加分仅对第一专业志愿有效；我校认可市教委、考试院有关加分和优先录取的政策，但对于加分值大于20分的，我校录取时一律认作20分。我校录取分数段在江苏一般为1万至2万名。
咨询,ru*** (浙江),2008-06-23 13:26,请问老师，贤达学院能本硕连读吗？可以出国吗？,不可以的。
青海口试,we*** (青海),2008-06-23 13:16,法语专业在青海口试是考核英语还是法语？是在本省口试，还是到学校口试．谢谢老师！,参加省高招办组织的英语口试。
广西考生,do*** (广西),2008-06-23 13:08,您好!我是广西考生，今年考试总分是544.加民族分是554分.我是理科生，曾经获得全国奥林匹克化学竞赛广西赛区一等奖.不知可否上我们学校的线?去年在广西的录取线是多少?我是女生.,我校去年在广西理科录取最低分为603，今年的录取情况难以预测，还请参考我校往年录取情况，可以与当年一本线做比较。
咨询,ru*** (浙江),2008-06-23 12:50,请问老师：浙江文科527分能进贤达经济人文学院吗,难以预测啊，还请参考往年录取情况，可以与当年三本、二本线做比较。http://zhaoban.shisu.edu.cn
咨询,hb*** (河北),2008-06-23 12:27,老师您辛苦了!我是河北一位理科考生.请问再高出重点线36分的情况下能否被贵校录取?谢谢!,分数不错，今年的具体情况实在难以预测，抱歉。
录取,qi*** (浙江),2008-06-23 12:26,浙江文科考生594。省排名816。报考贵校有希望吗？那对于专业的选择呢？,考分和排名蛮高，建议参考我校往年录取情况，可以与当年一本线做比较。为确保考生权利、尊重考生报考志向，我校在专业录取时，以分数优先，不设专业志愿级差分，因此建议你在填报专业志愿时大可将自己最喜欢、向往的专业放在第一专业。
ask,is***0 (浙江),2008-06-23 12:04,我浙江理科考生609，排名5225，进贵校有希望吗？大概可以报一个什么档次的专业？金融类、外语类的有希望吗,分数不错，但录取分数现在还无法预测，还请参考我校往年录取情况，可以与当年一本线做比较。为确保考生权利、尊重考生报考志向，我校在专业录取时，以分数优先，不设专业志愿级差分，因此建议你在填报专业志愿时大可将自己最喜欢、向往的专业放在第一专业。专业可以大胆报。
投档比例,ya***8 (浙江),2008-06-23 11:34,请问贵校投档比例是多少?(浙江文科),实行平行志愿的省市，投档比例将根据省招办的规定执行。
请问分差74有多大把握,th***s0116 (河北),2008-06-23 11:24,我是河北理科考生报考贵校有多大把握多谢,分差，是指高出一本线吗？那就很高了。
老师您辛苦,st***0 (贵州),2008-06-23 11:05,老师您好！听闻清华大学有自我推荐活动。请问贵校有自我推荐活动或预报志愿活动吗？若没有，那么我如何向学校推荐自己呢？谢谢。,我校也有网上自荐活动，但只针对招生人数较多的上海市。由于我校在其他省市招生计划都比较少，为保证公平、公正，没有实行此活动。
报考,li*** (内蒙古),2008-06-23 10:49,内蒙超一本29分是否有希望报考本校？对外语有特殊要求吗？是否可以转专业？,希望当然有，还请参考我校往年录取统计。我校任一专业对外语单科成绩都无最低要求。我校是一所多科性外语类大学，由于语言学习的特殊性和高要求的专业设置，学校不允许学生转系或转专业。
能否被录取,ya***8 (浙江),2008-06-23 10:32,浙江文科591分，超一本41分，总分排名1018名，是否有希望上贵校?专业选择幅度有多大?,分数蛮高的，希望蛮大。为确保考生权利、尊重考生报考志向，我校在专业录取时，以分数优先，不设专业志愿级差分，因此建议考生将自己最喜欢、向往的专业放在第一专业。
咨询,do***g (贵州),2008-06-23 10:30,我是贵州文科考生，高考成绩为620分，能上贵校吗?,分数蛮高的，还请参考我校往年录取情况，可以与当年一本线做比较。
请问,il*** (甘肃),2008-06-23 10:28,老师您好，我是甘肃文科考生，高考成绩为599分，预计一本分数线为560分左右，非常喜欢贵校。请问报考贵校可能性大不大？谢谢您。,分数不错，现在还无法预测录取情况，非常抱歉，还请参考我校往年录取情况，可以与当年一本线做比较。
咨询,yu*** (浙江),2008-06-23 10:25,浙江文科582，上外自主招生时加分10分，是否可以被贵校录取,目前还无法预测，专业选择时加分有较大优势。
咨询,in***zen (贵州),2008-06-11 14:42,请问贵校一般理科录取分数比一本线高出多少？如果进校后对自己所学的专业不满意，可不可以换？换专业有什么要求和限制？谢谢,我校在各省市录取时，录取线一般高出重点线40分左右。还请参考往年的录取情况。由于外语学习的特殊性，我校不允许转专业。
我估580,wa***ng (贵州),2008-06-11 14:41,请问贵校在贵州招的日语专业生中我估580可能性有多大?,非常抱歉，现在无法预测。
咨询,hj*** (天津),2008-06-11 14:24,请问贵校在天津招二本吗，招的话分数线大概是多少，谢谢,我校只有一本。
您好,sh***9999 (河南),2008-06-11 13:44,贵校每月的平均生活费是多少？,600左右，没有想象的那么多的。
文科生,sh***9999 (河南),2008-06-11 13:41,610能否被录取？文科。入校后能否调专业？谢谢/,录取分数现在无法预测，考分不错。我校由于外语学习的特殊性，不允许转专业。
文科生,sh***9999 (河南),2008-06-11 13:41,610能否被录取？文科。入校后能否调专业？谢谢/,分数不错哦。我校不允许转专业的。
报考咨询,ad*** (天津),2008-06-11 13:06,您好，请问天津理科560到570分之前报考您的学校有可能性么?,考分不错，但无法预测录取分数的。
咨询,ja***y (重庆),2008-06-11 12:49,请问一般在重庆录取比一本线高多少？？对外语有没有特别要求？？,一般高30-40分左右，每年都有可能不同，无法准确预测的。对外语没有特殊要求。
咨询,78*** (青海),2008-06-11 12:07,我是西藏汉族的一名文科考生，今估分590能否被贵校录取，谢谢,分数很高，但录取情况现在无法预测的。
录取,fo***s (天津),2008-06-11 12:02,您好我是天津理科考生预估高出一本线70-80分能否报考德语专业,分数很高的，但具体专业实难预测。
你好！,sx*** (陕西),2008-06-11 11:41,贵校能否转专业，由专业级差吗,由于我校外语教学的特殊性，学校不允许转专业。录取时，专业间无级差分。
你好！,sx*** (陕西),2008-06-11 11:38,我是陕西的考生，理科560分报贵校德语专业，有录取的可能吗谢谢！,录取分数现在无法预测.
咨询,dq*** (黑龙江),2008-06-11 11:17,黑龙江文科560分能被贵校录取的比率大吗?,现在录取分数无法预测，还请参考我校往年在黑龙江的招生情况。
问题,jz*** (辽宁),2008-06-11 11:11,老师您好:请问2008年学校在辽宁省的提档比例和招生计划.谢谢!,我校分省市、分专业的招生计划可在我校招生网上浏览：http://zhaoban.shisu.edu.cn。由于今年辽宁省实行平行志愿，提档比例根据省高招办的规定执行。
加分,dz*** (内蒙古),2008-06-11 10:48,"贵校网上咨询回答:""我校认可省级教委，高招办规定的优惠政策"".是否指投档和专业录取时均认可?谢谢!",投档时省级高招办已计入总分的加分，专业录取时也一样认可。
关于专业,lv*** (辽宁),2008-06-11 10:32,辽宁文科估分609，包贵校有可能吗?贵校小于种最牛的是那一个?,录取分数现在无法准确预测。我校各语言类专业就业情况都非常好。
提档问题,zj*** (辽宁),2008-06-11 09:26,辽宁考生平行志愿按多少比例提档，有够分退档可能吗?,由于2008年辽宁本科A段实行平行志愿，提档比例根据省高招办规定执行，同时，为确保考生利益，与其他实行平行志愿的省市一样，在考生愿意服从所有专业调剂，并符合身体、思想品德等录取要求的前提下，实行进档即取，不退档的政策。
问问,pe***heng (陕西),2008-06-11 09:19,老师你好；我想问问上外对于大学退学重新参加高考的学生有无什么限制？？？我07年上完大学一年级退学后补习一年参加了08年的高考，陕西的；；估了678分文科。。想报上外，就是不知道有没有限制？,符合教育部招生录取相关规定的考生，填报志愿报考我校，符合我校招生章程的规定，达到我校录取分数线可被我校录取。
学位点,sj***g (辽宁),2008-06-10 16:36,你校有法学硕、博点吗？什么方向？多谢！,有外交学，国际关系学等方向的硕士点和博士点
再咨询,lu***68 (辽宁),2008-06-10 15:50,十分感谢老师刚才的回答！！还有如下问题敬请老师回答：１．贵校哪些专业较热门，哪些专业相对较冷？２．贵校近年各专业就业率如何？谢谢老师的回答！！,1.就业趋势瞬息万变，很难预测哪个专业是热门，哪个专业是冷门。2.上外就业形势一直不错，07年的本科就业率为96.55％
是否有希望？,lu***68 (辽宁),2008-06-10 15:31,老师:您好!我是辽宁文科考生家长.我的孩子估分590，请问是否有希望被录取?感谢老师！,很难预估，请参考一本线，一般比一本线高出40分左右
咨询,lu***68 (辽宁),2008-06-10 15:20,老师:您好!我是辽宁文科考生家长.我的孩子估分575，请问是否有希望被录取?十分感谢老师的回答!,比较危险，请慎重考虑。
河南,sh***841342 (河南),2008-06-10 15:12,透露一下理科大约要高出多少吧。万分感激……,平均高出一本线40－50分左右
请问,68*** (贵州),2008-06-10 13:12,您好，我是贵州的文科考生，想请问一下要到贵校就读需要满足那些条件！,成绩到达贵省一本线40分以上
河南文科625,sh***9999 (河南),2008-06-10 11:31,文科625能否被翻译专业录取？谢谢,请根据一本线填报，本校一般比一本线高出40－50分左右
报考咨询,ai*** (河南),2008-06-10 10:41,我是河南洛阳考生，英语成绩比较好，请问理科生要报考贵校要比当地一本线高出多少分才有可能被录取?,平均比一本线高出40分左右。
江苏选修科等级要求,gl***lue (江苏),2008-06-10 10:28,老师，您好：请问贵校今年在江苏省选修科目的报考要求?江苏省内默认报考本科要求是2B，并未对本一批次单独要求。谢谢,我校没有特殊要求，请遵循贵省高招办的报考要求。
关于录取,ch***zi (贵州),2008-06-10 09:35,请问贵州文科生要高出一本线多少分才有望被贵校录取,我校在各省市招生，录取分平均高于当地一本线约40分。
上外在黑龙江有专科的招生计划吗？理科,ch***g0 (黑龙江),2008-06-09 11:03,上外在黑龙江有专科的招生计划吗？分数多少？,我校只在上海市有专科招生计划。
zhuanye,mu***uang (山东),2008-06-06 14:00,老师你好：我想问：如果报考贵校，专业服从调剂，会不会出现我被调剂到，没有在我省“有招生专业计划的专业”？比如我填报在我省有计划的报经济学专业，会不会把我调剂到在我省没有计划的国际政治专业？谢谢,不会。
专业,lo*** (吉林),2008-06-23 10:22,老师您好，我获得了河北省三好生加分资格加10分，假如我考590，加分后被贵校录取，在分专业是是按590还是600？谢谢,600.对于省级高招办投档时投档分中已包含的优惠录取加分，我校在专业录取时也认可。
咨询,in***zen (贵州),2008-06-23 10:09,请问贵校以往理科具体专业的录取分数是多少？（如法学、翻译）请问如果被贵校录取，户口能不能迁入学校所在地？,由于我校在各省市招生计划较少，并不是每个专业每年在某省市都有招生计划，若有，每个专业也仅有1-2名，录取分数受考生填报影响很大，因此没做相关统计，以免误导考生。考生可将户口迁入我校。
咨询,fu***ming (河北),2008-06-23 09:25,河北前多少名有望被贵校录取？,名次和录取没有必然联系，录取情况目前无法预测。
专业录取,gu*** (四川),2008-06-22 16:56,贵校录取无专业分差，假如我报的在第一专业落选，但分数比其他一志原的考分高，本人的二志原能被录取吗？,录取考分高的学生。你会被录取至该专业。由于我校不设专业级差分，因此建议考生将自己最喜欢、向往的专业放在第一专业。
老师好,zh***cheng (贵州),2008-06-22 14:40,老师您好，我是贵州考生，文科638分进贵校有希望吗？,分数很高，还请参考我校往年录取情况吧。
能否预测?,ny*** (云南),2008-06-22 12:49,老师，今年云南文科615左右报考贵校希望大否？另外贵校对往届生有无什么限制？另外今年文科有无可能出现冷门？谢谢！！,无法预测的。对往届生没有限制。
咨询,yx*** (云南),2008-06-21 14:06,老师您好！我是云南的一位考生，如果报考贵校要高出一本线几分？谢谢！,每年都会不同，还请参考我校往年录取情况，可以与当年一本线做比较。http://zhaoban.shisu.edu.cn。
加分,yj*** (广西),2008-06-21 09:55,少数民族加分算进安排专业没有,算的。
6A加分,js*** (江苏),2008-06-20 16:14,江苏考生选测和必测6A的加10分投档，而中央财大等北京院校按实考分排序录取(不加10分)，在实考分相同时优先录取6A，贵校如何操作?谢谢.,对于省级高招办投档时已加入投档分的优惠加分政策，我校在专业录取时也认同。
四川招生,zh***iu (四川),2008-06-20 14:14,今年名额大约会是多少，高出省控线多少会比较适合报考贵校,非延考9名，延考3名。还请参考我校往年录取情况，可以与当年一本线做比较。
报考咨询,bo*** (海南),2008-06-20 10:11,能否提供2007年上外在海南文科的分专业分数线招生网上只有录取线另能否提供08年在海南的招生咨询老师的联系方式和咨询计划谢谢老师回答,[由于我校在各省市招生计划较少，并不是每个专业每年在某省市都有招生计划，若有，每个专业也仅有1-2名，录取分数受考生填报影响很大，因此没做相关统计，以免误导考生。我校专业录取时不设级差分，因此建议考生将自己最喜欢、向往的专业放在第一专业。为保证招生录取工作的公平、公正，我校不外派相关工作人员。
报考分数,li***07326 (广西),2008-06-20 09:56,请问老师，我的分数大概在一本线，报考贵校小语种专业有没有希望?,难以预测。还请参考我校往年录取情况，可以与当年一本线做比较。
请教,dh*** (浙江),2008-06-19 10:49,我是浙江宁波的考生，专业服从是否进档即取？谢谢。,对于实行平行志愿的省市，为确保考生利益，在考生愿意服从所有专业调剂，并符合身体、思想品德等录取要求的前提下，实行进档即取，不退档的政策。
咨询,wb*** (四川),2008-06-19 09:58,四川，今年590(理)英语132，报该校行吗,难以预测的，还请参考我校往年录取情况，可以与当年一本线做比较。
咨询,nj***iu (江苏),2008-06-18 15:38,老师，我是江苏考生.请问等级6A在投挡分上是否有加份，在专业等级分上是否有加分.谢谢,对于省级高招办投档时已加入投档分的优惠加分政策，我校在专业录取时也认同。
急！！！,ti***hui (天津),2008-06-15 13:17,我是天津考生预估585高出本地预计分数线60分左右，报考贵校，服从专业调剂，能有把握被录取吗？谢谢,考分很高的，但录取情况目前无法预测，还请参考我校往年的录取统计。http://zhaoban.shisu.edu.cn
报考咨询,qi***g (辽宁),2008-06-15 11:00,您好，我是辽宁文科考生，估分６００，报考贵校外语专业是否能被录取？对女生是否有身高要求？,非常抱歉，录取情况现在无法预测，至于专业更加难以估计。我校专业录取时不设级差分，因此建议考生将自己最喜欢、向往的专业放在第一专业。我校各专业对身高都无要求。
特殊情况,13*** (山东),2008-06-15 10:40,老师您好！我是一名刚刚参加完高考的高三文科学生，由于高三一年生病的缘故，一直在养病，并未在校听课，也为在家系统复习，只参加了高三的几次摸底考试，高考后保守估计分数在430-450分左右。其实，我是一名很要强的学生，中考成绩优秀，高中一直拿着全额奖学金，学习基础扎实牢固，所以在并未进行高三复习的基础上，考到这个分数。我自己当然希望能上本科，但如若不能，我也希望能上一所可以专科升本科的院校，我选择的专业是会计学，请老师帮忙分析一下我的情况，看看我能否升入贵校。注：由于身体和心理状态已调节到最高点，相信我在贵校一定会绽放出光彩，请您给与我这次宝贵的机会，我一定不会让您失望。,非常同情你的遭遇。但，我校专科只在上海市有招生计划，而且没有你喜欢的会计学。非常遗憾。
请问,hu***009 (河南),2008-06-15 10:23,请问贵校专业极差是多少？入校后是否可转专业？是否有男女生比例？是否承认各种加分？,我校专业录取时不设级差分，因此建议考生将自己最喜欢、向往的专业放在第一专业。由于外语教学的特殊性、学习的艰巨性，我校不允许学生转专业。录取时没有男女比例，一视同仁。对于省级高招办制定的优惠录取政策我校认可。
请问,hu***009 (河南),2008-06-15 10:02,请问贵校专业极差是多少？入校后是否可转专业？是否有男女生比例？是否承认各种加分？,我校专业录取时不设级差分，因此建议考生将自己最喜欢、向往的专业放在第一专业。由于外语教学的特殊性、学习的艰巨性，我校不允许学生转专业。录取时没有男女比例，一视同仁。对于省级高招办制定的优惠录取政策我校认可。
江苏6A,zl*** (江苏),2008-06-15 09:20,江苏考生选修2A必修4A，有加分吗？,没有的。
能否录取,li***ng (天津),2008-06-14 16:52,我是天津市理科考生，高出重点线70-75分，能否有把握被录取?,分数很高啊，希望很大，但录取情况是无法现在确定的。
08招生计划,xi***5 (山东),2008-06-14 16:35,能否提供08山东招生计划,请浏览我校招生网：http://zhaoban.shisu.edu.cn/content.php?id=7159。
外语成绩,ms*** (吉林),2008-06-14 16:31,学校对外语成绩有要求吗？能转专业吗？可不可以学第二学位？,我校各专业对外语成绩都无特殊要求。由于外语教学的特殊性，外语学习的艰巨性，我校不允许学生转专业。但对于学有余力的同学，我们鼓励辅修第二学位或第二专业，选修范围除我校开设的专业外还可修读松江大学园区其他院校的专业，并可辅修上海市东北片大学的辅修课程（复旦、同济、上财）。
