标题,来源,时间,问题,回答
咨询,rl*** (浙江),2011-06-25 13:14,老师您好。我是浙江文科考生，文科第一批提前批的考生成绩有没有什么要求。我的总分只有573，英语成绩是134，可不可以优先考虑？,提前批也是根据考生高考成绩择优录取的。
咨询录取,51*** (河南),2011-06-25 12:14,老师您好：我是河南安阳的文科考生，我们省的重点线是562，我的分数是582，想报考贵校的德语和法语，不知道能录取不？麻烦您,按往年统计，你可以尝试A志愿填报我校，现在专业录取预测。
咨询,dy*** (山东),2011-06-25 12:14,老师您好：我是山东理科考生，今年高考成绩605分，不知能否报考贵校。再者，贵校在山东有提前批招生计划吗？,分数不错，我校今年在山东有提前批计划，欢迎考生提前批和本一批同时报考我校。
能否录取及专业咨询,sh*** (广西),2011-06-25 12:07,我是广西的文科考生，高考分数574，超过一本线55分，请问能否被贵校录取？贵校的多语种国际新闻人才培养计划中，新闻专业的学生比较有优势还是小语种专业的？入学的第一学年即需提出申请吗？,分数不错，可以A志愿报考我校。多语种国际新闻人才培养计划需一年后申请。
咨询,69*** (江苏),2011-06-25 12:03,你好！请问江苏理科考生排名多少可以报考贵校？谢谢！,去年的排名在4000名左右。
咨询,zh***ing88 (浙江),2011-06-25 11:56,老师，我是浙江理科考生，分数629，排名5307，可以进贵校吗？还有贵校是1:1录取的吗？,分数不错。按去年的统计，可以A志愿报考我校！平行志愿投档比例在1：1.05左右。
咨询,zh***ing88 (浙江),2011-06-25 11:53,老师，我是浙江理科考生，分数629，排名5306可以进贵校吗？还有贵校是1:1录取的吗？,已经回答。
山东理科,fl*** (山东),2011-06-25 11:40,语文131分，英语145分。总分一般，内否报贵校？大约超一本线多少分有望录取？,我校录取还是以高考总分为主要依据。往年超一本线30分左右吧，每年情况都有可能不同。
高考报考咨询,du*** (河北),2011-06-25 11:39,老师好，我是2011年河北文科考生，此次文科一本分数线562，我考了602分请问下面哪个专业录取可能性大：德语，西班牙语，英语，日语,分数还是不错的。但专业录取情况现在是无法预测的，我校专业录取政策是分数优先，不设级差分，考生可将最喜欢的专业填在第一专业志愿。
咨询,si*** (陕西),2011-06-25 11:36,老师你好！我是陕西文史类考生，请问贵校今年在陕西有小语种招生吗？如果有，都是什么专业？是不是在提前批？谢谢！,我校小语种专业在陕西有招生计划，部分被安排在提前批，考生可提前批和本一批都同时报考我校。详细可浏览我校招生网，http://zhaoban.shisu.edu.cn，并请以省招办公布的为准。
浙江,ql*** (浙江),2011-06-25 11:07,浙江实行平行志愿，请问实行平行志愿的省份是进档不退，不存在投进后退档的危险吗？,在实行平行志愿的批次，考生愿意调剂，投档进我校就不会退档。
咨询,sp*** (内蒙古),2011-06-25 10:55,老师您好，请问贵校新闻学专业是重点建设专业吗，如果报这专业入校后可以修双学位或转专业吗？谢谢老师,可以申请英语作为辅修第二专业，我校不可转专业。
小语种,er*** (陕西),2011-06-26 15:30,我是陕西文科考生，615分，想报考贵校的小语种有希望吗？谢谢,我校在陕西省将部分小语种专业安排在提前批录取，考生若有志向学习小语种专业，可在提前批报考我校，并在本一批同时报考我校，提前批未能被录取，也不影响本一批次的录取。
专业选择,55*** (重庆),2011-06-26 15:29,老师:请咨询贵校文科就业率最高的专业是什么，2010年在重庆的文科录取平均分是多少？谢谢！,我校大部分专业的就业率都是100%。去年重庆市文科平均分是630.2
贵州理科录取排名,li*** (贵州),2011-06-26 15:25,老师好，请问在贵州的理科考生排名多少有希望被录取？提档后是否会被退档？谢谢,去年我校录取最低分的名次在1200名左右。对于实行平行志愿的批次，考生愿意调剂，进档不退。
投档比例,zc***14 (浙江),2011-06-26 15:05,贵校在浙江省实行平行志愿后的投档比例是多少？,一般为1：1.05左右。
我的分数是595分.文科全省排名是1637.能否到贵校?,lu***1993 (福建),2011-06-26 14:58,我的分数是595分.文科全省排名是1637.能否到贵校?,去年文科高出一本线47分。你的分数可以A志愿报考我校。
录取,ma*** (天津),2011-06-26 14:25,天津理科625，报贵校可以吗，选专业有优势吗？,分数很高，有一定优势。我校专业录取政策是分数优先不设级差分，因此，考生可将自己最喜欢、向往的专业填在第一专业志愿。
咨询,ws*** (江苏),2011-06-26 14:13,我是江苏理科考生，想了解一下近几年贵校在江苏理科各专业录取分数线,可参考省高招办的录取统计。因为我校在各省市招生人数较少，各专业并非每年都有招生计划，有计划的，人数也较少，一般为1-2名，因此容易受考生专业志愿填报的影响，专业录取分数起伏较大，参考意义不大，易误导考生，我校未作统计。
山东文科,so***j (山东),2011-06-26 14:05,老师，您好，我是山东文科生600分，英语136分，英语口试已过。超一本30分，省3200名，请问报考有希望吗,不排除一定风险，可考虑我校提前批志愿
咨询,xu***h (江苏),2011-06-26 13:56,老师你好：我是江苏文科考生总分366，选修双A，江苏省文科排名1706名。报考贵校有希望吗？谢谢。,分数有希望
英语口试,hb*** (河南),2011-06-26 13:40,河南省没有组织英语口试，请问贵校会对已录取的河南考生专门举行口试么？如果举行，会是开学后在本校考试么？如果成绩不合格怎么办？,不会
咨询,ji*** (青海),2011-06-26 13:39,青海考生（理科）成绩536，省排名278，报考贵校的“阿拉伯语”专业有无希望？谢谢,分数不错，希望很大
咨询,qi*** (福建),2011-06-26 13:29,我是福建理科考生，今年考了620（福建本一572），省排名8656，能上贵校吗？？能推荐下专业吗？本人没有什么特别爱好。谢谢。。,分数有希望，我校没有很差的专业，建议还是按照自己的兴趣选择
录取咨询,lu***3 (浙江),2011-06-26 13:20,请问老师，浙江理科635分，全省4300名，报考贵校英语或日语专业希望大吗?,分数有希望
咨询录取,se***16107 (广西),2011-06-26 12:43,补充：老师我是广西文科考生今年超一本30分录取希望多大？怎样填报呢？,分数有希望，专业按照自己的兴趣选择即可
咨询录取,se***16107 (广西),2011-06-26 12:39,老师您好我是广西考生今年超一本线30分录取概率有多少？转专业是怎样的？,分数有希望，我校不允许专业，但是可以在学有余力的情况下辅修第二专业或学位
622,we***uke (河南),2011-06-26 10:20,我是河南理科考生，622分，高出一本线40分，报考贵校有希望吗？,分数不错，有希望
求助,pi*** (河南),2011-06-26 10:12,我是河南文科考生，614分全省385名报考贵校把握如何？能不能上较好专业？,分数不错，有希望
咨询,ga***henhan (甘肃),2011-06-26 10:03,你好，甘肃文科507分报考贵校有把握吗,不排除有风险
甘肃556能进吗？,he***y (甘肃),2011-06-26 10:01,我是甘肃省考生，甘肃一本线501，我考了556，能进贵校吗？谢谢,分数有希望
山东理工,cz*** (山东),2011-06-26 10:00,我是山东理工类女生，高考成绩633，英语单科138，口试成绩96，报考贵校希望大吗？谢谢！,分数不错，希望很大
咨询,va*** (浙江),2011-06-26 09:50,老师您好，我是浙江理科毕业生，分数是647分，一本线为550.请问我能进贵校的机会大吗？进了有好专业吗？,分数很好，希望很大，专业按照自己的兴趣选择即可
疑问,zh*** (浙江),2011-06-26 09:50,老师你好，我是浙江文科考生，看了招生计划，发现上外第二批文科不招生，是这样的吗？,是的，我校只有一本和三本
咨询,zh***gege (江西),2011-06-26 09:48,老师:您好!我是江西文科考生，排名1362，有希望被贵大学录取吗?,考分是多少？
录取,cx*** (江苏),2011-06-26 09:38,老师你好！我今年考了369分，物理B，化学A。全省排名8621名，能否报考你校？,有一定风险
关于录取,lu*** (新疆),2011-06-26 09:32,老师，您好！我是新疆的一名文科考生，新疆高考成绩已公布，我考了597，报考了贵校的商务英语，德语，是否有望录取？,分数很好，希望很大
咨询,ya***si (重庆),2011-06-26 09:29,1、贵校招生章程中有“对达到我校最低录取分数线、但未进入所填专业志愿且愿意服从专业调剂的考生作调剂录取。”，那么贵校在重庆的投档比例是多少呢，如果投档比例超过100%，那么按招生计划多投的考生，会不会因为其投档分数低于最低录取分数而被退档呢？2、重庆理科考生一般在全市排名多少，才能被贵校录取机会大呢？谢谢,重庆实行平行志愿，投档比例为105%，服从调剂进档不退。分数目前很难预测
咨询,hu*** (河南),2011-06-26 09:16,我是河南理科考生，620分，高出一本线38分，特别想去你们学校，请问第一志愿填报贵校风险大吗,分数有希望
咨询,le***ting (山东),2011-06-25 16:34,我是山东理科考生，高考总成绩为653分，英语单科146分，口试成绩95分（满分100），请问报考贵校有无希望？,考分很高，很有希望，欢迎报考上海外国语大学。
录取,js*** (江苏),2011-06-25 16:31,请问老师，江苏理科考生，387分，全省排1432名，A+、A，能否报贵校？,分数和排名都很不错，可以A志愿报考我校。
山东理科,89*** (山东),2011-06-25 16:29,请问成绩高出一本线64分有希望报考贵校吗？,有希望，欢迎报考。
文科考生,ma*** (河南),2011-06-12 10:17,文科考生400分左右能报考你校哪个批次？,你好，你的分数可能不太够
咨询,dy*** (山东),2011-06-12 09:46,老师您好：我是山东理科考生，请问贵校今年在山东有提前批计划吗？今年高考成绩620分左右报考贵校有希望吗？,你的分数不错，很有希望，山东提前批专业为阿拉伯语、波斯语和朝鲜语
咨询,dy*** (山东),2011-06-12 09:23,老师您好：我是山东考生，请问贵校今年在山东有提前批计划吗？今年高考成绩620分左右报考贵校有希望吗？,你好，有的，请问是文科还是理科
录取分数,yl*** (广西),2011-06-11 14:41,请问公布的录取分数是否含加分,你好，院校最低录取分不含加分
关于山东省招生的问题,cu***3 (山东),2011-06-11 13:23,每年山东省理科考生高于一本线多少分比较有把握报考贵校？,大约高出30~40分以上
咨询,yn*** (云南),2011-06-11 11:10,老师，您好：咨询一下1、贵校近三年在云南的录取分数（理科）2、入校后是否可以转专业以及转专业的条件3、身体条件有没有特殊要求4、关于面试的要求谢谢,你好，分数线可上我校招生网站，zhaoban.shisu.edu.cn，我校不可以转专业，但是可以在学有余力的情况下辅修第二专业。身体只需符合教育部出台的招生体检标准即可，我校没有面试
提档,yh*** (新疆),2011-06-11 10:56,老师您好：新疆考生提档比例为多少，如服从调剂，提档后是否退档？,提档比例请询问省级高招办，平行志愿省市，服从调剂，进档不退
关于录取,lu*** (新疆),2011-06-11 10:44,老师，您好！我是新疆的一名文科生，有以下问题想要咨询：1.我是少数民族，父母双方都是同一民族，省招办政策加50分，请问贵校这50分承认么？如果承认，是投档和分专业都承认么？2.估分565左右，线差65-75之间，报考贵校有风险么？3.服从调剂有退档风险么？4.入校后能转专业么？5.贵校在新疆招生组的联系办法是什么？谢谢！,承认，一加到底。分数不错，有希望。平行志愿省市服从调剂，进档不退，我校不能转专业，但是可以在学有余力的情况下辅修第二专业。我校没有新疆招生组，全部统一采取网上录取。
咨询,wx*** (天津),2011-06-11 10:31,老师您好，请问我自己估分580多，有希望被贵校德语商务英语国际经济与贸易录取吗？谢谢,目前还不能确定，但是你的分数不错，有希望
咨询,wx*** (天津),2011-06-11 10:27,老师您好，请问我自己估分580多，有希望被贵校录取吗？谢谢,分数不错，有希望
山东文科考生过一本多少分能上贵校？,sh*** (山东),2011-06-11 10:03,山东文科考生估计过一本线20-30分左右，若服从调剂，能报什么专业？谢谢,30~40分左右
咨询,ms***9 (新疆),2011-06-10 16:44,老师好，我是新疆文科考生，估分540分，能上贵校商务英语专业吗？服从调剂考上贵校，专业可以转吗？可以修双学位吗？谢谢！,[录取分数无法预测，欢迎A志愿报考我校。我校是一所多科性外语类大学，由于语言学习的特殊性，学校各专业均采用小班教学，加上各外语间的巨大差异、外语学习的艰巨性以及我校复合型、双外语型专业设置对学生的高要求，学校不允许学生转系、转专业。对学有余力的学生，学校鼓励修读第二学位或第二专业，修满规定学分、论文通过可获得辅修学士学位证书或辅修第二专业证书。
提档比例,fa***ng (浙江),2011-06-10 15:07,请问贵校在浙江的提档比例是多少,本一批平行志愿1：1.05左右。
德语理科生,ty*** (山西),2011-06-10 14:09,初一开始主修德语，英语是第二外语，理科生！报考贵校有什么建议？？,若是以德语作为高考外语，只能填报我校德语专业。
咨询,yh*** (新疆),2011-06-10 12:15,您好，我是新疆文科考生，估分580分，能否进入贵校学习？谢谢。,可以尝试平行志愿A志愿填报我校。
咨询,53*** (山东),2011-06-13 12:49,我是山东理科生，请问贵校中外合作办学的专业是什么？,我校没有中外合作办学，只有校际交流合作，非高收费。学生在大学就读期间有机会赴国外交流，并向国外大学推荐深造硕士研究生。
录取,53*** (山东),2011-06-13 12:40,您好，老师，我是山东理科考生，请问超出一本线多少分可以报考贵校？谢谢。,可以参考我校往年的录取统计：http://zhaoban.shisu.edu.cn
民考汉考生,xj*** (新疆),2011-06-13 11:42,新疆民考汉考生，报贵校是否加分。谢谢,我校认可民族司和新疆高招办规定的民考汉加分政策！
咨询,dy*** (山东),2011-06-13 11:18,老师您好：请问贵校往年在山东理科录取分数是多少？谢谢,请参考我校录取统计：http://zhaoban.shisu.edu.cn
潍坊的文科考生,ty*** (山东),2011-06-13 10:59,我是潍坊的文科考生，今年高考估分600分，英语130，我喜欢外语。请问这个分数报考贵校录取的可能大吗。或者我可以报考哪个专业比较有把握录取呢,分数不错。我校专业录取实行分数优先不设级差，考生可大胆将自己最喜欢的专业填报在第一专业。
新疆考生,xj*** (新疆),2011-06-13 10:25,我女儿是新疆考生，估分590。特别喜欢上外，能否报贵校。谢谢,分数不错，可以平行志愿A志愿报考我校冲一下。
咨询,ly*** (山东),2011-06-13 10:05,请问山东省文科生报考贵校投档比例是多少？投档加5分（已获贵校投档加5分优惠）后一定会满足前两个志愿吗？多些指导！,入选自主选拔录取的考生享受上我校投档线后满足前两个专业志愿的优惠。加分考生享受上投档线后加相应分值参与排序录取的优惠。
咨询,62*** (江西),2011-06-13 09:55,我是江西的女生，高考估分570分，请问贵校在招收男女生有比率吗？预计比江西一本线高出多少分？录取后在贵校能转专业吗？,[我校招生录取没有男女生比例限制。录取统计可以参考我校招生网：http://zhaoban.shisu.edu.cn。我校是一所多科性外语类大学，由于语言学习的特殊性，学校各专业均采用小班教学，加上各外语间的巨大差异、外语学习的艰巨性以及我校复合型、双外语型专业设置对学生的高要求，学校不允许学生转系、转专业。对学有余力的学生，学校鼓励修读第二学位或第二专业，修满规定学分、论文通过可获得辅修学士学位证书或辅修第二专业证书。
分数范围,su***0 (江西),2011-06-13 09:49,老师您好，请问一下贵校在江西招理科生时，分数一般高于一本线多少呢？谢谢老师。,去年高出68分，往年情况还请浏览我校招生网：http://zhaoban.shisu.edu.cn
英语分数要求,le*** (浙江),2011-06-13 09:33,很喜欢贵校，今年英语发挥不太好，请问对高考英语成绩有要求吗？理科生,没有最低要求。
自主选拔录取名单考生问题,po*** (江苏),2011-06-13 09:29,尊敬的招办老师，您好！我是江苏考生，在上外今年的自主选拔录取名单（本一线录取），已经按江苏省考试院要求与考试院签订自主选拔录取协议（在本一批次投档之前先行向贵校投档，“服从调剂”，类似“志愿”但不完全是）。但是按照贵校章程，需在本一批次第一志愿填写贵校且服从调剂，自主选拔政策才能生效。我知道如果不按此要求，优录政策即无效。我的问题是：（江苏在分数名次取得后填报）如果填提前批次或本一批次志愿时，我不填写贵校，能不能被投档进我重新填写的院校，还是仍然被投档进贵校？或者我是否面临提前和本一批次所有志愿均无效（全部无法录取）的危险？烦请招办老师详解，谢谢！,我们所说的服从调剂是指专业志愿服从调剂！请以江苏省高招办的规定政策来执行，按规定要求签订协议，否则省招办将不会投档，我校也无法录取。详细政策请咨询江苏省招办。
咨询,19*** (河南),2011-06-13 09:22,上海外大有二本院校吗？一般需多少分才能上？,没有。
录取线,63*** (江西),2011-06-13 09:20,我是江西的理科女生，请问2011年贵校在江西招收男女生有比率吗？分数线比一本线高出多少？,没有。去年高出68分，往年的统计请浏览http://zhaoban.shisu.edu.cn
咨询,ly*** (山东),2011-06-13 09:17,请问：山东文科考生，估分总分610-620分，英语143分，语文125。（已获贵校自主招生进档加5分分专业）报考贵校，录取几率大吗？山东文科生报考贵校要高出一本线多少分有希望被录取？多谢真诚指导！,分数很高。去年文科最低风高一本线25分，详细请浏览我校招生网统计：http://zhaoban.shisu.edu.cn
uqq=yq,si*** (陕西),2011-06-12 16:36,老师你好！我是陕西文科考生，估分580，能考你校的什么专业？,分数不错，我校专业录取政策是分数优先不设级差分，考生可大胆将自己最喜欢的专业填报在第一专业。
加分问题,sa*** (江苏),2011-06-12 15:59,我是江苏考生，获得了贵校自主招生考试加10分政策，我想问的是：如果我被贵校按1:1.2投档进了，这个加分是否就立即生效吗？,是的，不过投档比例是1:1.05
投档问题,sa*** (江苏),2011-06-12 15:48,我是江苏考生，我想咨询一下：贵校是按120%收档吗？,已答
咨询,19*** (黑龙江),2011-06-12 13:14,请问如果是1A二志愿上贵校的话，在录取分数上有影响么？,如果贵省不是平行志愿的话，我校只有在一志愿录不满的情况下有可能招收第二志愿
咨询,19*** (黑龙江),2011-06-12 13:14,请问如果是1A二志愿上贵校的话，在录取分数上有影响么？,已答
咨询,di***i (黑龙江),2011-06-12 12:44,如果1A二志愿报考贵校，在录取分数上有影响么？,已答
咨询,wy***387 (黑龙江),2011-06-12 12:02,我是黑龙江省理科考生，估530分报考贵校法学专业有希望吗,目前还无法确定
录取规则咨询,ch*** (陕西),2011-06-12 11:58,老师好！我是西安的往届文科考生，想咨询一下：（1）在录取往届生时贵校有什么政策？（2）在服从调剂的情况下，已投档的是否会退档？（3）录取专业如果不喜欢，以后能否转专业？如能，比例多大？难度多大？谢谢,只要高考成绩达到即可。平行志愿的省市，服从调剂，进档不退。我校不能转专业，但是可以在学有余力的情况下辅修第二专业或第二学位。
国际经济与贸易,22*** (内蒙古),2011-06-12 11:57,请问老师：如果我报考了国际经济与贸易专业，如何确定是去其中的（英语）专业还是（日语）专业？O(∩_∩)O谢谢！,我校国经贸英语在内蒙古没有招生
关于国际政治,22*** (内蒙古),2011-06-12 11:44,请问老师：国际政治专业和国际经济与贸易专业的就业方向是什么？O(∩_∩)O谢谢！,[国际政治：(1)国际知名会计师事务所：如普华永道会计师事务所、毕马威会计师事务所、安永华明会计师事务所和沪江德勤会计师事务所等；(2)中外律师事务所：如美国奥睿律师事务所、美国普衡律师事务所、美国博钦律师事务所、华诚律师事务所、中大律师事务所、惠诚律师事务所上海分所、汉氏律师事务所、西蒙斯律师行、锦天城律师事务所和方达事务所等；(3)中外大型公司：如通用汽车公司、IBM公司、DHL公司、宝钢集团、锦江集团、通用、华为、马士基(中国)航运、上海市对外服务公司、泛亚汽车技术中心有限公司、瑞典法码度公司驻沪办事处、澳大利亚宝声国际有限公司驻上海代表处等；(4)政府机关、新闻机构：如外交部、商务部、新华通讯社、上海市工商局、中国日报社、中国国际广播电台、上海日报社、北京电视台等；(5)金融、咨询、广告机构：如花旗银行、汇丰银行、渣打银行、日联银行、中国银行、工商银行、建行、交行、招商、浦发、华侨银行、智威汤逊中乔广告有限公司、上海润杰企业管理咨询公司、智豪咨询等；(6)涉外政府机构：如外国驻沪领事馆，高校、商贸、信息、证券等涉外企事业单位；(7)出国出境留学：如英国剑桥大学、伦敦大学、伦敦经济学院、美国哥伦比亚大学、纽约州立大学、澳大利亚墨尔本大学、香港中文大学、香港科技大学等；(8)赴国内名校攻读硕士、博士学位：如北京大学、清华大学、上海交通大学、复旦大学、华东政法大学、对外经济贸易大学等。国经贸：毕业生就业去向：政府外经贸机构、大型国有企业、外经贸企业、中外银行、中外保险公司、管理咨询公司、会计师事务所、广告传媒公司及其他三资企业、中国海外企业等。
咨询,di***i (黑龙江),2011-06-12 11:19,请问贵校在黑龙江招生的1A分数超过一本线大概多少？我估分585报考贵校1A有希望么？,大约30分左右，你的成绩有希望
考分,76*** (江西),2011-06-12 11:18,请问江西文科考生高于一本线多少分能进贵校？,30~40分左右
志愿顺序,lu*** (新疆),2011-06-12 11:09,老师，您好！我是新疆的一名考生，文科，A志愿报考的贵校，估分570左右，线差75左右，请问一下商务英语，新闻学，德语这样的顺序合理吗?如不合理，能否请老师给点建议，应怎样调整？谢谢！,专业分数线目前无法预测，按照自己的兴趣填写就可以了，我校不设级差
咨询,fk***1 (浙江),2011-06-12 11:07,本人目标是上外，理综考试因受干扰而考砸，估计已进不了上外。请问老师：是否有其他途径进上外？比如，先上别的大学，经过一年的努力，通过考试转到上外。就像浙江工商大学每年有一定的名额通过考试转到浙江大学读大二一样。,我校没有转学或者插班生制度
志愿填报咨询,di*** (新疆),2011-06-12 10:22,老师好！我是新疆文科考生，估分约585分，想填报贵校，是否有可能录取？,分数蛮高的，可以A志愿报考我校!
咨询,sa*** (湖北),2011-06-12 10:20,老师好？请问1.湖北省第一志愿实行平行志愿，提档后是否退档？2.进校后，还有选择专业的机会吗?转专业的比例有多大?3.专业有级差吗？专业的录取规则是分数优先，还是志愿优先？4.有男、女生限制吗？5.有否双学位？几年级可以选修双学位？6.请问贵校负责湖北招生的招生老师联系电话？7.考本校研究生有优惠吗？谢谢！,平行志愿省市服从调剂进档不退，我校不能转专业，我校不设级差，分数优先，没有男女生限制。在学有余力的情况下可以辅修第二专业或学位，大约大二开始。我校目前统一采取网上录取。我校部分专业有研究生保送名额
