标题,来源,时间,问题,回答
咨询,ti***igengju (河北),2010-06-26 09:47,您好！我是河北考生，分数594分，本一线561分，高出本一线33分，能被贵校电子信息类专业录取吗？电子信息类专业分数高吗？我有希望吗？谢谢！另外，分专业时认可加分吗？有无专业级差？分数优先还是专业优先？请一一回答，不胜感激！,[学校每年报考的情况都不一样，录取分数也不同，没办法对你的分数做评估。你可以以我校近几年的最低录取分数线作为参考http://www.zsw.shu.edu.cn/Default.aspx?tabid=5739&ctl=Detail&mid=9074&Id=50070&SkinSrc=[LSkins/zhaobiban31/zhaobiban31http://www.zsw.shu.edu.cn/Default.aspx?tabid=5739&ctl=Detail&mid=9074&Id=49870&SkinSrc=[LSkins/zhaobiban31/zhaobiban31http://www.zsw.shu.edu.cn/Default.aspx?tabid=5739&ctl=Detail&mid=9074&Id=24858&SkinSrc=[LSkins/zhaobiban31/zhaobiban31我校承认各省里的加分政策，我校不另行加分。我校录取各专业之间级差。我校对于高考成绩达到我校本科第一批录取投档要求的考生，按照各省市招生办投档成绩从高分到低分排序，根据志愿依次录取。
你好 艺术类文科高考填报咨询,hu*** (浙江),2010-06-26 09:46,你好我是浙江美术类考生。美术专业考试动画专业校考浙江区第十名文化成绩全部高于阻挡线请问我报考贵校动画专业被录取的可能性有多大？,学校每年报考的情况都不一样，录取分数也不同，没办法对你的分数做评估。
报考,no*** (山东),2010-06-26 09:43,你好！我是山东理科考生分数为611高出一本线31分名次在20000左右第一志愿报考贵校与电子相关的专业希望大吗？,[学校每年报考的情况都不一样，录取分数也不同，没办法对你的分数做评估。你可以以我校近几年的最低录取分数线作为参考http://www.zsw.shu.edu.cn/Default.aspx?tabid=5739&ctl=Detail&mid=9074&Id=50070&SkinSrc=[LSkins/zhaobiban31/zhaobiban31http://www.zsw.shu.edu.cn/Default.aspx?tabid=5739&ctl=Detail&mid=9074&Id=49870&SkinSrc=[LSkins/zhaobiban31/zhaobiban31http://www.zsw.shu.edu.cn/Default.aspx?tabid=5739&ctl=Detail&mid=9074&Id=24858&SkinSrc=[LSkins/zhaobiban31/zhaobiban31
咨询9,zh***9 (山东),2010-06-26 09:35,请问美术类绘画专业，文化课384英语73，专业素描90.2色彩74.6排名11今年能被录取吗,你好，学校每年报考的情况都不一样，录取分数也不同，没办法对你的成绩做评估。
咨询,wa*** (河南),2010-06-26 09:34,您好，我是河南考生，高考中分数是557，而且是河南省三好学生，想报考贵校物理系，请问希望大吗？,[学校每年报考的情况都不一样，录取分数也不同，我校近几年的最低录取分数线作为参考http://www.zsw.shu.edu.cn/Default.aspx?tabid=5739&ctl=Detail&mid=9074&Id=50070&SkinSrc=[LSkins/zhaobiban31/zhaobiban31http://www.zsw.shu.edu.cn/Default.aspx?tabid=5739&ctl=Detail&mid=9074&Id=49870&SkinSrc=[LSkins/zhaobiban31/zhaobiban31http://www.zsw.shu.edu.cn/Default.aspx?tabid=5739&ctl=Detail&mid=9074&Id=24858&SkinSrc=[LSkins/zhaobiban31/zhaobiban31
专业安排,ti***igengju (河北),2010-06-26 09:33,您好！我问一下专业级差是怎么回事？比如说专业级差为3分，是那种安排专业的方式？A按总分高分到低分排队，先满足高分的第一专业志愿，如果满足不了，紧接着减去3分满足高分的第二专业志愿——以此类推，总之是尽量先满足高分的志愿，高分录取完了，再安排低分。B先按第一专业志愿由高到低排队，然后满额为止，再将为录取第一志愿的考生减去3分，再按第二志愿又高到低排队，满额录取为止——以此类推，总之是以志愿优先，分数由高到低安排专业。是那一种安排方式？有没有“专业级差录取方式”的“详细流程”介绍？请提供一下！谢谢！,你好，我校的各专业志愿之间无级差。
咨询，谢谢,xy*** (河南),2010-06-26 09:31,老师好，我是河南理科生，考了578。报考贵校被录取可能性大吗？录取了，能上好专业吗？,考生您好！每年情况都不太一样，我们也无法估计。您可以以近几年的分数线为参考。
请问,zw*** (河南),2010-06-26 09:31,请问贵校优势专业有哪些？,我校是国家“211工程”重点建设高校之一，专业很多，具体可以参考我校网站www.shu.edu.cn中各个专业的介绍。
文科,da***3 (浙江),2010-06-26 09:29,你好，我是浙江文科，女，高考620分，2690名，能进你们学校吗？如果能，可以进什么专业,[考生您好！我们学校是一所综合类大学，在浙江也有许多专业是招文科的学生，这是招生计划：http://www.zsw.shu.edu.cn/Default.aspx?tabid=5738&ctl=Detail&mid=9027&Id=55368&SkinSrc=[LSkins/zhaobiban31/zhaobiban31分数线每年情况都不太一样，我们也无法估计。您可以以近几年的分数线为参考。给您一个网址方便您查询，http://www.zsw.shu.edu.cn/
报考,lz***9666 (河南),2010-06-26 09:27,我是河南理科考生.分数565分.报考贵校有希望吗?,考生您好！每年情况都不太一样，分数线我们也无法估计。您可以以近几年的分数线为参考。给您一个网址方便您查询，http://www.zsw.shu.edu.cn/
录取,vi*** (河北),2010-06-26 09:26,老师您好河北文科562分政策加10分一本线539报考贵校编导专业被录取的可能性大吗谢谢,[学校每年报考的情况都不一样，录取分数也不同，没办法对你的分数做评估。你可以以我校近几年的最低录取分数线作为参考http://www.zsw.shu.edu.cn/Default.aspx?tabid=5739&ctl=Detail&mid=9074&Id=50070&SkinSrc=[LSkins/zhaobiban31/zhaobiban31http://www.zsw.shu.edu.cn/Default.aspx?tabid=5739&ctl=Detail&mid=9074&Id=49870&SkinSrc=[LSkins/zhaobiban31/zhaobiban31http://www.zsw.shu.edu.cn/Default.aspx?tabid=5739&ctl=Detail&mid=9074&Id=24858&SkinSrc=[LSkins/zhaobiban31/zhaobiban31
填报咨询,zj*** (浙江),2010-06-26 09:23,浙江考生理科594分能上你校的生物工程专业吗,[学校每年报考的情况都不一样，录取分数也不同，我校近几年的最低录取分数线作为参考http://www.zsw.shu.edu.cn/Default.aspx?tabid=5739&ctl=Detail&mid=9074&Id=50070&SkinSrc=[LSkins/zhaobiban31/zhaobiban31http://www.zsw.shu.edu.cn/Default.aspx?tabid=5739&ctl=Detail&mid=9074&Id=49870&SkinSrc=[LSkins/zhaobiban31/zhaobiban31http://www.zsw.shu.edu.cn/Default.aspx?tabid=5739&ctl=Detail&mid=9074&Id=24858&SkinSrc=[LSkins/zhaobiban31/zhaobiban31
广西,31***1 (广西),2010-06-26 09:20,428分能上贵校吗？,[学校每年报考的情况都不一样，录取分数也不同，没办法对你的分数做评估。你可以以我校近几年的最低录取分数线作为参考http://www.zsw.shu.edu.cn/Default.aspx?tabid=5739&ctl=Detail&mid=9074&Id=50070&SkinSrc=[LSkins/zhaobiban31/zhaobiban31http://www.zsw.shu.edu.cn/Default.aspx?tabid=5739&ctl=Detail&mid=9074&Id=49870&SkinSrc=[LSkins/zhaobiban31/zhaobiban31http://www.zsw.shu.edu.cn/Default.aspx?tabid=5739&ctl=Detail&mid=9074&Id=24858&SkinSrc=[LSkins/zhaobiban31/zhaobiban31
中外合办,yi***an (浙江),2010-06-24 15:02,请问你们这旅游管理类是找专科的吗？大致入取分多少左右？,无法估计。。。欢迎报考上海大学。
风俗？,a3***3 (陕西),2010-06-24 14:59,老师您好，我是2010年陕西考生，想报考贵校，但是听朋友和其他大人说上海的大学包括山海人都很排外，请问是不是这样的？我很担忧以后在学校的生活问题~,没有这样的说法。。欢迎报考上海大学。
咨询,he*** (甘肃),2010-06-24 14:42,老师您好！我是甘肃理科应届考生，考分592，甘肃理科一本线531；是否有望被贵校录取？,去年不是很高。欢迎报考上海大学。
浙江考生,ba***e (浙江),2010-06-24 14:36,老师你好，我是浙江宁波的一名理科考生，男，在今年的高考中考了597分，排名10622名，今年的浙江理科一本分数线是551分，我想请问一下，我能报读贵校的金融会计专业吗？,去年是超一本线44分。平行志愿，愿意调剂不退。专业之间无级差。欢迎报考上海大学。
报考,an*** (浙江),2010-06-24 14:34,浙江文科超过一本线12分有希望进入贵校对外汉语专业吗,去年是超一本线36分。平行志愿，愿意调剂不退。专业之间无级差。欢迎报考上海大学。
中外合作办学,kf*** (河南),2010-06-24 14:34,请问从悉尼工商学院毕业，是否发双学位证书？,达一定条件发双学位
审计学,be*** (浙江),2010-06-24 14:32,贵校审计学有侧重点吗主要有哪些课程呢？以后就业方向是什么？谢谢！,没有审计学专业。。
信息管理与信息系统,be*** (浙江),2010-06-24 14:29,这个专业贵校有设置吗课程和就业方向如何？,有的。详见学院介绍www.shu.edu.cn
关于中外办学问题,kf*** (河南),2010-06-24 14:25,请问贵校合作办学专业发什么毕业证？是否实施双语教育？悉尼工商学院住宿条件和学院环境如何？,发上海大学毕业证，达到一定要求可以发双学位。住宿条件还不错，环境很好。
咨询,we*** (浙江),2010-06-24 14:24,老师你好，我是浙江文科考生，考分为623，排名为2338，是否有机会被贵校录取,平行志愿，愿意调剂不退。专业之间无级差。欢迎报考上海大学。
请具体回答,dj***6 (甘肃),2010-06-24 14:20,计算机科学与技术这个专业具体学什么？是理论类还是技术类？,请咨询：02156331669
咨询,ng*** (贵州),2010-06-24 14:07,老师您好我是贵州理科生我省今年重点线481分我的考分为542分请问我被贵校录取的可能性有多大？贵校的优势专业有哪些？,去年是招了47分。平行志愿，愿意调剂不退。专业之间无级差。理工类的专业都不错的。专业要自己喜欢才好。欢迎报考上海大学。
报考,za***anxia (广西),2010-06-24 13:25,广西考生，理科，567，报考贵校怎么样？学校对外交流中输送留学生的政策是什么？,去年是招省本27分。平行志愿，愿意调剂不退。专业之间无级差。欢迎报考上海大学。
录取咨询,to*** (浙江),2010-06-24 13:10,请问老师我是浙江理科考生，分数607，浙江省排名7808名，能进贵校吗？若能，是否必须填专业服从才比较稳妥？谢谢。,去年是超省线44分。平行志愿，愿意调剂不退。专业之间无级差。欢迎报考上海大学。
咨询,an*** (浙江),2010-06-24 13:04,老师，您好，我是浙江文科考生，今年考了630分，语文124分，是否有希望录取,平行志愿，愿意调剂不退。欢迎报考上海大学。
关于录取,qi***45 (江苏),2010-06-25 09:04,我是江苏考生理科377物理A化学B+省排名12800多名请问可以报考贵校么？谢谢！,我校对平行志愿，愿意调剂不退，能不能进，能进什么专业很难估计。专业之间无级差。欢迎报考上海大学。
中外合作办学,an*** (浙江),2010-06-25 09:02,请问下，浙江招生中的中外合作办学类对英语的要求到底是英语笔试在110分以上，还是英语综合成绩(包括听力)在110分以上.还有悉尼商学院与贵校合作办学的专业是否在浙江招生计划名额中，谢谢.,笔试不低于110分。在招生计划名额中。。
志愿,sp*** (贵州),2010-06-25 09:01,老师您好我是贵州理科生我省今年重点线481分我的考分为535分请问我被贵校录取的可能性有多大,去年我校理科高出省一本线47分。我校对平行志愿，愿意调剂不退，能不能进，能进什么专业很难估计，谢谢。欢迎报考上海大学。
录取,sj*** (浙江),2010-06-24 16:49,浙江理科609上建筑学行吗？,去年理科高出44分，我校对平行志愿，愿意调剂不退，能进什么专业很难估计。专业之间无级差。欢迎报考上海大学。
谢谢,ch***0103 (贵州),2010-06-24 16:46,老师你好，我是贵州考生，高考523分，贵州一本线481分，全省7186名请问我能否被贵校录取，若能，我一志愿填贵校的哪些专业把握较大呢？谢谢,我校对平行志愿，愿意调剂不退，能不能进，能进什么专业很难估计，谢谢。欢迎报考上海大学。
请问,sh*** (浙江),2010-06-24 16:42,入校后如对专业不满意可以转专业吗？谢谢,可以，要考试的。。。
咨询,lx*** (云南),2010-06-24 16:21,请问老师，我是云南少数民族文科考生，差2分上一本线，可以报考贵校的少数民族预科班吗？,请咨询省高招办。。
咨询,yi***u (甘肃),2010-06-24 16:09,我是理科生，超出一本线25分，可以录取吗？,什么省的？我校对平行志愿，愿意调剂不退，能不能进，能进什么专业很难估计，谢谢。欢迎报考上海大学。
咨询,79*** (甘肃),2010-06-24 16:08,老师:您好!我是甘肃文科考生，高考成绩521分，一本线511，超出一本线10分，报考贵校，如果服从专业调剂，能被录取?,我校对平行志愿，愿意调剂不退，能不能进很难估计，谢谢。欢迎报考上海大学。
河北明年能否增加几个文科计划,65*** (河北),2010-06-24 16:07,河北明年能否增加几个文科计划,看情况
招生 对口高考,vi*** (四川),2010-06-24 15:53,我想问一下，今年贵校招收四川对口高考（信息类）的考生吗？,没有对口专业
咨询,bi*** (山东),2010-06-24 15:47,老师，您好！我是山东理科生，估分550-560，报考贵校希望大吗？谢谢老师！,"考生您好！今年分数线我们也无法预测。去年上海大学在山东省理科一本最低分数线是598分,您可以以近几年的分数线为参考。给您一个网址方便您查询，http://www.zsw.shu.edu.cn/"
咨询,00*** (浙江),2010-06-24 15:46,请问我浙江省的艺术类本科线未过如果你们上海的艺术本科线能过是否可以报考你们的本科那你们对外省考生的艺术类分数线会提高吗大概提高多少谢谢,考生您好！分数线我们也无法预测。
专业录取规则,di***9 (河北),2010-06-24 15:26,贵校专业录取时是“分数优先，遵循志愿”，还是“志愿优先”,分数优先。
咨询专业,64*** (山东),2010-06-24 15:20,我是山东考生，请问计划中的“工商管理类”指的是什么专业？它与计划中的“工商管理类”（会计学）在录取分数上有什么差别？中外合作的专业毕业证与其他专业的毕业证一样吗？,有区别的，中外合作办学跟非合作的。。
今年要招海南文科生吗,ve*** (海南),2010-06-24 10:53,问题同上，如果答案是否定，那为什么一直不招呢？不是要实现教育资源公平化吗？,海南省因为计划很多，故没有投放计划，计划很多投向计划少的省份。
咨询,tr***g5 (浙江),2010-06-24 10:42,我是浙江的考生，请问贵校的投档比例是否为105%。如果我服从专业分配，而没有被选上，是否面临着退档,平行志愿，愿意调剂不退
咨询，谢谢老师,lx*** (广西),2010-06-24 10:37,我是广西考生，今年高考成绩562分，很想到贵校就读，请问老师，1我这分数报贵校的土木工程专业行吗?2其实我最喜欢的专业是建筑学，但贵校今年该专业在广西没有招生计划.请问老师如果我被贵校的其他专业录取了有没有可能转到建筑学专业.3贵校可以选修双学历吗?谢谢老师了.,平行志愿，愿意调剂不退。专业之间无级差。欢迎报考上海大学。进校一年后可以转专业。有第二专业辅修。
询问志愿,ts*** (甘肃),2010-06-24 10:29,甘肃理科550分，贵校对报考志愿顺序有什么要求？服从专业调配，退档不？,平行志愿，愿意调剂不退。专业之间无级差。欢迎报考上海大学。
咨询,li***n (四川),2010-06-24 10:12,请问贵校去年在四川录取的少数民族预科分数是多少,预科没有统计录取分。
调档、退档问题,qi***91 (浙江),2010-06-24 10:10,老师：你好！我是浙江考生，贵校在浙江调档比例多少？专业服从调剂会退档吗？调剂的专业是否是在招生计划内的？谢谢！,平行志愿一般以1：1.05投档，愿意调剂不退。专业之间无级差。欢迎报考上海大学。
位次,zh***356 (山东),2010-06-24 10:07,请问贵校工商管理、行政管理、公共管理、社会学、社会工作等专业在山东录取时考生的位次一般是多少之间？什么位次报贵校的把握较大？谢谢！,平行志愿，愿意调剂不退。专业之间无级差。欢迎报考上海大学。
咨询，谢谢啊。,19*** (浙江),2010-06-24 10:06,我是浙江的，今年第一批551分，我603分，能否进贵校？若能，就分数而言，选哪些专业较恰当呢？,平行志愿，愿意调剂不退。专业之间无级差。欢迎报考上海大学。专业只能看你自己喜欢什么了。
报考咨询,pk*** (云南),2010-06-24 09:55,老师，您好.我想请问贵校是否有二本专业?有的话，在云南招生吗?谢谢,没有二本。
咨询,hy*** (河南),2010-06-24 09:46,老师：您好！谢谢您的。刚才没有说清。郑州一中2010届有800名毕业生，560名以内一般能够达到河南的一本线。您能帮助判断一下吗？谢谢！,无法判断。谢谢
文科,79*** (甘肃),2010-06-24 09:43,如果能被贵校录取，可以转专业吗?,一年后通过考试转！
文科,79*** (甘肃),2010-06-24 09:40,老师您好!贵校录取时分数优先还是志愿优先?如果服从专业调剂退档的几率大吗?,平行志愿，愿意调剂不退。分数优先，专业之间无级差。欢迎报考上海大学。
河南理科考生咨询,ph***n61 (河南),2010-06-24 09:39,老师，我想问下，1贵校的优势专业都有哪些；2根据平行志愿，贵校的提档线今年会不会比往年高；3，投档了是不是承诺不退档；4，贵校预计超过211工程院校线多少分报考贵校有把握；5，受上海世博会影响，贵校预计的生源今年会不会较往年火爆。谢谢,平行志愿按1:1.05投档，愿意调剂不退。分数优先，专业之间无级差。欢迎报考上海大学。
二志愿,sd*** (山东),2010-06-24 09:38,老师您好：贵校在什么情况下可能招收山东理科一批二志愿考生？二志愿也有提档比例吗？如果专业志愿服从调剂，有被退档的可能吗？谢谢您。,如果一志愿不满，那么才有可能招二志愿。。平行志愿，愿意调剂不退。
是否有录取优惠,li*** (江苏),2010-06-24 09:30,老师你好，我的男孩是盐城市优团员、省级作文特等奖、钢琴十级、校台播音员，报考你校是否可获加分或优惠录取？,学校不另行加分。。
录取分数,li*** (湖南),2010-06-13 09:30,我是湖南的考生，高考成绩要本月26日出来。虽然贵校在湖南每年的录取抛档分数线资料均有记载，但依据那个填学校意义不是很大。我想询问贵校2009年在湖南录取的平均线是多少(或一般比抛档线高多少、成绩全省排名前多少)？另外贵校是否有录取的专业级差，有的话是多少？谢谢老师的回答。,我们只统计最低分，不统计平均分如果实行平行志愿就不存在级差分
咨询,wa***ang (黑龙江),2010-06-12 16:34,您好！我是黑龙江考生，估分590，请问报贵校录取的希望大吗？大概什么专业？,去年黑龙江文科最低551理科最低583，请你参考下
咨询 谢谢啊,ww*** (河南),2010-06-12 16:26,贵校是否承认二级运动员加分政策?,校内没有加班，请你咨询贵省考试院，是否会加在投档分上。
关于会展艺术,an***hunyu (山西),2010-06-12 16:14,会展艺术的就业方向如何？需要考研吗？,从事会展策划管理、创意设计、会展展示艺术与制作考研与否与自己意愿有关
请问贵校在四川一本的提档比例是多少？,nj*** (四川),2010-06-12 16:14,请问：贵校在四川本科一批次的提档比例是多少？政策性加分和竞赛加分在安排专业时算不算?服从调剂身体合格，贵校是否承诺不退档？谢谢,请你咨询贵省考试院投档比例的问题加分的问题也要咨询他们
2010年文科多少分有希望去贵校,an***hunyu (山西),2010-06-12 16:10,2010年文科多少分有希望去贵校？我估了545，行吗？我们这儿，预估一本535.想报会展艺术与技术。,去年山西文科最低分557，你可以参考一下
河南理科考生,sh***10060708 (河南),2010-06-12 16:03,老师你好：河南理科考生报贵校高出一本线多少分或在全省排名多少有望录取？专业服从调剂，提档后还退档吗？眼近视800度限报哪些专业？有无专业级差？贵校的重点专业是哪些？贵校的自主招生数是否占用公布的招生计划数？请。谢谢。,去年河南理科最低分571，你可以参考下如果河南省是平行志愿的话，完全服从调剂不退档自主招生没有在外地有计划
咨询,yg*** (新疆),2010-06-12 15:37,我是一名新疆理科生，请问估分大于一本线60分，能否报考贵校，贵校是否提档不退档。,因为每年情况都不太一样，我们也无法估计，欢迎报考上海大学。给您一个网址，上面有各类信息，方便您查询http://www.zsw.shu.edu.cn/。
内蒙古理科考生,lq***7 (内蒙古),2010-06-12 15:00,老师你好：我是内蒙古考生，我想问一下我预估了560分能报上海大学吗？另外上海大学在内蒙有招生老师吗？电话是多少？我想知道上海大学如何对待加分的。是一加到底吗？还是提档认可，分专业以实分为准，不算加分呢？,无法估计，欢迎报考上海大学。给您一个网址，上面有各类信息，方便您查询http://www.zsw.shu.edu.cn/。
咨询,wy***d (浙江),2010-06-12 14:55,老师您好！我是今年浙江理科考生，请问：今年贵校在浙江调阅考生档案的准确比例是多少？专业级差如何确定？另外，预估分数为590分，专业服从能否被贵校录取？谢谢！,无法估计，欢迎报考上海大学。给您一个网址，上面有各类信息，方便您查询http://www.zsw.shu.edu.cn/。关于提档比例请咨询教育考试院。
第二志愿考生,20*** (黑龙江),2010-06-12 14:55,请问贵校录取第二志愿的考生吗，谢谢,请咨询贵省教育考试院。在一志愿未招满的情况下会招生二志愿的考生。如果是平行志愿就不存在该问题。
艺术类,kw*** (河南),2010-06-12 14:07,请问动画在河南录取文化及专业分数是多少？是否有校考,无法估计，欢迎报考上海大学。给您一个网址，上面有各类信息，方便您查询http://www.zsw.shu.edu.cn/。
考生咨询,wo***n11 (广西),2010-06-12 13:41,本校在广西提档比例是多少？民族照顾降分投档，本校提档后分专业录取时照顾分是否还有效？,请咨询教育考试院。
咨询,21*** (甘肃),2010-06-12 12:48,贵校有何特色专业，最低分数线是多少?,各专业都很有特色。最低分要录取结束才知道的。
机械专业,wa***ang (黑龙江),2010-06-12 12:18,为什么机械专业排名靠前，而录取的分不高?,要看学生喜不喜欢这个专业啊！
上海大学计算机有关专业,dj***6 (甘肃),2010-06-24 13:02,上海大学的计算机有关专业中的强项是哪一方面？计算机科学与技术这个专业具体学什么，毕业后的就业在哪方面？,详见：http://www.ces.shu.edu.cn/Default.aspx
学校专业,be*** (浙江),2010-06-24 12:38,我是浙江考生今年理科考了590名次是13379能进你们学校什么专业贵校有专业级差吗,平行志愿，愿意调剂不退。专业之间无级差。欢迎报考上海大学。
咨询,15*** (浙江),2010-06-24 12:36,您好，我是浙江考生。高考理科615，若在填志愿中将贵校填在E志愿中，而A.B.C.D志愿都未被录取，则被贵校录取的可能性大么？,平行志愿，愿意调剂不退。欢迎报考上海大学。
录取,hn*** (浙江),2010-06-24 11:58,我是浙江文科考生，总分645，超一本线55分，总排名854，英语120分，请问上贵校是否有希望？谢谢！,平行志愿，愿意调剂不退。欢迎报考上海大学。
河南595能进入贵校么,hn*** (河南),2010-06-24 11:53,我是河南的理科考生，非常向往贵校的信息安全专业，不知理科595可否被录取,平行志愿，愿意调剂不退。欢迎报考上海大学。
咨询,00*** (浙江),2010-06-24 11:35,贵校本科好像是估分填志愿的而且已报玩那如果外省的学生想来报名是不是只能报考专科,估分填志愿，只是对上海市的。。本科都可以报的。。
咨询,00*** (浙江),2010-06-24 11:33,请问贵校有开设艺术类专科吗若有历年的录取分数是多少谢谢,有，第一年在外省招艺术专科
可以报吗？,pz*** (浙江),2010-06-24 11:16,广播电视新闻学和影视艺术技术两个专业，没有参加艺考的浙江普通理科生可以报吗？,这两个专业是普通本科
咨询,li***n (四川),2010-06-24 11:11,请问贵校去年在四川录取的少数民族预科理科分数是多少？一年后进入什么专业学习,预科没有统计录取分。预科要看当地的计划书。
投档分问题,yz*** (广西),2010-06-24 11:08,贵校章程说按投档分排专业，是否说明投档分中的政策加分对进专业一样有效，贵校在录取和进专业时都承认这一加分？,是的，我们看投档分。
