标题,来源,时间,问题,回答
具体咨询。,zh***cheng (贵州),2008-06-26 13:56,我是贵州文科考生，总分638，全省排名74名，我想填贵校，但又担心落选，其他院校又在与我联系，不知如何是好。能否告诉638分以前有多少人填贵校，能否告诉联系电话以便具体咨询。,欢迎报考我校，你的分数还是很高的，应该不会落选的。
来自浙江（续）,yu*** (浙江),2008-06-26 13:52,你们刚才的回答让我很不信任你们，你们是不是真的招考人员，说话不能这么不付责任！！！,在招生没有结束之前，没有肯定的回答，只能告诉你去年的情况
二本咨询,cy*** (江苏),2008-06-26 13:38,江苏考生，特征分329，投档分362，生物B物理C，请问可报考贵校二本吗？录取希望大吗？谢谢,去年最低分592
请问老师!,mc*** (贵州),2008-06-26 12:42,请问哪里可以找到最近三年上海大学在贵州的最高，最低分数线.以及具体录取人数，具体专业的最高(最低)录取分.谢谢!,招办的网上有07的分数线
请问,ig*** (山东),2008-06-26 12:42,我是山东考生，成绩609分，高出一本线27分，报考贵校有多大希望？,去年高出一本线10分左右
再问,jm*** (浙江),2008-06-26 12:34,投档后是否会退档.进校后，能否换专业,进校后可以换，但是是有条件，有计划的。
毕业文凭,jm*** (浙江),2008-06-26 12:32,我是浙江的，理科一本线超过50分，想读中外合作的会计学专业，问一下，四年毕业后，发的文凭是什么，是否拿双学位.如果不是，国外的学位要如何取得,国内读的拿上海大学的文凭，达标的优秀学生可以拿双学位或出国。
谢谢老师!,fe*** (广西),2008-06-26 12:31,老师好，我是广西一名文科考生，高出1本线15分，有希望被贵校录取吗?,我校在广西没有招生计划
咨询,jg*** (浙江),2008-06-26 12:27,尊敬的老师，请问１.中外合作办学的学院学生赴欧洲学习的比例是多大？２.估计一年生活费为多少？谢谢,"1.今年大概是1：1,2生活费要看自己怎么花。"
麻烦老师了！,ro*** (江苏),2008-06-26 12:19,尊敬的老师：我是江苏考生，情况是355+33=388物理A化学B+，全省排名10168，请问报考贵校有多大期望？？被退档风险多大？谢谢!!,期望不好说。
咨询,sa*** (浙江),2008-06-26 12:17,我是浙江理科考生，608分，超一本线58分.省排名5519名，报你们学校把握大不大?,去年我校在浙江的分数线是609，欢迎报考上海大学
咨询,qi***421 (内蒙古),2008-06-26 12:17,老师你好：请问贵校今年在全国招多少名一批本科生，在上海招多少名一批本科生？谢谢！,在全国招6千多，在上海招3千多。
咨询,ml*** (福建),2008-06-26 12:13,我今年成绩是554，报贵校有没有希望,"不知福建的一本分数线多少,只要在一本分数线上,就有报考的资格.如具备条件,欢迎报考"
内蒙理科考生,qi***421 (内蒙古),2008-06-26 12:12,老师您好，我是内蒙古理科考生。超出分数线50分能否报贵校？把握性大不大？,欢迎报考上海大学，多大把握不好说。
报考,wc*** (山东),2008-06-26 12:10,我是2008年山东理科考生高出重点线25分，报考贵大学有几成把握？建议报考什么专业？,去年我校在山东的理科一本线是583
急问,19*** (江苏),2008-06-26 12:08,我分数是３３６，数学附加分是３４物理化学都是B，可以报考上海大学吗？我在江苏省排名为３１２４５，可以报考贵校吗？是否能被录取呢？,本科要满足2B4C就可以报，多大把握无法预知
提档率,no*** (浙江),2008-06-26 12:03,请问在浙江提档率多少？,1:1.1
老师您好！,jb*** (江苏),2008-06-26 12:00,我是江苏考生！今年特征分达到二本，但是物理B，化学C，未达到贵校在本省要求。可是我省最新政策指出“报考第二批本科院校，考生的特征分须在省控线上，选测科目达到1B1C及以上等级”我符合要求。请问我能否报考贵校二本专业？录取可能性大吗？另外贵校有降分或降等级政策吗？有点招政策吗？,"特征分,我校按照江苏省的要求办,如省里许可,认为你符合条件,则可报考,能否录取无法回答,无降分或点招的可能性."
咨询,ji*** (江苏),2008-06-26 10:55,请问，我是今年的江苏考生，我的投档分是377分，特征分349分，附加分28分，历史A+，政治A，我的排名是21143。我这样的成绩有可能就读贵校吗？请答复，谢谢。,"在一本线上,欢迎报考,能否录取,无法回答.建议可以填报愿意调剂,减少风险."
咨询,li***7626 (甘肃),2008-06-26 10:50,老师您好，我是甘肃理科生，高考成绩571分，想报考贵校理学院，如服从调配被录取的希望有多大?,去年的理科一本最低分是569
咨询,zh***234567 (浙江),2008-06-26 10:47,老师好！浙江理科606分，6060名报考贵校希望多大？会不会被退档？,"欢迎报考,在一本线上,建议填报愿意调剂,减少风险,能否录取,现在无法回答."
咨询（江苏）,js***27 (江苏),2008-06-26 10:47,我是江苏文科考生，特征分332，投档分367分，历史A+，政治A，报考贵校是否有希望。谢谢！,"在一本线上,欢迎报考,能否录取,无法回答."
投档比例,19*** (浙江),2008-06-26 10:45,老师，我是浙江考生，文科582，重点线550，想报考贵校且服从专业调剂，有希望否？投档比例是否1：1？是否影响后面院校投档？,"在一本线上,欢迎报考,能否录取,无法回答.投档比列听省招办的,没录取,退回省招办,是否影响后面录取,请咨询省招办."
第一志愿是否有希望录取,se***ung (江苏),2008-06-26 10:45,我是江苏理科考生，特征分326，投档分360，物理A+，化学B+，请问第一志愿填上海大学本二的经济专业是否有希望被录取?,"有无希望,无法回答,但是欢迎报考."
咨询,ch*** (江苏),2008-06-26 10:38,请问342+34物化A，报考贵校的电子自动化专业有无希望,"欢迎报考,希望多填几个专业,有无希望,无法回答"
咨询,ww*** (浙江),2008-06-26 10:35,我是浙江考生理科，分数为565，报考贵校的二本录取的机会在吗？,"欢迎报考,能否录取无法回答"
咨询 谢谢！,xu*** (贵州),2008-06-26 10:23,请问老师我的分数了是580理科不加分希望被贵校录取几率大吗？,"在分数线上的考生可以报考,能否录取无法回答,"
咨询,lo***ring (江苏),2008-06-26 10:18,我是江苏文科考生，投档分365分，历史A+，政治A，是否有望录取贵校?谢谢.,能否录取无法回答
浙江考生咨询,mm*** (浙江),2008-06-26 10:05,我是浙江文科考生~总分588~高出重点线38分.次位:1184.英语分:140分.如果报考贵校的话，能否选以下专业:A.英语;B.经济学类(中外合作办)(金融学);C.经济学类(中外合作办)(国际经济贸易);D.汉语言学习(文学院);E.汉语言文学;F.广播电视编导.请问贵校有无专业级差分?谢谢!,"欢迎报考,我校各专业之间无级差分,专业选择按照自己的爱好选择,最好填报愿意调剂."
咨询,su***aocong (江苏),2008-06-26 09:57,我是苏州考生，语数外337分，投档分364分，物理A+化学A+，被贵校录取的几率有多大？,"在一本线的330以上,可以报考,录取几率无法回答"
aiber江苏邳州考生,ai*** (江苏),2008-06-26 09:54,老师好，江苏邳州理科考生，语数外331，数学附加分34分，物理A，化学B+，请问能报考贵校吗？谢谢我的联系方式是：13681944907,"一本线330,可以报考,但风险较大"
是否录取?,qq***13 (四川),2008-06-26 09:53,老师，您好!我是一名四川的考生，今年高考估分为620，如果第一志愿报考贵校且服从专业调配，是否能被录取?谢谢~,"四川的高考分数线不清楚,无法回答"
急切咨询！,zy*** (甘肃),2008-06-26 09:50,您好！我是甘肃考生，今年高考成绩567分，比本省重点线高9分，能否被录取？贵校哪个专业就业形势比较好？报贵校哪个专业录取的可能性大？,"在一本线上,可以报考,能否录取,现在无法回答,我校各个专业就业都不错,其中理工科比文科要好,"
咨询,li*** (北京),2008-06-25 15:53,有自考招生吗？,没有
重庆理科,ya*** (重庆),2008-06-25 15:44,重庆理科考生，女，总分578，重庆一本544，考贵校，专业不限，可以录取吗？谢谢,欢迎报考上海大学
关于专业级差.,mc*** (贵州),2008-06-25 15:40,请问老师，贵校的志愿有专业级差吗?具体分差是多少?谢谢,没有专业级差分
老师好!!!,mc*** (贵州),2008-06-25 15:37,由于贵校今年在贵州有增加招生，且增加量不少，分数线会降低吗?贵校认可少数民族的10分照顾吗?是做参考还是计入总分?今年贵州一本线是521我想请问一下高出一本线60分填报贵校有希望被录取吗?这个分数有选专业的余地吗?问题很多，见谅!谢谢!,要看考生的报考情况。录取按投档分。
山东理科,sh***antai898 (山东),2008-06-25 15:33,山东省理科581分，想报贵校二本，不知有没有希望?,只能说是报了才有希望。
咨询,xr*** (湖南),2008-06-25 15:32,老师您好，我是湖南文科考生，请问比一本省控线高出20分左右可以被工商管理类录取吗？谢谢,看情况定。。
咨询,sh***22 (江苏),2008-06-25 15:31,老师您好我是江苏地区考生我的成绩是320+28物理A化学B+请问录取贵校的二本希望大不大,本科要2B4C才可报考我校。
来自浙江,yu*** (浙江),2008-06-25 15:25,我考了597分，可以报考么？投档比是多少,欢迎报考上海大学，投档比例未定
请,ta***8 (重庆),2008-06-25 15:05,请问哪个专业学院的新生在延长校区上学而不是在宝山校区？谢!,新生都在新校区，大二后分到各校区，延长的有机自学院，计算机学院，影视学院，环化学院，通信学院。
专业,ya***ao (浙江),2008-06-25 15:03,上海大学的最好专业是什么啊？,详见：http://www.shu.edu.cn/Default.aspx?alias=www.shu.edu.cn/xkjsbgs
亟盼回复,fx***g (山东),2008-06-25 15:03,"我是一名山东考生.成绩610+省三好学生，请勿恩报考贵校有多大希望?""省三好学生在贵校有无加分政策?谢谢!",按投档分录取，欢迎报考上海大学
山东考生,me*** (河南),2008-06-25 15:01,您好！我是山东考生，比一批线多６分，想抱您校中外合作办学，不知希望多大？若报的话，需要先签合同么？,不太大
咨询,44*** (江苏),2008-06-25 14:56,老师你好，我是江苏考生，理科生，本一分数为330，我的分数是347+36，物理化学都是A。全省排名14391，有没有希望录取。,只有报了的才有希望·
请问,15*** (重庆),2008-06-25 14:55,贵校在录取时是否考虑少数民族加分?重庆理科591(含加分)重本线544，报考贵校适合哪些较好的专业?,按投档分录取
你好,ya***ao (浙江),2008-06-25 14:49,你好，我是浙江考生，我的成绩是610，可以报贵校吗,欢迎报考上海大学
咨询,a9*** (江苏),2008-06-26 09:12,老师我是江苏考生投档分370历史A政治A+请问报考有希望吧,多大把握无法告知
咨询,xs*** (湖南),2008-06-26 09:04,老师你好，我是湖南考生，估分550-560，今年我省一本线估计为535左右，我想报考咱们学校，录取几率有多大?谢谢,去年最低分文科563，理科560
zixun,yo*** (江苏),2008-06-25 16:54,309+21+A+B能被你校本二录取吗??,去年二本最低分592
咨询,le***ou (山东),2008-06-25 16:53,我是一山东理科考生，考了608分，比一本线高26分。是否有把握报取贵校！,去年理科最低分583
咨询,zh***iu (四川),2008-06-25 16:52,在川招生名额是多少,文科17.理科39
咨詢,si***y (湖南),2008-06-25 16:49,您好，老师。我想询问一下，贵校今年在湖南招生的理科投档线大概是多少呢？如果是理科560分左右，能否被贵校录取为电气工程及其自动化，或者经济学类（包括：国际经济与贸易，国际会计等）专业的学生呢？,招生没有结束没人知道分数线，去年理科最低分560分，录取时各专业没有级差分
江苏考生,na***n (江苏),2008-06-25 16:45,特征分338投档分368物B生A+全省三万多名，报本一较好专业有没有问题？,多大把握不知道。
咨询,wu***ra (湖北),2008-06-25 16:31,我是武汉的文科生，今年529，可否报考贵校？,你省的一本线出来了吗？
贵州文科,gz*** (贵州),2008-06-25 16:30,贵州文科考生，609分，被贵校录取的希望有多大？谢谢。,希望多大都不清楚。
山东考生咨询,lo***3 (山东),2008-06-25 16:11,老师你好：我分数587高出一本线5分，想咨询贵校07年山东录取计算机与科学技术专业分数段，若没有统计麻烦您告诉我整体分数段。另外贵校是否招收二志愿考生？您认为我今年报考该专业希望多大？谢谢您的耐心解答,二志愿一般不会招到的。
等待您的回答,lx***008 (云南),2008-06-25 16:07,我是今年的一名应届考生！平时成绩挺不错的～但是由于高考发挥失常～！！成绩很不理想，但是我对贵校相当向往~本科招生是不是招收一本和二本!　招不招收预科生!!各自的标准是什么!!谢谢!!,上大在云南只招一本
咨询,q3*** (浙江),2008-06-25 16:04,我浙江文科考生~总分588~高出重点线38分~专业报考经济学希望大不大~?有几成把握?,欢迎报考上海大学
文科女生,bl*** (山东),2008-06-25 16:00,老师您好，我考了611分。请问报考被录取有没有希望？,欢迎报考上海大学
甘肃,so***yue (甘肃),2008-06-25 15:59,老师好，我是一名甘肃的考生，今年高考考了599，我省重点线558，请问贵校今年在甘肃的录取线大概高出重点线多少分？进校后是否能转专业，有什么条件？,欢迎报考上海大学，进校可以转，条件可以参考今年的www.shu.edu.cn/zbbwz
咨询,rf*** (浙江),2008-06-25 15:54,浙江理科599能录取吗？投档比例多少、有无专业级差？,专业无级差
咨询,zh***234567 (浙江),2008-06-26 11:56,浙江理科考生606分，6060名，可以录取吗？会不会退档？,去年的理科一本分数线是573
咨询,dz*** (山东),2008-06-26 11:44,山东文科571分，报考你校中外合作办学的学校，希望多大？谢谢。,去年我校在山东文科一本线是601
咨询,54*** (贵州),2008-06-26 11:43,老师:我想请问1.贵校法律专业偏向哪方面，是经济法还是其他;2.需口试的专业在分数相同的情况下是否按口语成绩录取;3.贵校在贵州是否有招办，如果有，联系方式是什么,"专业情况请咨询：021-66133932，2,文理不同。3.我校在贵州招办。"
山东文科596分,ms*** (山东),2008-06-26 11:43,高出一本线12分，全省排名5727，请问这种情况报贵校录取几率有多大？,去年我校在山东文科一本线是601分。
老师您好!,yx*** (浙江),2008-06-26 11:43,浙江考生文科568，超18分，报贵校希望大吗?想请尽快回答，谢绝!,报了才有希望！具体希望多大不知道。
请问,ta***8 (重庆),2008-06-26 11:40,请问贵校什么时候提档，什么时候录取，建议重庆28日填完后早点录，担心有不规范行为对我们老百姓的好学生不利，谢!,重庆省统一安排的，都是网上录取，不规范的学校教育部会出红牌或黄牌的。
咨询,du*** (重庆),2008-06-26 11:22,我是理科生，571，可否填贵校经济学类,去年我校在重庆理科一本线是537
请问,46***3 (福建),2008-06-26 11:19,我是福建理科考生，成绩是614，高出本一线81分，全省排名748名。.请问有无希望被贵校录取?谢谢.,"欢迎报考,专业按照自己爱好选择,最好愿意调剂,"
请问,xq***4 (贵州),2008-06-26 11:14,老师你好，我是贵州理科的考生，高考分数是541，一本线是521，今年贵州是第一年知分填志愿，是否有希望上贵校？谢谢,"欢迎报考,最好愿意调剂,有无希望,无法回答"
咨询,wb*** (江苏),2008-06-26 11:14,我是江苏考生，我的分数是335+24历史A政治C，可以报考贵校吗？,"欢迎报考,能否录取无法回答"
咨询,aa***d (浙江),2008-06-26 11:13,浙江理科583，专业服从调剂是否有希望被归贵校录取？,"能否录取,无法回答"
咨询,ti***le (江苏),2008-06-26 11:05,问一下在江苏一般排名多少也被贵校录取?,不好说。
日期,hn*** (河南),2008-06-26 10:59,请问贵校招生的名单什么时候能出来?,看你们省的文件
报考咨询,js***27 (江苏),2008-06-26 10:59,我是江苏文科考生，特征分332分，投档分667分，历史A+，政治A，报考贵校是否有希望？谢谢！,报了才有希望。
咨询,55*** (甘肃),2008-06-26 10:56,老师您好，请问甘肃文科600分能否报考贵校？,"欢迎报考,在一本分数线560上,可以报考."
咨询一下？,cr***728 (江苏),2008-06-26 13:36,请问上海大学哪几个理科专业比较强呢？,都差不多
急切咨询,19*** (浙江),2008-06-26 13:33,老师，我是浙江考生，文科582，重点线550，想报考贵校且服从专业调剂，有希望否？投档比例是否1：1？,去年文科583，理科609，投档比例1：1
咨询,an***heng123 (安徽),2008-06-26 13:30,安徽618分理科可否报贵校,去年文科567，理科587
来自浙江,yu*** (浙江),2008-06-26 13:27,通过近几天的咨询，您统计哪些专业比较热门，597分能填什么专业,去年文科853，理科609
请问贵校今年在贵州省的招生线大概是多少？,ch***u (贵州),2008-06-26 13:24,我是贵州理科学生，考了585（无附加分数）。报考贵校有希望吗？希望有多大？能学些什么专业？谢谢老师！还有报考贵校有什么限制或者要求吗？,去年文科582，理科569，无特别要求
请问,jm*** (浙江),2008-06-26 13:22,老师:请问，未被中外班录取，进校后能否转中外班,可以参加考试，也是有名额的
排名,19*** (江苏),2008-06-26 13:17,请问在江苏省内排名多少能有希望被贵校录取?投档分392，选修AB，有希望吗?,本科2B4C都可以报。希望多大我们也不知道
录取概率,ea*** (江苏),2008-06-26 13:16,江苏考生，一本压线：投档分358（特征分330，附加分28）物理A，化学B，请问可报考吗？谢谢,本科要满足2B4C都可以报。
咨询,du*** (重庆),2008-06-26 13:09,我是理科生，571，可否填贵校经济学类,可以报，但不知道可不可以录取的。
咨询,zh***aosheng08 (浙江),2008-06-26 13:01,贵校去年在浙江的投挡线是550，但是去年最低的录取分数却是532，请问这是怎么回事？谢谢！,去年浙江文科一本的投档线是553，我校的最低录取线是583，不知道你是在哪里看到的532分！而且你的550也是不对的。
咨询,an***heng123 (安徽),2008-06-26 13:00,安徽618分可否报贵校,分数线未出，无法回答你
咨询,ll*** (江苏),2008-06-26 13:00,我是江苏考生，特征分333，附加分33，物理A化学A，报贵校物理系有可能吗？其他专业呢？,可以报，但不知道可不可以录取。
浙江理科考生急询,yj*** (浙江),2008-06-26 12:59,老师好，今年我考了605分，请问能否录取？若在贵校读书，四年后能否考研？貌似贵校有一个西南高校学习的机会的政策，能否给以解释？谢谢,可以考研的，要自己努力，有部分优秀学生可以录取。西南片选课，就是说可以到上海市的其他学校选课
咨询,wa*** (浙江),2008-06-26 12:54,若将A校填在第一批的A志愿上，将贵校填在B志愿上...若考生达到A校投档分数线却因专业问题而被退档....那会不会影响该校专业选择的范围...即晚被投档会否许多专业已被选择...,"上海大学只录取第一志愿报考的考生,二志愿的考生没有机会."
咨询,le***ou (山东),2008-06-26 12:53,贵校是否接受第二志愿,一般不会录到第二志愿。
咨询,54*** (浙江),2008-06-25 13:51,理科427分填报贵校有无希望被录取,重点线也没上，二本我校去年文科553，理科573
咨询,ma*** (江苏),2008-06-25 13:50,我是江苏文科考生，请问贵校以往录取江苏考生，一般多少排名的较有希望？,去年我校江苏607分
请教教师,ta***8 (重庆),2008-06-25 13:47,教师：我是重庆市一中的学生，叫陶然，理科，高考考了603分(没有加分)，我自主招生是上海交大(加10分)，现在发挥不好，但我一定要到上海学习，想报贵校，行吗？重庆的一本是544分。谢谢!我的电话是13608320098,去年理科537分
老师你好,js*** (江苏),2008-06-25 13:45,老师你好：我是江苏的考生。投档分364、特征分330、语文附加分34、政治A+、历史A，报考你校有希望吗？,去年607分
咨询,ra*** (江苏),2008-06-25 13:35,江苏考生。特征分337。投档分367。物化双B+。排名36267。请问有望报考贵校吗？,估不出
咨询,ch*** (江苏),2008-06-25 13:20,我是一名江苏考生，特征分３４８，数学附加分３２，理化２Ｂ，总分排名１７５３２名，报考贵校有希望被录取么？,估不出
把握大吗?,ma*** (江苏),2008-06-25 13:17,我是江苏无锡市文科考生，08年高考成债为365分，其中基本分344分，测试课政治A+，历史B+，排名399000，是江苏08年高考一本线为330分.我非常愿报考贵校，不知把握大吗?如果我专业服从，是否增加可能性?入学后能否转专业?如果万一退档，贵司是否有扩招生，即交纳一定费用后仍可入学一本?另外我从小过继给我香港的姑姑，我香港的姑姑至今未生育小孩，这种情况能否作为华侨子女加分照顾?调剂与退档询问(江苏)如填贵校—本并填专业服从，贵校按1:1.2调档，如万一没录取:(1)是否是在江苏招生计划的全国所有院校内调剂，也就是会被任何可能的院校的一本专业录取?如不服从，才退档进入本二院校?(2)还是先在贵校其他一本专业调剂，如还不行，再在江苏招生计划的全国所有院校内一本调剂，也就是会被任何可能的院校的一本专业录取?如不服从，才退档进入本二院校?(3)如果我填专业不服从，但填一个好的二本(如贵校)，这样一本退档后可保证该二本录取?多谢了!!!等侯你们的答复!非常感谢!,问题很多，好多问题现在没法回答，要等招生结束才能知道。我校是按你省的投档分录取，各专业之间无级差。愿意调剂录取的概率大。
咨询,mz*** (江苏),2008-06-25 13:14,各位领导：我是江苏文科考生，今年特征分331分，语文附加分32，投档分363，历史A，地理A+，报考贵校，能否录取！！谢谢！！,没法估计
排名,ra*** (江苏),2008-06-25 13:05,贵校一般招生在江苏省的排名是多少,我们不知道
浙江文科考生咨询,mm*** (浙江),2008-06-25 12:55,老师好，我是浙江的文科考生，本次成绩588，超过重点线38分，请问有资格报考贵校吗？什么专业比较有把握一些？谢谢~~,去年我校录取最低分583分，各专业之间无级差，欢迎报考
询问,ye*** (浙江),2008-06-25 12:47,我高考598，超重点48，请问贵校有哪些专业我有可能入取，是否可以入取特色专业贵校欲留志愿选择吗,根据往年的情况希望还是有的，各专业之间无级差，欢迎报考
咨询,lg***17693 (云南),2008-06-25 12:47,老师您好！我是云南文科考生，今年实考分是612分，高出分数线62分，请问能否填报贵校。另外，请有无招生咨询组派驻云南昆明，有，请问如何联系，谢谢！,目前没有派人去云南。
咨询,zh*** (江苏),2008-06-25 12:46,老师：您好！我是江苏理科考生，特征分357，投档分391，6A，全省排名8047。请问我今年的分数有希望录取贵校会计学（国际会计方向）或者临床医学专业吗？2A有加分吗？急盼告知，谢谢！,见：http://www.shu.edu.cn/Default.aspx?tabid=5738&ctl=Detail&mid=9027&Id=31622&SkinSrc=[LSkins/zhaobiban31/zhaobiban31，我校没有医学专业
批次,bo***g (河北),2008-06-25 12:43,贵校在河北省是几本？今年是否招文科生？,只招艺术类
咨询,wx*** (江苏),2008-06-25 12:36,江苏理科考生特征分349投档分383分，物理化学是B+B，能被贵校录取吗？,报考条件是2B4C，能否录取无法提前知道。
zixun,ji***u (河北),2008-06-26 09:50,内容：老师:学生体检情况是:大三阳，肝功正常，想报考贵校的国际经济贸易、法律或计算机专业，可以吗？如果能录取，可以和其他同学一样学习和生活吗？请老师给予明确答复。在这个问题上，如果答复“可以”，我们十分感谢；如果答复“不可以”，我们也能够理解。我们最不愿看到的答复是“我校执行教育部、卫生部高考体检标准”，因为这个标准我们也能查到，但是各学校具体执行时并不一致。所以，我们恳请老师给予明确答复。,"按教育部的体检标准执行,"
咨询,yj*** (浙江),2008-06-26 09:49,您好!请问2007年贵校生物工程\食品科学与工程专业浙江考生最低录取分是多少?谢谢!,浙江理科609分，各专业之间无级差
咨询,he*** (江苏),2008-06-26 09:48,我达到本一，投档分364，物理A化学B，排名41000，报考贵校有希望吗？,去年江苏607分
