标题,来源,时间,问题,回答
问,hu*** (浙江),2011-06-27 10:46,老师好！如果我被录取在普通5000元的专业，想进15000的中外合作班要有什么条件？我发现对已学专业不想继续再下去，并向学校汇报，学校会怎么处理？谢谢！,[为了给思想品德好、基础扎实、具有发展潜力的学生，提供进一步发挥其潜能和创造力的机会，也为了使那些经过一段时间学习后，志向有所改变的学生能充分发挥其学习特长，学校将向学生提供跨大类选择专业的机会。在第一学年末，专业分流前，对确实需要跨大类选择专业的学生(包括项目班、中外合作办学专业、日语专业的学生)，通过一定的程序与考核，可以进行跨大类直接选择专业。
专业,xh*** (山东),2011-06-27 10:42,金融学是在经济学类还是在工商管理类，是不是大二这两个专业的都可以选择金融学，谢谢。,经济学类是基础班，两个类可选专业是一样的。
报考咨询,bg*** (河南),2011-06-27 10:40,老师您好，我是河南理科考生，分数606，贵校能录吗？,根据往年的录取情况看，希望不是很大
报考。,sh*** (河南),2011-06-27 10:38,你好今年河南理科考生考了604分想报考贵校被录取的希望大吗？,去年高27分录取，请参考下
录取,yi*** (广西),2011-06-27 10:36,老师你好，我是广西考生，541分。请问：1、有没有机会录取贵校？2、一旦贵校提档，要是愿意调剂，会不会被退档？谢谢,根据往年的录取情况看，是有希望被我校录取的，平行志愿，愿意调剂不退档
咨询,na*** (江苏),2011-06-27 10:34,我江苏理科358分，物A+化A，报你校能录取吗？（注：江苏是不分第一志愿的）如果想转系，如何转系，又何时转系呢？,根据往年的录取情况看，是有可能被我校录取的，转院系的相关事宜是根据每年的具体情况而定的，现在还没有相关文件
报考咨询,bg*** (河南),2011-06-27 10:33,老师您好，我是河南理科考生，分数606，贵校能录吗？,根据往年的录取情况看，有一定的风险
向贵校提问题？,tp*** (河北),2011-06-27 10:33,河北省考生理科分数606已经报考贵校录取希望大吗？,根据往年的录取情况看，是没有希望被我校录取的
关于专业,ty*** (广西),2011-06-27 10:32,我听说贵校是第一年末才进行分专业，那么第一年的学习是按高考志愿的专业分的吗？如果是的话，第二年专业会不会有大变动？谢谢,学生入学第一年无专业身份，第一学年末在类内进行专业分流。分流时，学生依据本人意愿填满所在类内的所有专业，然后按照学生入学时的高考成绩、第一学年绩点排序，参考个人综合表现，依据各专业最大可容纳学生数，按填报志愿的顺序分流到专业。
报考,s4*** (山东),2011-06-27 10:29,我是山东文科考生。今年考了588分，想报考贵校，希望大不？,根据往年的录取情况看，有一定的风险
咨询,sd*** (山东),2011-06-27 10:29,1、我是山东考生，分数609分，高出一本线42分，报考贵校实验班，录取的可能性多大？2、报考中外合作办学，是否必须有法语基础？谢谢！,根据往年的录取情况看，是比较有希望被我校录取的，不需要法语基础
咨询,ba*** (内蒙古),2011-06-27 10:28,老师您好！我是内蒙古理科考生，今年考了530分，超一本线48分，报考贵校有希望吗？谢谢,根据往年的录取情况看，希望不是大的，比较危险
非常感谢！,fy*** (山东),2011-06-26 16:35,您好!我今年的高考分数是638，超过山东一本线71分，可以报考贵校的哪些专业？,你被我校录取的希望很大。填报自己喜欢的大类或着专业就好。
关于一年后选专业,lj***994 (浙江),2011-06-26 16:33,您好，请问：贵校经济管理类基础班和经济管理类一年后选专业哪个比较好选？谢谢！,基础班绩点在前80%的学生可以在类内任意选择专业。
老师你好,hu***qun (河南),2011-06-26 16:31,河南理科考生608分能上贵校吗？,去年录取线比一本线高了27分，根据你的成绩是否能被录取的可能性不好判断。
计划数,74*** (安徽),2011-06-26 16:29,老师您好，我是安徽理科考生，今年分数相当于去年的605分，请问，这个分数在去年能进入电气工程及其自动化+热能与动力工程+机械设计制造及其自动化这3个专业吗？电气工程及其自动化专业，今年和去年招收人数格式多少？谢谢老师，非常愿意报考贵校！希望能给我一个明确答复！,"如果你说你今年的分数相当于去年的605的话,去年605正好是我校的最低录取分数线,所以这几个专业可能不是很容易进,招生人数请参见:http://www.zsw.shu.edu.cn/Default.aspx?tabid=5738&ctl=Detail&mid=9027&Id=60819&SkinSrc=[LSkins/zhaobiban31/zhaobiban31"
录取,cx***y (云南),2011-06-26 16:25,老师，你好!我是云南理科考生，考分554分(一本线465)，请问报读贵校是否有希望?平行志愿如果服从调剂，调档后是否还会退档?此外，贵校的中外合作办学专业是指可以发外方学历证书，还是有机会到国外就读?,根据以往情况有希望。服从调剂不退档。悉尼工商学院达到条件可以拿到中外双学位。中欧工程学院通过选拔可去法国。
招生组咨询,qx*** (河南),2011-06-26 16:25,老师您好！请问贵校有没有在河南设立招生咨询组？联系方式是什么？,"河南我们没有设立咨询组,你可以明天拨打咨询电话:66134148"
经济类专业,xu*** (江苏),2011-06-26 16:23,急！我有5个问题：1、江苏经济学类（中外合作4人），是否包括金融学？2、人文社科类经考核是否可转入经济学大类，是否有机会转入中外合作悉尼工商学院？3、一年后专业分流，要按各学科的容量分配如何理解？谢谢！,"[经济学类是包括金融学的,中外合作的是有金融学这个专业的,具体情况可以参见以上网址:http://www.zsw.shu.edu.cn/Default.aspx?tabid=5738&ctl=Detail&mid=9027&Id=60820&SkinSrc=[LSkins/zhaobiban31/zhaobiban31,跨类考试的是可以的,有机会,只要能考试通过就行了,按学科的容量分配就是说考虑到学校的学科容量等各种条件."
报考,xx*** (安徽),2011-06-26 16:23,我是安徽文科，高考577，报考贵校有希望吗？,"根据往年的录取情况看,是有可能被录取的,但是希望不是很大"
咨询,91*** (河南),2011-06-26 16:23,河南理科，618，报贵校多大希望,去年在河南录取线比一本线高了27分，按以往情况你有希望被我校录取。
咨询,81***5 (浙江),2011-06-26 16:22,今年贵校在浙江省招的文科人数有所减少，请问投档分数线会高吗?,无法确定。
去年录取的最高最低分是多少,fj***fjm (浙江),2011-06-26 16:18,中欧工程技术学院和悉尼工商学院去年各专业浙江录取的最高最低分是多少，我是浙江考生，今年我612分能否进这两个分院？,"根据往年的录取情况看,是有很大希望被我校录取的"
理科生报文科试验班,hu***qun (河南),2011-06-26 16:17,1.没有文科基础有何影响？2.学习内容？3.发展方向？,"文科实验班是文理兼收的,没有什么影响,专业的详细内容请参见以下网址:http://www.zsw.shu.edu.cn/Default.aspx?tabid=5738&ctl=Detail&mid=9027&Id=60820&SkinSrc=[LSkins/zhaobiban31/zhaobiban31"
咨询,13***39 (湖北),2011-06-26 16:15,我是湖北考生，579分超出一本线8分，是否有希望被录取,去年高了3分，按以往情况来说你有可能被录取。
咨询,lg*** (江苏),2011-06-26 16:14,我江苏理科358分，物A化A+，报你校能录取吗,"你可以作为第一志愿试试,有可能被录取的"
是否成死档？,ch*** (安徽),2011-06-26 16:11,您好！我是刚才安徽581分理科生，得到你们可以填报贵校的回答很高兴，可万一我被投档到贵校却录取不了，那一批平行的其他三个志愿学校是否就不能再投档即成死档了？,愿意调剂不退档。
录取,xu*** (江苏),2011-06-27 12:54,我是江苏理科考生，365分，两B+，报贵校，把握大吗？,去年高13分录取，请参考下。
咨询,22***9 (云南),2011-06-27 12:48,您好，我是河南文科考生，高考成绩587分，了解了贵校历年在我省录取情况，请问能够到贵校读书的希望大吗？谢谢。,去年高27分录取，请参考下。
咨询,ki*** (河南),2011-06-27 12:46,您好。我是河南一理科生，今年考621分，报考贵校机会如何？谢谢,去年高27分录取，请参考下。
咨询,ac*** (河北),2011-06-27 12:43,您好，我是河北理科考生，今年考了615分，比本一线高出34分，若服从调剂是否有可能被贵校录取,去年高33分录取，请参考下。实行平行志愿的省市，我校按105%提档，且服从调剂不退档
浙江,77*** (浙江),2011-06-27 12:42,我是浙江理科一考生，分数610，C志愿填报贵校的录取可能性大吗？我不想去中外合作班，是否不能填专业服从？如果不填是否会被退档？谢谢回答。,外省市考生一般不会被调剂到中外合作办学专业。愿意调剂的，提档后不退档。
录取咨询,su***n (河南),2011-06-27 12:40,你好，我是河南理科考生，成绩是620分，请问被贵校录取的可能性大吗？请问贵校的王牌专业都有哪些？,按以往录取情况你很有可能被录取。我校各个专业都有优势。
报考咨询,zh***3 (山东),2011-06-27 12:39,山东598能报考贵校,去年高27分录取，请参考下。
转专业,vv*** (山东),2011-06-27 12:36,如果报考了中外合作的专业，大一末还可以转专业吗？,[为了给思想品德好、基础扎实、具有发展潜力的学生，提供进一步发挥其潜能和创造力的机会，也为了使那些经过一段时间学习后，志向有所改变的学生能充分发挥其学习特长，学校将向学生提供跨大类选择专业的机会。在第一学年末，专业分流前，对确实需要跨大类选择专业的学生(包括项目班、中外合作办学专业、日语专业的学生)，通过一定的程序与考核，可以进行跨大类直接选择专业。
河南理科考生,ya***nhaohaomeng (河南),2011-06-27 12:33,老师好！我考了626分，超极喜欢贵校。能提供一下贵校近几年各专业的录取分数的网址吗？谢谢了！！！,去年高27分录取，请参考下。具体专业的分数线应该在你们代码书里有的。
咨询,cj*** (福建),2011-06-27 12:22,今年我考615排9974名被贵校计算机专业录取机会多大,去年在福建录取的所有学生的最低分数比一本线高了36分，请参考下。
录取,yi*** (内蒙古),2011-06-27 12:20,我是内蒙考生，报考时实时精确排名，专业服从调剂，是否提档不退档。,如果被提档了，愿意调剂，不退档
咨询,cj*** (福建),2011-06-27 12:20,2011年福建理科9974名报计算机专业能进吗,去年在福建录取的所有学生的最低分数比一本线高36分录取，请参考下。
高考咨询山东,wa***g122 (北京),2011-06-27 12:18,您好，我是山东理科的一名考生，今年高考成绩618分，能否报考贵校，什么专业比较合适？谢谢,去年高27分录取，按去年的情况你很有希望被我校录取。填报自己喜欢的专业就好了。
退档,ma*** (浙江),2011-06-27 12:14,是否会退档,实行平行志愿的省市，我校按105%提档，且服从调剂不退档
调剂,vv*** (山东),2011-06-27 12:11,我是山东考生，考了619，想报经济类的，请问如果被调剂了，会调到所有专业里的没满的还是会调到在山东招生的专业里的没满的？,所有专业。
录取与转业,hu*** (浙江),2011-06-26 15:43,老师你好：我是浙江理科考生600分，今年有没有希望被录取？如果录入调剂志愿后想要转业，比率有多少？谢谢！,[根据以往的录取情况，你有希望被我校录取。为了给思想品德好、基础扎实、具有发展潜力的学生，提供进一步发挥其潜能和创造力的机会，也为了使那些经过一段时间学习后，志向有所改变的学生能充分发挥其学习特长，学校将向学生提供跨大类选择专业的机会。在第一学年末，专业分流前，对确实需要跨大类选择专业的学生(包括项目班、中外合作办学专业、日语专业的学生)，通过一定的程序与考核，可以进行跨大类直接选择专业。
咨询,no*** (浙江),2011-06-26 15:37,浙江考生文科613分，省内排名1770左右，能录取吗？中外合作的专业分数高吗，有希望么？,"根据往年的录取情况看,有很大的希望被我校录取!"
能否填报贵校？,ch*** (安徽),2011-06-26 15:32,我是安徽的理工考生，我省一本线534，本人考了581分，超一本线47分？请问能否填报贵校，能报工商管理（类）、经济学类专业？,"根据往年的录取情况看,是有希望被我校录取的"
老师好,wb*** (浙江),2011-06-26 15:31,您好，如果我没有选择专业服从，那么被录取的希望大不大？我是浙江理科考生，分数为621，超一本线71分。谢谢。,根据以往录取情况，再加上我校今年按大类招生，你被录取的希望还是很大的。
咨询,zh***i (浙江),2011-06-26 15:25,您好！请问下，经济管理类基础班和经济管理类，在第一学年末进行专业分流，可选专业是否一致？如不一致，又何区别？谢谢～～,"是一致的,只不过分流的条件不同"
老师你好,hu*** (浙江),2011-06-26 15:19,老师你好，我有一个问题。今年经济管理类与去年相比招生人数有何变化？其中，去年收费5000元与15000元各招了多少人？请分别回答，麻烦了，非常感谢！！！,今年经济管理是一个大类，和去年的没有办法比较。
咨询,tm*** (山东),2011-06-26 15:16,山东理科602分，过一批线35分，报考贵校几成把握，可选什么专业？,"根据往年的录取情况看,是有一定的希望被录取的,我校2011级新生是不分专业招生的"
录取问题,iv*** (江西),2011-06-26 15:14,老师您好，我是江西考生，一本线只过21分，很想上贵校，有希望吗？,按去年的分数线来说，希望不大。
江苏招生组,xu*** (江苏),2011-06-26 15:05,贵校在江苏是否有招生宣传组？江苏招生组联系电话是什么？,"江苏是在苏州有一场招生咨询会,6月27日,苏州市高等教育区体育馆（江苏）,电话你可以咨询:66134148"
咨询,wb*** (浙江),2011-06-26 15:04,老师您好，我是浙江理科考生，高考分数为621分，想报考贵校。如果我填选专业服从，有没有可能被分配到学费高的专业中去，因为我看到贵校有些专业是15000元/年的，这还是比较高的，对家里也会有压力。谢谢。,一般不会
贵校去年录取平均分多少？,lu***1993 (福建),2011-06-26 15:03,贵校去年录取平均分多少？是583分吗？,"我校去年在福建省的最低录取分数线为:文科:581,理科:575"
专业调剂,ta*** (河北),2011-06-26 15:03,感谢您回答我上面的问题，还想问一下是不是没有法语基础的考生就不会被调剂到该专业？,对的
关于录取,xi*** (江西),2011-06-26 14:57,我是江西理科考生，高出一本线60分，排名3570，请问录取贵校几率多大，能否进理科实验班,"根据往年的录取情况看,有很大的希望被我校录取"
咨询,12***9 (贵州),2011-06-26 14:51,贵校估计在贵州分差是多少？,要看今年学生填报志愿的情况而定，去年文科差了34，理科54
录取&中法合办专业,ta*** (河北),2011-06-26 14:46,我高考成绩比一本线高44分，报贵校的理科实验班，请问录取的概率大吗？中外合办的专业介绍中说第一外语为法语，如果没有法语基础怎么办？谢谢！,"根据往年的录取情况看,有希望被我校录取,没有法语基础的是不会被录取的,这是要求外语为法语的学生"
报考咨询,wu*** (福建),2011-06-27 09:15,老师好，我是福建理科考生，618分想报贵校理科试验班，有几成把握能被录取,根据往年的录取情况看，是很有希望被我校录取的
悉尼工商学院专业,qa*** (浙江),2011-06-27 09:10,到底是有几个专业在浙江招生？有出国学习机会吗？,按计划为准，都在国内。
一定要口试吗？,ti*** (贵州),2011-06-27 09:08,该校的招生简章中有一句话“外省市考生外语统一口试按考生所在省市的规定执行。”但是一定要考口试吗？应为当时我想到的是我读的是工科。所以我就没有参加口试了。一定要口试吗？,这是按照你们省的规定执行的，如果你们省规定要的，那就是要的
能否录取,wh***000 (湖北),2011-06-27 09:04,我是湖北的考生，理科考了573分刚好踩一本线，不知能否被该校录取,根据往年的录取情况看，被录取的希望比较校
能否录取,wh***000 (湖北),2011-06-27 09:03,我是湖北的考生，理科考了573分刚好踩一本线，不知能否被该校录取,根据往年的录取情况看，被录取的希望比较小
陕西理工604,15***90 (陕西),2011-06-27 08:49,陕西理工考生，女，604分，位次7618，能否报考本校，如果能，报什么专业较好,根据往年的录取情况看，是有很大的希望被我校录取的，我校2011年是按大类招生的，新生入学一年后才进行专业的分配
录取,al*** (山东),2011-06-27 08:49,你好，我是山东理科考生，高出重点线33分，报考贵校的理工科有把握吗？谢谢！,根据往年的录取情况看，是有希望被我校录取的！
问,hu*** (浙江),2011-06-27 08:45,非中外合作的经管类学生要转到中外合作的经济类有何要求？分专业后发现自己是在对该专业没有兴趣，向学校汇报后，学校怎么处理？请分别回答，非常感谢！,[：为了给思想品德好、基础扎实、具有发展潜力的学生，提供进一步发挥其潜能和创造力的机会，也为了使那些经过一段时间学习后，志向有所改变的学生能充分发挥其学习特长，学校将向学生提供跨大类选择专业的机会。在第一学年末，专业分流前，对确实需要跨大类选择专业的学生(包括项目班、中外合作办学专业、日语专业的学生)，通过一定的程序与考核，可以进行跨大类直接选择专业。
录取,ab*** (山西),2011-06-27 08:45,您好，我是山西省文科考生，我省文科一本录取线为543，贵校成绩567，本人成绩573，第一志愿为贵校。但贵校567分是12人的分数线（不包含中外合作办学专业的3人），我的第一专业志愿是中外合作办学专业，且专业服从调配，请问我是否达到贵校录取标准，能否被录取，被录取的话是贵校哪个专业？谢谢,你可以把中外合作的填进你的志愿，按照往年的录取情况看，是有比较大的希望被我校录取的
卓越工程师,yl*** (江苏),2011-06-26 16:56,老师您好！我是江苏一理科考生，考分365分，物A+，化学A;请问贵校卓越工程师专业是什么？,卓越工程师班的专业是：机械工程及自动化，金属材料工程，详细情况可以参见：http://www.zsw.shu.edu.cn/Default.aspx?tabid=5739&ctl=Detail&mid=9074&Id=60820&SkinSrc=[LSkins/zhaobiban31/zhaobiban31
浙江文科,ly*** (浙江),2011-06-26 16:52,浙江文科617排名1450求分析及专业推荐。另，一年后10%的重考名额参加重考详情请解释,根据往年的录取情况看，是比较有希望被我校录取的，关于重考名额的事情我们好像是没有的
经济学,yl*** (江苏),2011-06-26 16:52,老师您好！我是江苏一理科考生，考分365分，物A+，化学A;请问报考贵校经济学类希望如何？,根据往年的录取情况看，是有蛮大的希望被我校录取的
安徽计划,74*** (安徽),2011-06-26 16:46,老师您好，看了贵校网站，电子工程及其自动化专业在安徽招生193人，但是这个专业去年并没有在安徽招生，请问这个专业是不是今年新增的？,不是新增的，在安徽今年有了招生计划
录取,jh*** (贵州),2011-06-26 16:41,老师你好，我是贵州省考生，我省实行平行志愿。1，加分是否一加到底，即专业录取时也承认加分？2，设不设专业级差？,只要是投档时的加分都承认，专业无级差。
求证,hu*** (浙江),2011-06-26 16:40,老师好：你们的回答中对调剂志愿是否会被调进15000的中外合作班有二种回答：有的说有可能，有的说不会，到底怎么样请给个确切的回答。谢谢！,外地考生是不会被调剂到中外合作班中的
平行志愿,20*** (甘肃),2011-06-27 10:27,请问如果将贵校列在平行志愿，能不能录取？甘肃理科528分，谢谢老师！,根据往年的录取情况看，是有希望被我校录取的
咨询,ai***xing (河南),2011-06-27 10:26,你好！我是河南的一名文科考生，高考成绩为582，再全省排名3287，报贵校能被录取的几率大吗,根据往年的录取情况看，被我校录取的希望是比较小的
专业填报,07*** (浙江),2011-06-27 10:25,请问老师，贵校的三大类专业（如经济管理类，人文社科类）在填报志愿时只显示这些名称，但其下包括不少专业，在我所查的资料中都是具体专业（如应用化学，档案学等）的往年录取分，那在报这三大类专业时，对于他们往年的录取分应该参考什么才会更准确一些，使自己更有把握一些呢？希望您为我解答一下，谢谢！,今年是我校第一年按大类招生，所以没有过去大类分数线可以参考，你可以参考下类内专业的最低线。
录取,yi*** (内蒙古),2011-06-27 10:18,我是内蒙古考生，理科，分数为542分，在省级排名4900名，超一本分数线60分，能否被贵校录取，专业服从调剂，能否提档不退档,根据往年的录取情况看，是有希望被我校录取的，服从调剂，完全平行志愿，被提档后不退档
报考咨询,sh*** (山东),2011-06-27 10:17,老师您好，我是山东理科考生，超一本线30分，愿报考贵校，是否可能？谢谢,根据往年的录取情况看，有一定的希望被录取，但是不是很大
关于上海大学的几个中外合作专业问题及调剂问题,qq***70 (河北),2011-06-27 10:16,请问1：中外合办专业由于学费高，是否只招收有志愿的考生，我报考该校，是否有被调剂到这个专业的危险？2：贵校是否在考生德体符合且服从调剂的情况下，投档就不退？因为考虑到投档比例大于1比1多投的人是否这样处理？希望老师能够对我的问题给予答复谢谢我是河北考生,1一般不会把外省市学生调剂到中外合作专业中。2在实行平行志愿的省市，我们按105%提档，且愿意调剂不退档。
关于预科,fr*** (湖北),2011-06-27 10:16,老师您好，我是湖北恩施的理科考生，今年520分有多少把握上贵校的预科吗？,根据往年的录取情况看，上我校的把握很小
专业填报,07*** (浙江),2011-06-27 10:15,请问贵校的经济管理类基础班，理学工学类基础班这些班的往年录取分在浙江省大概为多少，位次要多少我一直查不到相关资料，希望您能替我解答一下，谢谢,今年我校实行大类招生，是第一年，所以可以参照的资源基本没有，只能参照往年的最低录取分数线
投档、提档、专业调剂、转专业,ch*** (安徽),2011-06-27 10:14,老师好！我是安徽理科生。1、我省投档是计划的105%，贵校提档也是105%，是相同的，按照贵校招生章程：第一批本科按照105%提档，愿意调剂不退档。该条的意思是不是只要投档到贵校，且愿意专业调剂就可被贵校录取？2、专业调剂是在我省招生计划中调剂还是在贵校理科专业中调剂还是在贵校所有专业中调剂？3、贵校入校后是否可以转专业？有什么要求？,第一条可以这么理解，专业调剂是指在我校所有专业（除中外合作）中调剂，入校后是可以进行转专业的，需进行相关考试
咨询2,pc*** (江苏),2011-06-27 10:12,我是江苏考生，高考成绩366分，选测科目物理B+，化学B，但色弱，能否上贵校?限报贵校那些专业？谢谢,根据往年的录取的情况看，是有很大希望被我校录取的
录取,ch***11 (河南),2011-06-27 10:12,我是河南理科考生，今年考了634分（一本582），请问录取的把握有多少？好专业呢？,按以往的情况你很有希望被录取。
文科考生咨询,ox*** (浙江),2011-06-27 10:12,本人考生成绩是608分有几成把握进入贵校,根据往年的录取情况看，只能说有一定的希望被我校录取
