标题,来源,时间,问题,回答
咨询,hh***9 (黑龙江),2013-06-18 16:23,尊敬的老师您好：我是黑龙江考生高一本线30多分能否报你校，你校一次就业率是多少？专业考研率是多少？毕业就业方向都是哪里？如果进档服从专业调剂是否退档。谢谢,可以报考，服从不退档
东北农业大学的今年有本科三批？,zh***ofei2013 (黑龙江),2013-06-18 16:03,老师您好：东北农业大学的今年有本科三批？是中外合作办学吗？必须出国？有什么具体的内容和规定？,没有三批
什么是不分省招生的专业,lu*** (辽宁),2013-06-18 12:10,老师你好，在你校的招生计划中看到“不分省招生的专业”不明白是什么意思？请解释一下好吗？谢谢！,不清楚你说的意思
报考问题,ka*** (黑龙江),2013-06-18 10:25,文科490有希望进入贵校二表B吗,2c可以报考
关于报考志愿,ka*** (黑龙江),2013-06-18 10:24,本科二批录取院校B段，和C省本科二批中外合作办学（含民办）院校志愿有什么区别,省内高校合作办学都在C段，省外高校在B段
二表A和二表B的关系,sg*** (黑龙江),2013-06-17 10:38,您好！我是黑龙江的理科考生，请问网上说平行志愿考生只有一次录取机会，假如我报了您校的二表A，也报了您校的二表B，如果我的考分够您校的二表A段，但不够所报的二A的专业段又不服从调剂，那么我是会被退档、参加以后的征集志愿或下一批次录取还是会被落到所报的您校的二表B专业。,我校合作办学在2c，2a和2c是两个批次，2a退档对2c投档没有影响
二志愿,qw*** (黑龙江),2012-06-15 14:57,贵校是否招收二志愿考生,一表理工有可能开二志愿
390,12*** (黑龙江),2012-06-15 13:22,390能走贵校啥专业,二表b希望不大
二表B,12*** (黑龙江),2012-06-15 13:20,贵校有哪些专业？？,查看省招生计划大本
二学位,hu***huzhu (黑龙江),2012-06-15 13:07,请问贵校二学位开设哪些专业.有金融学么,具体请咨询教务处，金融应该有
急需答案,50*** (黑龙江),2012-06-15 12:20,我的分数在470-480之间能呗被贵校的二表A录取吗?,可以报考，但有风险
联合办学和一表和二表毕业证一样吗？,ws*** (黑龙江),2012-06-15 12:05,请问上联合办学的学生毕业以后是否享受一表、二表毕业生一样的毕业证和推荐待遇？,毕业证书一样，没有区别
mk,55***000 (黑龙江),2012-06-15 11:52,该校招收一本第二志愿考生吗,黑龙江理科可以报考，有希望
二表B二次选择专业,xu*** (黑龙江),2012-06-15 11:46,二表B二次选择专业有什么要求,具体等待我校二次选专业通知
毕业证的相关问题,74*** (黑龙江),2012-06-15 11:11,老师您好：我想请问一下贵校的三表和二表的毕业证是否一样?谢谢！,一样
二表B专业哪个好一些,xu*** (黑龙江),2012-06-15 10:59,东北农业大学二表B专业哪个好一些,我校二表B录取后可以二次选择专业，可以根据自己的兴趣爱好及今后的就业打算选择
联合办学,ws*** (黑龙江),2012-06-15 10:58,往年是没有二表二录取的吗？,建议第一志愿报考
联合办学,ws*** (黑龙江),2012-06-15 10:46,联合办学报二表二能录取吗？,建议第一志愿报考
二学位,hu***huzhu (黑龙江),2012-06-15 10:19,贵校可否申请二学位.是只能在本批次内申请么,开设的二学位专业都可以申请
理科450左右？,qw***c (黑龙江),2012-06-15 10:05,我估了450多一点的分数，不知道东农二表B什么系可以录取我,录取分数与高考考题难易程度、志愿填报人数息息相关，学校和各专业最低录取分数线在录取结束后才能确定，所以现在不可能确定今年的录取分数。
关于第二批中外合作办学的问题,15***80 (黑龙江),2012-06-14 17:00,您好，我有几个关于第二批中外合作办学的问题向您请教1.在毕业证和学位证上与普通全日制本科学历证书有区别么？2.如果选择不出国，是否是在本校同批次科系学习3.若出国是否还需再次交费,我校二批中外合作办学考生毕业证和学位证与我校一表二表考生无差别，被二批中外合作办学录取的考生四年均在国内学习，不出国。
是否录取,du*** (河南),2013-06-27 11:27,您好我是河南理科考生成绩535高出一本线30分若报为平行志愿请问能否被贵校录取,可以报考，有希望
咨询,13***69 (黑龙江),2013-06-27 11:20,我是黑龙江考生，理工517分能被贵校录取么,2A可以报考
咨询,13***69 (黑龙江),2013-06-27 11:17,录取后可以选修其它专业么，毕业后证书上表明是选修专业么？,二学位可以，发学位证书
4紧急求助,15***8 (山西),2013-06-27 10:21,老师您好，我是2013山西理科应届生508高出一本线15分问是否能被贵校录取呢1A1B2A???可能性如何？？？希望您不要让我自己参考网上内容，我也是估计您也是估计，您肯定比我有把握，所以拜托了看一看吧,达到一本线就可以报考，我校在山西是1a
录取,cc***16 (山西),2013-06-27 10:05,老师您好，我是山西理科考生，分数超一本线2分，有希望被录取吗？如果可以，那能选择哪些专业？,有希望吧，专业可能是冷门的专业
我是安徽考生,54*** (安徽),2013-06-27 10:02,您好，我是安徽考生，今年我考理科505分，超一本线15分，排名在35000--35670名，想填报贵校，希望大吗？如果报考机械自动化等热门专业，有多大希望？,可以报考，专业不好说
黑龙江考生,qq***87 (黑龙江),2013-06-27 10:01,我今年考480能进贵校吗，如果能是什么专业,2A这个分数不好说
能否转专业,73*** (河南),2013-06-27 09:55,老师好我是河南理科考生成绩是515.报贵校化学专业能被录取吗？同意调剂到校还能转专业吗？谢谢,可以报考，有希望，以后成绩突出，才有机会转专业
咨询,ga***chou (黑龙江),2013-06-27 09:54,贵校旅游管理专业有身高限制，那么身高不够的考生会被调剂到这个专业吗？,不建议你报考
咨询,ga***chou (黑龙江),2013-06-27 09:52,黑龙江文科考生485分，超出二表线61分，服从调剂，能进贵校二表a吗？,有希望吧，可以冲一冲
咨询,26***4 (河南),2013-06-27 09:35,我是河南文科考生，今年考了528分，超一本分数线9分，能被贵校录取吗？有优势专业选吗？谢谢老师！,可以报考，专业不好说了
黑龙江理科,10***8777 (黑龙江),2013-06-27 09:16,1、理科513分，报考二本有无希望2、如果录取，转专业是在同学院转，还是全大学转？3、如果理科想学文科法学，可不可以转到文科法学，要有什么条件限制？4、服从调剂是否退档？,2A有希望，在理科转，服从不退档
着急啊,18***14 (黑龙江),2013-06-26 15:29,请问老师，500分报机械制造及其自动化，农业水利工程有希望么，那服从调剂会被退档么,你的分数偏低，专业选择没有优势，农水有希望吧，服从不退档
咨询,dt*** (黑龙江),2013-06-26 15:14,我是黑龙江考生，超一本29分，能进贵校吗？进电气工程自动化专业有没有希望，专级有没有级差。谢谢,有希望，没有极差
谢谢老师,18***14 (黑龙江),2013-06-26 15:12,请问老师，我501，报二表A的农学，植物保护，动物药学有希望么,有希望
录取问题,52*** (黑龙江),2012-06-28 11:50,黑龙江文科考生，考了505分，能否被贵校二表录取？,希望很大
贵校二批中外合作办学能否录取,hl***12 (黑龙江),2012-06-28 11:19,老师您好：我是黑龙江的理科考生，今年考取了清华大学艺术特长生二级优秀证（钢琴），高考成绩是408分，贵校的二批次中外合作办学能否录取我？谢谢。,你的分数偏低，不好说
我想报考贵校,sy*** (山东),2012-06-28 10:33,我是山东考生，于2012年毕业，高考成绩为596，想报考贵校，请问以此分是否有把握被录取？该报何专业？,可以报考，有希望
理科400分报贵校三表有希望吗,bc*** (黑龙江),2012-06-28 10:11,想报金融、会计、工商管理专业,学制五年的有希望，可以报考
咨询,ha***l (山西),2012-06-28 10:02,请问老师，山西一本线530，成绩为537，排名为17258的考生有望报考贵校吗？,可以报考
咨询,ha***l (山西),2012-06-28 09:59,请问老师，山西一本线530，成绩为537的考生有望报考贵校吗？,可以报考
录取咨询,30*** (黑龙江),2012-06-28 09:37,老师您好，我是黑龙江的一名考生今年高考打了431分，想去贵校里的2表B的专业，老师您看我有希望吗？,理科有希望
咨询,la***in (山东),2012-06-28 09:29,您好我是山东文科的一名考生，今年考了582分超一本线9分，我可以被贵校国际经济与贸易录取吗,可以报考，专业不好说
投档,13***46 (河南),2012-06-28 09:15,我是河南考生，请问贵校投档按照1比1还是1比1.2,平行志愿省份大概是1:1或1:1.05
二志愿会不会录取,10***8 (贵州),2012-06-28 09:09,您好，我是贵州的文科考生，加上民族分555，我把贵校填成二志愿且服从调剂，被贵校录取的概率大不大？,有希望吧，现在不好说
报考,59*** (河南),2012-06-28 09:05,我是一名河南理科考生高出一本线7分，报考贵校有希望吗？,有希望
录取,52*** (山西),2012-06-27 15:45,我是山西理科考生，考了530，能否被该校录取?,有希望
录取问题,10***8 (贵州),2012-06-27 15:34,您好，我是贵州的文科考生，加上民族分555，民族分算吗，学校是实行志愿优先吗？如果我填报贵校，我有可能被录取吗？希望您能帮我解答。,分专业时参照原始分。我校专业录取时不设专业志愿分数级差，以分数优先为原则，即先按高分到低分排序，按照考生填报的专业志愿顺序依次录取。
479分二表b一志愿会计学希望大吗,wy*** (黑龙江),2012-06-27 14:09,请问考479分，二表b，一志愿报会计学，希望大吗？谢谢！,现在不好说，请耐心等待
二批次A志愿,xl*** (黑龙江),2012-06-27 11:50,479分，二表A志愿能否有希望进贵校，贵校的主打专业有希望吗？,有希望，请耐心等待
报考,pe*** (河南),2012-06-27 11:38,您好，我今年分数高出一本线15分。非常想报考贵校，请问录取的希望大不大？,可以报考，有希望
山东文科考生高一本线8分志愿咨询,12***aode (山东),2012-06-27 10:51,你好老师我是山东文科考生高考成绩高于山东一本线8分不知道能不能报考贵校,可以报考，有希望
484,kj*** (黑龙江),2012-06-27 09:41,我女儿今年高考484分报的农大会计学二表B，请问能录上吗？,有希望
录取,lu*** (河南),2012-06-26 16:58,河南理科考生高出一本7分有希望上贵校吗？上啥专业好？,可以报考，有希望
咨询,wf***h (山东),2012-06-26 15:10,请问山东考生是否按照政策性加分后的成绩分专业？谢谢！,按原始分分专业
二表分数咨询,13***30 (黑龙江),2012-06-26 13:00,我高考成绩为448分，能否进贵校二表B？,理科希望大些
咨询,sx*** (河北),2012-06-26 11:28,老师：贵校可以转专业吗？要啥程序？,根据第一学期成绩，专业排名前10%，且智育学分3分以上，可以申请
咨询,sx*** (河北),2012-06-26 11:24,老师：河北考生一本线上14分，报贵校有希望吗？,可以报考，有希望
一志愿,30*** (河北),2012-06-26 10:41,我是河北理科生，今年考了572能不能报贵校？,可以报考，有希望
我要提问,18***7ing (河南),2012-06-26 09:26,1请问贵校的优势专业学科有哪些？（有博士或者是硕士授予权的专业）2在同意调剂的前提下，提档以后是否有可能退档？3是否有专业级差？4专业录取，是分数优先还是志愿优先？,我校以农科为优势，生物食品为特色。对于实行平行志愿的省份，对于服从的考生我校尽量都录取。没有极差。分数优先
艺术类考生,23*** (河北),2012-06-25 10:38,我是石家庄的考生，问一下联考206，文化450，能否被贵校录取呢？,什么专业，河北省艺术类考生需有我校校考合格证
学位选择问题,th***6 (辽宁),2012-06-25 09:25,请问贵校，我报的是广播电视编导专业，入学后，可以申请转为其他非艺术专业吗?如果可选的话，能够选那些专业?谢谢,不能
录取分段,th***6 (辽宁),2012-06-25 09:23,我是辽宁艺术理科考生，一本一志愿报考了贵校，文化课估分430分左右，请问能否录取?,现在还不好说，请耐心等待
二表B二志愿入取占总录人数的比率,zl*** (黑龙江),2012-06-15 16:06,二表B二志愿入取占总录人数的比率,建议一志愿报考，二志愿希望不大
二志愿,qw*** (黑龙江),2012-06-15 14:59,二志愿招收规则是什么,一志愿未录满会开二志愿，没有特别规定
浙江理科考生,10***6 (浙江),2013-06-26 09:27,老师您好，我是浙江理科考生，高考成绩为630，超一本线13分，有多大希望进入贵校？若服从专业调剂，是不是录取机率大呢,可以报考，服从希望大些
定向,al***580894 (陕西),2013-06-26 09:17,你好老师，我是陕西渭南贫困县考生，不到二本线，但招办说够本科线可报考单设定向招生，有录取可能吗,贫困计划应该是一本线上录取
投档比例,d5*** (黑龙江),2013-06-25 13:00,2013在黑龙江投档比例是多少？第一专业与其他专业分差多少？,平行志愿110或105，没有极差
咨询,27*** (黑龙江),2013-06-25 09:40,黑龙江理科考生高考成绩489分，能进贵校二本一般专业么？有多大把握？,可以冲一冲吧，没有把握
咨询,gm*** (江西),2013-06-25 09:20,老师好，我是一名江西文科考生，今年高考553分，全省排名2107，请问录机会多大？贵校的重点专业是什么？我能选专业吗？,达到一本线就可以报考
咨询,zm*** (黑龙江),2013-06-25 09:13,我是黑龙江省文科考生，文化成绩470分，侨眷子女10分，我有多大把握能进入你们学校。你们学校一旦提档之后，投档比例是100%还是105%。还能够被退档么？如果被录取你们学校的不喜欢专业，有什么办法可以调到喜欢的专业么？贵校按高考总分提档是否按考生总分录取，还是按文化课分数录取，侨眷的10分是否有作用,你的分数偏低，2A希望不是很大，侨眷加分没有用
录取分数,hl*** (黑龙江),2013-06-24 16:32,贵校金融学的录取分数线大概是多少?入学后还有转专业的机会吗?有几次?是通过考试择优吗?可以修双学历吗?谢谢,金融学属于热门专业，录取分数很高。转专业有机会，根据你的文化成绩，可以学二学位。
志愿咨询,hj*** (浙江),2013-06-24 13:59,亲爱的招生老师，你好！我是浙江兰溪一中学生，今年只考了618分，只超了1分，但渴望进入贵校学习，因此特向您咨询：今年会小年吗？我有可能会被录取吗？谢谢您！6月24日浙江某生,只能说你的分数报考有希望
黑龙江理科考生,ss*** (黑龙江),2013-06-24 12:34,黑龙江理科考生，高考成绩515分，能否报考贵校车辆工程专业？,有希望吧
三表,19*** (黑龙江),2013-06-24 11:52,您好老师。请问贵校今年有三表吗？如果有的话，最低招生分数是多少呢？谢谢。,没有
河北艺术类考生,ji***in (河北),2013-06-24 11:40,已取得美术专业合格证，文化成绩为389分，能否被贵校录取。,有希望吧
2表是否存在专业极差,15***57 (黑龙江),2013-06-24 11:26,您好贵校2表各个专业是否存在专业极差,没有极差
咨询,he***ang2013kao (黑龙江),2013-06-24 11:10,黑龙江省今年理科考411分想报贵校的二表C，能否走上呢？,你的分数偏低，希望不大
黑龙江文科考生，505分,dq*** (北京),2013-06-24 11:03,老师你好，我是今年的黑龙江应届考生，文科，考500分，另有5分的政策加分，想报农大的会计专业，保险专业，和人力资源专业，都哪个可以进去啊？谢谢！！,都有希望吧，但会计不太好说
老师您好 ，辛苦了 ，想问您几个问题！,48*** (黑龙江),2013-06-24 10:15,如果二表C专业没录上服从调剂如果名额满了会退档嘛？还是可以增加招生？有这种可能么？还有今年三表是否挪到了二表C?二表b和二表c有什么具体区别那？谢谢老师辛苦啦,服从不退档，往年三批5年专业调到2c2648代号，2c就是往年的2b
wenti25,we*** (黑龙江),2013-06-14 14:53,老师您好，今年二表Bí都有哪些专业，在黑龙江招多少人，毕业证和一表一样吗。就业怎样。,招生计划可到我校招生信息网查询，毕业证书没有区别。
报考,41*** (辽宁),2013-06-14 14:46,辽宁考生，想报考贵校的广播电视编导专业，艺术类省统考已过，文化课估分450分，被录取的机会大吗,有希望，但报考有风险
咨询,08***3 (黑龙江),2013-06-14 10:43,我是黑龙江理科考生，超一本线多少分能上电气工程及其自动化。,可参考该专业往年录取平均分与省控制线的差值
开设园林和风景园林专业吗？在辽宁有计划吗？,lu*** (辽宁),2013-06-14 09:01,老师你好，我是辽宁考生，今年贵校在辽宁开设园林和风景园林专业吗？在辽宁的招生计划是多少？贵校的园林专业的学习和就业方向是倾向种植还是设计呢或是其它什么呢？近几年在辽宁的录取分数约是多少呢？请您在百忙中解答，谢谢！,这些问题可以到我校招生信息网查询，在辽宁招生专业和计划、专业介绍、往年录取分数都可看到。
生物科学对视力的要求,yq*** (辽宁),2013-06-13 15:41,老师您好，请问生物科学及生物技术对视力有没有特殊故要求？孩子配镜度数一眼700，一眼500，能抱着两个专业吗？,对于考生身体健康状况要求，我校按照教育部、卫生部、中国残疾人联合会印发的《普通高等学校招生体检工作指导意见》执行。请查看《普通高等学校招生体检工作指导意见》
资源环境与城乡规划管理专业学习方向是什么?毕业后从事什么职业,lu*** (辽宁),2013-06-13 15:41,老师你好，再次打扰你，请问一下，资源环境与城乡规划管理的学习方向是什么?毕业后的对口工作是什么?谢谢!,"我校招生简章已在我校招生信息网招生信息一览公布，文件格式为PDF,请查阅"
风景园林专业近几年的录取分数大概是多少,lu*** (辽宁),2013-06-13 15:37,老师你好，我是辽宁考生，贵校风景园林专业的录取分数线大概是多少?入学后还有转专业的机会吗?有几次?是通过考试择优吗?可以修双学历吗?谢谢!,[录取分数现在不好说，请到我校招生信息网查看往年录取分数作为参考。新生入学后，经过一段时间学习，符合《东北农业大学本科学生学籍管理规定》相关要求的学生，可以提出转专业申请。根据《东北农业大学本科学生攻读双学士学位管理细则》相关规定，凡在校本科生完成一年学习，成绩优良，智育平均学分绩达到2.0以上（含2.0），可申请攻读双学士学位。
我是二零一三年考生,86*** (黑龙江),2013-06-13 15:16,我美术省联考打202分，文化课能打330多点，请问我有希望上贵学校吗,你的省联考分数偏低，报考有风险
老师你好,18***76 (黑龙江),2013-06-13 09:48,请问老师，2013年在黑龙江招文科的都有什么专业？广播电视编导专业在黑龙江找多少人？文科艺术类广播电视编导多少分能上贵校？谢谢,2013招生计划可到我校招生信息网招生计划一栏查询，录取分数现在还不好说
河北文科考生,58*** (河北),2013-05-10 16:23,请问老师，今年在河北招文科的都有什么专业？各专业计划在河北招几个人？河北文科高出本一线多少分？,我校招生计划及往年录取分数可到我校招生信息网查询
毕业证,61*** (黑龙江),2013-05-10 13:36,请问贵校的三表毕业证为什么和二表的毕业证是一样的？毕业后会不会出现用人单位不承认三表的现象,我校今年不招收三批次
金融学,ba***gzhichao (内蒙古),2013-05-10 11:31,老师好，金融学3个专业都只招蒙授文科吗？,是的
内蒙文科,ba***gzhichao (内蒙古),2013-05-09 10:28,请问老师，今年在内蒙招文科的都有什么专业？各专业计划在内蒙招几个人？内蒙文科多少分能上贵校？谢谢,金融学3（蒙授文科）、保险学2、会计学2、社会工作2、英语5、俄语2、旅游管理2、法学3、汉语国际教育3，共计24个招生计划，录取分数现在不好说
辽宁省文科考生,bw*** (辽宁),2013-05-08 15:55,辽宁省文科考生，想报考贵校，请问1.贵校的提档比例是多少？2.如服从专业调剂，是否不退档？3.服从专业调剂，是否意味着会被调剂到贵校今年招生的任何没录满的专业，而不局限于今年在辽宁招生的那几个专业？文科生是否会被调剂到理科的专业？是否会被调剂到高收费的专业？4.贵校英语方面的专业对英语科目有没有最低分要求？对高考口语考试是什么要求？对高考听力成绩是什么要求？因为辽宁省英语听力不计入总分，答英语时不答听力，没有听力成绩是否可以？5.贵校英语专业每年的学费是多少？每年的住宿费是多少？几个人住一个寝室？6.贵校有几个校区？大一新生在主校区还是分校区？,提档比例105%左右，服从不退档，调剂到辽宁未录满的专业，文科考生不会录取到理科专业，除艺术类专业我校在辽宁无高收费专业（正常学费在3000-5500元/年之间），英语专业无小分限制，英语学费4000元/年，住宿费800元/年，6-8人一个寝室，我校只有一个校区
2表B招生多少人,ch***3 (黑龙江),2013-05-08 14:02,今年2表B的会计和金融专业在哈市各招收多少人？去年这2专业高于2表线多少分才录取的？,在黑龙江省二批合作办学批次理科这两个专业各招收70人，文科各80人；往年录取分数可到我校招生信息网历年分数里查询。
浙江理科考生,10***6 (浙江),2013-06-26 14:39,老师您好，我是浙江理科考生，高考成绩为630，超一本线13分，有多大希望进入贵校？若服从专业调剂，是不是录取机率大呢,可以报考，有希望
我报东北农业大学什么专业好,18***14 (黑龙江),2013-06-26 14:37,请问老师，我是女生，我报东北农业大学什么专业好,请你根据自身的兴趣爱好选择
我的分数可以进农大吗,18***14 (黑龙江),2013-06-26 14:21,我考了501，进东北农业大学的可能大么,2A有希望
，,ju*** (黑龙江),2013-06-26 13:19,你好老师我想问一下你们今年2表B分数线是多少分我404有希望进二表B的金融学和工商管理么,2c希望不大
黑龙江考生,xi***666 (黑龙江),2013-06-26 12:03,老师您好，我是2013年黑龙江考生，我今年考了434分，能走你们的二表B吗？,2c，2634报考有风险，2648希望大一些
咨询,yh*** (河北),2013-06-26 11:30,河北理科超一本线19分，被录取可能大吗？,可以报考
退档,47*** (黑龙江),2013-06-26 11:02,我是黑龙江考生，请问一表服从调剂会被退档吗？,服从不退档
山东二表,li***1 (山东),2013-06-26 10:56,我是山东考生，理工类，521分，想报考贵校二表，请问什么专业可选？,都在一批招生
专业,xi***i (黑龙江),2013-06-26 10:50,请问如被二表A录取了，专业不理想，可不可转专业,以后根据成绩，有机会转专业
咨询,20***03040 (黑龙江),2013-06-26 10:35,今年理工考413分，能进贵校2634吗？,希望不大
咨询,13***69 (黑龙江),2013-06-26 10:12,老师您好，我是黑龙江考生，理工517分请问有希望上本校2本会计专业吗,希望不是太大
专业设置,li***3 (山西),2013-06-26 10:06,我是山西的考生，我想问一下，贵校今年的“机械设计制造及自动化”是新开的专业，还是原来的专业的名称换了？,不是新专业，名字也没有变过
辽宁文科考生,bw*** (辽宁),2013-06-26 10:06,辽宁文科考生，请问1.贵校今年在辽宁省的提档时间？2.贵校公布录取线的时间？3.贵校今年新生报到时间？,现在不清楚
尊敬的老师你好；,ab***8 (广西),2013-06-26 09:34,尊敬的老师你好；我是广西考生理科超一本50分很想填报贵校，现有几个问题急需了解，恳请老师尽快好吗，谢谢您了老师！一贵校是否承诺进档不退二省招办加入投挡照顾分，贵校在分专业时是否承认照顾分三可否转专业四是否可以辅修双学位，双学位是否单独发毕业证，学位证，学信网是否可查？五分专业是分数优先还是志愿优先，级差为多少？六服从调剂是广西区内调剂还是校内调剂？七贵校近三年在广西预科的分数,服从不退档，分专业按原始分，经过一段时间学习成绩优异可以申请转专业，有些专业可以、发学位证，分数优先没有级差，广西区内，我校在广西不招预科
