标题,来源,时间,问题,回答
请教,zi*** (黑龙江),2009-06-14 15:30,您好：我是黑龙江09文科考生，预估480分，能否被贵校二表录取？,去年二表最低录取分数线为540分，请参考
提问,zh***li2009 (黑龙江),2009-06-14 14:14,贵校农业经济管理专业在全国排名处于甚么位置，就业率如何，谢谢。,农业经济管理专业为黑龙江省重点学科，在东北农业大学有硕士授权点和博士授权点，就业率还是不错的
1,zo*** (黑龙江),2009-06-14 14:06,请问贵校强势专业有哪些?,请登陆我校招生网站查阅专业介绍情况
一表二志愿,zh***yay (黑龙江),2009-06-14 13:59,老师您好~!请问贵校招二志愿考生吗?是否有级差?级差是多少?谢谢回答~~!,按照往年的录取情况，报考我校本科一表的考生，一、二志愿都有录取机会。没有志愿级差。
报考,li*** (黑龙江),2009-06-14 13:44,只要到一表线就能上贵校吗,我校分数由生源情况决定，按照往年录取情况，我校一表录取线和省一表线持平。
农业经济管理,li*** (黑龙江),2009-06-14 13:41,贵校的农业经济管理在全国排名如何？谢谢,农业经济管理为黑龙江省重点学科，在东北农业大学设有硕士授权点和博士授权点
咨询,fy*** (黑龙江),2009-06-13 12:32,二表b和三表的课程是否相同？毕业证和学位证是否相同？,三表学制五年的出国。证一样。
咨询,sf*** (黑龙江),2009-06-13 11:54,老师你好：请问贵校电气工程及其自动化专业是否包含电子信息工程？谢谢,请登陆我校招生网站查阅详细的专业介绍。
咨询,li***6 (黑龙江),2009-06-13 11:47,我今年考了440分，请问有机会去贵校学习吗？,去年我校三表理工472，文史477，请参考。今年分数会是多少由黑龙江省整体分数情况和报考我校生源情况决定，现在不好说。
咨询,zh***ei (黑龙江),2009-06-13 11:44,我是黑龙江考生，满族，请问您校少数民族预科设置一表专业了吗？如被录取到您校就读后，怎样收费，是收16500吗？预科结束后如被食品科学与工程专业录取能和一批录取学生在一起学习吗,有一表专业。预科学费每年1.5万，升入我校后按我校相同专业收费标准执行，我校不同专业学费3000——5500不等，和一批学生一起上课。
录取,zh***897 (黑龙江),2009-06-13 11:26,老师您好:我是本省理科考生，估分460左右.想报贵校的园林专业，请问有希望被录取吗?,去年我校园林专业在二表B批次录取最低分是485，请参考，你的分数能否录取由黑龙江省整体分数情况和报考我校生源情况及报考这个专业的情况决定。现在不好说。
咨讯有关加分投档的问题,he***n (河南),2009-06-13 11:24,我是河南省考生，今年分数预估在一本线上下，不太稳。。河南省有农林类院校第一志愿加二十分投档的政策，请问贵校是否承认。。。,你们省的优惠政策我校承认。
考研,zh***44111 (黑龙江),2009-06-13 11:09,我想问一下贵校每年考研的人数占本科人数有多大比例？,一般30%左右
咨询,ji***ie (黑龙江),2009-06-13 10:49,我是黑龙江考生，请问贵校水利水电工程一般高出普本线多少,去年我校二表最低540，具体到这个专业最低分数是564，请参考。
你好，我要咨询,cn*** (黑龙江),2009-06-13 09:58,我是黑龙江考生，估分在480-490之间，现在要报考你校二表B，有希望吗？另外我想问一下，二表A与二表B是同时开始录取吗？,去年二表B文史490，理工485，请参考。今年分数会是多少由黑龙江省整体分数情况和报考我校的生源情况决定，现在还不好说。二表A先录取。
录取,ch***an (河南),2009-06-13 09:42,我今年估了560分，不知能否被贵校土木工程录取。谢谢,能否录取由你们省整体分数情况和报考我校的生源情况决定，现在还不好说。
咨询,yu*** (黑龙江),2009-06-13 09:13,我是黑龙江考生，请问三表各专业能否与二表B各专业相互转系。,不能。
您好,wy*** (黑龙江),2009-06-12 16:05,黑龙江理科考生，估分540，能被贵校录取吗？,有希望。去年我校二表A理科录取分段为540
我要上农大,xi***9 (黑龙江),2009-06-12 15:58,我是黑龙江省理科09届理科考生估分560是否有望不敢报考贵校一表,去年我校一表理科录取分段为577分
食品质量与安全专业,zh***ei (黑龙江),2009-06-12 15:35,食品质量与安全专业有考研方向吗,有
老师您好,de***g (黑龙江),2009-06-12 14:08,我是黑龙江理科考生、估分525，我报考你们学校2表有希望吗？谢谢,去年我校二表理工540，请参考。今年分数会是多少由黑龙江省整体分数情况和报考我校生源情况决定，现在还不好说。
咨询,ba*** (黑龙江),2010-06-15 08:07,我是黑龙江文科考生估分455左右，应怎样报考，才有可能被你校录取？,你的分数可以报考我校二表A和二表B，被我校二表B专业录取的几率会更大一些，建议你按照自己的爱好程度从高到低选取你的报考专业，同时建议报考时尽量不要所有专业都是往年分数较高的专业，可以适当选取一个或两个往年分数较低的专业，这样录取几率会大一些。
关于成栋学院,xi***4 (黑龙江),2010-06-14 15:50,成栋学院去年金融学的最低录取分数是多少？,成栋学院为独立学院，招生由成栋学院负责，详情请咨询成栋学院。
专业,a5***0 (黑龙江),2010-06-14 13:03,在黑龙江省招收的文科生二批次专业中都哪些有硕士授权点或以上？,农业经济管理、会计学、金融学、英语专业均有硕士授权点或以上。
老师您好！,14***2 (黑龙江),2010-06-14 12:19,如果是二表录取，转专业时必须是二表专业吗?转专业有名额限制吗？,如果考生在大学第一学期期末考试中智育成绩达到所在专业前10%即有转专业的机会，然后考生可以提出转专业申请，一表二表在一表二表里转专业，二表B只能在二表B的专业范围内转。
您好！贵校招二志愿考生吗？,ji***ng1967 (黑龙江),2010-06-13 17:07,贵校二批次招二志愿考生吗？贵校有专业极差吗？,我校不招收二批次第二志愿考生，我校没有专业级差。
请问贵校是否招收1表2志愿考生,ge*** (黑龙江),2010-06-13 16:27,请问贵校是否招收1表2志愿考生如招收是否加分，对待方式等同1志愿考生吗,我校建议第一志愿报考，这样录取几率会大一些，只有我校一表第一志愿没有招满的情况下，才会开第二志愿，没有加分；如果第一志愿招满，我校不会录取第二志愿考生。
咨询,xx*** (黑龙江),2010-06-13 12:50,我是美术生，联考228.6文化课估315有希望能上贵校吗？,我校艺术设计专业的录取原则为：术科过省一批控制线，然后按文化课成绩从高到低录取，你的联考成绩还可以，可以报考我校，但是文化课成绩能否不好说。
请问老师,du***jiangxue68 (河南),2010-06-13 11:06,请问老师，我是河南省理科考生，平时成绩在610分以上，这次高考由于理综时间安排不好，导致很有把握的30多分的题没有来得及作答，估分在570多分，如果在平行志愿第一位报考贵校，专业服从调剂，有希望被录取吗？,如果你的分数超出省一批控制线并且报考我校即有机会被我校录取。
录取,cg*** (吉林),2010-06-13 10:04,请问贵校去年辽宁招生粮食工程专业最低录取分数？,我校2009年在辽宁省招收粮食工程专业最低录取线为536分，请参考。
录取,87*** (黑龙江),2010-06-12 14:31,500分考取贵校有希望否？,暂时我校还未得到各中学的估分段，现在还不好说能否被哪个批次录取，超出省一表线均有机会被我校一表专业录取，超出省二表线15——20分才有机会被我校二表录取。
录取,mi***hunli (黑龙江),2010-06-12 13:27,我是大庆考生，文科估分460分，会计专业，请问贵校能有机会录取吗？,由于我校暂时未接到各高中的估分信息，所以能否被录取现在还不好说。
关于软件工程专业,sh*** (黑龙江),2010-06-12 12:47,贵校的软件工程是一级学科吗?对高考单科成绩有限制吗?(如数学成绩达到90以上等),软件工程是我校去年刚刚开设的专业，对单科没有要求。
录取1,ly*** (黑龙江),2010-06-12 10:13,如果刚够二表分数段能被该校二批中外合作办学会计系录取吗?,至于能否被录取，以及被哪个专业录取，我们暂时无法预测。
报考,ly*** (黑龙江),2010-06-12 10:06,我如果刚够二表分数段可以报考该校二批中外合作办学吗?如果报考的系分数不够会被甩到别的系吗?谢谢,如果分数达到省二表段即有机会录取，至于能否确定被录取，我校暂时无法预测，如果你选择专业调剂，你所填报的专业没有被录取，我们有可能给你调剂到其他专业；如果你不服从调剂，你所报的专业未被录取，你的档案将被退回到省招生办。
请教关于录取原则问题,su***i168 (黑龙江),2010-06-12 08:36,贵校招生章程中说：“以分数优先为原则，即先按高分到低分排序，按照考生填报的专业志愿顺序依次录取”。是否是指按照成绩高低先满足分数靠前考生的1-5专业志愿后再进入到下一个考生录取？谢谢指教。,分数高的同学先确定专业
咨询,re***ng123456 (黑龙江),2009-06-14 13:10,老师，我是黑龙江理科考生，估分超过一本线70分左右，请问能否进贵校，如果可以录取，专业选择性大吗？谢谢！,按照你的估分，进本校、选择专业都不会存在什么问题。
如果以二表B考上贵校，以后可以选修一表或二表的专业吗?,cl*** (黑龙江),2009-06-14 12:03,如果以二表B考上贵校，以后可以选修一表或二表的专业吗?我是文科生，如果能，选修以后给不给发双学位证?,可以选修。
咨询,ga*** (黑龙江),2009-06-14 11:51,贵大学一批、二批和二批B开第二志愿吗？是否有专业级差？,按照往年的录取情况，报考我校本科一表的考生，一、二志愿都有录取机会；报考我校本科二表和三表中外合作办学的考生，历年都是第一志愿录取；报考我校本科二表中外合作办学的考生，最好填报第一志愿，这样录取的几率会大一些。没有专业志愿级差。
黑龙江,na*** (黑龙江),2009-06-14 11:41,黑龙江理科估515能否被贵校电气工程及其自动化专业录取,这个专业去年最低分573，请参考。
平行志愿的极差,xi***9 (黑龙江),2009-06-14 11:35,第一志愿的每个专业间极差是多少啊,我校没有专业志愿级差
咨询,li***6 (黑龙江),2009-06-14 11:28,请问，哪一个专业是你们学校的招牌学科？谢谢,请登录我校招生网站查阅专业介绍情况。
咨询,sd*** (海南),2009-06-14 11:21,天津理科，估分520，分数线预估510，能否报贵校一本,今年我校录取分数由天津市整体分数情况和报考我校的生源情况决定，现在还不好说。请登录我校招生网站查阅历年在天津的录取分数情况作参考。
咨询,fy*** (黑龙江),2009-06-14 11:16,贵校三表代码3026，在此学习期间是否在本部就读？毕业时发学位证书吗？,学制五年的出国，四年的不出国。发学位证
08我校三表联合办学最低分数线多少？,qq*** (黑龙江),2009-06-14 10:04,08我校三表联合办学最低分数线多少？,文史477，理工472
咨询,ji***6 (湖南),2009-06-13 16:37,请问:美术专业243，文化350分左右，请问填报贵校有希望录取吗?(贵校承认湖南的联考成绩吗?),我校在湖南没有艺术类招生。
您好,58*** (黑龙江),2009-06-13 14:15,我是一名黑龙江文科考生估分在505左右能上贵校？？,去年我校二表联办490，请参考。今年我校的分数高低由黑龙江省整体分数情况和报考我校生源情况决定，现在还不好说。
咨询,li***6 (黑龙江),2009-06-13 14:02,请问去年贵校二表B机械设计制造及其自动化的录取分数线是多少？报考的人多吗？谢谢,去年整个二表B批次最低分485，具体到这个专业最低498，请参考。
咨询,sf*** (黑龙江),2009-06-13 13:57,老师你好：请问我今年高考估分为545分，能否被本校一本录取？谢谢,我校一本分数由黑龙江省整体分数情况和报考我校生源情况决定，现在还不好说。
艺术考生咨询,78*** (黑龙江),2009-06-13 13:16,您好老师：我是黑龙江美术艺术类文科考生，专业课成绩是196.4分，文化课估分350左右，请问报考贵校的艺术设计专业是否有机会被录取，概率能有多少？拜托给予指点,东北农业大学招艺术类考生，录取规则是招收艺术设计专业的考生术科成绩达到招生省份艺术类本科控制线后，按照文化课成绩从高到低录取，所以分数会是多少由黑龙江省招办和报考我校生源情况决定，现在不好说。
艺术咨询,zh*** (辽宁),2009-06-13 12:36,我是辽宁美术考生，专业课216.4，文化课370，请问报考贵校有没有希望？,东北农业大学招艺术类考生，录取规则是招收艺术设计专业的考生术科成绩达到招生省份艺术类本科控制线后，按照文化课成绩从高到低录取，所以分数会是多少由你省招办和报考我校生源情况决定，现在还不好说。
咨询,ch***sy (黑龙江),2009-06-24 12:47,我想进入本校三表（理科）学习，如按分数录取，填报人员多有可能进不了本校。如果本人在第一、二志愿都填报本校，录取的机率大吗？另三表与二表、一表毕业证一样吗？如想考研，三表中外办法允许吗？谢谢。,我校123表毕业证书无差别，都可以考研。我校录取原则是分数优先，只要你的分数够就能进入我校，不是说你都报我们学校，录取的几率就会增加。
f,49*** (河北),2009-06-23 15:08,我体育成绩考了265文化考了376可以上你们学校的专科吗,我们学校没有专科。
贵校在吉林省提档比例如何执行？,88*** (吉林),2009-06-23 10:48,吉林省本科第一批A段实行“平行志愿”。吉林省招生办公室《普通高等学校招生录取工作的通知》（吉招办字【2009】27号）规定：文史、理工类第一批A段实行“平行志愿”投档，“凡同一科类招生计划人数小于9人的按100%比例，否则应控制在105%以内。”请问：贵校在吉林省提档比例如何执行？现在我们这里报志愿已经开始啦，十万火急，请准确地回答一下。谢谢,120%提档，
专业,mr*** (云南),2009-06-23 10:18,请问老师:填服从专业调剂，会调剂到最冷门、分数最低的专业吗？贵校对填服从专业调剂的考生是如何进行专业调剂的？谢谢！,不一定，按分数优先原则，尊重你的志愿录取，如果你报考的专业都没有录取，而你服从专业调剂，给你调剂到没有录满的专业里。
黑龙江文科2B,38*** (黑龙江),2009-06-23 09:55,老师您好!我是文科的，估分470，2B一志愿报的贵校会计专业，请问机会大吗?,现在没开始录取，具体不好说，请耐心等待。
2B,yy***89 (黑龙江),2009-06-22 11:54,理，估分485，2B能否上农大。,这个分数希望很大
咨询,zc***r (黑龙江),2009-06-22 11:29,我是黑龙江的理科考生，今年估分455，能不能被你们学校的2表B录取啊？,我校近几年二表B的校段与省控制线相同，如果能达到省控制线就有希望被我校录取。
咨询,49*** (河北),2009-06-22 10:59,体育生按综合成绩投档分数县是多少,不知道你是否是参加我校高水平测试的运动员，目前分数线还没有划订。
文史类 480分 二表,zi*** (黑龙江),2009-06-22 10:04,老师您好。本省文科考生，估480分，已表贵校二表的A、B两个志愿，请问会有录取希望么？,这个分数二表B的希望很大
专业,zc*** (黑龙江),2009-06-22 09:13,贵校二表三表可以转专业吗？,根据第一学期的学习成绩，并且符合《学籍管理规定》相关细则的学生，可以提出申请转专业。被一表、二表录取的学生可在一表、二表专业范围内转专业，被中外合作办学录取的学生只能在中外合作办学的专业范围内转专业。
劳驾,wj*** (河南),2009-06-15 16:32,请问贵校的强势学科和特色专业是什么？焦急等待。。。,请登录东北农业大学网站查阅
提问,zh***li2009 (黑龙江),2009-06-15 16:09,贵校，可以修双学位吗，有什么条件要求，什么时候可以兼修，谢谢,可以修双学位，不同的专业要求不同，入学后会有这方面的咨询。
专业咨询,cu***19 (黑龙江),2009-06-15 15:48,农大生物制药请问是今年新增的项目么？该学科的主要学习课程及就业方向是什么,不是新增的专业，毕业去向主要是高校，科研院所，生物制品和生物制药单位等。主要课程请登录东北农业大学网站自行查阅。
咨询 谢谢,cu***19 (黑龙江),2009-06-15 15:47,众多学校的第一第二专业存在分差请问农大的志愿级差是多少？,我校录取无专业级差
咨询,cu***19 (黑龙江),2009-06-15 15:45,老师你好我是黑龙江省应届毕业考生，这次2卷的试题偏难。请问学校预计的一表最低分数线大概在什么范围？农大去年许多专业的最低分数线都是577。请问这是巧合还是由于这其中包括部分补报考生,现在没有预测分数线，去年一表、一二志愿都招收学生了。
谢谢老师！,ww*** (河南),2009-06-11 14:19,老师我高考考了400到410分左右，能报考你们学校吗？能的话能报考什么专业？谢谢老师！,去年我校三表文史477，理工472，请参考。
你好，我是09美术生,da***1 (黑龙江),2009-06-11 12:26,我是黑龙江09美术考生，请问你校艺术考生录取原则是什么？我的专业课联考成绩203.7，文化课320左右有机会考上么贵校么？,东北农业大学招艺术类考生，录取规则是招收艺术设计专业的考生术科成绩达到招生省份艺术类本科控制线后，按照文化课成绩从高到低录取。省里术科分数段由省招办定。文化课分数由报考我校的生源情况确定了，现在还不好说。
二表B,bg*** (黑龙江),2009-06-11 10:34,二表B独立编班原因可以说下嘛,根据省里相关规定及考生文化课基础水平存在差异，所以单独编班。
你好,hl*** (黑龙江),2009-06-11 10:31,请问贵学校在09年在省内录取方式文化课和美术专业录取分数是否需要单科成绩,招收省内艺术设计专业的录取原则是考生术科成绩达到招生省份艺术类本科控制线后，按照文化课成绩从高到低录取。今年术科分数会是多少由报考我校的生源情况确定。现在还不好说。不需要单科成绩。
二志愿,ji*** (陕西),2009-06-11 09:37,老师好.请问贵校是否录取第二志愿报考的考生?,在一志愿生源录取不满额的情况下，我校会录取第二志愿考生。
请问您校近几年来就业率较好的专业?,yo*** (黑龙江),2009-06-11 09:21,请问您校近两年来，理科就业率较好的前10名专业?,请咨询我校就业指导中心。0451-55190498.
河南录取,lu***ng (河南),2009-06-11 09:21,老师您好，贵校是否承认关于农林院校加20分投挡并参与专业录取？是否可以转专业/系？,你们省相关的优惠政策我们学校承认。可以转专业。根据第一学期的学习成绩，并且符合《学籍管理规定》相关细则的学生，可以提出申请转专业。
请问今年贵校二表B和三表院校今年录取分数大约是多少分？,yo*** (黑龙江),2009-06-11 09:17,我今年理科考了大约485分，请问上你们学校二表、二表B和三表能上去吗？请问今年二表、二表B和三表录取大约多少分？你校三表院校必须出国学习吗？不出国在国内学习是否行？另外，二表B和二表有什么区别，毕业证书一样吗？学习时单独编班，还是和二表学生一起学习吗？再有，三表和二表B有什么区别，毕业证书一样吗，学习时和二表B或二表学生一起学习吗？谢谢回答！,今年录取分数由黑龙江省整体分数情况和报考我校的生源情况确定。http://zsb.neau.edu.cn/zhaosheng/z_zsdt_nei.asp?id=326请登录08年分数作参考查询。我校三表学制五年的出国。我校一表二表三表毕业证都一样。联合办学的单独编班，单独教学计划，单独授课。
农林,65*** (河南),2009-06-10 16:42,假如东北农业大学提挡线是550，而我是河南考生，只考530，能否提档？,如果你们省有相关的投档政策，我们学校承认。
艺术疑问,ha***518 (河南),2009-06-10 16:17,您好，我专业课过了贵校的分数线了，文化课估了460，请问报贵校有希望吗？,东北农业大学招艺术类考生，录取规则是招收艺术设计专业的考生术科成绩达到招生省份艺术类本科控制线后，按照文化课成绩从高到低录取（山东、河北、河南艺术类考生除以上条件外还必须获得东北农业大学颁发的术科成绩合格证书）。文化课分数会是多少由你们省报考我校的生源决定了。
河南美术类咨询,lu*** (河南),2009-06-10 15:47,请问贵校2008年在河南美术类各专业录取的文化课最高最低分是多少，专业课最低分数或名次是多少？,去年没有在河南招美术类考生。
转系,zh***yan621004 (黑龙江),2009-06-10 15:35,三表入学后可以转系吗？,不可以。
今年录取分数,la***402 (黑龙江),2009-06-10 13:35,今年二表的录取分数大约多少,今年录取分数由黑龙江省整体分数情况和报考我校的生源情况确定，现在还不好说。
报考,zi*** (陕西),2009-06-10 11:29,老师您好，我是陕西的文科考生，想报考贵校最低需过本一分数线多少？谢谢老师,录取分数由陕西省整体分数情况和报考我校的生源情况确定，现在还不好说。http://zsb.neau.edu.cn/zhaosheng/z_zszc_nei.asp?id=326&pic=zsdt_15&pic1=11_15请查阅陕西省08年录取分数情况作参考。
补充二表B的问题,wb*** (黑龙江),2009-06-10 11:16,请问二表B的学生是单独授课还是和其他普通本科学生一起授课,二表B学生单独编班，单独教学计划，单独授课。
咨询,07*** (黑龙江),2010-06-11 19:49,请问1.贵校二表的强势专业是什么？2.比省估的普本线高60分以上录取的希望大吗？3.贵校的特色专业是什么？有一志愿报考，二表录取的形式吗？,我校以农科为优势，以生命科学和食品科学为特色，考生尽量按照自己的兴趣爱好报考，如果比普本线高出60分以上，被录取的希望非常大，但我校二表仅收第一志愿考生。
美术类考生录取几率怎样？,67*** (黑龙江),2010-06-11 15:12,专业成绩省联考222分，文化课约350分，报考贵校设计专业录取几率怎样？谢谢！,专业课成绩还可以，文化课成绩现在还不好说
贵校最近三年会计学（文史类）录取分数是多少？,zh***8 (黑龙江),2010-06-11 15:02,老师：　　您好！　　我想了解贵校最近三年会计专业（文史类）的录取分数，您能帮助我吗？谢谢！,详细信息请到我校招生信息网——往年录取分数一栏查询。
贵校能否转专业，规则是啥？,zg***21 (黑龙江),2010-06-11 11:59,贵校能否转专业，规则是啥？,根据第一学期的学习成绩，并且符合《学籍管理规定》相关细则的学生，可以提出申请转专业。被一表、二表录取的学生可在一表、二表专业范围内转专业，被中外合作办学录取的学生只能在中外合作办学的专业范围内转专业。
艺术类,sy*** (黑龙江),2010-06-11 11:26,老师您好！本省艺术类考生，学校招生是按联考本科合格线180分还是按一本二本合格线标准允许报考本校艺术类。,我校按艺术一批合格线作为专业课录取分数段。
录取,zg***21 (黑龙江),2010-06-11 10:21,我是黑龙江考生，今年高考成绩525分，成绩大约在一本线上，若服从调剂请问能上贵校吗？谢谢！,如果能达到省一批控制线，可以报考。
请教,ws*** (黑龙江),2010-06-10 15:58,黑龙江考生估494，报贵校有希望吗？,现在还不好说
专业疑问,nu***i (安徽),2010-06-10 15:49,您要像亲人一样，我将以亲人的姿态聆听！我，理科，女生，生性活泼、思维敏捷、口齿伶俐，智商还行，就是烦坐冷板凳！请给推荐一些理工科中偏文的专业，适当介绍一些专业情况更好。再问，您校的特色专业有哪些？您的经验最丰富，往往能一语中的。尽量不要给我一个网址，让我去瞎摸，指个兔子让我去撵啊！您和我的时间真的都很宝贵呀！就把我当成您的亲人吧！诚心感谢您！,你可以到我校招生信息网——专业介绍一栏查看，重点关注一下文理兼招的专业。
分数线,zc*** (黑龙江),2010-06-10 11:06,我想咨询贵校二表B2010年最低录取分数线估计也可以现在没有估计出来大约什么时间可以有结果急,现在我校也未掌握各中学的估分信息，现在还不好说。
