标题,来源,时间,问题,回答
迷茫的考生,xi***88 (山东),2006-06-28 12:02,我是山东济宁的考生，我考了579分，比一本少4分.第一志愿报贵校，如果贵校一批没招满，会不会降分录取我.谢谢,不降分．一切都得等录取完才知道．
三表,he*** (黑龙江),2006-06-28 11:48,老师你好：我是黑龙江一名文科考生，我的高考分数是427分，请问我有进贵校三表的希望吗？,三表请在七月末再咨询
!?谢谢?!,zh*** (黑龙江),2006-06-28 11:35,446文走2表B，有否可能去年文科2表B分数线是多少?谢谢老师!,现在还不知道，还没开始录取呢
谢谢，,zh*** (黑龙江),2006-06-28 11:23,我是黑龙江考生，请问，去年，文科，2表B，录取分数线是多少?谢谢老师!,文科是４７１
志愿,mo***2 (黑龙江),2006-06-28 11:01,今年贵校2表有希望开2志愿吗?,开的机率不大，往年都没开
另一个问题,el*** (黑龙江),2006-06-28 10:50,三表联办只有两个专业，我想学其他专业填表是怎样报？我是本省理科考生，482分三表有希望吗？,录取可以选专业的．
湖北考生,cn*** (湖北),2006-06-28 10:16,湖北文科545分上贵校有多大希望?,现在还不知道．
贵校是否在河南招收一专?,sh***jiao (河南),2006-06-28 10:16,我能否上贵校?,我校不招专科
三表问题,xi*** (黑龙江),2006-06-28 10:14,老师您好！我是一黑龙江理科考生，分数为434，另外还有20分加分（博士子女）。请问老师，我报您校三表有希望吗？,三表请在七月末再咨询．
002,ll*** (黑龙江),2006-06-28 09:26,专科(文)录取要多少分，可以生本吗?都有什么专业,我校不招专科
咨询,hl*** (黑龙江),2006-06-28 09:25,您好:请问贵校三表中有的专业注有(招英语考生)，这是指考生所考的语种是英语?还是指的高考最后一天所考的加试英语呢?,那就是只招英语考生.
001,ll*** (黑龙江),2006-06-28 09:23,我387分，文科报3表能录取吗,"请您七月三十号以后咨询,或者您咨询一下成栋学院55191871"
三表,xi*** (黑龙江),2006-06-28 09:19,请问贵校三表什么时候开始报名??采用什么方式报名??往年三表的录取分数是多少??,七月三十号.去年的理科三表450文科425
请问贵校有志愿级差和专业级差吗？,da***ir (山东),2006-06-28 09:19,请问贵校有志愿级差和专业级差吗？如有，是多少？要二志愿考生吗？？,"没有级差.以往年的经验二表二志愿没开,一表二志愿开了"
贵校录取二志愿考生吗,18*** (黑龙江),2006-06-28 09:18,贵校录取二志愿考生吗,"一表二志愿根据往年经验开了,但二表二志愿开的机率不大."
机械专业合作办学,li*** (黑龙江),2007-06-11 10:02,请问贵校机械专业今年有二表B或三表招生计划吗？此专业合作办学2006年的录取分数线是多少？谢谢！,只有二表B有机械设计制造及其自动化专业。2006年的合作办学录取政策是过线重新选择专业。跟今年没有可比性。
贵校是否认可河南报考农林学院加２０分投档？谢谢．,he***06 (河南),2007-06-11 09:29,贵校是否认可河南报考农林学院加２０分投档？谢谢．,承认
中外联合办学,40***love (黑龙江),2007-06-11 09:10,06年中外联合办学中农业电气化与自动化专业分数线多少,06年中外联合办学政策是录取后重新选择专业，跟今年没有可比性。
咨询,wa*** (河南),2007-06-11 09:02,河南考生报农林类大学加20分提档请问贵校是否认可,认可
贵校农林是否在原分数上加20分后录取,sh*** (河南),2007-06-10 16:05,我省(河南)在农林院校录取时会有在原分数上加20分录取贵校是否认可????,认可
急！！！,ti***lan (河南),2007-06-10 15:30,贵校农林专业在河南有加20分投档的政策吗？,你们省的政策我们学校承认。
美术生,li*** (黑龙江),2007-06-10 14:28,我是文科美术类考生请问走贵校联合办学的多少分,我们学校联合办学不招收艺术类考生。
理科艺术生,li*** (黑龙江),2007-06-10 14:13,我是理科艺术类考生联考153分文化课300分能否被贵校录取,有希望
老师，指导~~谢谢,ca***n (陕西),2007-06-02 13:44,陕西的理工类考生报考园艺学一般多少分？,得根据考生报考该专业志愿和分数情况确定
咨询,86*** (黑龙江),2007-05-21 12:55,老师您好：我在一模中打了450分，能否被贵校的生物技术专业录取。谢谢！,生物技术专业在一批招生
录取及学费(8100),sy*** (黑龙江),2007-05-20 12:51,请问老师:二表合作办学的学费是多少?必须要求出国吗?如需要，国外的学费一年是多少?谢谢!!,15750元/年，二表合作办学不出国。
报考问题(syg8100),sy*** (黑龙江),2007-05-18 16:47,黑龙江文科考生500-520分能否报考贵校?中外联合办学如选择4+1，国外一年学费多少?硕士学位国家是否承认?谢谢!!,500-520分能否报考不好说，得根据省二表段和报考我校生源情况确定。我校无4+1。俄罗斯：1900美元/年获得本科学位，国家承认。
从该平台的高考志愿填报参考系统中能查询到贵校从2000年到2006年各专业的录取数据，现在请问贵校哪些专业最强，是在该平台上显示往年录取分数高的专业吗？,xu*** (广东),2007-05-16 14:31,我从该平台的高考志愿填报参考系统http://gk.chsi.com.cn中能查询到贵校从2000年到2006年各专业的录取数据，我应该能考上，现在我想请问贵校哪些专业最强，是在该平台上显示往年录取分数高的专业吗？,具体专业情况可到我校网站查询
贵校今年招第二志愿吗>?,li***anxia (黑龙江),2007-05-16 13:36,贵校今年招第二志愿吗>?,得根据生源情况确定
中外合资办学毕业证和正常本科线入取生毕业证一样吗？,13***82 (黑龙江),2007-05-16 12:11,中外合资办学毕业证和正常本科线入取生毕业证一样吗？,一样
SOS,nn*** (山东),2006-06-28 09:16,山东理科考生，586分(重点线583)报考贵校希望多大?谢谢老师的回答!,现在只能在录取完才知道.
老师好,dr***2 (河南),2006-06-27 16:31,我是河南文科考生，成绩为596，我省一本线为591，我第一志愿填报的是贵校，请问被录取的可能大吗？谢谢！,"现在一切还不知道,你得首先够你们省的线."
二表,fc***8 (黑龙江),2006-06-27 16:15,老师好，我是本省考生，一志愿报的是东农，实际分数为525，今天公布的二本线为516，请问老师我有机会被东农录取吗？专业是否能满足志愿？,"现在还不好说,得看我校生源,录取后才能知道.去年就比线高了十五分."
积极,30*** (黑龙江),2006-06-27 16:12,我得492分，是否贵校可以录取（大庆考生）3批,三批七月三十号再咨询.
请问,ha***123 (黑龙江),2006-06-27 15:42,如果我因为降挡政策进入贵校投挡生中问怎样择优？是把我们的真实分对比择优还是看其他方面？？如果我分比其他人低但进挡了是否可以被贵校录取？请您详细回答，谢谢,不降分.首先得够省的分数投档线
录取,sh*** (黑龙江),2006-06-27 15:38,贵校有降线录取的可能吗,没有
谢谢,19***30531 (黑龙江),2006-06-27 15:28,我是黑龙江的理科考生，打了531分，能否被录取，谢谢,现在具体情况还不清楚.等录取完之后我校的分数线才能出来
分数段,ha***123 (黑龙江),2006-06-27 14:53,请问贵高校今年2表最低分数段为多些大约分数（我知道具体的相应还未出来）希望给予回答谢谢,"得先看省的分数线,我校的录取之后能知道,现在还不清楚."
三表,be***12 (黑龙江),2006-06-27 14:45,老师你好，我是齐齐哈尔的文科考生考了３２３报三表一志愿能去会计学吗？,"希望不太大,请你咨询一下成栋学院55191871."
在山东是本科几批招生？,da***ir (山东),2006-06-27 14:26,在山东是本科几批招生？理科590分有希望吗？,有一批也有三批.你得够你们省的重本线.
三表,lh*** (黑龙江),2006-06-27 14:24,请问贵校三表本发东北农业大学毕业证还是东北农业大学成栋的毕业证，一年学费多少？除学费外还需交什么费用？,"三表是联合办学,毕业证和一表二表一样,成栋请咨询55191871.每年学费15750元."
四川理科超重点15，报贵校哪个专业把握大?贵校有无专业级差?,57*** (四川),2006-06-27 14:21,四川理科超重点15，报贵校哪个专业把握大?贵校有无专业级差?,"一表是志愿优先录取,没有专业级差."
关于专科,ji***iu (黑龙江),2006-06-27 14:15,我是黑龙江的啊，我今年考了441分，报贵校的专科有希望吗,我校没有专科招生
请问,lh*** (黑龙江),2006-06-27 12:56,我是黑龙江考生考了552分，报考了该校的二表的动物医学，不知能否被录取？,"首先你得过省段,我校得录取完才能知道,二表是分数优先录取,如果这个专业上不了,如填服从上别的专业也有希望的"
老师你好 我问2表B开二志愿吗？还有。。。,ji***hao (黑龙江),2006-06-27 12:56,问一下2005年2表B开没开二志愿，谢谢您。,没开
请问去年3本最低分是多少？,vi*** (黑龙江),2006-06-27 12:30,请问去年3本的最低分是多少？我是黑龙江的一位理科考生，今年考了459分，有希望进贵校的三本?,"去年的理科三表497,今年的七月三十号您再咨询,现在还不清楚"
伊春考生,ha***123 (黑龙江),2006-06-27 12:29,我打了531有侨眷照顾降挡10分录取政策并且二表一报的是贵校，且服从分配问是否可以被贵校录取,"本省有相应的政策我校承认,但只是投档分,排专业不算"
专业,sh*** (黑龙江),2006-06-27 12:26,被录取后，是否可以调专业，有什么条件,一学期以后根据你的成绩申请调剂.但文理不能互转
hainan,mi***0 (海南),2006-06-27 11:57,您好!!我是海南的考生，你们的学校今年是否招第三批呢?我很想很上你们的学校!!可我考的分数很低:442分，是否能上你们的第三批的专科录取分数线呢?,我校不对海南省招生
谢谢您 这么快就给我回复 但是,el*** (黑龙江),2006-06-27 11:39,联办录取分数是不分专业统一的吗？今年是否比去年低一些，大家都这么说嘛！我考了482分去贵校有几成把握，请老师保守一点回答我，请给个百分比吧。谢谢您。,"录取分是统一的,就是录取后选专业.今年的分得录完才知道."
关于联办 麻烦您了,el*** (黑龙江),2006-06-27 11:21,我是黑龙江理科考生，我想问的是2005年贵校几个专业的2表联合办学最低分，这几个专业分别是1，金融学2，计算机科学与技术3，工商管理，我找了很多网站都找不到，请老师务必，十分感谢您。,二表联合办学录取后选专业
请问贵校在湖南招生是属于第几批次,ya*** (湖南),2006-06-27 11:02,非常感谢,属第一批
2表,f2*** (黑龙江),2006-06-27 10:09,哈尔滨理科考生，560分，报第一志愿园艺专业，请问老师，录取希望大么？,"二表二志愿我校不开,要是一志愿填写服从,有希望!"
三表,f2*** (黑龙江),2006-06-27 09:26,我是哈尔滨少数民族文科考生，470分，请问报贵校三表有希望么？,请您在七月三十号以后咨询.
咨询,de*** (黑龙江),2006-06-27 09:08,我是文科考生，今年考了528分.请问老师我是否能走上贵校的经济学专业,有希望.
2005省内民族预科最低录取线,sh*** (黑龙江),2006-06-26 16:32,你好，我是黑龙江的少数民族文科考生成绩456问能否报贵校的预科班。2005年的最低录取线是多少？,请您咨询省民族管理干部学院
咨询,mi*** (广西),2006-06-26 16:24,我是一名广西理科考生，今年二本线是473，我的考分是482+5，请问是否有希望被贵校录取?是否承认少数民族加分?谢谢回答~!,我校对广西不招生.
山东理科考生,xi***ing1206 (山东),2006-06-26 16:17,老师您好！请问去年贵校在山东的理科本科录取分数线是多少，我的成绩５２４分报考贵校有希望吗？,"去年山东最低录取分数线是572,你得先过你们省的重本线.才有希望"
加分政策,ta*** (黑龙江),2006-06-26 16:15,在二表B中外联合办学对享受加分政策的考生加分吗?比如说贵校二表B的录取分数为497，那么477就可以投挡了，只是在专业分配时不照顾吗?谢谢!,"投档时享受,专业分配时不享受.录取后选专业."
山东理科考生,li*** (山东),2006-06-26 15:15,老师您好，请问503可以报考贵校吗？如果可以请问报那些专业录取把握较大？,看能不能够你们省的重本线．我校的分数线在录取后才能知道
问,qi*** (黑龙江),2006-06-23 09:37,430分，能上贵校三表吗？,请在七月三十号以后咨询
录取咨寻0501,zw*** (黑龙江),2006-06-23 09:18,请问录取一专业与二专业时按照什么原????????(黑龙江考生),一表是按志愿，二表是按分数优先
４００分文科能否报贵校３表中外联合办学,dz*** (黑龙江),2006-06-22 10:33,４００分文科能否报贵校３表中外联合办学,请在七月三十号以后咨询
再问,mi*** (黑龙江),2006-06-15 16:59,如果在一表二招生，大约比一表一高多少分？,没有专业级差和志愿级差
老师、,mi*** (黑龙江),2006-06-15 16:57,请问贵校是否在一表二招生,根据往年情况招收
zhaong,ch***125666 (黑龙江),2006-06-15 16:41,农业电气化与自动化专业06nianduoshaofen?,"今年的还不知道,去年最低是551.你再参考一下"
录取,mi*** (黑龙江),2006-06-15 16:41,老师好，请问贵校招收一表二志愿的考生吗？理科考生580分能否在一表二被录取？,"根据往年的都招了,现在还不清楚"
2表B是什么?谢谢,22*** (黑龙江),2006-06-15 16:21,请问老师2表B是指的什么,是中外联合办学
nihao,ha***ng (黑龙江),2006-06-15 16:18,你好请问525分报贵校有希望吗希望多大,"有希望,但二表联合办学报希望会更大."
分数？,le*** (黑龙江),2006-06-15 16:14,我估分是５７０分左右，报贵校一表有把握吗？若以这个分数报贵校二表，选哪些专业比较合适？请列举，辛苦了,"现在还不清楚,但二表希望很大."
123456,ww*** (黑龙江),2006-06-15 16:11,490有可能进贵校吗,二表联合有希望!
二志愿,wx*** (黑龙江),2006-06-15 16:11,二志愿报考贵校(本一批)，志愿级差为多少?,没有志愿级差.
录取问题,cc*** (黑龙江),2006-06-15 16:09,我是理科生估分530二表二能否录取,录取机率没有二表一志愿大.
咨询,jy*** (辽宁),2006-06-15 16:08,我是辽宁应届理科考生估555分（一本线估分520分），另有国家二级运动员(+10分)证书。B段第一志愿报考贵校是否有把握？录取和分专业是否是否认可加分？谢谢！,"现在还不了解具体情况,但加分政策我校承认."
我是黑龙江理科考生　估分在５３０左右能上贵校吗若能上什么专业比较保险,61*** (黑龙江),2006-06-15 16:07,我是黑龙江理科考生　估分在５３０左右能上贵校吗若能上什么专业比较保险,"有希望,但你二表B你要是报会更有希望,欢迎你报我们学校"
龙江考生,xi***g (黑龙江),2006-06-26 13:50,理科我打521二表一报贵校有希望被录取吗？？,你得先过咱们省的段，但我校分数只能在录取之后
山东考生,ch*** (山东),2006-06-26 13:12,我是山东理科考生，今年考了589分，请问我有没有希望被贵校录取?如果可以，热门专业可以吗?,我校对山东是重本一表招生．只要过了你们省的重本线，就有希望，但我校分数线只能在录取后才能知道．我校一表是按志愿优先录取
请问去年3本最低分多少?(文科)我省,18*** (黑龙江),2006-06-26 13:07,如题``哈尔滨,０５年三表文科是４２５，今年请您在七月三十号以后再咨询．
请问。。,su***n (黑龙江),2006-06-26 12:20,农大三表都有哪些专业可以选择？是否与一二表学生一起上课？,三表录取后可以选专业．如人够单独编班，但教学计划都一样．一起上课．毕业证也一样．
预科？？？,le*** (湖北),2006-06-26 11:53,请问1。贵校在湖北有预科的招生计划吗？多少？2。我是土家族的理科应届考生，但只有417分，有没有希望上贵校的预科班？？？,我校在湖北没有预科．请您咨询一下黑龙江省民族管理干部学院看一下吧
山东理科考生,xi***ing1206 (山东),2006-06-26 11:23,老师你好！我是一名山东理科考生，成绩５２４分，请问报考贵校本科有希望吗？谢谢！,一本好像没希望了
请问,el*** (黑龙江),2006-06-26 11:06,我是黑龙江理科考生，482分，可以去贵校联合办学吗？谢谢。,"现在还没录取,分数线在录取之后才能知道,报二表联合有希望,"
老师您好！,gu***n123 (河北),2006-06-26 09:58,河北理科542分能否报贵校本二专业？能的话，请推荐几个专业，谢谢了！,我校对河北不招生.
请问,18*** (黑龙江),2006-06-26 09:29,老师您好我是黑龙江的理科考生我今年考分是427是否能进入贵校三表,请您在7月30号之后咨询
咨询,sh*** (黑龙江),2006-06-26 09:10,我是理科考了559分一表一填的贵校并服从分配录取的希望大么,如果够省段就差不多
问,19*** (黑龙江),2006-06-26 09:10,请问二表B有补报的机会么今年的录取分数会是多少？我是黑龙江的理科考生,没有补报，今年的录取分线只能在录取后才知道．
三表咨询,su***n (黑龙江),2006-06-26 09:10,请问老师本省文科考生442是否有希望就读贵校？毕业证是否与二表无异？入校后是否有转系的可能？,三表请您在7月30号再咨询.毕业证与一表二表一样.入校一学期后可以根据成绩申请调剂.
请问,fr***ry (山东),2006-06-26 09:10,我是山东考生，我考了583报贵校有无希望？？哪些专业比较有希望！,有希望
联合办学,li*** (黑龙江),2006-06-26 09:09,我465分，是否能进贵校的二表联合办学？希望有多大？谢谢！,首先你得够省的段．我校只能录取完之后才能知道分数线
黑龙江文科,88*** (安徽),2006-06-25 15:52,我是文科考生估分530多请问报贵校人力资源管理可行吗,你是哪个省的．对安徽是一表招生．首先你得够一表线．
老师请问:,88*** (黑龙江),2006-06-29 09:46,我是黑龙江考生，579分.二表一志愿报贵校.录取希望高吗?,"一表录取不上,二表应有很大希望."
咨询,41*** (黑龙江),2006-06-29 09:20,老师好，我是理科考生600分，一表二报的贵校，录取的可能有多大，谢谢,"根据往年的经验在一志愿没招满的情况下,是开二志愿的."
老师好,62*** (黑龙江),2006-06-29 09:03,我是黑龙江的考生，文科323是否能上贵校的三表,"希望不大,请咨询一下55191871看有没有希望"
123456789,ha***123 (黑龙江),2006-06-28 16:53,请问去年贵校农林经济管理多少分？？,去年最低534
7777777777777,ma*** (云南),2006-06-28 16:01,我今年考了云南文421能起本校吗???能上１专或预科吗？？？？希望大吗？？,我们学校今年在你们省只招收一本的学生．
服从调剂,lh*** (黑龙江),2006-06-28 14:28,请问该校的服从调剂是调剂到考生报考的相关专业还是学校随意调剂。,两种可能都有
动物医学,lh*** (黑龙江),2006-06-28 14:23,请问该校二表的动物医学专业去年的最低的录取分数线是多少？,去年的动物医学最低５６０
专业级差,lh*** (黑龙江),2006-06-28 14:20,请问该校的二表专业的专业级差是多少？,没有专业级差
请问三表,ch*** (黑龙江),2006-06-28 14:04,请问去年三表理科录取分数线？预计今年能略降吗？,０５年理科三表４５０，请您在七月末再咨询．
hanxilong,ha***123 (黑龙江),2006-06-28 13:32,如果我分数不够该校最低分数但享受黑龙江省考生照顾政策进入贵校投档学生当中，且服从专业分配。请问是否一定会被录取？？？伊春考生,承认本省的相关政策投档分承认加的分，排专业不看
老师,ls*** (黑龙江),2006-06-28 13:07,请问：贵校的食品科学与工程专业是贵校的品牌专业吗，就业率怎样？就业方向是哪里？,是比较好的专业．就业请登录我校网站查看一下吧
学费问题,ls*** (黑龙江),2006-06-28 13:04,请问：联合办学中一次交完四年学费有优惠吗？,现在还不清楚
老师请问：,ls*** (黑龙江),2006-06-28 13:02,二表联合办学与三表联合办学学费一样，毕业证一样，但是录取分数不一样，那么二表联合办学与三表联合办学到底有什么区别？,就是录取批次不一样．其他都一样
1,15*** (广西),2006-06-28 12:54,志愿级差，专业级差,没有级差
谢了,15*** (广西),2006-06-28 12:52,当生员不足时，贵校怎么办,我校不对广西招生
中外合资办学毕业证和正常入取生毕业证一样吗？,13***82 (黑龙江),2007-05-16 12:08,中外合资办学毕业证和正常入取生毕业证一样吗？,一样
咨询,ww***o (黑龙江),2007-05-15 14:39,1.是否有二表B，如果有是否有电气工程及自动化专业，去年的录取分数是多少，学费是多少？2.是否有三表(本科），如果有是否有电气工程及自动化专业，去年的录取分数是多少，学费是多少？,2B：有，没有电气工程及自动化专业，去年理工474分，文史468分，学费15750元/年；3本：有，没有电气工程及自动化专业，去年理工461分，文史466分，学费15750元/年。
报考,su*** (黑龙江),2007-05-15 13:02,2006年有本科三表生吗?录取分数是多少，收费标准?有哪些专业,[有；录取分数理工461、文史466；学费15750元/年；专业进校后重新选择，除我校规定的部分专业不能选以外，其余专业都可选择。07年本科三表大部分专业需要出国，与06年相比计划减少，为中俄合作办学，学制5年，计划理工110人，文史50人，按考生志愿录取。理工专业名称招生计划培养层次学制外语语种是否口试是否高职学费标准其中定向人数其中走读人数备注元/年国际经济与贸易10本科五年不限否否15750　　和俄罗斯太平洋国立大学合作办学，学生入学后前2.5年必须出国学习，不允许转入国内学习，毕业后发两国文凭工商管理10本科五年不限否否15750　　和俄罗斯远东国立技术水产大学合作办学，学生入学后前2.5年必须出国学习，不允许转入国内学习，毕业后发两国文凭金融学10本科五年不限否否15750　　和俄罗斯远东国立技术水产大学合作办学，学生入学后前2.5年必须出国学习，不允许转入国内学习，毕业后发两国文凭会计学10本科五年不限否否15750　　和俄罗斯远东国立技术水产大学合作办学，学生入学后前2.5年必须出国学习，不允许转入国内学习，毕业后发两国文凭计算机科学与技术20本科五年不限否否15750　　和俄罗斯太平洋国立大学合作办学，学生入学后前2.5年必须出国学习，不允许转入国内学习，毕业后发两国文凭食品科学与工程20本科五年不限否否15750　　和俄罗斯远东国立技术水产大学合作办学，学生入学后前2.5年必须出国学习，不允许转入国内学习，毕业后发两国文凭土地资源管理20本科五年不限否否15750　　和俄罗斯太平洋国立大学合作办学，学生入学后前2.5年必须出国学习，不允许转入国内学习，毕业后发两国文凭金融学10本科四年不限否否15750　　中外合作办学项目文史专业名称招生计划培养层次学制外语语种是否口试是否高职学费标准其中定向人数其中走读人数备注元/年国际经济与贸易10本科五年不限否否15750　　和俄罗斯太平洋国立大学合作办学，学生入学后前2.5年必须出国学习，不允许转入国内学习，毕业后发两国文凭工商管理10本科五年不限否否15750　　和俄罗斯远东国立技术水产大学合作办学，学生入学后前2.5年必须出国学习，不允许转入国内学习，毕业后发两国文凭金融学10本科五年不限否否15750　　和俄罗斯远东国立技术水产大学合作办学，学生入学后前2.5年必须出国学习，不允许转入国内学习，毕业后发两国文凭会计学10本科五年不限否否15750　　和俄罗斯远东国立技术水产大学合作办学，学生入学后前2.5年必须出国学习，不允许转入国内学习，毕业后发两国文凭金融学10本科四年不限否否15750　　中外合作办学项目
会计学和财务管理专业最低分数线,ka***jie (黑龙江),2007-05-15 09:31,请问贵校2006年会计学和财务管理专业（联合办学）理科考生最低录取分数线是多少？,06年2B是474分3表是461分我校无财务管理专业07年联合办学专业是按志愿录取，06年是进校后重新选择专业。录取方法不一样。
