标题,来源,时间,问题,回答
今年贵校是否在云南招国际文化贸易专业？立志读它该怎么办？,ph*** (云南),2010-05-11 10:38,国际文化贸易专业,考生你好，经济学类在云南云南的招生计划是文科3人。感谢你对中国传媒大学招生工作的支持，祝你高考成功。
有关“第一志愿考生”,xu*** (浙江),2010-05-11 10:29,请问：平行志愿中的第一、第二、第三……顺序考生（即A、B、C、D、E顺序）都等同与贵校简章中的“第一志愿考生”，对吗？,[考生您好：感谢您对我校2010年招生工作的关注！~~~对于浙江省，2010年的报考是采取平行志愿，平行志愿中的第一、第二、第三等都是平行的，所以无论顺序，只要您填报了我校，就等同于我校的“第一志愿考生”了。其他填报志愿相关事宜，建议您随时与我校或浙江省招办进行联系，以免出现任何问题。欢迎您报考中国传媒大学，并预祝您在高考中取得优异的成绩。
在天津招生,za*** (天津),2010-05-11 10:11,你好，贵校今年在天津招编辑出版专业吗,考生你好，中国传媒大学2010年在天津没有编辑出版专业的招生计划。感谢你对中国传媒大学招生工作的支持，祝你高考成功。
2010高考咨询,yi*** (广东),2010-05-11 09:59,老师，您好!我是广州市2010届高中毕业且是散居在广州市的少数民族文科考生，一模，二模均派位在二本文科生范围，请问您校2010年在广东省招生吗？若招，您校2010年招生有什么学院，什么系，什么专业可能招我这样的散居少数民族二本文科考生？请问您校2010年招生对我这种散居少数民族考生有没有什么特殊政策?有少数民族预科班吗？谢谢!,考生你好，学校的学院设置和专业设置请登录中国传媒大学本科招生网查询。我们学校没有二本专业。关于我校民族预科班的问题请咨询广东省招办，查看是否有招生计划。感谢你对中国传媒大学招生工作的支持，祝你高考成功。
安徽考生一问,ah*** (安徽),2010-05-11 09:49,请问贵校在安徽招生多少名，我文科摸考578可能被贵校录取吗？,同学你好，安徽省2010年招生计划是48人，其中，文科15人，理科33人。我校历年录取分数可以在中国传媒大学本科招生网上进行查询。感谢你对中国传媒大学招生工作的支持，祝你高考成功。
浙江理科662,qu*** (浙江),2009-06-25 13:12,老师您好，能否进中传,同学你好：比较有希望。可以报考。
山西文科考生,a8*** (山西),2009-06-25 13:08,我们山西的分数已经出来了。中传在晋的录取分数线会是多少？,同学你好：录取分数线现在还没出来。
山西文科考生,a8*** (山西),2009-06-25 13:08,我们山西的分数已经出来了。中传在晋的录取分数线会是多少？,您好，欢迎报考中国传媒大学山西文史类：08年重点线545最高分594最低分546平均分56107年重点线580最高分612最低分597平均分60306年重点线561最高分603最低分575平均分586具体情况请根据往年的录取分数线来定。谢谢您的提问。
录取,ca*** (云南),2009-06-25 13:05,师老，您好！我是一名云南的理科生，一本线是500，考了536，全省上一本的有13749，我的排名在6400名左右，能否进贵校？机会有多大？老师辛苦了！,云南去年最低理科录取线为573线上43分供你参考
艺术生（急！）,if*** (山东),2009-06-25 12:58,老师您好，我是山东一名艺术考生，想请教一些问题1.请问贵校的动画学院在山东省招收人数是多少？2.我的专业排名比较靠后，属于1/4计划范围内，文化分是429，参考过往年的分数线，但是非常想去贵校就读，希望老师给些建议，是否有希望被贵校录取呢？,同学你好：动画专业不给具体的省划分名额。全国统一招生。你的专业成绩排名不靠前，只能按四分之一录，但你的文化课也不占优势，希望可能会小些。
录取,ff*** (四川),2009-06-25 12:57,四川理科568能上贵校吗,同学你好：一般超过省重点线30分左右比较有希望上。
中国传媒大学转专业是如何安排的？,mu*** (浙江),2009-06-25 12:43,我怕专业服从后上了不喜欢的专业所以先想问问转专业的问题。,同学你好：关于转专业的问题，请登陆我校教务处下载相关文件来看。
请问广告学在各院校的排名顺序,ml*** (广东),2009-06-25 12:41,请问广告学在各院校的排名顺序,同学你好：我校各专业不排名，请理解！
山东招生老师的联系电话？,ma*** (山东),2009-06-25 12:39,我想知道主管山东招生的老师的联系电话，谢谢,同学你好：那边都是临时的咨询摊位，没有咨询电话。有问题可直接咨询我校招生办。
录取问题,do*** (云南),2009-06-25 12:31,老师你好，我是云南文科考生，高出一本44分，想报考贵校，任何专业都可以接受，请问，希望有多大,同学你好：很难估计。因为分数高的一年要超出重点线53分，低的一年只超出1分就可以。分数上下浮动很大，所以很难估计。你的成绩应该有希望，可以考虑一下。
咨询,cs*** (重庆),2009-06-25 12:28,老师你好，我是重庆理科考生，考分６３３，能否有把握贵校的工科专业？？谢谢,同学你好：重庆考生理工类一般高出重点线40分左右希望大些。
日语系,yi***itu (海南),2009-06-25 12:27,请问贵校今年在海南招的日语系会学习哪些内容，以后的就业方向有那些如果要转系，需要什么条件呢？谢谢,欢迎报考中国传媒大学关于日语系的介绍，敬请查看中国传媒大学主页。转系的条件可以咨询教务处主页。谢谢询问
咨询一下,aj*** (浙江),2009-06-25 12:15,浙江理科663报考电气信息类把握大吗？（中传的分数线一年比一年高啊）,你好去年分数供你参考浙江理科为600
河北一考生，急！,f5*** (河北),2009-06-25 12:03,请问文科593分报考贵校和选择专业把握大么？可以转专业么？,您好，欢迎报考中国传媒大学河北文史类：08年重点线537最高分589最低分567平均分57707年重点线566最高分615最低分569平均分58606年重点线561最高分603最低分594平均分600具体情况请您参考往年的高考录取分数线。专业是可以转的，但是要符合一定得条件。谢谢您的提问
咨询,xg*** (内蒙古),2009-06-25 12:01,老师您好：内蒙考生577上贵校有把握吗？,去年文科为575理科为601供你参考
询问：艺术类/戏剧影视美术,mo***u00 (山东),2009-06-26 11:55,老师您好：艺术类（戏剧影视美术）的考生。专业考试排名92（招收40）文化课444.根据我们省的《现代教育》资料书，2008年该系录取的山东考生最低分数419分，请问这是属于按什么排名录取的学生。（传媒官方网站上面的表格是没有说明的）像我这样的是否有希望？谢谢老师。,你好，415为专业排名四分之三的学生的最低分数，排名后四分之一的学生的最低分数线为460
cgl河北编导,sh*** (河北),2009-06-26 11:53,我是河北的考生，编导联考专业分154(河北省最低控制线150分)，文化分是364(河北省的编导专科最低控制线是348分)，报贵校的编导高职专科能被录取吗?,你好，我们没有统计过高职的录取最低分数线，从高分向低分录取
咨询,jc*** (福建),2009-06-26 11:49,我是福建理科考生今年成绩：597排名：9136本一线：569请问如何能被该校录取？？？无论是否请谢谢~,福建理科去年录取的最低分数线为546，供你参考，
湖北考生急求,lm*** (湖北),2009-06-26 11:47,湖北非艺术考生文科534能上贵校的广播或是传播学吗？,你好，06年我校此专业的最低分数为582线上接近四十分，供你参考
湖南文科考生583有多少把握考贵校？,yy*** (湖南),2009-06-26 11:41,湖南文科考生583有多少把握考贵校？,湖南08年的文科考生最低录取分数线为596供你参考
湖南理科考生.,42*** (湖南),2009-06-26 11:39,您好，我是湖南理工科考生，考了583分.我对贵校的广告学和媒体创意专业很有意向.请问我这样的情况可以作为第一志愿填报吗??并且我通过了贵校的艺术类广播电视编导，电视编辑方向专业考试，可以作为填报非艺术类专业的参考条件吗??(如同等条件下优先录取等.)谢谢.,你好，我校07年在湖南广告学的最低分为602供你参考，电视编导为全国统一录取。
咨询,jc*** (福建),2009-06-26 11:35,我是福建理科考生今年成绩：597排名：9136本一线：569请问如何能被该校录取？？？,福建理科考生08年最低录取分数线为546供你参考
是否有机会上贵校,lo*** (福建),2009-06-26 11:28,我是福建的考生，今年585，是否有机会上贵校,我校去年在福建理科最低分数为546文科为561
577,sh*** (河北),2009-06-26 11:18,老师您好，文科５７７高一本线３８分，报对外汉语是否有希望,你好去年的分数供你参考对外汉语普通类文史类589573
你好，老师,68*** (云南),2009-06-26 11:16,云南今年实行了平行志愿，贵校录取的分数会不会更高了？还是会下降一些？我是云南文科考生，我高云南一本线52分，报考贵校被录取的机会有多少？风险会不会很大？,你好，去年的云南文科录取最低分数为595供你参考
能否录取？,wr*** (湖北),2009-06-26 11:02,我是湖北文科考生，高考分数546，高出一本线28分，已拿贵校电编、数媒专业合格证，第一志愿是电编，第二志愿是数媒，能否被录取？盼答！,你好，这两个专业都是全国一起录取，数字媒体去年录取的最低分数为558供你参考
咨询,mo***991 (贵州),2009-06-26 10:57,您好，我是贵州理科考生，比一本录取线高70分，能否报考贵校?,你好，贵州理科去年最低录取分数线为550供你参考
报考,so***n (河北),2009-06-26 10:57,河北考生文史类585分，超一本线46分，全省第328位，报考贵校有把握吗？,河北文科的最低分数线去年为567分，供你参考
江苏报考，急!!!,67*** (江苏),2009-06-26 10:49,您好!中国传媒大学总部电话一直是忙音，请问是否能提供江苏省的招生电话吗???谢谢!,你好，我校招生办的电话一直有人接，电话为010-65779370/010-65779256
老师好,le*** (江苏),2009-06-26 10:33,请问.今年江苏考生，理科，383分，排位6740，测试AA，请问有希望上贵校吗,去年江苏理科最低分数为380供你参考
请教,zh***009 (山东),2009-06-26 09:09,老师：我是山东往届考生，今年文科考了621分报贵校新闻或法学专业？谢谢！,你好，新闻学普通类文史类6336243备注法学普通类文史类618615此为去年的分数供你参考
录取,wh*** (安徽),2009-06-26 09:07,老师，您好，我是安徽考生，报考播音与主持艺术专业，专业排名19，文化课考了436分，能录取吗？谢谢！,去年播音主持最低分数为420分，供你参考
咨询,gs*** (甘肃),2009-06-26 09:04,我是甘肃理科考生考分为574高出重点线53分能否被贵校录取谢谢,甘肃理科去年的最低分数为559供你参考
咨询,zh***shu (重庆),2009-06-26 09:03,我是重庆理科考生，考了603分，请问上贵校有无希望？,去年重庆理科最低分数为584供你参考
山西文科,ly*** (山西),2009-06-25 16:54,老师您好我是山西的文科考生，成绩564，高出一本线16分报考贵校希望大吗？而且我有书法特长，在录取专业有没有一些优惠的政策？谢谢,去年山西文科录取最低分数为546供你参考没有优惠政策
山东理科641,sh***41 (山东),2009-06-25 16:48,我是山东理科考生，执行省属线，考了641分，报考贵校有多大把握被录取？谢谢！,山东理科去年分数最低为606供你参考
老师您好!,yy*** (湖北),2009-06-25 16:43,老师您好!我是湖北省的考生，理科总分591.报考学校英语播音主持自主招生，并且取得合格证.请问:学校英语播音主持自主招生原本招收30人，现在合格的有69人，学校按什么原则录取!被录取的希望有多大?,英语（节目主持方向）专业实行自主招生，所有被认定为自主招生对象的考生，参加当年全国普通高等学校招生统一考试，在高考志愿中重点本科批次的第一志愿填报我校，高考成绩达到我校在当地招生计划数1：1调档线下20分，且实际高考成绩（不含加分）在当地省重点控制线上，即予录取。
录取,zo*** (广西),2009-06-25 16:42,我广西理科考生，高出一本线15分，愿意服从专业调剂，是否有机会录取,广西理科的最低录取分数去年为501
关于调档线（急！）,gl*** (浙江),2009-06-25 16:38,我是浙江理科生，想问下调档线是怎么确定的。和专业最低分有什么区别。今年中传的调档线会比一本线高50以上吗？,一般情况下专业最低分就是调档线去年浙江考生的理科最低录取分数为600分
咨询,fl*** (山东),2009-06-25 16:31,如何分配电气信息类所含专业小类,入学后一段时间再分
提前批,pa***a (浙江),2009-06-25 16:28,请问本校提前批专业有什么,浙江今年有德语意大利语葡萄牙语
咨询,li*** (山东),2009-06-25 16:24,你好！我是山东文科考生，今年考了632分，想报考贵校的西班牙语，能否被录取？,你好，非通用语没有历年分数可循，请耐心等待
咨询,71*** (浙江),2009-06-25 16:21,我是浙江文科考生6371999名报考贵校是否有希望还有在专业服从条件下是否会退档　投档比例是多少贵校哪些文科专业比较突出有没转专业专业级差多少,一般不退档，有转专业，级差2分，具体详情请查看我校招生网
help,ry*** (浙江),2009-06-25 16:12,请问浙江理科654分第一志愿填写中国传媒并且专业服从调配可以进吗？,去年浙江理科最低分数为600分供你参考
山东,mo*** (山东),2009-06-25 15:59,请问文科高一本30分有希望吗?能报什么专业呢?需要服从调剂吗?学小语种就业如何?,山东文科去年最低分为615供你参考，具体专业请登陆我校招生网，小语就业前景很好。
咨询,ji*** (河北),2009-06-26 09:57,请问老师能告诉我贵校的——戏剧影视美术设计——专业按照3/4录取，最后一个录取学生的专业排名？最好提供08、07、06三年的！！谢谢你的辛劳！,你好，我们没有统计过，具体分数请查看我校招生网http://zhaosheng.cuc.edu.cn/wsm/Default.aspx#
报考问题,hc*** (安徽),2009-06-26 09:55,请问贵校对于平行志愿省区的A，B，C，D志愿填报排序可有要求？安徽文科高一本线27分，报考贵校可能可大？哪些专业录取可能性大？谢谢,你好安徽去年文科最低录取分数为579分，供你参考，具体专业的分数请查看我校招生网http://zhaosheng.cuc.edu.cn/wsm/Default.aspx#
二志愿,qu*** (山东),2009-06-26 09:49,山东文科考生，650分，排名140，若二志愿报考贵校，是否只有当山东一志愿计划未完成才行？需要减掉一定分数么？希望大不？,第一志愿生源不足的情况下，接收非第一志愿考生。第一志愿生源充足时，在各省（自治区、直辖市）的投档规则可操作的情况下，按不低于40分的分数级差录取非第一志愿考生，录取人数不超过该省（自治区、直辖市）招生计划的10%
考生咨询,ha***698 (福建),2009-06-26 09:49,请问：非应届生可以报考贵校的艺术特长生吗？,可以报考我校的艺术类考试
天津理科575第二平行志愿有被录取的希望吗,in*** (天津),2009-06-26 09:45,我是天津理科考生，575分，第二平行志愿报的是中国传媒大学，能被录取码?(专业服从调剂)有多大把握?,第一志愿生源不足的情况下，接收非第一志愿考生。第一志愿生源充足时，在各省（自治区、直辖市）的投档规则可操作的情况下，按不低于40分的分数级差录取非第一志愿考生，录取人数不超过该省（自治区、直辖市）招生计划的10%
山东09文科631分,ca*** (山东),2009-06-26 09:40,山东文科，631分报考传媒的工商管理有无把握?,去年的分数工商管理普通类文史类618616
时间,nl*** (山西),2009-06-26 09:40,您好，请问提前批艺术类提档时间和录取日期是多会？最早什么时候可以知道结果？谢谢,你好，具体因省而异，具体请耐心等待
录取咨询,90*** (浙江),2009-06-26 09:39,我是浙江文科考生超出重点19分服从调配被贵校录取几率大吗？有没有可能,去年文科最低分数线为577，重点线为550供你参考
贵校的电气信息学,sa*** (浙江),2009-06-26 09:29,是不是先学一年再分科那其中的广播电视工程专业适不适合女生学女生多不多我浙江女生673有没有把握进,对，我们今年实行大类招生，适合女生学习，浙江去年理科最低分为600分
报考咨询,qy*** (山东),2009-06-26 09:23,老师您好，我是山东文科645分考生，若报考贵校，把握多大？,山东文科最低分数为615，供你参考
江苏考生咨询,cy*** (江苏),2009-06-26 09:23,359分，选修物理A+，化学A，必修AAAA，有希望报贵校吗?江苏考生排名多少可报贵校?请问贵校哪些专业比较强?考研以及出国的几率有多大？,江苏理科最低分数去年为380至于以后的考研和出国要看个人安排
baokao tingwen,cy*** (山东),2009-06-26 09:17,山东理科615分，报贵校可以吗？专业方面呢？谢谢,山东理科最低去年录取分数为606具体专业请查看我校招生网http://zhaosheng.cuc.edu.cn/wsm/Default.aspx#
政策加分,ci*** (河北),2009-06-26 09:16,您好！我是河北省考生，高考实际成绩608分，排名7546，优惠加分后618，排名5040。本一A志愿填报的贵校，现在我担心被投档后又被退档，然后只能降到本二录取。请问我这种情况被退档的可能性有多大？,我校据各省（自治区、直辖市）生源情况，提档比例控制在招生计划的110%以内。录取最低控制分数线不低于当地重点本科录取线。其中，实行平行志愿的省（自治区、直辖市），提档比例控制在招生计划的105%以内。如果专业服从调剂一般情况下不退档
老师您好!,yy*** (湖北),2009-06-26 09:15,老师您好!我是湖北省的考生，理科总分591.报考学校英语播音主持自主招生，并且取得合格证.请问:学校英语播音主持自主招生原本招收30人，现在合格的有69人，学校按什么原则录取!被录取的希望有多大?,英语（节目主持方向）专业实行自主招生，所有被认定为自主招生对象的考生，参加当年全国普通高等学校招生统一考试，在高考志愿中重点本科批次的第一志愿填报我校，高考成绩达到我校在当地招生计划数1：1调档线下20分，且实际高考成绩（不含加分）在当地省重点控制线上，即予录取。
安徽2009年文科录取分数大概,mi*** (安徽),2009-06-26 09:13,请问，一般来说在安徽的文科考生分数要高过一本线多少分才能被贵校录取?,去年安徽的文科考生最低录取分数为579
shandong,sh*** (山东),2009-06-26 10:32,老师好，我是山东文科考生626，报中国传媒大学有希望吗,去年山东考生的文科最低分数线为615，供你参考
录取咨询,sq*** (云南),2009-06-26 10:30,老师，您好，我是今年云南的文科考生，高考成绩高出一本线22分，想报考贵校（提前批次），请问是否有可能被录取，希望大吗？？,你好，我校非通用语第一次参加高考，没有分数查询，请耐心等待
提前本科录取,67*** (陕西),2009-06-26 10:29,我是陕西的文科考生，报考的是贵校的法语，属于提前本科，请问口语考试你们有什么具体要求，还有高考成绩中的英语成绩是不是很重要，我超出一本线43分。谢谢老师,没有特殊的要求，但是需要英语口试成绩合格。
提前批次问题,wa***nglei (河南),2009-06-26 10:27,老师好!我是河南文科考生，高考分数超一本线29分，提前批报考了我校小语种专业，这个分数线能顺利录取吗?另外录取前我想到贵校参观一下可以吗?能提供一下我校河南招生老师的手机号吗?谢谢!,你好，我校非通用语专业第一年参加高考没有分数可以参考，如你想参观学校可以直接来。
第一第二志愿录取比例？,mx*** (广东),2009-06-26 10:23,请问该校在2006，2007，2008录取的第一第二志愿学生录取各占多少比例？,你好，第一志愿生源不足的情况下，接收非第一志愿考生。第一志愿生源充足时，在各省（自治区、直辖市）的投档规则可操作的情况下，按不低于40分的分数级差录取非第一志愿考生，录取人数不超过该省（自治区、直辖市）招生计划的10%。
转专业,gy*** (湖南),2009-06-26 10:23,请问老师：贵校的小语种是在提前批里录取，本人很喜欢小语种，如果在提前批没被录取到贵校，但在本科一批被录取到贵校小语种之外的其他专业，以后还可以转小语种吗？或者可以转到英语主持专业吗？谢谢！,你好，外国语学院一般不接受转专业，具体情况请查看我校教务处
咨询,yy*** (福建),2009-06-26 10:21,我是福建理科考生，分数是590，上贵校有希望吗？,你好，去年我校理科的最低录取分数为546分
咨询,ne***1 (广东),2009-06-26 10:21,老师，您好!请问贵校数字媒体艺术有无排名?录取是按照高考五科成绩，还是四科成绩?谢谢!,你好，数字媒体专业是按照高考成绩录取的，
请问老师关于投档比例,zw*** (浙江),2009-06-26 10:20,老师您好，我是浙江理科656分，请问报考贵校有希望吗？还有投档比例是否1：1，有退档风险吗？谢谢。,根据各省（自治区、直辖市）生源情况，提档比例控制在招生计划的110%以内。录取最低控制分数线不低于当地重点本科录取线。其中，实行平行志愿的省（自治区、直辖市），提档比例控制在招生计划的105%以内。
报考咨询,ma*** (山东),2009-06-26 10:19,老师您好！我是山东理科考生，分数635，全省排名为7282，请问我报考贵校有多大的希望？能不能选你们的优势学科？一年后可以重新选专业吗？贵校往年在山东省录取学生排名约为多少啊？录取第二志愿考生吗？谢谢！,[去年山东的最低录取分数线为606，学生如果对录取的专业不满意，入学一年后有转专业的机会第一志愿生源不足的情况下，接收非第一志愿考生。第一志愿生源充足时，在各省（自治区、直辖市）的投档规则可操作的情况下，按不低于40分的分数级差录取非第一志愿考生，录取人数不超过该省（自治区、直辖市）招生计划的10%
播音主持咨询,gu*** (河北),2009-06-26 10:19,老师好，孩子很喜欢播音专业，很想知道文化分过河北省2本线16分能报你们学校专科吗?贵校的播音主持专科还能专生本吗？谢谢！,你好，我校没有专升本今年开始就没有了。
专业录取考虑加分？,ma*** (河北),2009-06-26 10:15,老师您好，我是河北理科考生，高考成绩为597+5，请问报考贵校的希望多大；若能被录取，再专业录取时是否承认优惠加分？谢谢老师！,河北理科去年录取分数最低分为587专业录取时不考虑加分
以往几年各专业的录取分数,gy*** (湖南),2009-06-26 10:12,老师，您好！我是湖南的一文科考生，想请问一下2008年之前贵校各专业在湖南的录取分数.谢谢！,你好请登陆我校招生网查看http://zhaosheng.cuc.edu.cn/wsm/RecruitPlanMarkForm.aspx?
咨询,ye***i (江西),2009-06-26 10:07,我是江西理科考生，高出一本线48分，请问报贵校被录取可能大么？,江西理科去年最低录取分数线为544，供你参考
关于提前批小语种,55***9 (安徽),2009-06-26 10:06,请问贵校在安徽提前批招收的意大利语对考生的身高有要求吗？,你好，没有
浙江理科660,bo***sheng (浙江),2009-06-25 15:59,老师您好，请问一下　1、我能否进中国传媒大学　2、如果服从专业调剂，会不会被退档谢谢,浙江理科去年最低分数为600分，一般服从调剂不会退档
有没有预科班?,ja*** (云南),2009-06-25 15:45,?,有少数民族预科班
疑问,qi***57 (广西),2009-06-25 15:41,老师您好！贵校专业中英语（影视剧译制）是近几年新开设的吧，我想了解一下该专业的就业方向和就业前景，会不会太窄啦？还有，若被贵校录取，除艺术专业外，转专业可以吗？比例是多少？,可以转专业，具体详情请咨询我校教务处
关于报考情况,ab***ao (山东),2009-06-25 15:39,老师您好，我是山东理科生，想报考贵校，成绩638分，比一本线高52分，能否被录取？谢谢老师回答,山东理科考生去年录取最低分数我为606，供你参考
