标题,来源,时间,问题,回答
请问，速回,zy*** (四川),2007-06-27 15:52,我是四川文科考生，分数为596.超出重点线37分.报考贵校有多大希望??,有希望，但无法确定。你省2006年录取成绩为文科551-601
就业,yu*** (浙江),2007-06-27 15:40,贵校就业前景如何,[作为中国广播影视传播人才的摇篮，50多年来，我校为广播影视系统及信息传播业培养输送毕业生6万多人，培训在职人员35万多人次。校友遍布全国各地及世界70多个国家和地区，很多人成为著名的记者、编辑、播音员、节目主持人、导演、编剧、制片人、翻译和高级工程技术专家。社会对学校的办学水平和人才培养质量给予了较高评价。我校毕业生以“专业特色明显，有良好的政治素质和理论修养，基础知识扎实，实践能力强，具有开拓和创新精神”等特点受到用人单位的青睐。近几年来，我校毕业生就业率一直保持在95%以上，毕业生整体需求旺盛，大部分专业供需比稳定在1：4以上，近年新增专业也有较好的就业前景，每年就业的毕业生中有80%的比例进入全国各地的省、市地区的广播、电视、报刊、网络、电影等传媒机构及相关行业，其中很多毕业生已成长为单位的业务骨干力量。
十万火急!!,da*** (河南),2007-06-27 15:28,不知道贵校是否在河南设有专科招生计划???是否可以专升本???，我是河南理科考生，今年考了521，想报考贵校的新闻方面的专业，不知是否有希望???谢谢老师!!!,我校没有专科专业
关于报考中国传媒大学的咨询,li***lisme (云南),2007-06-27 15:26,老师您好，我是2007届云南省文史类考生，高考成绩618分，请问如果报考中国传媒大学有希望吗？,有希望。
播音主持专业大专,qi*** (河南),2007-06-27 15:25,万分着急我参加的是河南播音主持统考艺术成绩是285，文化分是459.报考贵校的播音主持专业大专班有希望吗?希望有多大?录取规则是什么样的??谢谢!!,艺术类高职专业要视各省报考该专业的考生整体情况而定。
hyfdr,zy*** (云南),2007-06-27 15:24,云南省理科考生617，报贵校如何?高出一本线57分,很有希望。
咨询,wp*** (内蒙古),2007-06-27 14:50,我是内蒙的理科考生，考了607，我区的一本线是559，请问报贵校的希望大不大？,有希望。
我很想报考贵校,ti*** (江苏),2007-06-27 14:43,我是江苏省的生化考生，今年考了613，请问我可以投报贵校吗?谢谢!,有希望
老师好,xi***c (重庆),2007-06-26 16:30,我是重庆的一考生今年高考成绩584有希望能上贵校吗,有希望
山东文科考生640分,su***110 (山东),2007-06-26 16:21,请问老师，我是山东文科考生成绩640分，高出重点线47分，报考你们学校希望大吗?有多大?,请参照历年的各专业录取分数线http://zhaosheng.cuc.edu.cn/WSM/PastYearsMarkForm.aspx
四川考生,li***5 (四川),2007-06-26 16:17,你好我是四川文科考生高考成绩579在全省排名1877名有希望进入贵校学习吗?请介绍一下贵校新开设的专业--媒体创意还有，我的分数能上这个专业吗?,[有希望。媒体创意专业是应传媒事业发展需要而创办的一个带有交叉、综合特色的专业，旨在培养现代传媒所需要的专业的媒体“创意人”。所谓媒体“创意人”，即面向市场需求和变化，能够为大众传媒的信息建构与传播，以及媒介经营与管理等不断地提供创新性策略和构思的职业化的媒介“军师”，是一种以创新思维为核心，集艺术素养与传播智慧及媒介经营管理策略于一体的高素质、强能力的现代复合型人才。主干课程：媒体创意概论、美学概论、艺术符号学、视听语言、叙事学、媒介生态学、传播学概论、视觉传播、传媒市场调查与分析、创新思维原理与应用、报刊创意与策划、广播电视创意与策划、网站策划与设计、数字媒体技术与应用、流媒体原理与应用等。
录取,pu*** (重庆),2007-06-26 15:27,我是重庆文科学生，今年文考592分，能否报考贵校。,报考有希望。
江苏文科,xy*** (江苏),2007-06-26 15:08,我是江苏文科考生，今年611，还有希望报考贵校不?,请参照去年的录取分数线http://zhaosheng.cuc.edu.cn/WSM/PastYearsMarkForm.aspx
艺术类招生,ji***1 (广西),2007-06-26 14:24,请问：贵校０６，０７年艺术类招生最低分是多少？　　　如果错过了艺术类考试还能不能再考？,我校的艺术类专业录取原则各专业差异较大，最低控制线也不相同。艺术类专业必须先参加我校的专业加试，通过专业考试才可报考。
有无身高限制?,60*** (云南),2007-06-26 14:21,如题，谢谢.,非艺术类专业无身高限制，按照国家体检标准执行。
山东考生,sd*** (山东),2007-06-26 14:14,老师，您好。我是山东的文科考生，成绩是631，超重38分，报考贵校的文化管理专业有多大的把握？,有希望，但把握大小无法预测。
报考,we***in (福建),2007-06-26 13:56,我是福建的文科考生，本一线是565，我考586，报考贵校有多少希望啊，还有，我是北京大学的特长生，但是分数不够也，所以报考你们学校能有优先照顾吗？谢谢！！！谢谢！！！,高出20分有希望。但无其它照顾政策。
劳驾,yu*** (浙江),2007-06-26 13:53,浙江文科考生586分(1328名)上贵校可能大不大?,请参照去年的录取分数线http://zhaosheng.cuc.edu.cn/WSM/PastYearsMarkForm.aspx
英语系,89*** (安徽),2007-06-26 13:35,603分安徽可否填报贵校英语系？,可以，但我校英语（国际新闻专业）录取成绩较高。
云南文科考生的问题,me***8 (云南),2007-06-26 12:01,老师您好!我是云南省的文科考生，今年我的分数是619，云南省今年的一本线是575，请问我报考贵校有希望吗?希望有多大?谢谢!,请参照去年的录取分数线http://zhaosheng.cuc.edu.cn/WSM/PastYearsMarkForm.aspx
艺术类,su*** (河南),2007-06-26 11:49,我是美术类文科考生，文化课总分416，报贵校是第一志愿;1第一专业志愿戏剧影视美术设计，专业排名21，第二志愿动画，名次68名，请问上贵校有把握吗?2录取通知书的发放在什么时间?谢谢老师,你的专业和文化成绩都比较有希望。录取通知书的发放时间为河南省艺术类提前批次录取结束，办理完录取手续。
江苏考生,13*** (江苏),2007-06-26 11:49,文科605有希望报考贵校吗？有的话，什么专业？,请参照历年的各专业录取分数线http://zhaosheng.cuc.edu.cn/WSM/PastYearsMarkForm.aspx
山东考生554分想报考传媒大学戏剧影视文学专业有希望吗,li*** (山东),2007-06-26 11:35,我是山东的考生｀文化课考了５５４分｀艺术文｀请问报考中国传媒大学戏剧影视文学专业有希望吗？请问中国传媒大学戏剧影视文学专业在山东预计招收多少名学生｀有什么分数的要求？录取原则是不是全国文化课从高到低录取还是各省有具体规定,去年为578分；面向全国招生
hehe,en***16 (山东),2007-06-25 13:04,山东文科633，贵校有希望吗？,有希望
理472,25*** (山东),2007-06-25 12:39,可以吗？,一般来说高于重点线30-40分。
少数民族预科生,gx*** (广西),2007-06-25 11:51,我女儿是今年文科生，高考成绩特征分为529分，想填报嗝贵校的少数民族预科班，请问是否有希望?谢谢!,我校今年在广西没有预科招生计划。
湖南招生人数,62*** (湖南),2007-06-25 11:44,湖南招生人数,计划总数38人，其中文科16、理科22
咨询,yx*** (浙江),2007-06-25 11:38,"我是浙江文科考生，请问高出重点线31分是否有希望报考贵校?专业的级差分是多少?这个分数报考""新闻学""，""对外汉语""的希望大吗?",有希望。专业级差2分。这个成绩报考新闻学专业有风险。
报考,12*** (四川),2007-06-25 11:30,理科540有希望报考贵校吗?,请登陆我校招生网查询历年各专业录取分数线等相关详细信息http://zhaosheng.cuc.edu.cn/WSM/Default.aspx
07年提前批次的数字媒体艺术在北京招多少人？,63*** (北京),2007-06-25 11:17,控制分数线是多少？,该专业全国招生，不做分省计划。06年在北京录取文科583-559，理科621-523
四川文科考生620,13***68 (四川),2007-06-25 11:11,我是四川文科考生，重本线为558，我考了610分，加优干10分，我想报贵校媒体创意与传播学，请问是否有希望被录取?这两种专业是否授学位?,请登陆我校招生网查询历年各专业录取分数线等相关详细信息http://zhaosheng.cuc.edu.cn/WSM/Default.aspx都授学位
关于艺术专业影视戏剧文学(译制片方向)的一些疑惑,su*** (湖南),2007-06-25 11:10,在中传的资料书上有看到译制片这个专业是专业成绩通过后按高考成绩来录取.但是如果专业成绩位于全国前三就可以有优惠政策.但是我们收到的专业录取合格书没有写明专业成绩的排名，请问，没有写明是否就表示不是全国全三呢?这类通过高考排名的专业的专业成绩的排名会不会公开呢?,没写明的就不是前三。除全国前三外其余不做排名。
河北游戏考生疑问，谢谢解答！,ba*** (河北),2007-06-25 11:09,我在广院通过游戏程序设计数字媒体艺术和戏文（影视片译制）的专业考试经查询在河北省专业排名均在前3位，但广院在我省有两个学校代码，我只能在最喜欢的游戏和译制中择一填报第一志愿。请问第二志愿是否有机会被广院录取？我倾向游戏程序设计请问报游戏或译制为第一志愿哪个录取几率较大？河北省今年一本控制线为587分我的高考成绩为620分请老师解答我的问题，谢谢！,我们的录取是按照专业考试时在我校填报的志愿顺序进行录取的，各志愿之间不设志愿级差。你的成绩有希望。
咨询,fj*** (浙江),2007-06-25 11:04,浙江文科生576分，超出重点线23分，请问，进入贵校学习的希望有多大?谢谢.,有希望但不确定。你省2006年录取成绩为文科611-623
你好,sh*** (山东),2007-06-25 11:04,老师您好，我想咨询一下，贵校的录取分数线最低是多少分．谢谢！,你省2006年录取成绩为理科602-646
请问我文科572报译制专业希望大吗?,in*** (浙江),2007-06-25 10:38,请问我文科572报译制专业希望大吗?,该专业去年在浙江的录取分数为583-605供参考。
山东理科,lo***1 (山东),2007-06-25 10:35,老师您好，估计今年最底线大约是多少?山东理科考了590报考贵校，被录取的几率大约多大?,你省2006年录取成绩为理科602-646
山东烟台考生,wa***ong (山东),2007-06-25 10:25,我是山东烟台考生，我的高考分数是467分（语文65分，数学131分，英语70分，理综150分，基本能力48分，我的理科成绩较好，今年主要是英语和理综科目发挥失常，平时我英语成绩在100左右，理综在190左右），我在烟台市高中生中计算机属于顶尖水平，曾经在高二，高三获得两届全国中学生信息学联赛二等奖（其实我两年都是一等奖，是被人为因素排挤下来的，因为一等奖有保送资格等诸多因素，烟台二中刘昊洋分数本来不够一等奖，结果他的分数由于人为因素达到了一等奖，保送到中国人民大学）。我知道我的分数未达到贵校分数线，贵校是否能破格录取我到计算机科学与技术系？我的电话是0535-4981915（小灵通）,我校没有破格录取
老师好-山西文科考生590分报贵校有风险么？,zo*** (山西),2007-06-13 09:19,老师好-山西文科考生590分报贵校有风险么？今年最低分会是多少呢？谢谢！,去年山西文科最低分为575请登陆我校招生网查询相关资料http://zhaosheng.cuc.edu.cn/WSM/Default.aspx
关于录取分数,xu***3456 (天津),2007-06-13 09:07,天津考585分报考贵校有风险吗，归校毕业生考研成功的比例是多少,请登陆我校招生网查询相关资料http://zhaosheng.cuc.edu.cn/WSM/Default.aspx每年都有许多学生考研成功。
理科估560，报中国传媒大学可以吗？,ji*** (天津),2007-06-12 16:47,理科估560，报中国传媒大学可以吗？,请登陆我校招生网查询相关资料http://zhaosheng.cuc.edu.cn/WSM/Default.aspx
????,86*** (河南),2007-06-12 16:10,我古拉600上贵校希望大吗？[河南的,请参照历年的录取分数线http://zhaosheng.cuc.edu.cn/WSM/PastYearsMarkForm.aspx
河南考生　理工类　估分620报考贵校录取可能性有多大？,ba***1989826 (河南),2007-06-12 15:11,我是今年河南应届考生，理工类，保守估分620报考贵校录取可能性有多大？,请登陆我校招生网查询相关资料http://zhaosheng.cuc.edu.cn/WSM/Default.aspx去年河南理科的最低分为599
咨询,wx*** (江苏),2007-06-12 14:48,老师：我是一名江苏理科生，今年估分约超出重点线30分左右，我想报贵校动画学院，录取的可能性大吗？另，贵校06年在江苏招生的分数是多少？,请参考我校招生网相关资料http://zhaosheng.cuc.edu.cn/WSM/Default.aspx理科最低为601
传播学,40*** (四川),2007-06-12 14:46,老师好，请问贵校传播学专业的就业方向是什么？谢谢！,新闻媒体、专业网站等
去年全国各地招生录取人数,fl*** (河南),2007-06-12 14:44,中传的老师们好！我今年报了中传的播音与主持艺术专业，我只知道贵校去年的最低分是505，但我想知道这个分数的考生是哪个省的？我是河南的，专业考了男生全国44名，想上得多少分？,这个成绩是全国排队后的最低分。
咨询,qf*** (浙江),2007-06-12 14:41,老师好，我是南京一考生，请问老师我想报考贵校的西班牙语专业，估计今年的分数线是多少?单独考试考什么?何时进行?谢谢,小语种考试已经结束
天津理科考生,zh***g (天津),2007-06-12 14:41,请问564分能否报考贵校新闻或广播电视工程专业？谢谢。,新闻今年在天津不招生；广电工去年分数为562
新闻学,73*** (陕西),2007-06-12 14:18,新闻学专业在陕西录多少人？,今年不招生
艺术专业能否兼报,19*** (河南),2007-06-12 14:01,老师您好！我是艺术生我想问一下如果第一志愿我报了咱学校的播音第二志愿能不能报其他艺术院校的空乘这属于兼报吗！,各省的兼报要求不一样，请咨询你省招办。
咨询!,st*** (湖北),2007-06-12 12:53,老师您好.我想询问有关在湖北的招生情况和分数线问题.以及其他的身体方面的要求.,请参考我校招生网相关资料http://zhaosheng.cuc.edu.cn/WSM/Default.aspx
问题,hj*** (浙江),2007-06-12 12:11,问：英播专业（已获专业合格），04-06年浙江省录取分数线是多少？该专业分配就业情况又如何？毕业后是否有条件可继续深造？,06年浙江录取文科625-570，理科571。该专业毕业后就业前景不错，学生也有部分考研、联系出国深造
河南考生问,fx*** (河南),2007-06-12 12:06,取请问考615分在河南2007被录取有多大希望,有希望但不确定
咨询,fa*** (江苏),2007-06-14 14:41,老师好，我是南京金陵中学的考生，请问报考贵校的英语或小语种专业，对选考科目有要求吗?招生时有专业级差吗?谢谢.,小语种已面试结束专业级差为2分
录取,zh***in (贵州),2007-06-14 14:29,贵州文科565，既报统招，也报预科，把握大吗???,统招没上重点线，预科有希望。
急问,xk*** (安徽),2007-06-14 14:03,安徽理科今年600分能否报考贵校,请参考我校招生网相关资料http://zhaosheng.cuc.edu.cn/WSM/Default.aspx去年安徽理科最低为585
咨询,ly*** (云南),2007-06-14 13:23,云南估分620能报吗？,请参考我校招生网相关资料http://zhaosheng.cuc.edu.cn/WSM/Default.aspx
咨询,57*** (江苏),2007-06-14 12:18,问贵校今年是按专业大类招生吗？理工科各专业级差是多少？如服从，入校后还能转专业吗？,没有大类之说级差为2分就读一年后有转专业的机会
河南播音主持理科考生,ma*** (河南),2007-06-14 12:11,老师您好！我是河南理科考生，我的播音主持省统考成绩为328分文化课440分，请问报考贵校的大专，希望大么？,有希望，但不确定
我是艺(理)考生，专业课已过，今年高考成绩估分520，能否被,ir*** (安徽),2007-06-14 11:39,请问老师，我是艺(理)考生，专业课已过，今年高考成绩估分520，能否被贵校游戏程序设计录取?谢谢!,去年该专业河南录取成绩550分，供你参考。
咨　询,wa*** (黑龙江),2007-06-14 11:35,我是黑龙江省文科考生　估分610　请问我要是二志愿报考贵校可否录取（服从调剂）录取分数线大概是多少？,请参考我校招生网相关资料http://zhaosheng.cuc.edu.cn/WSM/Default.aspx志愿级差为40分
咨询,re*** (黑龙江),2007-06-14 11:19,我是黑龙江文科考生，估600--610，有希望学新闻系吗？,请参考我校招生网相关资料http://zhaosheng.cuc.edu.cn/WSM/Default.aspx
咨询,zh*** (黑龙江),2007-06-14 11:03,我是黑龙江文科考生，估分在607分左右，没有参加贵校的各种专业考试，请问能否报考贵校?加的分在分专业时是否认可?谢谢!,请参考我校招生网相关资料http://zhaosheng.cuc.edu.cn/WSM/Default.aspx我校还有其他不需要专业考试的普通本科专业提档加分录取不加分
问题,41***000 (河南),2007-06-14 10:56,中国传媒河南招生组电话?,没有
自费,sh*** (浙江),2007-06-14 10:49,如果考的不是很好，文科生可以到贵校自费就读吗?,没有
iask,ts*** (广西),2007-06-14 10:48,您好，我是一名理科考生，估分605分，请问录取贵校的风险大不？报那些专业希望较大？,请参考我校招生网相关资料http://zhaosheng.cuc.edu.cn/WSM/Default.aspx
联系电话,ba***i (贵州),2007-06-14 10:43,请问贵校在贵州省招生的联系电话,没有本校招生
联系方式,re*** (黑龙江),2007-06-14 10:42,我想咨询贵校在黑龙江咨询人员的联系方式谢谢,请致电010-65779370咨询
615,gb*** (河南),2007-06-14 10:38,今年615分上贵校的可能有多大？,请参考我校招生网相关资料http://zhaosheng.cuc.edu.cn/WSM/Default.aspx
请教,ji*** (河南),2007-06-14 10:36,河南理科620，能选择专业吗？谢谢,请参考我校招生网相关资料http://zhaosheng.cuc.edu.cn/WSM/Default.aspx
请问贵校开设的少数民族预科班在云南是否招生,lq*** (云南),2007-06-14 09:58,请问贵校开设的少数民族预科班在云南是否招生？去年的预科生最高最低分分别是多少？录了多少人？今年打算在云南招收几人？估分555有没有希望？请老师详细介绍一下详细情况。辛苦老师了！,预科班在云南没有招生计划
咨询,al*** (黑龙江),2007-06-14 09:55,老师您好，我是黑龙江文科考生，保守估计607分，但根据往年贵校在我省的录取分数线感觉不是很有把握，贵校的专业设置我都很喜欢，不知能否有希望被贵校录取？谢谢！,你省2006年录取成绩为理科606-644，供你参考
老师您辛苦了,zy***yy (广西),2007-06-14 09:51,老师您好:我想请教您两个问题:一个是请问贵校是怎样看待加分政策的，安排专业是是否还看加分?二是请问贵校是否招收二志愿考生，如果招收招收规则是怎样的?贵校近五年来是否有过招收二志愿考生的情况，如果有，每年的人数是多少?谢谢!,提档加分录取不加分有2志愿但基本1志愿报满了
云南文科590（估）能否报考贵校,re***imoto (云南),2007-06-14 09:49,您好，我是云南文科考生，英语口语方面较为突出，是2007年度中央电视台希望英语栏目希望之星英语风采大赛全国总决赛选手，希望报考贵校英语专业，请问有无录取可能，如有可能，哪一个专业合适？谢谢！,请参考我校招生网相关资料http://zhaosheng.cuc.edu.cn/WSM/Default.aspx
要紧(艺术类),yu*** (山东),2007-06-14 09:35,老师好，我的专业是戏剧影视美术设计(场景方向)，排名91，文化课估分420左右，如果我第一志愿报这个，被贵校录取的几率大吗?多大?谢谢!,有希望，但不确定
老师辛苦,sy*** (黑龙江),2007-06-13 15:47,我是黑龙江一考生，报考贵校动画（游戏设计方向）与电视摄影专业，我高考估分为550左右，我能否被录取，哪一个机会更大一些呢？谢谢了,请参考我校招生网相关资料http://zhaosheng.cuc.edu.cn/WSM/Default.aspx报考这2专业都需参加我校之前组织的艺术类专业考试
关于小语种的招生,46*** (河南),2007-06-13 15:07,小语种是否只招收应届高中毕业生？为何不招收复读生？,只招收应届高中毕业生
咨询,68*** (黑龙江),2007-06-13 14:43,老师：你好！我想问一下我今年高考估分在600分左右，有希望报考你校新闻专业和工商管理专业人员吗？,请参考我校招生网相关资料http://zhaosheng.cuc.edu.cn/WSM/Default.aspx此2专业在黑龙江招生文科生去年文科最低分为580供你参考
提前批,yo*** (广西),2007-06-13 14:38,请问一下，贵校提前批专业中有否非艺术类考生可报考的专业？谢谢,没有
liaoning,ya*** (辽宁),2007-06-13 13:01,我是辽宁应届理科女考生，初步估分在610左右，1.抱考贵校是否有希望被录取?2.贵校录取过程是否看英语小分?谢谢!!,请参照去年的录取分数线http://zhaosheng.cuc.edu.cn/WSM/PastYearsMarkForm.aspx
电视节目制作专科,de*** (河南),2007-06-13 12:13,我是河南理科考生，请问该专业的录取是看统考分和高考成绩的综合分，还是在统考成绩合格的情况下只看高考成绩，今年估分５２２是否有希望？,统考成绩合格的情况下只看高考成绩从高到低录取
咨询,ml*** (天津),2007-06-13 11:54,老师您好，文科550分能否被贵校录取？谢谢,天津去年最低位542请参考我校招生网相关资料http://zhaosheng.cuc.edu.cn/WSM/Default.aspx
570-580分可以报考您校吗?,li*** (天津),2007-06-13 11:21,谢谢!,请参考我校招生网相关资料http://zhaosheng.cuc.edu.cn/WSM/Default.aspx天津去年文最低为542理最低位532供参考
休息一下,xi*** (河北),2007-06-21 10:39,老师您好我是河北文科普通考生今年估分570-580第一志愿报考贵校并服从专业调剂有多大希望被录取？谢谢老师回答！,请登陆我校招生网查询历年各专业录取分数线等相关详细信息http://zhaosheng.cuc.edu.cn/WSM/Default.aspx
老师您好,ge*** (广西),2007-06-21 09:37,老师您好请问1超出重点线60分录取你校希望有多大？2学校是否招收2志愿考生？2志愿招生政策如何？3进入小语种专业的学生是否有机会转入其他非语言专业学习？4学校是否参加2007年在广西的高考招生咨询会？谢谢，老师辛苦了,请参考我校招生网相关资料http://zhaosheng.cuc.edu.cn/WSM/Default.aspx小语种的不能转专业
二视一,cb*** (四川),2007-06-20 10:57,请问对第二志愿考生，参加专业排序时，是按实考分数，还是要减去40分,志愿级差为40
有关二愿,li*** (辽宁),2007-06-20 09:10,贵校今年是否开二愿，如果开，有什么条件,第一志愿生源不足的情况下，接收非第一志愿考生。第一志愿生源充足时，在各省（自治区、直辖市）的投档规则可操作的情况下，按不低于40分的分数级差录取非第一志愿考生，录取人数不超过该省（自治区、直辖市）招生计划的10%。
对外汉语,zq*** (山东),2007-06-19 16:03,老师您好！贵校的对外汉语专业是否需要英语口试成绩？,不需要
老师您好，,gh*** (河北),2007-06-19 13:17,我是河北理科考生，分数６００分，能否考取贵校？请,河北去年理科录取最低为603分供你参考
艺术生,ka***23 (湖北),2007-06-19 11:24,我是湖北数媒考生，估计能达到普通一本线，是否有录取机会，该专业在湖北能招多少人．,面向全国不分省
宁夏考生,nx*** (宁夏),2007-06-19 10:13,您好！我是宁夏回族文科考生！估分550左右，报考贵校能否被录取？谢谢！,去年最低分为542供参考
求助于老师,dz*** (云南),2007-06-18 13:55,我是云南的文科考生(男)，估计高考考分620分，并有政策加分，是否能读贵校?,云南去年理科最低录取分数为603请参考我校招生网相关资料http://zhaosheng.cuc.edu.cn/WSM/Default.aspx
我是黑龙江文科考生,se***rever (黑龙江),2007-06-18 13:48,我是黑龙江文科考生，我估了620分，估计今年重点线563，来中国传媒的新闻学把握大吗？汉语言文学呢？,请参考我校招生网相关资料http://zhaosheng.cuc.edu.cn/WSM/Default.aspx新闻学去年在黑龙江未招生汉语言文学去年在黑龙江最低录取分为595
咨询,js*** (江苏),2007-06-18 13:21,老师您好，我是江苏文科考生，请问贵校英语（国际新闻）专业大概要高于一本线多少分？谢谢,请参考我校招生网相关资料http://zhaosheng.cuc.edu.cn/WSM/Default.aspx
