标题,来源,时间,问题,回答
咨询,18***04 (云南),2018-06-27 10:39,您好，请问云南昆明市城镇户口的白族考生，高考分数606，是否有资格报考贵校的预科？,资格的问题要咨询省招办
咨询,15***70 (云南),2018-06-27 10:36,云南考生分数645超过一本线115理科省排2087报考贵校有无可能,你好，按照历年录取情况看，该分录取希望非常大！
河南理科,18***36 (河南),2018-06-27 10:21,河南理科成绩598分，英语139，听力29，小语种有望录吗？需要什么附加条件吗？,河南没有小语种计划啊？
中国传媒大学和中国传媒大学的南广学院一样吗,15***51 (河南),2018-06-27 10:12,中国传媒大学和中国传媒大学的南广学院一样吗,您好，这是不一样的两所学校
河南理科考生 国家专项计划录取,15***55 (河南),2018-06-27 10:05,561分（本一499）是否有希望报考贵校,有希望但是希望不太大
河南文科617（超一本线70分），排名2562,15***92 (河南),2018-06-27 09:38,老师您好！河南考生文科617（超一本线70分），排名2562，第一志愿有希望上贵校吗？,您好，按历年看，有一定困难，但平行志愿同样欢迎您报考
河南文科考生,17***61 (河南),2018-06-27 09:33,老师我今年文科高考分数633，省排名1089，报考中传有希望吗,有希望
艺术类提前批录取,18***05 (山东),2018-06-27 09:33,请问今年艺术类提前批最早何时能公布录取结果？,您好：我们严格按照各个省招生办的录取时间进行录取，您可以查看所在省份的录取时间计划
山西文科普通一本招生,18***45 (山西),2018-06-27 09:33,我是山西省文科考生，高考分数602，高出一本批次线56分，全省排名721名，报考中传汉语国际教育可能性大吗，有可能选择自己喜欢的专业吗？,有点困难
贫困专项,15***89 (青海),2018-06-27 09:23,老师您好，我是青海农村文科考生，享有贫困专项，超一本线65分，总分540，报考贵校录取希望大吗？,有希望
天津 考生,13***89 (天津),2018-06-27 09:10,您好，我是天津考生，今年考分622，位次3983。报考贵样有希望吗?谢谢！,比较困难
咨询,18***70 (青海),2018-06-26 16:35,老师您好，我是青海文史类考生，分数574，排名100，有希望上贵校吗？若有，能上哪些专业？,http://zhaosheng.cuc.edu.cn/zs/Inquiry/Plan.aspx招生计划查询网址有希望
志愿填报,13***44 (山西),2018-06-26 16:27,老师你好，山西理科，男性考生594分，有没有可能进入贵校学习？,有希望
美术类：专业统考240 文化统考432,xc***126.com (河南),2018-06-26 15:43,美术类：专业统考240文化统考432被贵校录取的概率有多大,有校考合格证么？
吉林考生 一批A,15***88 (吉林),2018-06-26 15:12,请问吉林考生628分（一本线533）省排名2948被贵校录取的可能性大吗,大
关于提前批,18***53 (广西),2018-06-26 12:42,老师您好，我文科604分，在广西文科排名1149，请问报考贵校提前批的西班牙语有希望吗？,你好，有录取希望的，欢迎报考。
河南理科 专项计划,15***10 (河南),2018-06-26 12:08,你好.河南理科568.位次34859.有希望吗？,你好，请参考我校往年录取分数排名情况填报志愿，国家专项计划为平行志愿投档录取，可以冲一冲
我是河南文科考生，咨询提前批,50***@qq.com (河南),2018-06-26 12:06,我的分数614，请问文科提前批都有什么专业？有希望被录取吗？如果走平行志愿，有希望大吗？谢谢老师！,河南没有普通类提前批
咨询,15***70 (云南),2018-06-26 11:49,云南考生分数645超过一本线115省排2087报考贵校有无可能,非常有
重庆理科录取咨询,13***98 (重庆),2018-06-26 11:24,老师，您好！我是重庆理科考生，分数624，线差100分，位次5737，(本科第一批)报考贵校录取希望大吗？如果我服从调剂，会更有可能吗？,你好，根据我校往年录取排名，你的成绩有希望被我校录取。平行志愿投档建议考生均选择志愿服从调剂
山西提前批小语种,15***03 (山西),2018-06-26 11:14,你好，我是山西考生省排1116，请问有希望提前批次录取吗,有希望
提前批小语种,15***32 (河南),2018-06-26 10:58,请问中传在提前批小语种中的学校代码是什么？（河南的招生之友上没有）如果我报考提前批小语种被退档，我还能在国家专项中继续报考中传吗？谢谢老师,你好，我校在河南省的院校代码为1470。小语种为提前批次录取，不影响后续的国家专项及一批的录取。
提前批问题,15***30 (海南),2018-06-26 10:24,您好，请问中传提前批法语等语言系的就业方向，以及去年提前批海南的录取分数线是多少？,你好，专业介绍请参见：http://zhaosheng.cuc.edu.cn/zs/MajorInfo.aspx我校2017年在海南省提前批小语种录取最低分783分。
提前批咨询,15***30 (海南),2018-06-26 10:19,您好请问贵校提前批法语系能拿什么文凭，是贵校的优势学科吗？,你好，小语种专业是我校外国语专业的特色专业，法语专业就业前景良好，欢迎报考
海南文科,15***30 (海南),2018-06-26 10:17,海南文科785全省文科排名148有希望吗,有
贵校在山东有专科计划吗,zx***sohu.com (山东),2018-06-26 09:55,在山东有专科计划吗？山东理多少分能报,你好，我们只有艺术类高职，您可以参照我校今年高职招生简章查看：http://zhaosheng.cuc.edu.cn/zs/Plugins/pdfViewer/web/viewer.html?file=http://zhaosheng.cuc.edu.cn/zs/CUCUploadfiles/%5c201802%5c2018%E5%B9%B4%E9%AB%98%E8%81%8C%E7%AE%80%E7%AB%A0.pdf
四川文科考生总成绩621分，位次大概在390左右,13***89 (四川),2018-06-26 09:49,报考贵校有希望吗？,你好，非常有希望被我校录取，欢迎报考
中国传媒大学视觉传达,13***11 (四川),2018-06-26 09:25,请问老师视觉传达2.03分能被录取吗,你好，根据往年的录取情况，综合分2.03被我校视觉传达设计专业录取可能性较大。
国家专项 河南考生 录取,15***55 (河南),2018-06-26 09:24,我561分，省排名33974，我想靠国家专项计划报考贵校，有希望,你好，请参考我校往年录取分数填报志愿。
录取问题,yu***000@126.com (北京),2018-06-26 09:17,您好，北京理科今年成绩637，市排名3644，请问有没有可能报考贵校,你好，根据我校往年在北京市录取排名，有望被我校录取。欢迎报考。
中外合作,13***99 (北京),2018-06-28 10:26,请问中外合作有什么特殊要求吗？是否提档了不退档？谢谢1,没有特殊要求，100%提档，不退
新疆考生,13***51 (新疆),2018-06-28 10:04,请问贵校在新疆一本只招收三个专业，同意调剂，如果提档，会被退档吗,服从调剂不退档
报考及专业咨询,18***57 (甘肃),2018-06-28 09:58,青海理科考生564分，英语单科141分，排名557-578，贵校今年没有在青海招生网络新媒体、新闻传媒。想报传媒经济，有希望吗，入校后能在1-2年内转专业到新闻传媒或网络新媒体，可以吗？谢谢！,有希望
转专业,13***75 (北京),2018-06-28 09:53,您好，请问学校转专业难吗，计算机和信息类的转传播学，比例是多少，大一的时候基础课一样吗？谢谢,要考试，每年情况不一样，没有比例统计
录取,13***55 (河北),2018-06-28 09:47,你好，河北考生，艺术理高考626分，河北一本线511，有电编专业合格证，提前批A录取概率有多大？,几乎100%
录取几率,18***23 (河南),2018-06-28 09:47,河南理科考生611分11712名，报考贵校有希望被录取吗？谢谢。,希望不大
广西考生,15***81 (广西),2018-06-28 09:36,我是广西理科2018年考生，总分606，区位排名5666，想问一问老师冲中传有希望吗,前两个志愿报我们试试吧，还是有希望的
报考咨询,13***02 (河南),2018-06-28 09:34,河南考生理科596分，高出一本线97分，省排名18100左右，报考贵校可以吗？如果可以有哪些专业推荐呢？,可能要10000名以内
录取咨询,15***71 (山西),2018-06-28 09:28,您好，我是山西文科考生，分数591，省排名1223，有希望能被贵校录取吗？有可能选到理想的专业吗?,一志愿冲一冲有可能，但肯定选不了专业
北京文科排位1311,18***06 (北京),2018-06-28 09:26,老师辛苦了，非常喜欢小语种，没考好！想报提前批同意调剂，有机会录取吗？谢谢。,不是特别保险，但也不是没有机会
报考,13***51 (广西),2018-06-28 09:14,老师，广西理科620分，排名3608。报贵校有希望吗？,非常有
江苏,18***67 (江苏),2018-06-28 09:10,理科372分，选修B+B+录取希望大吗？,不算太大
录取几率,13***16 (河南),2018-06-28 09:07,您好，河南理科61510370名第一或第二志愿报考贵校录取几率大吗？,一志愿冲一下可以试试
咨询,13***12 (贵州),2018-06-28 09:02,贵州考生理科615排名3264，有希望进贵校吗,非常有希望
录取几率,13***16 (河南),2018-06-27 16:17,河南考生615排名100370录取可能性大吗?能不能选专业？谢谢老师,你好，文科10000名希望不大。
广东文科,13***75 (广东),2018-06-27 15:48,您好，本人高考成绩511，想报考贵校的中外合作办学专业，请问能被录取的几率有多大？谢谢。,你好，希望不大。
录取,18***69 (江西),2018-06-27 15:29,江西文科609分，通过国家专项有可能录取吗？,你好，有希望
青海文科考生录取咨询,18***89 (青海),2018-06-27 15:16,老师，您好！青海文科考生，高考成绩562分，超一本线87分，全省排名160，报考贵校传播专业有希望吗？,你好，有希望，可以报考。
老师您好！,13***75 (江西),2018-06-27 14:43,老师您好！请问文科628分，江西省排名649有希望被贵校录取吗？,你好，有希望，可以报考。
咨询,13***33 (黑龙江),2018-06-27 14:36,黑龙江理科600分排名5911报考你校有多大希望呢,你好，可以冲一下。
滑档,13***75 (北京),2018-06-27 14:34,2018北京本科一批如果提档分够了，服从调剂，回滑档吗？,您好，提档后服从调剂，不再退档
广东文科一批，录取概率大吗？,13***44 (广东),2018-06-27 13:25,老师，您好！我是广东文科考生，609分，排名1677，报考贵校新闻学，广告学的概率大吗？如果服从调剂，有可能被录取吗？如果在提前批报小语种，入读后转专业的话是否只能在小语种专业里申请转？是否可以申请转到普通一批类或是艺考专业？谢谢！,你好，这个分数有希望被我校录取，但是新闻传播学类专业难度较大。小语种可以申请转出到其他类别专业。
报考,13***46 (贵州),2018-06-27 12:58,请问老师贵州理科考生859分有望报考贵校吗？提档后退档吗？谢谢,859？？提档后服从调剂原则上不退档
山东603文科,15***06 (山东),2018-06-27 12:11,老师您好，请问山东省排名4659文科生能报考贵校哪些专业？,你好，按照历年录取分数看，文科生4659名可能比较难录取，但山东省实行平行志愿，您可以尝试报考
提前批和调剂,13***58 (辽宁),2018-06-27 12:11,你好我是辽宁理科考生分数632位次47901将贵校作为提前批第一志愿有希望录取吗2将贵校作为本科普通批能否被调剂到计算机或软件工程学科谢谢,你好，这个分数可以冲一下。进档后有可能调剂到计算机或软件。
北京考生，文科,13***66 (北京),2018-06-27 11:44,北京考生，文科，661分，想报考广告专业，可以吗？据说这个专业报的人很多,您好，按照往年看，您来我校希望很大。但这个专业能否录取，还要看其他报考学生的成绩，平行志愿建议报考。
咨询,13***44 (青海),2018-06-27 11:12,我是青海考生，想咨询535分（含民族分）、排位1100，报考贵校是否有希望,有希望
广西理科报考,13***71 (广西),2018-06-27 11:08,你好，老师，广西理科592分排名8200名，可以报名贵校吗？,有希望
志愿,13***26 (江西),2018-06-27 11:03,老师好，江西理科592分，有希望吗？,有点困难
录取问题,13***04 (山东),2018-06-27 10:46,分数636，位次5930，可不可报考本校的计算机类专业？,您好：按照历年录取分数看，这个分数很有希望报考该专业，但还是要看今年报考该专业的学生情况
录取线,13***22 (河南),2018-06-24 09:57,您好老师，我校今年在河南省文科预估录取分数多少？文科610分报考网络与新媒体专业有希望吗？谢谢您,你好，请参考我校前几年在河南省录取的分数线以及排名来进行志愿填报。
新闻学数据新闻报道专业,13***07 (山东),2018-06-24 09:50,请问该专业国内有研究生专业吗？如果没有，考研有哪几个方向，如果没有本专业的研究生，那么这个专业能有保研资格吗,该专业有保研资格，相关新闻传播学研究生，您都可以报考。非常欢迎您报考我校~
招生章程疑问，录取咨询 [贵州文科考生】,13***62 (贵州),2018-06-24 09:31,请问贵校在《招生章程》中对于录取规则中的描述：“学校在提档时，原则上承认省级招办报教育部备案的全国性加分项目，但录取时以实际高考成绩（不含任何加分）”，是指：1.在提档时按照实考分提档2.按总分（含政策加分）提档后安排专业时按实考分当前本人文科少数民族加分后省排名407，有志于报考贵校，不知是否能有较大把握被贵校录取。谢谢！,1.学校在提档时，原则上承认省级招办报教育部备案的全国性加分项目。2.有
录取位次,13***08 (辽宁),2018-06-23 16:45,请问辽宁省考生一般可以录取到多少位次？,3200名吧
志愿填报2018,13***07 (北京),2018-06-23 16:22,艺考只有一个校考合格证，是否需要服从院内专业调剂？,选上吧，虽然也只能录到有合格证的专业
滑档,35***@qq.com (安徽),2018-06-23 16:05,2018美术生专科如果提档分够了，服从调剂，体检合格，会滑档吗？,你好，我校艺术类高职将按照分配的分省计划进行录取，超出计划数的投档考生，按照录取规则有存在退档可能。
北京646,13***00 (北京),2018-06-23 15:40,您好，我是北京文科生，646分，830名，能够报考贵校吗？,能
投档进中传后被退档的可能性大吗？,18***22 (云南),2018-06-23 12:34,想问如果被投档进了中传，选了专业服从调剂还有可能被退档吗？按105%投档的话剩下没被录取的5%是不是都会被退档？还是被投档但未被录取的考生会直接被预留计划录取,服从调剂原则上不退档
中传媒双培问题,13***23 (北京),2018-06-23 10:11,我准备报北京二外双培计划，问一下互联网电视是放在哪个学院培养，插班吗，培养的方向是什么？,请咨询二外
关于提前批专业,13***20 (山西),2018-06-22 12:58,请问中传提前批往年分数是多少？大概超一本线多少分？山西考生,16年线上34，17年线上45分
关于贵校本科一批B段招生问题,13***33 (黑龙江),2018-06-22 11:30,请问贵校本科一批B段招生的毕业证和A段完全一样么？毕业证代码是否一样？,除了专业名称为“传播学（中外合作办学）”外都一样
关于数字传媒技术专业,ma***26.com (北京),2018-06-22 10:32,1.贵校数字传媒技术专业在全国的实力、大体排名情况。例如，跟浙江大学、湖南大学、江南大学、华中科技大学相似专业比，有何优劣势？2.该专业毕业生近几年的去向分布如何？近5年留学卡内基梅隆大学的毕业生有多少人？,你好！1、我校理工类专业培养主要面向于传媒行业，毕业生中80%以上进入传媒领域从事技术等相关工作。2、就业及升学情况请查阅http://jy.cuc.edu.cn/pub/ebook/index.html#p=1，里面有详细的数据统计。
关于转专业,ch***u (福建),2017-06-28 16:33,中传转专业的具体情况是什么样的，特别是不同院系间的转专业可以吗？有什么要求吗？,艺术类不能转普通类，国家专项不能转专业
中外合作办学的专业和普通一表的相同专业有什么区别,ro*** (黑龙江),2017-06-28 15:35,例如，一表传播，和中外传播。能否给个链接。,培养方案不同
全省排名1502名。报考贵校哪些专业比较有希望？,xu***017 (山西),2017-06-28 15:21,全省排名1502名。报考贵校哪些专业比较有希望？,只能冲一下试试
老师您好，我是山西文科考生,xu***017 (山西),2017-06-28 15:18,全省排名1502名。报考贵校哪些专业比较有希望？,只能冲一下试试
江苏文科,wo***keai666 (江苏),2017-06-28 14:02,请问江苏文科376aa+（814名）有把握录取吗？,有希望，你报一下冲冲
退档咨询,ha*** (辽宁),2017-06-28 13:27,报考贵校，服从调剂，但入取满额了，有退档风险没？提档比例105%，都服从调剂，多提的5%怎么处理？谢谢！,服从调剂，符合教育部的体检要求，不退档。多余的计划学校会给省里追加
河南考生,fi***g (河南),2017-06-28 12:51,河南考生2017高考理科578分，报考贵校请问有希望录取吗？,有希望
服从调剂会不会滑档,ji***ua (青海),2017-06-28 12:16,青海理科高考高一本125分，全省排名1080，报考贵校，服从调剂后会不会滑档？,服从调剂，符合教育部的体检要求就不会退档
志愿填报咨询,kf***yu (广东),2017-06-28 12:13,老师您好，我是广东考生，理科，高考成绩578分，排名8841，请问报中传有把握么？愿意服从调剂。,可以冲一下，建议在第一志愿报考
咨询专业,ma*** (江西),2017-06-28 11:36,请问贵校的公共关系专业有什么优势呢？还有汉语言专业的情况？谢谢老师解答！,[通过几年的发展，公共关系专业已经建成了比较完整的课程体系，该课程体系建设参照了国内外一流大学的同类专业的课程体系，具备了国内领先水平。本科教学层面，课程体系注重循序渐进，培养学生的综合素质和专业能力：一年级学生重在人文社会科学方面课程的学习；二年级学生重在专业基础课程的学习；进入三年级后，我系为学生开设了大量的专业课程；三年级下半年开始引入部分研讨选修课程。四年级的学生以研讨选修课程为主。学生可以根据自己的兴趣选择研究的侧重点，同时选择另外方向的课程作为兼修。这种方法是为了帮助学生建立自己的知识、提高实际思考问题、分析问题和解决问题的能力；四年级下半学期，学生以实习和毕业论文为主要学习任务。我系为每个学生的毕业论文写作配备指导老师。在教学实践中，我们汲取我院广告系与艺术设计系的经验，同时参考在评教活动的学生反馈意见，近年开始逐步尝试一种新的教学思路——围绕“核心课程”展开教学。核心课程是指学科建设中逐渐形成，并且努力扶植培养的，帮助建构学生专业知识体系的、有学科特色的重要课程。我专业以核心课程带动多门专业课；以核心课程，使一批年轻教师、骨干教师形成合力；以核心课程创造一个平台，使学生的理论修养和实战能力得到一个锻炼、展示的机会。公关专业以核心课程带动多门专业课；以核心课程，使一批年轻教师、骨干教师形成合力；以核心课程创造一个平台，使学生的理论修养和实战能力得到一个锻炼、展示的机会。
贵州省313理科考生在贵校的专科中可报哪些专业？,sh***ushi (贵州),2017-06-28 11:28,请问一下，贵州省313理科考生在贵校的专科中可报哪些专业？,我校在贵州没有高职招生计划
填报志愿,fj***70101 (福建),2017-06-28 11:26,福建理科考生，分数558，在省排名4505。填报提前批日语有把握吗？,可以试一下
学费之外的费用,do*** (福建),2017-06-28 11:22,老师好！广院的专业让人如此“活泼”，那除了学费之外学校有没有很多活动费用？,我不太理解你的问题
山西考生咨询,yz*** (山西),2017-06-28 10:57,老师您好！我是太原考生（女），高出一本线46分，想报考贵校中外合作文化产业管理或传播学，有多大把握能录取，谢谢你的回答。,可以试试。
黑龙江考生，587文科，排名419，报考贵校有希望吗？,ro*** (黑龙江),2017-06-28 10:12,如有希望吗，适合哪个专业的分数,可以冲一下，把我校放在第一个。同时建议报考我校的中外合作办学专业
提前批问题,ak***s (山东),2017-06-28 09:09,你好，请问提前批小语种，进校后还有机会调整专业么？谢谢！,可以
湖北女生咨询专业排序,ss*** (湖北),2017-06-28 09:02,您好！我是湖北理科女生考生，分数585，排名9818，请问有没有希望进贵校？如果能进，我对广告、新闻很感兴趣，我的暂定排序为广告、新闻、数字媒体、自动化、通信工程，烦请您在综合考虑专业极差和我的水平后给些建议，真挚感谢！,你得分数有可能被我校录取，建议你将我校报在平行志愿的第一个
中外合作办学,be***yh (山东),2017-06-27 16:20,中外合作的毕业证上带有“中外”字样吗？还是和普通招生的学生颁发一样的毕业证书？本科毕业考国内研究生和普通本科生一样吗？,有中外合作字样，考研在我校没有影响
提前批 小语种 河南理科,15***32 (河南),2018-06-25 11:47,请问报中传的提前批小语种有什么限制？河南理科571有录取的可能吗？,我校外语类专业只招英语语种的考生。报考我校外语类的考生如所在省级招办组织外语口试，考生须参加口试且成绩合格，同时高考英语成绩须达到满分的70%（含）以上。你的成绩有希望被录取的。
山西考生 提前批,13***19 (山西),2018-06-25 11:19,老师您好，请问报考贵校提前批若不符合条件被贵校调剂的话是在什么范围内调剂？是不是仅限于本批次的专业？还是在贵校所有专业里调剂？,你好，专业调剂范围是在贵省当前批次今年有计划的招生专业之间进行调剂。
北京考生 广播电视学专业 可以吗,13***61 (北京),2018-06-25 10:34,北京考生，理科，644分，想报考广播电视学专业，可以吗？据说这个专业报的人很多,你好，欢迎报考中国传媒大学。你的成绩报考传媒大学有较大把握能够进档，广播电视学属于我校优质学科，也是国家重点建设的一流学科，录取分数上会叫高一些。建议选择专业服从调剂。
江西理科,18***67 (江西),2018-06-25 10:12,江西理科608，省排名7066，进贵校行吗？,一志愿冲一冲有希望
山东文科考生,13***19 (山东),2018-06-25 09:09,你好，问一下山东文科考生610分，位次3421，报考贵校有希望吗？,你好，按照历年录取情况看，这个分数有一定困难，但平时志愿欢迎报考
安徽提前批去年分数线是多少（小语种）,13***76 (安徽),2018-06-24 17:00,安徽提前批去年分数线是多少（小语种）,你好，录取分数请详见：http://zhaosheng.cuc.edu.cn/zs/Inquiry/ScoreDetail.aspx
山东文科,15***59 (山东),2018-06-24 16:48,老师你好，山东文科619，位次2169想报考贵校可能性大吗？,你好，按照历年录取分数看，有一定困难，但同样欢迎您报考
山东文科,15***59 (山东),2018-06-24 16:47,老师你好，山东文科619，位次2169想报考贵校可能性大吗？,你好，按照往年录取情况看，有一定困难，但同样欢迎报考
理科,13***77 (甘肃),2018-06-24 15:23,你好。甘肃理科成绩597，位次3140。填报贵校录取概率多少,比较有希望
2018最低投档线是多少,17***95 (陕西),2018-06-24 15:13,陕西601分报考能录上吗,够呛
录取情况咨询,18***28 (北京),2018-06-24 15:03,我们是北京文科考生，高考成绩是657，孩子非常想报考贵校，有可能被录取吗？,你好，录取可能性较大，欢迎报考
有关民族加分政策和中外合作办学,17***15 (贵州),2018-06-24 12:36,请问报考贵校中外合作办学的专业也必须要求实考分上一本线还是可以加上民族加分呢？,实考分
报考咨询,15***11 (浙江),2018-06-24 11:51,浙江考生648位次7422有希望被贵校录取吗？,你好，有望被录取，欢迎报考
想报考贵校的文化产业管理或新闻学,13***31 (上海),2018-06-24 11:20,老师您好！我是上海考生，分数544，全市排名5832，很喜欢贵校，想报考999科目的文化产业管理或者新闻学，请问有希望吗？谢谢,你好，有希望被录取，请勾选专业志愿服从调剂。
