标题,来源,时间,问题,回答
录取,03*** (湖南),2012-06-28 12:05,我是今年湖南理科考生高考成绩562高出一本线42分请问报考贵校的电气工程及其自动化（去年平均分为595）有希望吗？,有把握，希望非常大！
录取问题,qf*** (山东),2012-06-28 12:04,老师，您好，我是今年山东的一名文科生，高考620，想报考贵校经济学专业，可以吗？,8成把握
录取咨询,18***9 (山东),2012-06-28 11:42,尊敬的老师，我是今年山东的理科考生，考了630，请问被贵校录取的概率有多大，中等专业呢，需要服从调剂吗，请详细解答，谢谢,8成把握吧，好好报志愿，选取中等偏上专业都是可以的，还是服从调剂的好。当然，尽量好好报志愿，争取第一个专业就走了。欢迎报考！
来自江苏,al***g (江苏),2012-06-28 11:41,江苏353上贵校的可能性有多大，A+A是否加分,理科高出当地重点线2-5分，就有希望只要是国家或者是当地招生办承认的加分政策，我们就承认。A+A好像不属于其中，您再和当地招生办确认一下！
志愿咨询,ml*** (山东),2012-06-28 11:24,不同批次分数优先，同一批次志愿优先在山东本科一批的第一志愿和平行志愿间还通用吗？如果不通用在中国石油大学又是怎么样录取的？,我们学校是志愿优先，专业优先，专业之间有级差，第一和第二专业之间差3分，第二和第三专业之间差2分，好好报志愿！
山西理科考生,zh*** (山西),2012-06-28 11:12,今年高考超一本线12分，请问报考贵校有多大希望？如可以什么专业较适合？期待您的答复。,看你们投档人数吧，如果投档人数少，还是有希望的，一半把握。专业不做推荐，根据分数和兴趣自己选择！
录取,40*** (福建),2012-06-28 11:12,您好，我是福建理科考生，今年考581，超出本一线35分，能报哪些贵校的专业？可能性分别是多大？我个人偏向有关化学一类的专业，还有环境工程和安全工程。,过我校提档线应该没有问题的。专业不做推荐，有7成把握！
报考,xi***8 (山东),2012-06-28 11:10,老师您好··633分上石油大可以吗？可以选择专业吗？,刚超51分，冲石油专业还是有一点小风险的，如果山东孩子投档石油大学石油工程专业人数不多，今年就问题不大！好好报专业吧！
专业,22*** (山东),2012-06-28 11:08,山东理科619分，超一本线37分，贵校工科有什么专业把握较大？,过提档线应该是没有问题的，7成把握能录进来吧，避开专干专业，选择中等专业，还是有希望的！
报考,ng*** (山东),2012-06-28 11:07,文史576能报哪些专业有把握要学校不要专业,文科基本上今年超过20分报考，就有把握一些。选择保底低分专业，专业服从调剂的话，您的分数也是偏低的，很有风险的！
女生适合的专业,xi***8 (山东),2012-06-28 10:56,女生去贵校学什么专业合适？,除了国防生对男女性别有要求以外，别的专业都可以考虑，男女都适合！
专业,22*** (山东),2012-06-28 10:49,能否部分服从专业调剂？如除理学院文学院外服从调剂，山东理科考生619分这样填有把握吗？,过今年提档线问题不大，选取中等专业分数相对低一些的报考、是在所有理科专业计划额范围内调剂，会突破院系的限制，哪个学院未录满，就会安排到哪个专业欢迎报考！
山东考生,qi***587 (山东),2012-06-28 10:47,你好，我是山东理科考生620分，专业调剂，报你们学校，有几分把握，因为机会只有一次，请慎重给说明下，谢谢，顺便问下，早上问的提档线是分差25左右，下午好像到了40分左右，你们是根据什么调整的提档线，起码你们也不知现在投档多少，谢谢,7成多的把握，好好选专业，走进来的概率会很大，不知道您咨询哪位老师，我们提档线是在你们报考结束，我们开始录取的时候，根据你们报考的人数来确定的，现在没有确切的分数！！！预计提档线今年大约25分左右浮动，主要多高多低，全在于你们报考石油大学的比例上。不要着急，慢慢选取专业！
录取,bi***r (河南),2012-06-28 10:45,你好，我是河南理科考生，599分，全省排名7220名，请问报考贵校有望被录取吗？,跟排名没关系，过于重点线大约30分报考把握就有！
咨询,sy*** (山东),2012-06-28 10:42,您好，请问贵校在山东的招生办电话是多少？谢谢,0532-89983085
专业咨询,ml*** (山东),2012-06-28 10:41,我山东理科640，全省10000名左右，报考贵校石油工程或油气储运，不服从调剂有多大把握录取？在第一志愿中录取和在平行志愿中录取有区别吗？,还是有希望的，主要和报考人数有关！7成把握！一志愿未满才会有征集志愿！
广西,35*** (广西),2012-06-28 10:41,请问贵校在专业录取上是裸分录取还是加分后的成绩录取？我的成绩是577+20=597（理科），报考贵校是否有望,承认加分，一加到底，大约超线在5-36分之间！
咨询,la***94 (山东),2012-06-28 10:38,听说贵校有两个校区，能知道哪些专业在东营校区？哪些专业在青岛校区吗？谢谢,都在青岛上学了
录取,77*** (山西),2012-06-28 10:38,我是山西的考生，超一本线31分，能否进入贵校，可选择的专业多吗？,这个成绩可以，可以参考近三年录取分数，选择合适专业。主要填报合理，是会被顺利录取的！
山东考生,qi***587 (山东),2012-06-28 10:34,你好，我是山东理科考生620分，专业调剂，报你们学校，有几分把握，因为机会只有一次，请慎重给说明下，谢谢，请顺便说下你们现在预估的提档线是多少,有6成把握吧，好好报专业吗，概率会大点，提档线没法预估，投档以后才有确切的分数，大约今年得超20多分！
录取咨询,jg*** (山东),2012-06-28 10:34,老师您好：我是山东文科考生过一本分数线32分。请问能否被贵校经济或会计学，财务管理专业录取？谢谢,这些专业历年都要超重点线30分以上，你的成绩应该还是有希望的！
l咨询,j3***95 (山西),2012-06-28 10:33,老师您好，我高考分数564，报考贵校被录取可能性有多大？另外色弱对哪些专业的学习有影响？谢谢,对山西的提档线历年都得高于10-20分以上才有把握，和你们那边投档石油大的人数有关。我校化工类或者勘探类专业可能要对色弱有限制！
自主招生,ib***ic22 (山东),2012-06-28 10:32,尊敬的老师；我是山东理科生考了600分，通过自主招生，能被咱校录取吗？,300名额我们只录取200个自主招生的山东考生，如果投档以后您能挤进200名，就没有问题！
山西考生,ka*** (山西),2012-06-28 10:09,你好，我考了543分比一本线高13分，如果我服从专业调剂会不会被退档？退档的几率有多大？贵校提档比例是多少？,如果所有录取结束，您还是没被我校录取是会被退档的，今年这个分数有点小风险。退档概率很小，提档比例105%，大约有5%会被退档！
报考提档,19*** (河南),2012-06-28 10:03,高考成绩高于河南一本线41分，省内排名14400，报考贵校能提档吗,提档应该没问题
咨询,dy***263 (山东),2012-06-28 10:03,我是山东理科考生，630分，请问报贵校录取几率大吗？选择专业上有优势吗？会不会被退档（专业服从调剂）？,7.8成把握，石油工程等可能高分专业选不上，建议选择中等偏上专业!如果分数不错，被退档的概率是很小的！
油气储运及石油工程,xu*** (山西),2012-06-28 10:00,您好我是山西理科生分数597高出一本线67分报考这两个专业有多大把握？,把握很大很大，放心报考！
新疆,sd***19 (新疆),2012-06-28 09:51,我是新疆应届考生，实考分514分，比一本线高69分，一志愿报考贵校，有把握录取吗？谢谢老师!,把握很大，好好填专业！
山西考生,ka*** (山西),2012-06-28 09:51,你好我是山西考生，我今年考了543分想抱贵校一A专业，不知道能否被录取？如果服从专业会不会被退档。,基本超重点线大约35分以上，就有希望，退档概率非常非常小！
老师辛苦了！,as*** (山东),2012-06-29 09:53,您好，我是山东文科考生，高出一本线32分，问一下有多大把握报考上贵校？另外想咨询一下，文科生大学4年的学习是在黄岛还是在东营校区？谢谢老师！,把握很大的，好好报专业，都在黄岛校区上学。
录取,sx*** (山西),2012-06-29 09:51,山西理科高一本49分有几成把握？,过提档线没有问题，好好选专业了，走进来的概率还是很大的！
河南理科考生！！！,hn*** (河南),2012-06-29 09:49,我是河南理科考生，考了592分，超一本线52分，全省排名9千多，上贵校有几成把握？若被贵校录取，服从了调剂，能上贵校的强势专业，一般专业，还是很差的专业？,"我校对河南考生提档线一般要高于15-25分以上还是有希望的，好好报专业，7,8成把握吧。应该是可以冲击不错的专业的！"
报考 谢谢,h1*** (山东),2012-06-29 09:46,你好，我是山东理科考生，今年高出一本40分，报考贵学校的自动化、通信工程、电气工程、会计专业把握多大？谢谢您。,按照近几年情况来看，会计学和通信工程概率一半以下，自动化和电气工程录取概率一半以上！
咨询,10***10878 (山西),2012-06-29 09:44,我是山西理科考生，高一本19分，若服从调剂能否上贵校？,6成把握吧，好好选专业，概率会大一些！
咨询,za*** (山东),2012-06-29 09:39,山东理科613分服从调剂报软件工程有几成把握,超31分报这个专业还是有6成把握的！
录取,13***0 (山东),2012-06-29 09:38,贵校国防生的基本要求是什么，大致分数段是什么？贵校一本中等专业大致有哪些？大致录取分数为多少?谢谢老师解答,超25分以上，一半把握，超40分以上，就有很大把握了各专业分数，参考网上近三年的录取线，如果历年都比较稳定，不是特别高分，中等专业都是可以选择的！
志愿录取,wx*** (山西),2012-06-29 09:36,老师您好我是山西理科考生，今年考了583高出一本线53分，位次4393.请问报考贵校把握大吗？另外我也想问一下贵校强势专业有哪些？我又可以报哪些？,基本上这个成绩冲击我们学校最好的专业也是有可能的，欢迎报考，祝您成功！
录取,ba***11 (山西),2012-06-29 09:35,您好，我今年高考超一本线8分，请问报考贵校有多大希望？专业选择哪些录取的几率更大呢？,还是有很大风险的，如果你们那边投档我校的人数很少，还是有一些希望的！
恳请老师指点,1p*** (河南),2012-06-29 09:24,我是河南理科考生今年高出一本线46分全省排名12000左右不知可报考贵校否如果可以可报什么专业多谢老师指点,过我校提档线没有问题的，好好选专业，走进来的概率很大！
报考 望速回,da***08 (山东),2012-06-29 09:20,老师您好，我是山东文科考生，今年高考成绩为599，想报考贵校经济学，有把握吗？,一半把握吧，如果今年这个专业报考人数不多，希望会更大一些！
录取,wb*** (山东),2012-06-29 09:16,老师，您好。我是山东理科生，633分，想报考通信工程专业，录取机会大吗，有几成把握？另外，通信工程在贵校定向和石油专业结合的吗？电气类的其他专业有没有把握，有几成把握？,如果今年专业不扎堆的话，7.8成把握吧。有些学科是有结合各交叉的电气类也差不多的！
录取,cy***899 (福建),2012-06-29 09:13,我福建省排名8400能上贵校吗？贵校存在专业极差吗？能转专业的？,对福建考生我们的提档线大约要高于重点线15-30分录取有专业级差，能转专业！
报考,fe*** (山东),2012-06-29 09:10,理科652分，报考贵校石油工程和资源勘查工程专业有无把握,把握非常大，没问题的，放心报考！
退档问题,jh*** (山东),2012-06-29 09:07,老师，您好，贵校是按照110%提档吗，什么情况下退档，是按照分数呢还是按照专业顺序择优录取,基本上是105%到110%之间，一本所有录取程序结束，调剂专业结束以后，还未被录取，很小的一部分是会被退档的。专业优先！
山西考生理科554追问,zh*** (山西),2012-06-27 11:55,能否帮我看下，554能报考什么专业？谢谢,高出一本线40分以上有希望
报专业,13***9 (山东),2012-06-27 11:52,山东理科632分报什么专业最有把握？,一般理工科专业可以参考，热门专业希望不大
国防生,gu***ong (山东),2012-06-27 11:51,老师好，我理科619分，能否报贵校国防生？希望有几成？近三年国防生录取信息怎么获悉？毕业分配去向？谢谢。,希望不大，国防生信息没有统计
录取,zy*** (内蒙古),2012-06-27 11:50,您好，在内蒙古贵校实行“分数清、专业清、分数优先+级差、专业优先+级差”四种的哪种？谢谢！,专业优先+级差
调剂问题,li*** (山东),2012-06-27 11:46,623分若调剂会不会调到特别不理想的专业啊？这个是不是不好说啊~,不好说
提档,ji***94 (山东),2012-06-27 11:46,老师，过了提档线有多大把握会被录取？,不同专业把握不同
专业咨询,li*** (山东),2012-06-27 11:45,老师您好，可不可以推荐一下贵校的中等专业？？,计算机类的，经济类的，土木工程，建筑类的
山西考生554,zh*** (山西),2012-06-27 11:38,山西理科考生，高一本24分能否报考贵校,过我校提档线应该没问题，好好选专业吧！
咨询,ge*** (山东),2012-06-27 11:25,尊敬的老师好，我是山东文科考生，高出山东本科一批20整，请问有希望被录取吗？？,70%的把握吧，好好选专业，把握会更大一些！
咨询,lo*** (福建),2012-06-27 11:23,老师您好。我是福建理工类考生。今年福建本一录取线为546分。我考了579分。报考你们学校的话有机会被录取吗（服从调剂的情况下）？谢谢老师。,超重点线33分，我校提档是没有问题的，好好选专业，把握很大的！
录取咨询,sd*** (山东),2012-06-27 11:22,您好，我是山东理科，636分，高出一本54分，想报贵校油气储运工程，电气工程及其自动化，热能与动力工程请问有多大的把握？,如果今年山东考生投档比例变化不大的话，这个分数走这几个专业还是有把握的！
高考咨询,su*** (山东),2012-06-27 11:06,老师，我是山东考生，高考分数（裸分）632，高出重点线50分，报考石工院石油工程，储建院油气储运，地院资源勘探，化院石油化工希望大吗？哪个希望最大？有几成把握？,这是我们学校四大院，每年分数都很高，。基本上超出50分我们建议报，有希望，有些专业甚至要超出55分录取才有可能，参考近三年的分数，好好报专业吧！
咨询,hl*** (山东),2012-06-27 10:45,627分报考贵校录取的希望有多大，能报的专业有哪些,过提档线没问题，好好报专业，避开分数最高的几个专业，应该问题不大。
专业咨询,li*** (山东),2012-06-27 10:25,老师您好，我是山东一理科生考了623分，全省排名20000左右，想报考贵校，我想知道这个分数可以报考贵校的稍好一些的专业吗？？若服从调剂，录取贵校的几率大吗？？谢谢,跟省里排名没关系，只和报考石油大的山东考生之间有竞争，建议报中等专业，服从调剂，也是按照分数择优录取，如果分数可以，退档概率很小。
咨询,xi***x (湖北),2012-06-27 10:24,您好，我是湖北考生，考了594，上贵校石油工程有希望吗？,如果能超出重点线30分报考还是有希望的
咨询,pp***10 (山东),2012-06-26 14:06,我是山东本地学生，今年高考理科605。如果报考石油大学，录取可能性是否高？,被录取的希望小
咨询,qi*** (山东),2012-06-26 13:55,您好，我是山东文科考生，成绩为605，高一本分数线32分，请问报考贵校是否有把握？谢谢！,有九成以上把握
录取率,zx*** (山东),2012-06-26 13:41,山东考生625分能上么,希望非常大
咨询,xi***o (山东),2012-06-26 13:35,老师您好，山东理科614分不报热门专业，能被录取吗？谢谢老师,希望非常大
录取情况,li***456 (陕西),2012-06-26 13:33,我陕西考生672报考中国石油大学(华东)有可能没,我校对陕西考生历年提档线大约要高于你们那边重点线15-50分，主要根据你们投档情况确定分数。希望给您一些帮助，欢迎报考！
报考咨询,an***s (陕西),2012-06-26 13:32,您好，我是陕西文史类考生，今年成绩571，位次4272.报考贵校会计学，经济学的可能性大吗？,要超出一本线20分以上才有机会。
山东理科 录取几率,ga*** (山东),2012-06-26 13:04,老师好，山东理科生，成绩654，省排名近5000。。。希望报考石油类专业，请问希望大不大。如果不合适，有什么专业较适合这个分数？谢谢老师！,根据往年的录取信息看，这个分数报考石油类专业应该没有问题
录取与专业,we***oxin (山东),2012-06-26 12:48,老师您好，我是山东潍坊的一名理科考生，今年考了615分，高出一本线33分，如果服从调剂的话，被录取有几成把握？如果被录取，在大学期间有转专业的可能吗？,有八九成把握；大一和大二的下学期各有一次转专业的机会
q,71*** (陕西),2012-06-26 12:45,我是陕西理科考生597分上贵校有希望吗？？陕西今年一本分数线517,按照往年的录取成绩分析，你报考我校应该没问题
关于被录取概率以及退档之类的麻烦事,qi***u (山东),2012-06-26 12:39,您好，我是山东考生，今年分数625，能否报考贵校地质学专业？不能的话，能否进入贵校其他专业？,报考地质学专业有八九成的希望
录取几率,11*** (山东),2012-06-26 12:37,我是山东考生，今年分数624，能被贵校石油专业录取几率有多大？谢谢,8成把握。
理科605录取我问题不大吗、去年567分也就是一本线没招满。,lg*** (山东),2012-06-26 12:16,理科605录取我问题不大吗、去年567分也就是一本线没招满。,希望小
咨询,21*** (云南),2012-06-26 12:07,我是云南理科考生，今年考分519，请问能报考贵校？报考什么专业比较保险？,我校对你们云南理科历年的录取线都要高于你们当地重点线25-50分之间的，主要根据你们投档情况来确定分数线。专业自己选，有规定我们负责人不做推荐，给您一些提示，欢迎报考！
老师您好,yc*** (河南),2012-06-26 12:07,我是河南理科考生，总分597，超一本线57分，排名7800多，名次较低，如果报考贵校被录取的可能性大么？如果能录取好的专业有可能么？,我校对河南理科录取的重点线一般要高于你们当地重点线10-30多分，像你的分数，属于中等偏上，好好报专业，把握非常大，祝您成功！
咨询,zy*** (河北),2012-06-26 11:45,我是河北考生，分数607，想报考贵校建筑学，能录取吗？报考竞争激烈吗？填志愿，填专业时填到1志愿和2志愿的录取概率会有多大区别,河北那边一般高于重点线30分是我校的提档线，历年比较稳定，如果今年投档比例变化不大的话，也是大约在30分左右浮动。您可以参考一下。志愿之间有级差，一二专业间差3分，尽量一专业就报的稳妥点，再降3分很容易失去竞争优势。
录取几率,wf*** (河南),2012-06-26 11:40,我是河南文科考生，高一本线27分，有录取把握吗?,我校历年提档线都比你们当地重点线高10-30分，像您的分数，第一志愿报考我们学校，如果提档线今年不是很高的话，还是有希望的。欢迎报考，祝您成功！
录取问题,wo***03 (河南),2012-06-26 11:33,河南理科过一本线33分被录取可能性大吗？,今年过我校提档线应该问题不大，好好报专业，祝您成功！
录取的可能性大么,al*** (河南),2012-06-26 11:31,河南理科考生高一本线32分，服从专业调剂，全省排名19600名左右，录取的可能性大么？,和你们省的排名没有关系，您主要和投档我们学校的河南考生有竞争。超32分，过提档线应该问题不大，好好报专业，祝您成功！
咨询,wp*** (安徽),2012-06-26 11:05,老师你好！我是安徽理科考生高出一本线20分，报考贵校是否有机会录取，如果能录取那报志愿的时候有什么要注意的事项，谢谢！,您好，百分之五十的可能吧，比较有风险！
专业,za*** (河北),2012-06-26 11:04,石油工程是做什么的啊？就业前景是什么？,石油工程要求能掌握石油工程基本技能，能在石油工程领域从事设计，开发和管理研究工作。全国排名第一，就业率每年都高于95%。
咨询,za*** (河北),2012-06-26 11:03,请问老师卓越计划专业是在本一批录取吗？有哪几个，书上怎么没标注？,"您好。首先，卓越计划的第一步是先以本一批进入我校。然后，在勘查技术与工程，化学工程与工艺，石油工程，机械设计制造及其自动化等4个专业进行试点，实行""3+1""校企联合，双师指导。，3年在校薛本科，累计一年在企业进行实习实践和毕业设计！"
321,gu***ong (山东),2012-06-26 11:01,老师好，我理科619分，报贵校有希望吗？服从调剂。,今来说这个分数有点危险，好好报志愿吧，服从调剂录进来的概率会大一些，祝您成功！
工业设计,mo*** (山东),2012-06-26 10:57,请问工业设计必须要有一定的美术功底吗,不需要，欢迎报考！
咨询,wa*** (山东),2012-06-26 10:56,我是山东考生，考了647.较喜欢石油专业。报考贵校石油专业有把握吗,石油专业一般超55分报考比较有希望，您的分数基本来说，问题不大。祝您成功！
咨询,xc*** (山东),2012-06-26 10:54,山东理工考生617分报考贵校有希望吗？谢谢！,希望很大
咨询,ls*** (山东),2012-06-26 10:52,老师您好，山东理科615分报考贵校哪个专业的国防生录取机会大？谢谢,四个专业的机会都很大
2012高考咨询,sc***2 (山东),2012-06-26 10:48,我是山东理科考生。613分，超山东省一本线31分。能报你校么？,可以报考，希望很大
咨询,ca*** (山东),2012-06-26 10:47,山东理科考生657分能上贵校的石油工程拔尖班？谢谢,拔尖班进校后进行选拔，你的成绩很好，希望非常大
录取,qi***ao (陕西),2012-06-26 10:44,我是陕西一理科生，请问623分能否上贵校？能否报热门专业？,我校对陕西理科录取历年提档线要高于你们当地大约18-52分之间，主要和你们投档人数有关系。建议您根据历年热门专业录取线，好好报专业！
111,sd***56 (山东),2012-06-26 10:41,老师你好，我是山东的考生，今年考了609分，想报考贵校的土木工程专业，有希望被录取吗,有希望
咨询,sd***56 (山东),2012-06-26 16:30,老师您好，山东理科609分报土木工程专业，能被录取吗？谢谢老师,有希望
录取,li*** (山东),2012-06-26 16:28,593报考贵校有戏吗,希望较小
录取咨询,59*** (山东),2012-06-26 16:27,老师您好，我是山东考生。成绩为596，高出一本线23分。排名大致4761。报考贵校有多大把握？谢谢。,有九成把握
咨询,18*** (山东),2012-06-26 16:22,老师您好，请问605分报考贵校有没有希望？有多大的把握？,希望小
河北文科录取,hs*** (河北),2012-06-26 16:21,请问河北文科592分（超一本20分）能被录取吗,我校对你们河北文科的录取线一般要高于你们当地文科重点线15-25分之间，才有希望，如果超20分应该是有65%的可能吧，好好报志愿，您可以参考一下，欢迎报考！
报考,li*** (河北),2012-06-26 16:04,我是河北理工考生，高考成绩597，请问一下报贵校哪个专业录取几率较高,报非热门专业，专业服从调剂。
咨询,12*** (山东),2012-06-26 15:23,您好，我去年报考贵校时专业被调剂，没去报到，请问今年641分报考贵校石油类专业是否有希望？,希望非常大，录取概率达到九成以上
录取把握,ga***n (山东),2012-06-26 15:23,老师你好！我是2012年山东理工类考生，高考成绩为623分，请问报考贵校的把握多大？谢谢老师！,九成以上
咨询,ha*** (湖南),2012-06-26 15:20,您好，我是一名湖南的理科考生，成绩高一本线19分，请问报贵校的几率有多大？能的话，专业要注意什么吗？谢谢。。,被录取的希望很大，请选择非热门专业
录取,wa***eng (河南),2012-06-26 15:15,请问，我是河南考生今年成绩高出一本线44分能上贵校吗？如果能上能上什么专业？谢谢。,有8成希望。报非热门专业。
咨询,12*** (山东),2012-06-26 15:14,我是山东考生，请问641分报考贵校石油工程或油气储运工程专业希望大不大？谢谢,希望非常大
