标题,来源,时间,问题,回答
老师您辛苦了~,ei*** (云南),2006-06-26 14:32,我理609，还不知道云南重点线，我该怎么办?报考贵校有希望么?,您好！贵省的重点分数线还没有公布，请您耐心等待。祝您暑假愉快！
副噶,li*** (山东),2006-06-26 14:26,604分能不能报考山东省的一批本科,您好！请您指明问题！祝您暑假愉快！
你好,ca*** (江苏),2006-06-26 14:21,我是江苏一考生，600分在平行志愿B填报贵校有希望吗？,您好！您的分数超过贵省重点分数线28分，还是很有把握被我校录取的。我校在一志愿录取不足的情况下才会招收二志愿考生。欢迎报考我校！
549分能否录取,yt*** (湖北),2006-06-26 14:19,您好，我是湖北的一名文科考生，549分，请问报考贵校能否被录取,您好！您的分数超过贵省文科重点分数线4分，还是有一定把握被我校录取的。欢迎报考我校！
你好，老师,ca*** (江苏),2006-06-26 14:18,我是江苏一考生，600分在平行志愿C填报贵校有希望吗？,您好！您的分数超过贵省重点分数线28分，如果填报一志愿还是很有希望被我校录取的，我校只有在第一志愿考生录取不满的情况下才会考虑第二志愿和第三志愿考生的录取。祝您暑假愉快！
山东自己人,wh*** (山东),2006-06-26 14:09,招生咨询会上领贵校统计表填好，有什么优惠政策？,您好！若您填好了我校的统计表，当您的成绩达到我校2006年省一批本科调档分数线者，同等情况下可被优先录取。我校没有其他优惠政策。欢迎报考我校！
自己人，在招生会上写了资料的,wh*** (山东),2006-06-26 14:07,603高重本20，可以上吗？可以上什么专业,您好！您的分数超过重点分数线20分，还是比较有把握被我校录取的。若您填好了我校的统计表，当您的成绩达到我校2006年省一批本科调档分数线者，同等情况下可被优先录取。我校没有其他优惠政策。欢迎报考我校！
山东,ch*** (山东),2006-06-26 14:05,山东理科考生589分，请问报考有没有希望?哪些专业希望比较大?,您好！您的分数超过山东重点分数线6分，被我校录取的希望不大，建议您避免报考我校热门专业和优势专业。欢迎报考我校！
我是体育考生,ko*** (山东),2006-06-26 14:02,我是临沂体育考生，文化科491，体育分76.3能否报考贵校？,您好！我校招收国家一级运动员，面向山东省招收二级运动员，录取时考生文化课成绩达到山东省给我校划定的分数线后按专业成绩排名择优录取。欢迎报考我校！
急问?,ha*** (内蒙古),2006-06-26 13:58,老师：　　您好！内蒙古理科一本线５５７，我能否被录取？内蒙考生５８０分能否被录取？下午交志愿了,您好！您的成绩超过重点分数线23分，还是有一定把握被我校录取的。建议您在报考时避免集中报考我校优势专业和热门专业。欢迎报考我校！
山东理科598能否被贵校录取?,ts*** (山东),2006-06-26 13:58,前三年的最低录取分数线是多少?请告知.,您好！关于我校的最低录取分数线的情况请登陆我校招生网站http://zhaosheng.hdpu.edu.cn查询。祝您暑假愉快！
你好,si*** (山东),2006-06-25 15:56,我是山东理科考生，山东一本线583分，我是608分报贵校电气信息类或工商管理类专业录取率有八九成的希望吗？,您好！您的分数超出山东重点分数线25分，电气信息类是我校热门专业，报考这些专业还是比较有希望的，但是因为还没有开始录取，具体情况还不好说。欢迎报考我校！
专业分数,bk*** (河北),2006-06-25 15:49,请问贵校的重点专业有哪些分数高出一本多吗,您好！我校的重点专业为勘察技术与工程、石油工程、化学工程与工艺、油气储运工程。重点学科专业录取分数一般在我校录取平均分左右及以上。欢迎报考我校！
谢谢老师,bk*** (河北),2006-06-25 15:47,请问贵校重点专业是有那些分数如何,您好！我校的重点专业为勘察技术与工程、石油工程、化学工程与工艺、油气储运工程。重点专业的录取分数线一般都在我校录取的平均分数线左右或以上。欢迎报考我校！
请问,sd*** (山东),2006-06-25 15:42,今年山东省的文科一本录取重点线为568分，我考了589分，请问贵校：在山东省招收文科一本分数是多少？可否报考，能否录取，什么专业合适？把握有多大？二本有无计划，有多少？谢谢！,您好！您的分数超过文科重点分数线21分，还是比较有把握被我校录取的。因为今年的招生工作还没有开始，招生分数线还不清楚。我校不招收二本考生。欢迎报考我校！
sos,fe***87 (辽宁),2006-06-25 15:42,你好，今年咨询贵校能否被入取的考生多吗,您好！比较多。祝您暑假愉快！
592能否录取,52*** (江苏),2006-06-25 15:41,我是江苏考生，分数587+5=592。B志愿能否录取,您好！您的分数超过江苏重点分数线20分，还是比较有把握被我校录取的。今年我校的一志愿录取率还是比较高的，二志愿的录取的可能性比较小。欢迎报考我校！
咨询--感谢,ha***365 (山东),2006-06-25 15:34,我今年高考分数是544分，报考贵校的专科有没有希望，专科的专业有那些，有专升本的专业吗？？？,您好！专科的情况请咨询中国石油大学胜利学院，电话0546-7396777、7396999。祝您暑假愉快！
老师好,qi***an (山东),2006-06-25 15:30,山东，640（理科），报考热门专业行吗？推荐一下好吗？,您好！您的分数高出重点分数线57分，还是比较有希望被我校录取的。我校的热门专业有勘察技术与工程、石油工程、化学工程与工艺、自动化、电子信息工程、电气工程及其自动化、计算机科学与技术、软件工程、通信工程、油气储运工程10个热门专业。欢迎报考我校！
咨询专业,86*** (浙江),2006-06-25 15:29,浙江理科考生分数为584，具体哪些专业录取希望较大?,您好！您的分数高出浙江理科重点分数线14分，还是有一定把握的，建议您在报考时避免同时报考我校热门专业。欢迎报考我校！
120,iu*** (四川),2006-06-25 15:25,四川理611加分20即630左右重本线560想读机械制造及自动化或相关专业？有希望否？特想知道加分政策！！,您好！您的分数高出四川重点分数线70分左右。我校按照各省市的加分政策执行。您可以报考我校机械制造及自动化或相关专业，还是比较有希望被我校录取的。欢迎报考我校！
sos,fe***87 (辽宁),2006-06-25 15:25,你好，我是一名内蒙理科考生，今年考了585，一本线是557，请问，报考贵校有希望吗，有多大希望啊,您好！您的分数高出内蒙古重点分数线28分，报考我校还是比较有希望的。欢迎报考我校！
山东理科考生,sd*** (山东),2006-06-25 15:18,测绘工程、环境工程在贵校是热门专业吗？山东理科高出重点线25分可以报考以上两个专业吗？,您好！测绘工程和环境工程不是我校热门专业。您可以报考这两个专业，还是比较有希望被我校录取的。欢迎报考我校！
山东理科考生,sd*** (山东),2006-06-25 15:17,测绘工程、环境工程在贵校是热门专业吗？山东理科高出重点线25分可以报考以上两个专业吗？,您好！测绘工程和环境工程不是我校热门专业。您可以报考这两个专业，还是比较有希望被我校录取的。欢迎报考我校！
山东理科考生,sd*** (山东),2006-06-25 15:17,测绘工程、环境工程在贵校是热门专业吗？山东理科高出重点线25分可以报考以上两个专业吗？,您好！测绘工程和环境工程不是我校热门专业。您可以报考这两个专业，还是比较有希望被我校录取的。欢迎报考我校！
请问,we***6 (山东),2006-06-25 15:11,603分有无把握报考,您好！您的分数高出山东省理科重点分数线20分，还是有较大把握被我校录取的，建议您不要集中报考我校热门专业。欢迎报考我校！
咨询,po***14 (山东),2006-06-26 09:13,老师您好！我是山东理科考生成绩６０９报考贵校的材料科学与工程专业是否有把握？如果专业服从调剂能否录取？服从调剂的话，专业是随机分配的吗？谢谢！,有希望，如果很希望进入我校学习，建议专业服从调剂。服从调剂的话，一般按照考生报考的专业，尽可能调剂到相近专业。
山东考生,bu*** (山东),2006-06-26 09:13,老师你好，我是潍坊地区的考生，高考分数是517分，请问报考贵校的一专被录取希望有多大？谢谢解答,请咨询胜利学院05467396777
我是浙江理科考生 我572 多出一批线2分 第一志愿能被入取的机会大吗？有什么专业好选？,ni***g (浙江),2006-06-26 09:09,我是浙江理科考生我572多出一批线2分第一志愿能被入取的机会大吗？有什么专业好选？,不是很大，建议避开热门专业报考。
四川考生  593能上贵校吗,la***ng520 (四川),2006-06-26 09:09,各专业的往年分数是多少,一般来讲热门专业录取分数相对高一些，建议报考时不要集中报考热门专业。
请问一下~,10*** (江苏),2006-06-26 09:08,我是江苏考生，这次分数是606，能否报考贵校油气储运专业?另外，该专业历年的分数线是多少?退挡率是多少?女生报考该专业是否合适?最后，贵校的住宿条件如何?公寓是否有热水器和空调?是否有网络连线口?,有希望，建议不要集中报考我校热门专业。学生公寓6个人一个房间，没有热水器和空调，电话，网络进入寝室。欢迎报考！
xiexie,li***g800 (河北),2006-06-26 09:08,您好，621（一本577）全省3070名，要是服从调剂，进入贵校有几成把握？,很有把握!欢迎报考！祝您暑假愉快！
请问,fr***ry (山东),2006-06-26 09:06,我是山东考生，今年考了591，报考贵校有无希望。什么专业有可能被录取！！,希望不大。
报考（急）,wa***0513 (河北),2006-06-26 09:04,老师您好:我是河北考生，分数６２８分，超我省本一线５７７分５１分，省排名１８１９，若第一志愿报考贵校，被录取的希望多大？专业可以任选吗？,把握很大。可报考我校优势专业，为稳妥起见，建议优势专业不要集中报考。欢迎高分考生报考我校！祝您暑假愉快！
专业,12*** (山东),2006-06-25 16:58,我高考在山东考了592分，请您推荐一下比较有把握录取的冷门专业，谢谢!,您好！您的分数超过重点分数线9分，我校的热门专业有勘察技术与工程、石油工程、化学工程与工艺、自动化、电子信息工程、电气工程及其自动化、计算机科学与技术、软件工程、通信工程、油气储运工程10个热门专业，其他专业录取分数都差不多。欢迎报考我校！
山东理科,sp*** (山东),2006-06-25 16:44,请问我600分报考贵校有多大希望？,æ¨å¥½ï¼æ¨çåæ°è¶è¿éç¹åæ°çº¿17åï¼è¿æ¯æ¯è¾æå¸æè¢«ææ¡å½åçãæ¬¢è¿æ¥èææ¡ï¼
咨询(河北),he***i (河北),2006-06-25 16:40,老师您好:我是河北考生，请问，贵校承认少数民族照顾分数吗??590加5分少数民族分数报考贵校化工工程与工艺专业风险大吗?河北一本分是577,您好！我校承认贵省招生办的加分政策。您的分数超过贵省重点分数线18分，还是比较有希望被我校录取的，建议您避免集中报考我校热门专业。欢迎报考我校！
河北 理科599,ta***lang (河北),2006-06-25 16:36,报考贵校风险多大?如有可能，报考什么专业比较保险,您好！您的分数超过重点分数线22分，还是比较有把握被我校录取的，但是具体风险因为招生录取工作还没有开始，还不好说。建议您在报考时避免集中报考热门专业。欢迎报考我校！
问,mi*** (山东),2006-06-25 16:21,我是山东理科考生594分报考贵校能否被录取,您好！您的分数超过山东重点分数线11分，还是有希望被我校录取的。欢迎报考我校！
咨询,pe***ao (山东),2006-06-25 16:15,老师，您好。我是一名山东理科的考生。今年我的高考分数为626分，想报考贵校的化学工程与工艺专业。请问我的分数是否有希望？谢谢！,您好！您的分数超过重点分数线43分，还是比较有把握被我校录取的。欢迎报考我校！
广西理科,xi***aonian (广西),2006-06-25 16:03,老师你好我是广西理科考生我今年是561+20（照顾分），广西今年高考重点线是538，请问老师我想报考贵校的电器信息类把握大吗？谢谢！,您好！您的分数超出广西重点分数线43分，还是比较有把握被我校录取的，建议您在填报志愿时避免同时报考我校热门专业。欢迎报考我校！
关于专业调剂,co***006 (内蒙古),2006-06-24 16:58,请问贵校调剂情况，如果不写专业服从调剂，报了六个专业，第一专业没被录取，那么可能被剩下的几个专业录取么？,您好！一般来讲，如果您报考的前三个专业都没有被录取的话，后面的专业基本上就是调剂的了，不再降分。欢迎报考我校！祝您马到成功！祝您暑假愉快！
关于专业调剂,co***006 (内蒙古),2006-06-24 16:54,老师您好：请问贵校专业级差是5分，假如一个考生前五个专业都没被录取，到第六个专业要讲多少分呢？是否要降25分？,您好！一般来讲，如果您报考的前三个专业都没有被录取的话，后面的专业基本上就是调剂的了，不再降分。欢迎报考我校！祝您马到成功！祝您暑假愉快！
请问老师,ch***8 (浙江),2006-06-24 16:51,电气信息类读出近几年就业如何？　另如果毕业回浙江工作是否合适？　谢谢老师,您好！电气信息类就业率还比较高，一般在90％以上。现在毕业生就业实行双向选择，毕业生可根据自己意愿回浙江工作。欢迎报考我校！祝您马到成功！祝您暑假愉快！
浙江,ml*** (浙江),2006-06-24 16:51,浙江理科581分高出重点线11分，报考被录取可能性大吗？服从调配。二志愿报考请况如何？,您好！您的高考成绩高出重点线10分以上比较有希望被我校录取。我校在第一志愿考生生源不足的情况下接收非第一志愿的考生，近几年我校在浙江录取的考生基本上都是第一志愿的考生，鉴于您的高考成绩没有太大的优势，建议您第一志愿报考我校！欢迎报考我校！祝您马到成功！祝您暑假愉快！
一本线,pa*** (山东),2006-06-24 16:49,山东理科重点线为多少?,您好！山东省的理科重点线在25日前公布。欢迎报考我校！祝您马到成功！祝您暑假愉快！
咨询,34*** (四川),2006-06-24 16:45,请问实习在哪里?油气储运工程将来可以在石油单位工作吗?,您好！我校共有90多个实习基地，有校内的，也有校外的固定实习基地。油气储运工程专业的毕业生多在石油相关单位工作。欢迎报考我校！祝您马到成功！祝您暑假愉快！
老师好,ch***8 (浙江),2006-06-24 16:40,请问老师浙江理科５９９分报考电气信息类能否进？　另电气信息类内含电子信息，自动化等，入学后是都学还是学一样？　　谢谢,您好！比较有希望。但是电气信息类是我校热门专业，一般来讲录取分数相对较高，在重点线20分以上比较有希望。入学后先学基础课，进入高年级后进行专业分流。欢迎报考我校！祝您马到成功！祝您暑假愉快！
hebei,la***0 (河北),2006-06-24 16:38,河北一本577，591分报贵校如何?,您好！比较有希望。建议热门专业不要集中报考。欢迎报考我校！祝您马到成功！祝您暑假愉快！
咨询,zh*** (内蒙古),2006-06-24 16:31,我是内蒙古考生，考了589分，重本线是557，请问我报考贵校希望多大？有级差吗？,您好！建议您参照我校往年在贵省的录取分数及贵省重点线报考，如果您的高考成绩比重点线高出20分以上，可报考我校热门专业，如果您的高考成绩在分数上没有太大的优势，建议您热门专业不要集中报考！我校分数级差是5分。欢迎报考我校！祝您马到成功！祝您暑假愉快！
好,li*** (河北),2006-06-24 16:30,(河北614分能在贵校上个好专业吗?河北本一线为577)601呢,您好！建议您参照我校往年在贵省的录取分数及贵省重点线报考，如果您的高考成绩比重点线高出20分以上，可报考我校热门专业，如果您的高考成绩在分数上没有太大的优势，建议您热门专业不要集中报考！，欢迎报考我校！祝您马到成功！祝您暑假愉快！
就业,34*** (四川),2006-06-24 16:22,请问贵校的毕业生进入中石化，中石油等大型企业工作的百分比多大?学生会不会被动分配到一些边远地区?谢谢解答!,您好！我校就业实行双向选择，每年召开大型招聘会，用人单位和毕业生之间双向选择，已经不是学校分配了，您可选择去中石油，中石化等大型企业，也可去西部支持西部建设。
咨询,34*** (四川),2006-06-24 16:07,"我是四川的理科考生，成绩比一本线高31分，请问有希望上贵校的""石油过程""吗?希望多大?谢谢解答!",您好！比较有希望。欢迎报考我校！祝您马到成功！祝您暑假愉快！
理科575能进一本吗??????????????,95*** (浙江),2006-06-24 15:56,理科575能进一本吗??????????????,您好！浙江省的理科重点线是570分，建议您报考时热门专业不要集中报考！欢迎报考我校！祝您马到成功！祝您暑假愉快！
老师好,yy*** (陕西),2006-06-24 15:54,今年陕西理科一本线545，我考了580分，是否可以上贵校？过程装备与控制工程就业情况咋样？可到石化部门吗？,您好！您的高考成绩比重点线高出35分，很有希望被我校录取！过程装备与控制工程就业率比较高，截止到2006年6月，该专业2006届毕业生就业率为92.72％。就业单位多是石油，石化部门。欢迎报考我校！祝您马到成功！祝您暑假愉快！
599,zj*** (浙江),2006-06-24 15:48,请问贵校有哪些是重点学科？专业有级差吗？是否有双学位？麻烦老师解答，谢谢！,[您好！我校重点学科是和石油相关的学科，包括油气储运工程，化学工艺，油气井工程，油气田开发工程，矿产普查与勘探。专业级差是5分。有双学士学位的专业有：石油工程、计算机科学与技术，工商管理，工程管理，英语，法学，行政管理，俄语强化班。欢迎报考我校！祝您马到成功！祝您暑假愉快！
急,po***ess (四川),2006-06-25 15:08,请问贵校对高考各科成绩有无要求?谢谢!,您好！我校对单科成绩没有特殊要求。祝您暑假愉快！
咨询分数,86*** (浙江),2006-06-25 15:05,我是浙江理科考生，分数为584，请问能否上贵校?,您好！您的分数高出浙江重点分数线14分，还是比较有希望被我校录取的。欢迎报考我校！
把握？~,ch***0 (山东),2006-06-25 14:59,山东理科考生成绩620报考贵校强势石油专业有把握吗？我是山东邹城地方人请问可以按照定向生报考吗？~如可以请问需要怎么报？~谢谢,您好！您的成绩高出重点分数线37分，报考我校优势专业还是比较有希望被录取的。我校在山东没有定向招生计划。欢迎报考我校！
山东理科考生,sd*** (山东),2006-06-25 14:57,山东理科考生高出重点线25分，可以报贵校哪几个专业？,您好！您的分数高出山东重点分数线25分，很有希望被我校录取，建议报考时不要集中报考我校热门专业和优势专业。欢迎报考我校！
求助!!!!!!!!!!!!!!!,li*** (河北),2006-06-25 14:54,我是河北考生，588分超重点线11分有希望被贵校录取吗?,您好！您的分数高出河北重点分数线11分，可以报考我校，但是建议您不要集中报考热门专业。欢迎报考我校！
帮助,po***ess (四川),2006-06-25 14:51,我是四川理科考生，成绩为587，四川重本是560，请问报考贵校较好的专业可以吗，比如油气储运工程等?,您好！您的分数高出四川重点分数线27分，可以报考我校热门专业，但是建议您不要集中报考热门专业。欢迎报考我校！
贵校收第二志愿吗?往年录取第二志愿情况怎样?,li*** (河北),2006-06-25 14:51,贵校收第二志愿吗?往年录取第二志愿情况怎样?,您好！我校近几年在河北录取的考生一志愿率都是100％，建议您一志愿报考我校！祝您暑假愉快！
?,13***97 (山东),2006-06-25 14:49,贵校有哪些热门专业,您好！我校的热门专业有勘察技术与工程、石油工程、化学工程与工艺、自动化、电子信息工程、电气工程及其自动化、计算机科学与技术、软件工程、通信工程、油气储运工程10个热门专业。欢迎报考我校！
录取,ty*** (安徽),2006-06-25 14:49,请问老师:如果降分录取，是在什么时机:一志愿结束么?,您好！在报考我校的本科一批所有志愿录取完毕后生源还不足的情况下才会和安徽省招生办协商是否降分录取。一般来讲，我校在安徽省生源还可以，没有降分录取。祝您暑假愉快！
zhixun,ji***idao (浙江),2006-06-25 14:48,老师，我是浙江理科考生，请问贵校哪些专业较好，598分报考这些专业有希望吗？,您好！我校优势专业都是和石油石化相关的，您的分数高出浙江重点分数线28分，报考我校还是有一定把握的。欢迎报考我校！
急,ji***987 (山东),2006-06-25 14:42,山东理科583报考有多大希望,您好！您的分数正好在山东重点分数线，报考我校的希望不是很大。祝您愉快！
老师好,yy*** (陕西),2006-06-25 14:34,贵校过程装备与控制工程专业实力如何?转专业是否可以在两校区进行?食宿条件如何?谢谢!,[您好！该专业有博士和硕士学位授予权，虽不是我校热门专业和石油主干专业，但师资力量和科研实力都很好。该专业是在东营校区就读，只要满足学校转专业的条件，都可以向所在学院申请转专业，没有校区限制。我校现有8个学生餐厅和18个特色风味小吃店，其中两个民族餐厅，学生寝室六个人一个房间，电话网络进入学生寝室。欢迎暑假期间来我校参观！欢迎报考我校！
报考,me*** (浙江),2006-06-25 14:30,老师您好，我是浙江理科考生，605高出重点35分，全省11000多名，报考贵校的把握有多大？谢谢老师！！,您好！您的分数超过浙江重点分数线35分，还是比较有把握被我校录取的。欢迎报考我校！
595,13***97 (山东),2006-06-25 14:20,报考贵校有问题吗,您好！您的分数高出山东重点分数线12分，报考我校有一定把握，建议参考我校往年的录取分数线并避开我校热门专业。欢迎报考我校！
HELP,mj*** (四川),2006-06-25 14:18,我是四川理科考生，考了570分，重点560分，报贵校有无希望?如有希望，报哪些专业可能性大?,您好！您的成绩高出贵省重点分数线10分，报考我校应该有一定的希望，我校热门专业都是和石油、石化相关的专业，包括石油工程，油气储运工程，化学工程与工艺，资源勘查工程、勘查技术与工程等专业，建议报考专业时避免我校的热门专业。欢迎报考我校！
fhg,15*** (四川),2006-06-25 13:06,老师，您好！我今年在川高考成绩为597分，不知可否就读于贵校，若能，又可以选择哪些较好的专业，请老师赐教，谢谢！,您好！您的成绩高出四川省理科重点分数线37分，报考我校还是有较大把握的。我校的热门专业有勘察技术与工程、石油工程、化学工程与工艺、自动化、电子信息工程、电气工程及其自动化、计算机科学与技术、软件工程、通信工程、油气储运工程10个热门专业。欢迎报考我校！
预科班,44*** (山东),2006-06-25 13:01,不知贵校是否有预科班，如有，最低分数是多少,您好！我校只在新疆招生预科班，要求为少数民族考生。祝您暑假愉快！
老师！！~~山东考生610分,i5*** (山东),2006-06-25 12:55,老师您好！我是山东考生考了610分，不知道报贵校的热门专业或一级学科专业有没有希望？另请老师解答下：贵校的一级学科专业有哪些？谢谢！,[您好！您的分数高出山东重点分数线27分，可以报考我校热门专业，但是建议您不要集中报考我校热门专业。我校的热门专业有勘察技术与工程、石油工程、化学工程与工艺、自动化、电子信息工程、电气工程及其自动化、计算机科学与技术、软件工程、通信工程、油气储运工程10个热门专业。欢迎报考我校！
