标题,来源,时间,问题,回答
咨询,zh*** (云南),2012-06-29 10:25,对实行平行志愿的省，专业志愿之间有极差吗？,"你好：专业极差是2,2,0"
河南,ta*** (河南),2012-06-29 10:24,您好我是河南的理科考生，过一本31分。参加过自主招生未过（会优先吗），今年报贵校的希望大吗？谢谢！,你好，不会优先考虑，按往年看，超一本线31分有希望
老师，急啊...5,99***233 (山西),2012-06-29 10:18,您好，我是山西考生，联考成绩是218，【205过线】，专业合格了，但是文化课考了313，差7分没过线，请问如果是这样的情况的话，按贵校历年的专科录取情况，我的文化课是不是很低呢?敢不敢报贵校的专科呢?拜托老师了，给我详细说一下.......,你好：我校艺术类高职是专业通过联考后按照文化课成绩从高到低录取，录完为止。
555,wm*** (山西),2012-06-29 10:07,山西文科生555报考贵校成功率高吗？省内排名1984.,你好，希望不是很大，若是平行志愿可以考虑报考
咨询,t7***0 (山西),2012-06-29 09:52,老师您好，我是山西美术类艺考生，省专业统考成绩为223.35，文化课成绩308，我在本省的报考志愿看到贵校有提前专科在山西招生，请问我是否能报，录取的几率大吗？谢谢！,你好：通过美术省统考就可以报考，按照文化课成绩从高到低录取
河南 艺术文 美术考生,xi***yimeng (河南),2013-06-18 15:26,您好，我在河南省美术联考中220分，能报考贵校艺术类专科专业吗？贵校往年在河南艺术类专科批次录取最低分数是多少？敬候佳音，谢谢！,你好，我校影视动画高职去年三百多分，报考我校艺术类高职需要通过省级联考。
山东艺术类,xw*** (山东),2013-06-18 13:42,请问：通过贵校电视编辑专业后，山东艺术生文化课需要达到多少分才能有把握被录取？另：在山东是提前批录取么？,你好，请登录中国传媒大学本科招生网查看历年各个专业的录取分数。我校艺术类属于提前批次。
关于辅修专业问题,yq*** (山东),2013-06-18 12:00,您好老师：请问如果被贵校艺术类专业录取，是否可以辅修普通类本科专业？可否跨学院辅修？谢谢！,ä½å¥½ï¼ææ¡å¯ä»¥è¾ä¿®æ®éç±»ä¸ä¸ã
播音主持专业排名什么位置能录取,13***87 (安徽),2013-06-18 10:39,请问老师，贵校播音主持专业（男生，文科），根据往年实际，四分之三计划录取的最后一名大概的专业排名在什么位置？若文化课达标，排名第60位的能录取吗？谢谢！,你好，由于每年的情况不尽相同，我校没有对排名进行统计。请登录中国传媒大学本科招生网查看历年1/4计划录取分数。
艺术类,ch***80877 (河北),2013-06-18 10:26,老师您好：我是河北考生拿到了贵校的音工、音导、音乐学的合格证，提前批志愿里必须报考提前批A志愿？,你好，是的。
你好！,wy*** (河北),2013-06-17 15:52,报考了贵校，如果填有“服从分配”，还会退档吗？,你好，服从调剂一般不退档。
专业,53*** (河南),2013-06-17 13:12,老师您好：请问一下贵校的数字媒体技术专业今年没有招生吗，怎么差不到,请登录http://zhaosheng.cuc.edu.cn/wsm/RecruitPlanMarkForm.aspx?province=%E6%B2%B3%E5%8D%97进行查询。
专业级差,13***08 (云南),2013-06-17 13:06,你好：是否有专业级差，如果有，是多少？谢谢,你好！专业极差2分。
提前批,qi***a (山东),2013-06-17 11:06,请问贵校今年在山东的提前批小语种有什么计划？一批中有小语种吗？,提前批有德语、俄语、尼泊尔语。一批次中没有小语种。
黑龙江文史,ya***qi (黑龙江),2013-06-17 09:52,贵校是否有艺术生与非艺术生兼报的专业，哪些专业有研究生，今年在黑龙江招收人数和分数线？,您好！请登陆http://zhaosheng.cuc.edu.cn/wsm/RecruitPlanMarkForm.aspx?year=2013%E5%B9%B4查看我校2013年招生计划。
无专业代码,zh***uan (山东),2013-06-17 09:39,老师好，我是山东考生，自招广播电视学，但山东省无计划所以无专业代码，在演练填报时发现无法填报提交，怎么办？急。,你好！填报志愿问题请咨询本省教育考试院。
就业问题,19***hubb (四川),2013-06-14 16:24,请问贵校的小语种中目前和6年后市场需求最大的是什么语种？,您好！小语种在每个省份的招生计划不同，具体请查询学校本科招生网http://zhaosheng.cuc.edu.cn/wsm/Default.aspx
2013年招生计划,19***hubb (四川),2013-06-14 16:13,1.今年投放四川的提前批、本一批招生总计划是多少？2.提前批的小语种有哪些？招女生人数？3.本一批具体专业名称及招生人数？,您好！四川今年提前批招生计划有日语、德语、俄语共三个专业6个名额，普通类招生计划41，具体招生专业请查询学校本科招生网http://zhaosheng.cuc.edu.cn/wsm/Default.aspx
辽宁理科,su*** (辽宁),2013-06-14 15:31,老师您好！想咨询一下辽宁理科估分在590左右，有希望能考上贵学校吗？谢谢！,您想报考的是普通类专业还是艺术类专业？请到中国传媒大学本科招生网上查询各省历年录取分数线
录取评估,sc*** (广东),2013-06-14 15:24,尊敬的中传老师：我是今年广东考生，参加了贵校动画专业考试，已获合格证。请问：1、我专业排名第74名。有并列的吗？并列有多少名？2、我文科总分500分以上，能被动画专业录取吗？谢谢！,各专业排名并列的情况不多，就算有并列也不会影响录取，所以不用考虑。按照往年的情况，如果排名可以进入前3/4就有希望录取
录音专业,zc*** (四川),2013-06-13 15:35,报考中传录音艺术专业，有没有什么特殊的要求？我是理科考生。,我校2013年在四川省没有录音专业的普通类分省计划，如果报考我校2013年艺术类专业中的录音艺术专业需拿到我校该专业的合格证方可报考。关于艺术类考试的相关情况请参看我校艺术类招生简章。
天津理科,76*** (天津),2013-06-13 15:06,老师：理科生报贵校学什么专业好？,你好！专业都不错，可根据你的喜好和分数填报。
浙江考生 电编专业是按照一类科目录取的吗,sp*** (浙江),2013-06-13 15:00,我是浙江考生报考贵校的编导（电视编辑方向）专业课已经通过，那么在浙江录取时的文化课是按照语数外、文综和18选六（即一类科目）的总成绩录取呢？还是按照语数外和文综（即二类科目）的总成绩录取呢？,您好！浙江是艺术类满分为750分。
志愿填报,zh***uan (山东),2013-06-13 13:52,老师好，山东省志愿填报有自主招生批次，贵校自招的广播电视新闻是否在本批次填报？还是本一批A志愿（自招通知书要求）？,建议在自主招生批次进行填报，但还需与省招办进行确认。
山东招生,a1***a (山东),2013-06-13 13:52,您好，理科一般录取英语（播音主持）一般高一本分数线多少分？今年中国传媒在山东共招多少学生？比以往有所增加吗？,您好！请登录中国传媒大学本科招生网查询往年录取分数做参考。招生计划也可在网站查询。网址：http://zhaosheng.cuc.edu.cn/wsm/Default.aspx
艺术类录取线,ys*** (山东),2013-06-13 13:07,请问招生简章里说动漫专业录取要参照考生省份重点线，那动漫专业的最低文化线是不是本省的一本线呢？谢谢！,不一定是一本线，历年录取最低分请到中国传媒大学本科招生网查询。
请教,12***3 (山东),2013-06-13 12:58,您好，我是山东的理科生，请问我在今年的高考中要高出一本多少分可以填报贵校？,您好！请登录中国传媒大学本科招生网查询往年录取分数做参考。网址：http://zhaosheng.cuc.edu.cn/wsm/Default.aspx
投档与录取,wr*** (山西),2013-06-13 12:53,你好，我的孩子是山西文科考生，如果高考成绩已经达到贵校的投档线，但是所报专业无法满足，而且服从专业调配，会不会退档？,平行志愿省份若考生服从调剂提档后通常不退档。
自主招生,da***i (湖南),2013-06-13 11:56,请问老师，1、获得自招资格的考生，在填报志愿时，在自招志愿栏除第一专业志愿只能填写获自招资格的专业外，还有没有必要在二、三、...专业志愿填报贵校其他专业2、按自招专业录取的话还可以在以后转专业吗,不必填写其他专业自主招生考生原则上不能参与转专业考试
少数民族预科,17*** (四川),2013-06-13 11:09,老师，您好：我想问一下非聚居地的四川应届少数民族考生能否报考贵校的少数民族预科，贵校招生对某些科目，身体素质等是否有特定限制，升本时是否需要考核？贵校少数民族预科招生是否针对某一特定的专业，以后就只能就读该特定专业？谢谢解答。,您好！关于少数民族预科的问题请咨询本省教育考试院。
专业，志愿，国防生,mx*** (山东),2013-06-13 10:42,请问贵校招收国防生么？招收多少（山东）？请问贵校高考录取分数线多少（近年）？（我是山东文科生，三模在560分左右）,您好！国防生今年没有招生计划。
理科考生,65***ll11 (山东),2013-06-13 10:18,请问老师山东理科考生报考贵校通常需要高出一本线多少分或者达到省排名多少才有希望？,您好！学校没有统计过省排名。请登录中国传媒大学本科招生网查询往年录取分数做参考。网址：http://zhaosheng.cuc.edu.cn/wsm/Default.aspx
国际经济与贸易,tj*** (天津),2013-06-13 09:56,国际经济与贸易在天津招生吗？,您好！今年经济学类在天津没有招生计划。各专业招生计划请查中国传媒大学本科招生网。网址：http://zhaosheng.cuc.edu.cn/wsm/Default.aspx
预科咨询,lf*** (贵州),2013-06-13 09:45,老师好:请问老师:1.贵校2013年贵州少数民族预科招生计划是多少;2、预科在提档时是否认可各省的加分政策？抑还是按实考分提档？3.预科学生预科期瞒后是否回本校学习;4.预科学生在预科期满后进入本科可否自己选专业;5.预科学生的毕业证和正式学生一样吗，就业有什么不同;6.预科期间可以选修本科课程吗;7.贵校预科录取线比一本第一志愿录取线低多少分;8.民族预科学生预科期间在本校还是在其他地方学习;,您好！少数民族预科提档问题请咨询本省招办。请打学校招生咨询电话：010-65779370
山东理科生咨询,ch*** (山东),2013-06-13 09:44,老师您好，请问一本以上多少分有提档可能？贵校的数字媒体技术专业是优势专业吗？将来什么专业会有对外交流的机会？,您好！请登录中国传媒大学本科招生网查询往年录取分数做参考。网址：http://zhaosheng.cuc.edu.cn/wsm/Default.aspx每个学院都有对外交流学习的项目，学校也为学生提供了很多对外交流的机会。
天津 文史类 招生线 专业,zh***hu (天津),2013-06-14 15:18,您好：1.估分介于570~620，取平均值为595，此分报贵校为何种水平？2.贵校今年在津录取分数约为多少？3.各专业分别有几个名额？4.贵校在津录取的文科专业有哪些，优势专业有哪些？能学到实用技能的专业有很大兴趣，望老师给予建议、指导。谢谢,[您好！请根据所报的专业查询学校往年的录取成绩做参考。专业的招生计划在中国传媒大学本科招生网http://zhaosheng.cuc.edu.cn/wsm/Default.aspx上有公布。学校的每个专业都有其特点，可以根据自己的喜好查询专业介绍，了解专业都要学习什么和将来的就业方向做参考。历年分数、招生计划和专业介绍都已公布在学校本科招生网http://zhaosheng.cuc.edu.cn/wsm/Default.aspx欢迎查询
专业,zj*** (浙江),2013-06-14 14:24,贵校的专业设置了极差吗？,"您好！专业级差2,2,0."
艺术类,zh***0877 (河北),2013-06-14 13:12,您好：我是河北考生，拿到了贵校的音工、音导、音乐学的合格证，我想知道合格证的发放比例？录音艺术是按文化课成绩录取，如果文化成绩相同呢？还有如果前两个志愿没被录取第三志愿有希望吗？,我校通常情况下合格证的发放比例在1:4左右。文化课成绩相同看单科成绩，依次按英语（文、理科）、语文（文科）或数学（理科）、文综（文科）或理综（理科）科目成绩排队录取。成绩够的话第三志愿也有希望。
重庆,zp*** (重庆),2013-06-14 11:56,贵校的传播学、广告学是否对视力有要求,您好！没有要求。
预科提档,lf*** (贵州),2013-06-14 10:32,老师您好：预科原则是：“提档时认可加分，录取时看高考实考分”，那意思就是如果被提档了，也不一定录取是这意思吧！感谢老师解答！,您好！预科要先在民族大学学习，所以关于预科的问题请咨询本省教育考试院。
我是山东考生,yt***an (山东),2013-06-14 10:18,请问这所大学今年在山东省的录取线大概是多少,您好！录取分数线目前还没有，请随时关注中国传媒大学本科招生网http://zhaosheng.cuc.edu.cn/wsm/Default.aspx
转专业问题,a6*** (天津),2013-06-14 10:13,请问贵校入学后允许辅修第二学历吗？辅修的专业发毕业证和学位证吗？,关于辅修的相关问题由我校教务处负责，请到中国传媒大学教务处网站上查看。地址：http://jw.cuc.edu.cn/home/index.do
山东提前批,ca*** (山东),2013-06-14 09:56,老师您好，文科女明年高考。请问贵校在山东有提前批么?都哪些专业？需要提前参加测试么？谢谢。,您好！今年山东地区的提前批是小语种，明年的还未定，请随时关注中国传媒大学本科招生网010-65779230或者致电010-65779370
自考,li***678 (四川),2013-06-14 09:16,老师您好，请问贵校有自考吗？自考需要多少分呢？,请拨打010-65779230中国传媒大学远程与继续教育学院进行咨询
自考,li***678 (四川),2013-06-14 09:16,老师您好，请问贵校有自考吗？自考需要多少分呢？,请拨打010-65779230中国传媒大学远程与继续教育学院进行咨询
专业,la*** (北京),2013-06-14 09:16,你好，老师，我是重庆的一名考生，若我想报考贵校的数字媒体艺术必须还要什么专业证吗？,需要提前参加我校艺考，拿到该专业合格证
咨询,ne***ng (山东),2013-06-14 09:06,老师：您好，贵校在山东是否招收非艺术生，要多少分才能被录取。,您好！普通类专业在山东有招生计划，请登陆中国传媒大学本科招生网查询：http://zhaosheng.cuc.edu.cn/wsm/Default.aspx
咨询,ti***u8899 (山东),2013-06-14 09:02,请问老师，贵校的专业就业率怎么样，主要职业方向是什么,我校整体就业率在95%以上，主要为传媒领域文化产业方向
预科,lf*** (贵州),2013-06-13 16:07,老师您好：预科提档时是否认可各省的加分政策？升入本科后都有哪些专业？升入大二后是否有转专业的机会？,提档时认可加分，录取时看高考实考分。具体升入专业要到明年才知道，基本上为我校普通类专业中的个别专业。学校提供转专业的机会，但需要参加转专业考试。
预科,gy***6818 (贵州),2013-06-13 15:37,老师您好：预科提档时是否认可各省的加分政策？升入本科后都有哪些专业？升入大二后是否有转专业的机会？,已回答
艺术类提前批次问题,xg*** (北京),2013-05-09 10:01,我已取得中国传媒大学艺术类“文编”和“图片摄影”2个专业考试合格证书，不知这2个的文化考试分别最低是否要达一本线，高考后考生填报志愿需要注意的事项，是否加试英语口语？,你好！可以登录中国传媒大学本科招生网查看历年录取分数。填报志愿请咨询本省的教育考试院。没有英语口语加试。
广告学，数字媒体技术适合理科女生吗？,ji*** (天津),2013-05-09 09:23,天津理科女生高于一本线多少能报贵校？,你好！可以登陆中国传媒大学查看历年录取分数，这两个专业都适合女生学习。
咨询,cy*** (北京),2013-05-09 09:20,请问，该校，文编/电编测试已通过，提前批志愿是否可以都报，少数民族加分用的上吗?,你好！都可以报，加分用不上。
河北艺术理,zh***0877 (河北),2013-05-09 09:16,老师您好：录音艺术（音工，音导）还有音乐学都取得了贵校的合格证，比如按文化课录取的录音艺术是取得合格证的考生全国排名吗？文科和理科单独排队吗？,你好！录音艺术不分文理，专业考试合格的情况下，按照高考成绩，参考各省重点线，从高到低录取。
咨询,ma***oyu (江苏),2013-05-08 16:23,请问江苏理科考生，想报考贵校的话大约全省排名多少名以内有希望录取？另外色弱的话能报考贵校的哪些专业？,你好，我校没有排名的相关统计。普通类专业没有色弱的要求。
咨询,df*** (湖北),2013-05-08 15:55,湖北文科考生，高于一本30分，报考贵校能被录取吗？专业录取空间大吗？,请登录中国传媒大学本科招生网查看历年录取分数。
咨询,66*** (四川),2013-05-08 15:05,老师：您好！我是四川艺术文考生，已通过贵校广播电视编导（电视编辑方向）校考，请问一般需要在四川一本线多少分以上才有机会录取？录取时第一志愿是以在校考时在贵校网站上填写的为准还是高考后在四川省教育考试院网站填报的为准？,你好！登陆中国传媒大学本科招生网可以查看历年的录取分数。录取时依照艺术类网上报名时志愿为准。
咨询,ap*** (北京),2013-05-08 12:57,老师您好！请问已经获得艺术类专业考试合格证书，在填报志愿时，是在志愿表本科提前批的第一志愿第一专业那一栏填报所考的专业吗？,你好！每个省份报考志愿的要求都不一样，报考志愿问题请咨询本省教育考试院。
大学退学复读录取,13***08 (云南),2013-05-08 12:01,你好：1，从大学正常办理退学手续复读是否录取，往届应届是否一视同仁。2，云南平行志愿专业服从调剂是否退档。谢谢,你好！1.报考普通类或艺术类，复读没有问题，往届应届一视同仁。2.服从调剂一般不退档。
再问提前批,li*** (北京),2013-05-08 10:31,请问如果提前批中填服从调剂，会调剂到什么别的专业？,您好！提前批是小语种，一般会根据志愿调剂专业
北京提前批,li*** (北京),2013-05-08 10:07,请问贵校提前批文科招生小语种没有提前面试吗？是否收第二志愿？,您好！提前批小语种没有加试，直接报考，但是须参加北京市口语考试，且成绩达4分或者4分以上。不预留二志愿。
专业,sh***a (北京),2013-05-08 09:34,通讯工程、广播电视大学、数字媒体技术、文化产业管理是干什么的？,您好！请登录http://zhaosheng.cuc.edu.cn/wsm/shownews.aspx?id=1227中国传媒大学本科招生网，上面有详细的专业介绍。
关于招生简章外语问题,lw*** (辽宁),2013-05-08 09:03,请问：1、看该校招生简章，上面有一条。报考我校外语专业的考生必须参加英语口试加试且成绩达到本省（自治区、直辖市）成绩满分80%（含）以上。本人已经参加了本省的口语加试，成绩为优。那么该校外语专业（英语小语种）如果入取了是不是到学校还要加试口语？如果不合格怎么办？（辽宁考生高考没有口语，这方面欠缺）2、考外语专业是否要求高考英语单科成绩？,您好！学校小语种专业没有加试。
专业咨询,yu*** (山西),2012-06-29 16:42,尊敬的老师：理科高考分数590，想报考咱们学校，特别是新闻学，但是贵校在山西理科不招收该专业学生，进校后能否调整？感谢您的认真回答!,你好，学生在大一和大二下学期有转专业的机会，通过转专业的考试，可以转专业
录取,19*** (河南),2012-06-29 16:27,河南文科考生599分，高一本线42分，省排名1287，有无希望上贵校？如被提档会不会被退档？,你好，按往年看，有希望，我校对于实行平行志愿的省份，专业服从调剂，提档后不退档
天津文科生,su***ang (天津),2013-05-10 11:19,老师好！我是天津文科生，有天津市优干20分加分。请问：1.广播电视新闻学和媒体创意专业要高出天津一本线多少分才能被录取？2.选专业时，认20分加分吗？谢谢！,你好！1.可以登陆中国传媒大学本科招生网参考历年录取分数。2.录取时不认可加分。
关于以大类录取怎么选专业的问题,sh*** (宁夏),2013-05-10 11:14,老师您好：我是宁夏的文科考生，请问以大类如“工商管理类”录取后，可以自己选择专业吗？,你好！工商管理类一年级打通培养，不分专业，统一授课。从第二年开始，再根据学生兴趣自行选择细分专业，然后分专业进行培养。
咨询,wf***u (山东),2013-05-10 11:04,山东文科一模613分、二模647分，高于一本线60分，想要报考贵校，接收调剂，有多大希望？想要报考英语、或新闻传播妆也可能性有多大——联系往年该专业分数看的话。。谢谢！！！,你好！分数还是很有希望的。可以登陆中国传媒大学本科招生网查看历年录取分数。
小语种,gs*** (重庆),2013-05-10 10:39,老师好！请问今年提前批在重庆有安排小语种招录吗？,你好！我校招生计划教育部尚未批复，请20日左右登录中国传媒大学本科招生网进行查询。
内蒙古预科班,20***nggu (内蒙古),2013-05-10 10:14,老师好，请问今年在内蒙古有少数民族预科计划么，有的话是几个名额。谢谢。,你好！有计划，名额数量请咨询本省教育考试院。
文史类和新媒体相关的专业有哪些,sp*** (浙江),2013-05-09 15:24,孩子特别想从事和新媒体，如微博等社交平台相关的工作，作为文科考生不知道选择什么样的专业能为将来的这些工作打下基础,你好！我校有网络与新媒体等一些相关专业，请登陆中国传媒大学本科招生网查看专业设置等详细内容。
艺考生咨询,xr*** (江苏),2013-05-09 14:58,请问贵校艺术类专业考试第一名，文化分有没有适当的优惠？谢谢！,你好！按照本专业最低分录取。
选专业是否合适,yk*** (山东),2013-05-09 14:54,请问，有思想、个性强的男生在贵学校学习哪个专业更合适？,你好！请登录中国传媒大学本科招生网查看专业设置，专业介绍，培养方向等信息，然后结合自身情况进行报考。
本科一批一志愿,mj*** (北京),2013-05-09 14:52,您好，请问西城理科女生如果报贵校分数只达到录取线且服从调剂就不会退档，是这样吗?预估560分.谢谢,你好！服从调剂一般不退档。
河北艺术理,zh***0877 (河北),2013-05-09 13:37,老师好：请问音乐学专业通过拔尖创新人才的是属于四分之一计划还是四分之三计划?属于计划招生名额内吗？,你好！拔尖创新属于计划招生的名额内。能入选拔尖创新人才，都是专业课优秀的考生。请登录网站http://zhaosheng.cuc.edu.cn/wsm/shownews.aspx?id=1179查看拔尖创新人才选拔实施方案。
电视编导,li*** (北京),2013-05-09 12:13,我们已经获得电视编导报考资格，请问，录取时，针对北京地区，文科和理科是分别录取，还是按照分数混合录取？,你好！电视编导按照高考成绩，参考各省重点线，从高到低录取，不分文科理科。
北京考生,ld*** (北京),2013-05-09 11:48,请问海淀文科生排名多少录取的把握大？,你好，我校没有相关的排名统计。
2013年报考音乐与录音艺术学院考生,me***971 (河北),2013-05-09 11:34,已经取得贵校音工和音乐学两个专业校考合格证，报考时只能报这两个专业是吗？想兼报小语种的专业行吗？（都是提前批）专业校考成绩什么时候能在考生所在省教育网上公示？在网上查贵校2011年和2012年音乐学各省录取分数时，发现录取的四分之一指标人数就有20多人（共45人）多出将近一倍为什么？,你好！报考时填这两个专业即可。是否可以兼报小语种，请咨询本省教育考试院。省教育网是否公示成绩，何时公示，也需要咨询本省教育考试院。凡是有专业排名的专业，每个省都给出了一个参考的分数，但是并不是所有省份都有考生被录取。
咨询,ma***oyu (江苏),2013-05-09 11:00,请问一下江苏理科考生，如果想报考贵校大约全省排名多少名以内有希望录取？或者高出一本线多少分能录取？色盲能报考贵校吗？,您好！省排名没有统计过，可登陆中国传媒大学本科招生网查询历年成绩http://zhaosheng.cuc.edu.cn/wsm/Default.aspx
艺术生,ys*** (山东),2013-05-09 10:32,我是山东艺术理科生今年传媒动画校考114名请问文化成绩需要多少分谢谢老师！,您好！可登录中国传媒大学本科招生网http://zhaosheng.cuc.edu.cn/wsm/Default.aspx查询近几年录取分数做参考。
