标题,来源,时间,问题,回答
关于专科,yw*** (北京),2009-06-25 16:59,老师您好！北京文科440分左右，有可能被贵校录取吗?,请参考前三年的分数。07年483分，08年466分
咨询,lu*** (山东),2009-06-25 16:38,老师您好：我是山东的理科考生，想问一下，今年贵校在山东省的招生计划，以及在山东的历年招生分数线，谢谢,临床医学专业纳入清华招生，08年最低680分
咨询,wa***heng (山东),2009-06-25 15:49,您好，我是山东考生，622分去贵校有希望麽,临床医学专业纳入清华招生，08年最低分680分。
山东理科617,00*** (山东),2009-06-25 15:02,老师您好，我是山东理科考生，617分，今年山东一本线586，620分以上15409人，615分以上19214人.请问报考贵校希望大吗，有哪些适合的专业，如果我的分低，那国防生可以吗?谢谢!!,临床专业纳入清华招生，08年最低680分
咨询,je***1 (安徽),2009-06-25 14:56,请问安徽女生，分数为330分左右，能够报考贵校护理学专科吗？还有走读是什么意思，学校不提供统一住宿吗？请问专科的就业方向大概是在哪里？能在北京的医院工作吗？,在安徽没有专科计划
咨询,ki*** (北京),2009-06-25 14:29,老师您好：我是北京的一名考生，我高考成绩是416分，我有希望读贵校的护理（专科）吗？,08年423分，请参考
录取,en***os (山东),2009-06-25 13:10,您好老师请问贵校今年在山东有招收计划麽我是往届理科生考了601比一本线高了15分,在山东只有临床专业有机会，但分数高于清华提档线
预录取,to*** (安徽),2010-06-25 14:19,请问贵校有没有预录取？条件是什么？,没有
护理专业,sn*** (北京),2010-06-25 13:34,你好，我想咨询一下，今年协和护理专业（专科）的分数线大约是多少,以下是前两年的总分，刨去文综或理综的分数，剩下的语数英三门分数，供你参考。09年文科最低分285分，理科最低分260分08年文科最低分249分，理科最低分239分
我问,to*** (安徽),2010-06-25 12:47,我是安徽一考生，分数659，全省排名539，请问能不能报考本硕博连读?,临床纳入清华，去年最低687
录取,ff***ic (河南),2010-06-25 12:25,高考成绩626，省里排名1200左右，报贵校希望大吗,河南没有计划
家长的提问,we*** (广西),2010-06-24 16:56,老师，您好!我儿子是乙肝病毒携带者(肝功能正常)，可以报读贵校吗?贵校是否每年都有体检要求?谢谢,广西没有计划
安徽 640,to*** (安徽),2010-06-24 16:27,录取的希望大吗？,临床医学，纳入清华招生，去年最低分687
转专业,a9***1 (陕西),2010-06-24 13:18,我想报考贵校但贵校在陕西没有招生计划请问在报考清华其他专业后转专业好转吗如果分数特高能特招吗,全省前十名可以任选清华的专业（包括临床）。如果没进入临床专业，一年后可以参加清华大学的转专业
关于招录问题,63*** (广西),2010-06-24 11:37,尊敬的协和医学院招办老师：我是广西玉林考生宾春丽，请问贵校在广西是否有招生计划，我的成绩是569分，比我区划的一本1批线高69分，我很想进入贵部学习，不知有没有可能性？谢谢！宾春丽2010,在广西没有招生计划。
关于招生,bo*** (甘肃),2010-06-12 14:48,请问贵校在甘肃招生吗?大概高出一本线多少分?,我校在甘肃没有招生计划
天津550理科,ya***g (天津),2010-06-12 14:44,可以报考吗一本的话有可能吗？,前三年在天津没有护理专业的招生计划，所以没有分数可以参考。2005年护理专业在天津招生，最低分503分（当年一本线458分）
咨询,xi***zkaosheng (新疆),2010-06-12 11:25,请问您校有没有在新疆招生,在新疆没有招生计划
咨询,yi***666888888 (陕西),2010-06-11 12:37,我是陕西理科考生，想问贵校临床医学600能录吗？,在陕西没有招生计划
在山东省的招生计划,lv*** (山东),2010-06-11 12:05,尊敬的招生办主任：您好！请问贵校今年在山东省的招生数量是多少？都有哪些专业？录取的分数是多少？谢谢您了！,临床医学专业在山东有计划，纳入清华招生，计划招3名理科生，去年最低分686
招生,co*** (陕西),2010-06-10 13:01,贵校在陕西招多少名，大概多少分,在陕西没有招生计划
特色专业,tt*** (新疆),2010-06-10 11:07,1.贵校的特色专业有哪些？2.是不是《新疆招生与考试》上贵校所列专业考前的为特色专业,我校高招是临床和护理两个专业，在新疆都没有计划
招生,jl*** (湖南),2009-05-13 10:58,请问：我是理科生，2009临床专业7年和5年在湖南招生数分别是多少？2008年该两专业的录取分数线分别是多少？,我校临床医学专业为八年制，纳入清华大学招生。09年在湖南计划招收4名理科生。08年录取最低分638分。
录取就业,ly*** (北京),2009-05-12 09:26,请问报考贵校，高出本科线多少分，能上本博连读斑，就业前景如何，毕业之后大多数人被哪些单位录用,八年制临床医学专业纳入清华大学招生，08年在北京的最低分为656分。就业率接近100%，单位是包括协和医院在内的各三级甲等医院
咨询,zj*** (浙江),2009-05-11 15:48,请问该校护理专业毕业的学生就业在北京的可能性大吗?一般会在什么城市?,在北京就业的挺多的。就业是双向选择
咨询,bi*** (河南),2009-05-11 10:54,老师：你好！请问该校09年在河南是否招生？有哪几个专业？是提前批次还是在第一批次录取？是高考实分录取还是自主招生等国家承认的加分也算？往届生也录取吗？,我校在河南没有招生计划
视力与专业录取？（一眼是正常5.1，另一眼只能矫正到4.7）,po*** (云南),2009-05-11 09:28,老师，您好。我是云南09年应届考生。我想请教一下，我一眼是正常5.1，另一眼只能矫正到4.7。“指导意见”说此部分内容供考生在报考专业志愿时参考。学校不得以此为依据，拒绝录取达到相关要求的考生。那我在填报志愿时仍然填了相关专业，录取时同两眼均正常的其他人比会有影响吗？普通高等学校招生体检工作指导意见二、患有下列疾病者，学校有关专业可不予录取4、屈光不正(近视眼或远视眼，下同)任何一眼矫正到4.8镜片度数大于400度的，不宜就读海洋技术、海洋科学、测控技术与仪器、核工程与核技术、生物医学工程、服装设计与工程、飞行器制造工程。专科专业：与以上相同或相近专业。　　5、任何一眼矫正到4.8镜片度数大于800度的，不宜就读地矿类、水利类、土建类、动物生产类、水产类、材料类、能源动力类、化工与制药类、武器类、农业工程类、林业工程类、植物生产类、森林资源类、环境生态类、医学类、心理学类、环境与安全类、环境科学类、电子信息科学类、材料科学类、地质学类、大气科学类及地理科学、测绘工程、交通工程、交通运输、油气储运工程、船舶与海洋工程、生物工程、草业科学、动物医学各专业。专科专业：与以上相同或相近专业。此部分内容供考生在报考专业志愿时参考。学校不得以此为依据，拒绝录取达到相关要求的考生。,我校的招生录取完全按照《普通高等学校招生体检工作指导意见》的要求。同时也建议你根据自身情况选择合适的专业，才不会影响将来就业。有问题请咨询010-65249442，招生老师会进行具体解答。
关于健康问题,ti***87 (广西),2008-06-27 15:57,乙型肝炎表面抗原携带者能否报考针灸推拿专业？眼镜度数高于600度的学生能否报读针灸推拿专业？,我校没有针灸推拿专业
636,f1*** (山东),2008-06-27 15:00,1志愿理636可否录取,我校的临床医学专业纳入清华大学招生，必须过清华大学的提档线。去年最低分670
老师，您好,62*** (广西),2008-06-26 16:11,我是广西的考生，今年507分，报贵院校有可能被录上吗？（服从调剂）,我校在广西没有招生计划
山东考生506分是否能报贵校大专,12***87456321 (山东),2008-06-26 14:21,山东考生506分是否能报贵校大专,我校的临床医学专业在山东有计划，该专业是纳入清华大学招生的，去年最低分670。
可否被录取?,yi*** (广西),2008-06-26 12:45,广西理科579分可否被贵校录取?,我校在广西没有招生计划
护理专业,zl*** (广东),2008-06-26 09:54,老师，您好！请问护理专业是做护士吗？男性适合吗？,我校的护理专业男女生兼招，没有性别限制
录取线,ma***cs (内蒙古),2008-06-26 09:47,老师您好，内蒙古理科重点548，我高出68分，能上贵校哪些专业？哪些专业分男女？谢谢,我校在内蒙古没有招生计划
咨询,je*** (浙江),2008-06-26 09:26,老师好，我是08浙江理科考生，今年的分数是597，若报考贵校的护理专业，希望大吗？贵校的护理专业的就业率及就业地域趋向如何？除了当护士以外是否还有其他方面的就业取向？该专业是否有加强英语方面的培养？,我校的护理专业去年在浙江招生最低分数581分。还是有希望的。我校的护理专业就业率接近100%，就业地域在北京等各大城市。主要职业是护士。
本校有大专么，可以专升本么,zz*** (北京),2008-06-24 14:21,本校有大专么，可以专升本么,可以专升本
咨询,cs*** (浙江),2008-06-24 11:10,我是浙江理科564，能在贵校就读吗？能在贵校就读什么专业？,我校的临床医学专业去年最低678分，护理专业最低581分。你可以参考我校以往的分数线
咨询,ma***oyu (江苏),2013-05-08 09:16,请问老师，色盲能报考贵校吗？如果可以的话能报哪些专业？单色块识别没有问题。,按照《普通高等学校招生体检工作指导意见》，除患有学校可以不予录取的疾病外，有下列情况之一者，不能被医学类各专业录取：色弱、色盲者。
咨询,13*** (河南),2011-06-13 15:10,老师您好：我是河南理科考生家长，孩子高考估分640左右，预估一本线585，报考贵校有希望吗？假如被贵校录取，而专业不理想，有机会转专业吗？能辅修第二专业吗？如果两个专业都通过，那么辅修的第二专业如果颁发辅修证明，就业时是否与第一专业等级一样？,你好！我校在河南没有计划。
贵校在山东有那几个专业招生？分数线,15*** (山东),2011-06-13 10:14,在山东有没有二本？谢谢能给回答。,在山东没有二本专业。只有临床，是一本，纳入清华招生。
录取分数线,sh***gguang (广西),2011-06-12 09:23,请问北京协和医学院属于第几批次，分数线大概是多少，如何填报？,我校在广西没有招生计划
关于招生人数,hi*** (四川),2011-06-09 16:18,请问贵校今年准备在四川招收多少学生？,临床专业在四川招收5人，纳入清华招生。
咨询,qu*** (北京),2011-05-12 16:34,“可以参加二招或者转系，转入协和医学专业”，老师，请问，能否考入考入协和医学专业转入清华本部？另外，协和医学专业有哪些？我只看到了护理学专业？谢谢。,[临床医学是纳入清华招生的，就是说，是清华大学里面的一个专业，你报考的时候，报考的就是清华大学。所以清华的其他专业新生可以通过二招或者转系进入临床医学专业，而临床医学专业的学生如果发现自己不适合学医，也可以参加转系，转到清华大学的其他专业。我校另外一个专业就是护理学，由协和招生。所以你在协和医学院下面，就只能看到护理专业。因为临床医学专业在清华大学下面。
咨询,lu*** (河北),2011-05-12 13:51,请问河北理科考生排名多少可以上贵校？,临床医学纳入清华招生，至少要过清华提档线；护理学专业至少要过一本提档线
报考咨询,xu*** (河北),2011-05-12 13:04,老师你好！贵校是和清华合办的，报志愿时能和清华的其他专业并行吗？临床医学去年在河北的分数线是多少？谢谢！,临床医学专业纳入清华招生，就是清华大学里面的一个专业。你报考清华其他专业怎么报，报考临床也怎么报，没有区别。临床专业2010年在河北最低671分
转专业时间和条件,wy*** (江西),2011-05-11 15:34,如果录取到清华大学本部后，要求转入贵校学习，一般在什么时候提出申请？要具备什么条件？,在清华新生报到的当天，我们会在生物系报到处发放临床医学专业二招的申请表，一般新生报到后几天内就会安排二招面试。所以在新生报到时请到生物系新生报到处找我们填写二招申请表格。（电话：65295964）
考生,lt*** (北京),2011-05-11 12:58,老师好，西城一模500分，二模528分能上贵校护理学吗？,我校护理专业的平均分一般比一本线超过20~30分，请作为参考
招生计划,19***2 (辽宁),2011-05-11 11:15,请问贵校在辽宁的招生计划数。分数线得超过清华线才能提档吗？贵校不是清华的医学院吗？招生计划是不是在清华计划里？,临床医学是纳入清华大学招生的，但今年在辽宁没有招生计划
能否转专业,wy*** (江西),2011-05-11 09:50,我是江西考生，但贵校在江西无招生计划，我如果录取到清华大学本部，能不能转入贵校学习？,可以的。可以参加二招或者转系，转入协和医学专业。
咨询,zh***i (北京),2011-05-10 14:59,老师您好.高一本多少能报咱们学校.谢谢.,临床纳入清华招生，要过清华提档线。护理由协和招生，平均分大概高于一本线30分左右。
对于女孩，选择医学选什么专业好？,za*** (四川),2011-05-10 12:15,老师好！对于女孩，想学医，选择什么专业较好？成绩在一本线上60-70分（预估），谢谢指点！,医学专业比较辛苦，我觉得性格因素比性别因素更要考虑。我校临床专业的男女生比例大概是1:1的，女生学临床或者医学的其他专业都可以的。
不明咨询,wu***u (广西),2011-05-10 11:09,老师:为何在教育部网站和其他网站上公布的985和211大学名单中没有贵校吗?,http://gaokao.chsi.com.cn/sch/info/search.do在阳光高考的网站就有公示啊，你可以点击查看。我们学校是211和985
报考,na*** (天津),2009-06-12 16:44,我是天津的考生，今年估计是565分，可以报考吗?我服从调剂,我校临床医学专业在天津招生，去年最低分665。所以希望很小。建议考虑其他学校。
想知道,jo*** (内蒙古),2009-06-12 11:55,八年制临床医学专业招收复读生么？,招收。但是今年在内蒙古没有计划。
想知道,jo*** (内蒙古),2009-06-12 11:54,八年临床内蒙古有名额么？近几年少数民族录取最低分约是多少？,今年在内蒙古没有计划。
请问09年计划在新疆招生人数及分数线,do*** (新疆),2009-06-12 11:33,请问我是新疆的2009届考生汉语文史类估分在527分左右够新疆一本分数线请问够贵校录取分数线吗或者自费可以报考的专业感谢,09年在新疆没有计划。
大专,bj*** (北京),2009-06-12 09:21,请问：贵校大专怎样才能专升本。专升本后与本科生有区别吗？,[专科生在第五学期末，可根据国家大学英语四级成绩、平时学习成绩、德育考核等进行综合选拔，挑选出优秀的学生进入本科阶段继续学习，享受本科学生待遇，学习期满，成绩合格者发给“专科起点本科学习”毕业证书及理学学士学位。其他学生毕业后，可通过成人高考再进入“专科升本科”的学习，学习期满，成绩合格并达到规定要求者，可获得成人教育毕业证书及理学学士学位。
报考,19*** (天津),2009-06-11 13:34,老师好；天津理科生，估分560分，想报考贵校难度大不大。谢谢,我校只有临床医学专业（八年制）在天津有计划，该专业纳入清华招生，去年最低分665。
咨询,20*** (天津),2009-06-11 10:07,在天津有招收二批的计划吗？,没有二批计划。
江苏去年的录取分是多少,zh***118 (江苏),2009-06-10 14:57,江苏去年的录取分是多少，今年江苏有几个计划,临床医学专业：纳入清华招生，去年最低分433，今年计划8名理科生。护理本科：由协和医学院招生。去年最低分365，今年计划15名理科生。
北京考生,bj*** (北京),2009-06-10 14:46,请问贵校大专能专升本吗,[专科生在第五学期末，可根据国家大学英语四级成绩、平时学习成绩、德育考核等进行综合选拔，挑选出优秀的学生进入本科阶段继续学习，享受本科学生待遇，学习期满，成绩合格者发给“专科起点本科学习”毕业证书及理学学士学位。其他学生毕业后，可通过成人高考再进入“专科升本科”的学习，学习期满，成绩合格并达到规定要求者，可获得成人教育毕业证书及理学学士学位。
咨询,gr***29 (山西),2009-06-10 12:48,贵校09年在山西计划招理科多少人，最低多少分？,我校09年在山西没有招生计划。
关于专业问题,19*** (天津),2009-06-10 09:47,请问：贵校临床专业是8年制吗？,是8年制
关于录取线,19*** (天津),2009-06-10 09:46,您好，请问贵校的临床专业，与清华的临床专业是一码事吗？,就是清华大学的八年制临床医学专业，是一回事。
临床医学7年制录取分,wu***55 (河南),2009-05-13 15:33,请问贵校临床医学7年制是否提前录取？近三年录取分是多少？,我校只有临床医学八年制，在河南没有招生计划
急,li*** (北京),2009-05-13 14:43,专科护理收男生麽,招收男生
招生,jl*** (湖南),2009-05-13 13:24,请问：我是理科生，贵校2009临床专业在湖南有7年和5年制的招生计划吗？分别计划多少人？2008年这两专业在湖南的录取最低分数线是多少？保送生和自主生会占去普通生的招生计划吗？,我校临床医学专业为八年制，纳入清华大学招生。09年在湖南计划招收4名理科生。08年录取最低分638分。不招收保送生和自主生。
588浙江,ch*** (浙江),2006-06-23 16:31,老师好!浙江理科588能进贵校吗?,请参考我校护理学专业往年的分数
贵校是否承认少数民族自治州的照顾分,xu*** (四川),2006-06-23 15:38,老师您好！我是四川凉山州的汉族，在四川有10分照顾分，请问贵校认吗？,我校的临床医学专业在四川有招生计划，纳入清华大学招生，至少要过清华大学的提档线。详细情况请咨询清华大学招生办老师。
浙江理科587分,ga***82 (浙江),2006-06-23 15:21,我是浙江的考生理科587分，能报贵校吗？有那些专业能被录取的可能性大一点？,请参考我校护理学专业历年的分数线
转专业,ye*** (浙江),2006-06-23 14:26,请问在读书的过程中能否转专业?如能，则其条件是什么?,临床医学专业前两年半在清华大学学习，是否能转专业要按照清华大学当年的转专业原则来执行。临床医学后五年半、护理学不能转专业。
分数差,ye*** (浙江),2006-06-23 14:17,请问贵校第一志愿与第二志愿之间、第一志愿的第一专业与第二专业之间是否存在分数差(即降分处理),不存在
志愿,ye*** (浙江),2006-06-23 14:14,请问贵校是否只取第一志愿?,在第一志愿未录取满的情况下录取第二志愿
录取,ye*** (浙江),2006-06-23 14:11,您好，我是一名浙江考生，我的分数是650，请问我第一志愿填报贵校被录取的希望有多大?,请参考我校的历年分数线。
请问,yy*** (山东),2006-06-23 13:55,我是山东考生，很想报考贵校，请问25号贵校是否来济南参加高招咨询会，老师的电话是多少？,010-65295964
招生,th*** (江苏),2006-06-23 12:58,江苏考生可否考医学,我校的临床医学专业在江苏有招生计划，纳入清华大学招生，至少要过清华大学的提档线。详细情况请咨询清华大学招生办老师。
招生,th*** (江苏),2006-06-23 12:47,在江苏是否可考基础医学,本科没有基础医学
浙江考生咨询,xu*** (浙江),2006-06-23 10:38,您好!我是浙江考生，今年我考了525分(理科)，贵校有没有三本，以我这样的分数在贵校能报考哪些专业.及其收费情况.能否给我详细解答，非常感谢!,无法报考我校的任何专业
咨询,25*** (云南),2006-06-23 10:11,你好，我是一名云南的理工类考生，我想请问以下本校今年在云南的招生计划.,没有招生计划
nihao,sa***n (河北),2006-06-23 10:00,河北理工类607+10，是否有望，如服从调剂呢,我校的临床医学专业在河北有招生计划，纳入清华大学招生，至少要过清华大学的提档线。
几个问题?,zi*** (浙江),2006-06-23 09:36,请问我620(理)能上贵校吗?贵校在浙江招的临床医学是几年制的?,你的分数可以考虑护理学专业，请参考我校的历年分数线。
一般在高出重点线多少分？或者排名在河北多少可报贵校？,li***g800 (河北),2006-06-23 09:29,一般在高出重点线多少分？或者排名在河北多少可报贵校？,我校的临床医学专业在河北有招生计划，纳入清华大学招生，至少要过清华大学的提档线。
请问,ca*** (北京),2006-06-30 10:21,我什马时候能咨询455这个分数是否能被贵校录取,专科录取结束后
我是理科生,pi*** (北京),2006-06-29 16:23,我考了467，报考护理学专科是否有希望?,不好说，请参考往年分数决定
咨询,pi*** (北京),2006-06-29 16:13,请问贵校护理学专升本的毕业证书和正常本科生的是否一样?,是一样的
提问,in*** (湖北),2006-06-29 14:09,请问贵校在湖北录取二志愿吗？,不录取二志愿
问,in*** (湖北),2006-06-29 13:54,请问贵校在湖北招生么？,临床医学专业，录取3人，纳入清华大学招生计划。
咨询,pi*** (北京),2006-06-29 10:45,我今年考了467分，报考该校的护理专科是否有希望?,护理收文科和理科考生，一律走读，不知道你是文科还是理科考生
区别,un***15 (福建),2006-06-29 10:09,临床医学与中西医临床医学有何区别？,一般所说的临床医学应该是西医的，对中医的学习比较少。你所说的中西医临床医学我校没有，请咨询开设此专业的学校
转系,lz*** (山东),2006-06-29 09:10,贵校护理学学生是否可能转入临床医学？有什末要求？谢谢回答！,护理不能转临床
招生？？,34*** (广西),2006-06-28 16:53,广西考生可以报贵校吗？？,没有招生计划
7777777777,ma*** (云南),2006-06-28 16:18,我今年考了云南文421能起本校吗???能上１专或预科吗？？？？希望大吗？？,没有招生计划
请问．,ci*** (福建),2006-06-28 11:50,我在清华的招生计划中看到临床医学怎么是四年制的？感觉有点奇怪．临床应该没有四年制的吧．．．,我们的临床医学专业是八年制的，请咨询清华大学招生办的老师
请问,ci*** (福建),2006-06-28 11:49,我在清华的招生计划里看到的临床医学是四年的？我觉得有点奇怪．．．想请老师给我解释一下．．．临床应该没有四年制的啊．,我们的临床医学肯定是八年制的。我不知道四年制的临床医学，请咨询清华大学招生办的老师。
老师您好！,pi*** (黑龙江),2006-06-28 11:29,我查到贵校在黑龙江没有招生先例，我明年参加高考，请问老师明年可能在黑龙江招生吗？,请于2007年二至三月份打电话咨询我校07年的招生计划。电话：65249442
老师您好！,pi*** (黑龙江),2006-06-28 11:25,请问贵校在黑龙江有招生计划吗？,没有招生计划
明天是填志愿的最后截止~~~~~急急急~~~谢谢,jo*** (山东),2006-06-27 16:56,明天是填志愿的最后截止~~~~~急急急~~~谢谢我是山东理科考生今年考了612分（15000名左右）请问报考贵校有无希望？？？？希望多大？非常感谢！,第一年在山东招生，无往年分数可以参考。
你好,we***5 (山东),2006-06-26 12:22,我是山东考生642上贵校有把握吗？,可以考虑我校护理专业。
北京理科387护理（高职）能否被录取？,hu***ao (北京),2006-06-26 12:18,我妹妹今年的高考分是387是理科请问能被贵校的护理（高职）专业录取的几率大吗,不好说，可能录取的几率不大。
重庆招生组电话,pa*** (重庆),2006-06-26 11:31,我是重庆理科考生，高考分数为661+10分，想上贵校临床医学专业，请问有没有希望?,我校临床医学专业纳入清华大学招生，请咨询清华大学的招生组。
北京考生,13***14 (北京),2006-06-26 11:08,我今年考了440分，可以上贵校的专科吗？几率有多大？贵校的开放日是哪天？谢谢！,我校的开放日在4月份举行过了。你的分数能否上我校专科不好说，要看报名情况。
紧急！,ss*** (山东),2006-06-26 10:23,山东潍坊理科考生545能上贵校三本吗,我校没有三本。
录取,ji*** (湖北),2006-06-26 10:10,我是理科考生，642分，全省361名，请问录取希望大吗？,我校临床医学在湖北有3个招生计划，纳入清华大学招生，请咨询清华大学招生办的老师。
