标题,来源,时间,问题,回答
两校关系,hx*** (安徽),2008-06-12 08:58,老师:您好!我是安徽考生，我想咨询一下老师，一:贵校与北京的华电是什么关系，是一所学校两个校区，还是两所学校一个校名.二:贵校在安徽招生分数与一本分差每年大约是多少?哪几类的专业是属于强专业，需要多少分可以才能报.三:贵校各专业的学生就业是不是全部在电力系统?或者说在电力系统就业比例有多少?,[第一，华北电力大学（保定）和华北电力大学（北京）同属华北电力大学，两校区实行一体化管理，在校生分别录取并在各自校区就读，毕业生统一颁发华北电力大学的毕业证书和学位证书。华北电力大学校部原设在保定，1995年合并北京动力经济学院为华北电力大学北京校区，2005年，经教育部批准，校部注册地由保定变更为北京。保定办学历史较长，基础雄厚，师资优良，具有良好的校风学风。根据学校“十一五”发展规划的要求，学校将充分发挥保定教育基础雄厚的优势，着力打造一流的本科教育基地。保定校园占地面积800余亩，基础设施完备，环境优美，共有各类在校生约14000人，其中本专科生约11000人。第二，07年我校在安徽录取最低分为589，超过重点线26分。其余年份请参考：http://202.206.208.40/zs/ShowClass2.asp?ClassID=2。第三，学校就业采用双向选择、自主择业的方式，并不局限于电力系统内部。
咨询,qi***18 (河北),2008-06-12 08:50,河北考生高出三本线多少分可录取,请参考我校07年河北录取分数：http://202.206.208.40/zs/ShowArticle.asp?ArticleID=1659。
现在还不能确定?????,19*** (广西),2007-07-11 17:54,一批一志愿已经录取完了不可以统计吗?有没有可能在广西复征志愿吗?还是一志愿都招满了，没有可能了^^?有没有可能在复征时追加计划?如果我的分蛮高的呢?急需答复^,广西区的录取工作正在进行中，请耐心等待。
开档线,ti***ongou (天津),2007-07-11 14:08,请问：天津开档线是多少？谢谢！,560左右
关于今年贵校有没有可能在广西进行复征志愿?,19*** (广西),2007-07-11 10:54,^,看具体情况！
咨询视力,mn***jhg (福建),2007-07-11 10:52,请问:一眼视力4.2(弱视，戴眼睛没用)，另一眼近视(戴400度)，这样可以报贵校的物理学系吗?,在这方面没有太大限制
咨询,ba*** (广西),2007-07-11 01:28,老师，你好。我是广西考生考了理科623分，能不被你校提档。,一般不会！
关于招生网,ou*** (广西),2007-07-10 13:53,老师您好！为什么招生网都进不得还有我想问我们这里具体知道录取结果的时间~~谢谢啦,16好左右！
请问,25*** (福建),2007-07-10 12:34,我是福建理科考生，我想请问一下怎么第一时间知道是否有被录取。谢谢！,我校正在开展招生录取工作，贵省录取情况于7月底出来，请及时关注我校招生信息网的最新动态。
咨询,li***10 (山东),2007-07-10 09:51,老师您好!请问艺术类考生什么时间能查到录取结果，今天能在网上公布吗?真是着急啊!,我校正在开展招生录取工作，请耐心等待几天，最新信息我们会在我校招生信息网上公布。
专业问题,c0*** (内蒙古),2007-07-09 20:02,我是内蒙理科生593分无加分请问在报考贵校时前四个专业顺序按照电气工程及其自动化通信工程机械工程及其自动化电子信息科学与技术是否合适?哪个专业的录取机会较大?谢谢老师,你好，我校近期正在开展招生录取工作，请耐心等待，相关信息请及时关注我校招生信息网。
请问,yc*** (山东),2007-07-05 21:31,请问艺术类的录取结果何时能够公布，通知书大概要什么时候才能发出，希望得到一个具体的时间，谢谢老师,同学你好，正在录取过程中，请耐心等待几天。录取结果出来后我校会在网上公布相关信息，请及时关注！
请问,yc*** (山东),2007-07-05 17:17,请问艺术类的录取结果何时能够公布，通知书大概要什么时候才能发出，希望得到一个具体的时间，谢谢老师,同学你好，正在录取过程中，请耐心等待几天。录取结果出来后我校会在网上公布相关信息，请及时关注！
重要概念，亟待解释,yc*** (山东),2007-07-05 15:59,老师您好，我是山东的艺术类考生，有个概念急需要您来帮忙解释，这个直接关系到能否被录取，请您帮忙，谢谢。在华电网站上找到那么一条，去年在山东艺术类录取专业最低分是253，请问这个253究竟是指什么？A.所有专业合格的考生中专业最低分是253B.所有被华北电力大学正式录取的考生（收到录取通知书的考生）中的最低专业分数是253。老师是哪个对，请求速答，谢谢谢谢。,后者正确！
咨询,li***10 (山东),2007-07-05 11:36,请问艺术类学生什么时间能在网上查到录取信息?谢谢!,同学你好，正在录取过程中，请耐心等待几天。录取结果出来后我校会在网上公布相关信息，请及时关注！
咨询,zh***55 (山东),2007-07-05 07:33,请问电气工程即自动化是大类招生吗,你好，是大类招生，入学后二年级分具体方向。
请问专业情况,zx***4 (浙江),2007-07-04 10:41,老师，你好。我是浙江考生考了理科623分，能不被你校提档。另外请问你校的电气信息类（中外合作）专业主要包括那些专业，是否包含电气工程及其自动化。,[2007年我校在浙江省的招生计划为86人，其中理工类78人。2004——2006年理工类录取分数分别为：585，551，588。根据我们的经验，我校在贵省的理工类录取分数一般高出重点线10-20分左右另外，今年的录取分数主要取决于贵省一志愿报考我校的考生人数及今年考试的难易程度。合作办学指的是电气工程及其自动化专业。
咨询,li***10 (山东),2007-06-27 16:17,老师好!关于贵校艺术专业合格证能否用于科技学院，得到两种回答，一是可以，二是不可以，请问究竟是行还是不行.谢谢!,我们两边是分开测试的，不可以。
？？？,ng*** (贵州),2007-06-27 16:09,�������589¼ȡϣ���Ƿ��?һ����536,欢迎报考！祝你好运！
l理科,ng*** (贵州),2007-06-27 15:53,贵州理科589希望是否大?,[2007年我校在贵州省的招生计划为63人，其中：文史类6人，理工类57人。2004——2006年文史类录取分数分别为：538，562，545。理工类录取分数分别为：497，565，548。根据我们的经验，我校在贵省的理工类录取分数一般高出重点线15-25分左右，文史类一般高出重点线10分左右。另外，今年的录取分数主要取决于贵省一志愿报考我校的考生人数及今年考试的难易程度。欢迎报考，祝你好运！
咨询-----急!!!!!!!!!!!,wu*** (河北),2007-06-27 15:42,河北文科考生，分数533(含独生子女照顾10分)报考贵校本3科技学院会计专业，能否被录取谢谢,2007年我校科技学院在河北省的招生计划为：946人，其中：文史类79人，理工类841人，艺术类26人。2005——2006年文史类录取分数分别为：508，548。理工类录取分数分别为：503，538。
黑龙江考生,12*** (黑龙江),2007-06-27 15:25,请问贵校的三表分数黑龙江是多少2006年的也行478有希望吗,2007年我校科技学院在黑龙江的招生计划为40人，其中：文史类5人，理工类35人。2005——2006年文史类录取分数分别为：495，450。理工类录取分数分别为：517，504。
jiangsu 物化,zh***984 (江苏),2007-06-27 15:02,老师您好！物化624色盲报电子类的那些受限？,电子类不受限制。
在线咨询,ah***ng (安徽),2007-06-27 14:34,我是安徽考生，我考了605，能否报考贵校？,[2007年我校在安徽省的招生计划为71人，其中：文史类6人，理工类65人。2004——2006年文史类录取分数分别为：567，552，585。理工类录取分数分别为：579，543，566。根据我们的经验，我校在贵省的理工类录取分数一般高出重点线10分左右，文史类一般高出重点线10分以内。另外，今年的录取分数主要取决于贵省一志愿报考我校的考生人数及今年考试的难易程度。欢迎报考，祝你好运！
河南理科,ao*** (河南),2007-06-27 14:21,老师您好我的分数是601分超过重点线5分请问被贵校录取的可能性大吗,[2007年我校在河南省的招生计划为87人，其中：文史类8人，理工类79人。2004——2006年文史类录取分数分别为：601，565，591。理工类录取分数分别为：600，570，591。根据我们的经验，我校在贵省的理工类录取分数一般高出重点线10分左右，文史类一般高出重点线10分以内。另外，今年的录取分数主要取决于贵省一志愿报考我校的考生人数及今年考试的难易程度。欢迎报考，祝你好运！
专业`,zh***03 (浙江),2007-06-27 14:18,与电力有关的专业，都有什么??,你好，请参考我校专业介绍：http://202.206.208.40/zs/index.asp
色盲的专业,zh***984 (江苏),2007-06-27 14:14,老师您好！！除了色盲受限的专业，贵校的其他专业什么比较好？,"请参考我校学科建设：http://gaokao.chsi.com.cn/sch/schoolInfo;schId,69;categoryId,39653;mindex,2.html"
关于华北电力大学科技学院,li*** (海南),2007-06-27 14:10,我是海南的理科考生，高考成绩是486，有希望上华北电力大学科技学院吗？听说贵校有三个校区，对吗？华北电力大学科技学院和北京校区和保定的老校区在毕业正和学位证上是否有区别？请老师尽快回答。,[2007年我校科技学院在海南省的招生计划为20人，其中：文史类3人，理工类17人。2006年文史类录取分数为：628。理工类录取分数为：554。根据教育部有关文件的要求，独立学院学生的毕业文凭由独立学院颁发，即毕业证书全部以华北电力大学科技学院的名称加盖印章，单独发放；符合学位授予条件的，由华北电力大学颁发学位证书。
请老师帮忙！！,zh***984 (江苏),2007-06-27 13:49,老师您好，我是江苏的物化生，考了624，可以考取贵校吗？物品是色盲，单颜色完全可以分清，什么专业不能报？？,由于热能与动力工程、自动化、艺术设计、应用化学、电气工程及其自动化专业对辨色力有较高要求，录取时从严执行，所以色盲色弱考生不建议报考。
老师好,zh*** (河北),2007-06-27 13:41,我是河北理，今年考了594分，报贵校预科生希望大吗？（一本线587分）谢谢老师,我校去年在河北的预科班录取分数是577分，请参考！
老师好,zh*** (河北),2007-06-27 13:41,我是河北理，今年考了594分，报贵校预科生希望大吗？（一本线587分）谢谢老师,我校去年在河北的预科班录取分数是577分，请参考！
老师好,zh*** (河北),2007-06-27 13:39,我是河北理，今年考了594分，报贵校预科生希望大吗？（一本线587分）谢谢老师,你好，我校去年的预科班录取分数是577分，请参考。
~~save ~~,da***nd (广西),2007-06-26 16:40,贵校各个专业在广西的录取分？找不到```,请查询http://202.206.208.40/zs/ShowArticle.asp?ArticleID=1597
问``~~~,da***nd (广西),2007-06-26 16:30,贵校有专业级差吗？,有，是3分。
二志愿,ca*** (安徽),2007-06-26 16:24,请问贵校是否招收二志愿考生?有无专业级差?谢谢,我校优先录取第一志愿的考生，专业级差是3分。
提问,3w*** (云南),2007-06-26 16:21,我是云南考生，今年一本线560，我的分数高出一本67分，请问能否录取到电气工程与自动化专业?,我校该专业06年在云南的录取线是607，请你参考，欢迎报考，祝你好运！
咨询,25*** (福建),2007-06-26 16:15,请问进入贵校后可否转专业？,我校在一年级升二年级的时候专业排名前3%，学分绩80分以上的优秀学生可以转专业。
老师好！录取信息,ti***ongou (天津),2007-06-26 15:49,老师好！录取信息什么时候发布？如果已被贵校提档，是否就意味着已被录取？如果电气工程及自动化专业服从调剂，那么可调剂的专业有哪些呢？与电有关系吗？会不会差别很大？谢谢老师！麻烦老师详尽回答，我很着急。再次感谢！,录取信息将在七月中旬左右公布。如果被提档，并不意味已被录取。如果服从调剂，我们将尽可能的调剂到工科类的专业。欢迎报考，祝你好运！
山东考生,ls*** (山东),2007-06-26 15:34,我是山东的一名考生，今年考了591分，比我省的重点线573分高了18分，请问老师，一志愿报考贵校，能否被录取,[2007年我校在山东省的招生计划为110人，其中：文史类8人，理工类85人，艺术类17人。2004——2006年文史类录取分数分别为：600，572，575。理工类录取分数分别为：627，597，599。根据我们的经验，我校在贵省的理工类录取分数一般高出重点线20分左右，文史类一般高出重点线10分以内。另外，今年的录取分数主要取决于贵省一志愿报考我校的考生人数及今年考试的难易程度。欢迎报考，祝你好运！
咨询,li***10 (山东),2007-06-26 15:33,老师您好，我是山东艺术考生，有贵校本部的专业合格证，请问华北电力大学科技学院该是否承认合格证？若未被录取，能否报科技学院？谢谢,我们两边是分开加试的，各自参考自己出具的专业合格证，并且都是第一批录取。
广西580分````,ou*** (广西),2007-06-26 15:26,想问下看贵校怎样对待加分``？拜托了```为什么都不回答我的问题~~~~~~~~~~,[2007年我校在广西省的招生计划为62人，其中：文史类6人，理工类56人。2004——2006年文史类录取分数分别为：675，567，572。理工类录取分数分别为：661，597，546。根据我们的经验，我校在贵省的理工类录取分数一般高出重点线20分左右，文史类一般高出重点线10分左右。另外，今年的录取分数主要取决于贵省一志愿报考我校的考生人数及今年考试的难易程度。我校在投档的时候看加分，分专业的时候按原始分。欢迎报考，祝你好运！
山东考生 将报志愿  加急  谢谢,zj*** (山东),2007-06-26 15:13,山东文科考生高考成绩606报考贵校有几成把握?可有选择志愿的余地?急急急帮帮忙谢谢,2007年我校在山东省的招生计划为110人，其中：文史类8人。2004——2006年文史类录取分数分别为：600，572，575。根据我们的经验，我校在贵省的文史类一般高出重点线10分以内。另外，今年的录取分数主要取决于贵省一志愿报考我校的考生人数及今年考试的难易程度。欢迎报考，祝你好运！
请问投档比例,66*** (浙江),2007-06-26 15:11,我是浙江考生，理超重点线11分，请问投档比例及录取的可能性.谢谢!,[2007年我校在浙江省的招生计划为86人，其中：文史类8人，理工类78人。2004——2006年文史类录取分数分别为：577，569，583。理工类录取分数分别为：585，551，588。根据我们的经验，我校在贵省的理工类录取分数一般高出重点线10-20分左右，文史类一般高出重点线10分以内。另外，今年的录取分数主要取决于贵省一志愿报考我校的考生人数及今年考试的难易程度。欢迎报考，祝你好运！
您好,li***ong2008 (山西),2007-06-26 14:47,请问贵校在山西的录取分数线是多少？,[2007年我校在山西省的招生计划为82人，其中：文史类7人，理工类75人。2004——2006年文史类录取分数分别为：584，534，569。理工类录取分数分别为：589，551，561。根据我们的经验，我校在贵省的理工类录取分数一般高出重点线10到20分左右，文史类一般高出重点线10分以内。另外，今年的录取分数主要取决于贵省一志愿报考我校的考生人数及今年考试的难易程度。欢迎报考，祝你好运！
请教老师.我是贵州的考生能录取吗?,ha*** (贵州),2007-06-26 14:45,我在一自愿报的贵校，分出来后，我很伤心.只考577分，不知道能录取吗?能得到电气工程与自动化吗?还有自动化吗?谢谢老师!,[2007å¹´ææ¡å¨è´µå·ççæçè®¡åä¸º63äººï¼å¶ä¸­ï¼æå²ç±»6äººï¼çå·¥ç±»57äººã2004ââ2006å¹´æå²ç±»å½ååæ°åå«ä¸ºï¼538ï¼562ï¼545ãçå·¥ç±»å½ååæ°åå«ä¸ºï¼497ï¼565ï¼548ãæ¹æ®æä»¬çç»éªï¼ææ¡å¨è´µçççå·¥ç±»å½ååæ°ä¸è¬é«åºéç¹çº¿15-25åå·¦å³ï¼æå²ç±»ä¸è¬é«åºéç¹çº¿10åå·¦å³ãå¦å¤ï¼ä»å¹´çå½ååæ°ä¸»è¦åå³äºè´µçä¸å¿æ¿æ¥èææ¡çèçäººæ°åä»å¹´èè¯çé¾æç¨åº¦ã06å¹´ææ¡çµæ°ä¸ä¸çå½ååæ°ä¸º596ï¼èªå¨åä¸º573ï¼æ¬¢è¿æ¥èï¼ç¥ä½å¥½è¿ï¼
专业,zh***03 (浙江),2007-06-26 14:30,贵校的哪些专业较为热门,我校的电气工程、热能与动力工程、自动化、机械工程等专业都相对比较热门。欢迎报考，祝你好运！
紧急求助,zw*** (福建),2007-06-26 14:11,老师您好，我是福建理科考生，高出本一线21分报考贵校有希望吗?谢谢.,[2007年我校在福建省的招生计划为69人，其中：理工类63人。2004——2006年理工类录取分数分别为：537，557、573。根据我们的经验，我校在贵省的理工类录取分数一般高出重点线15分左右。另外，今年的录取分数主要取决于贵省一志愿报考我校的考生人数及今年考试的难易程度。欢迎报考，祝你好运！
紧急咨询,20*** (山西),2007-07-03 21:23,老师您好：我是山西考生，今年的高考成绩是587不知道是否能被录取，可学校补习班就要开学了，不知道该怎么办？,[2007年我校在山西省的招生计划为82人，其中：文史类7人，理工类75人。2004——2006年文史类录取分数分别为：584，534，569。理工类录取分数分别为：589，551，561。根据我们的经验，我校在贵省的理工类录取分数一般高出重点线10到20分左右，文史类一般高出重点线10分以内。另外，今年的录取分数主要取决于贵省一志愿报考我校的考生人数及今年考试的难易程度。欢迎报考，祝你好运！
天津考生,ti***ongou (天津),2007-07-03 16:31,老师好！天津考生报考贵校的多吗？高出一本线46分希望大吗？您校什么时候发布开档线呢？真是着急啊！谢谢您正面回答好吗？,我校在贵省的理工类录取分数一般高出重点线20到30分左右即认为比较有希望，你的分数属于比较有把握的阶段。录取线的划定需要等待进一步的安排，预计七月中旬左右，我们将在第一时间公布录取结果。
咨询,qm*** (青海),2007-07-03 12:52,老师您好，我是青海理科考生，分数线高出录取线80分，请问老师，报考贵校(保定)有希望吗,2007年我校在青海省的招生计划为55人，其中理工类52人。2004——2006年理工类录取分数分别为：456，452，491。根据我们的经验，我校在贵省的理工类录取分数一般高出重点线30分左右。另外，今年的录取分数主要取决于贵省一志愿报考我校的考生人数及今年考试的难易程度。欢迎报考，祝你好运！
英语,ti***ongou (天津),2007-07-03 10:50,老师好！请问做为大一新生，今年12月份能否参加大学英语四级的考试？听说有的大学是不允许考的，华电可以考吗？谢谢老师！另外，我弟弟是天津考生555分能录取吗？可以选专业吗？,[你好，大学英语四级考试时间由学校教务处来定。2007年我校在天津市的招生计划为58人，其中：文史类7人，理工类51人。2004——2006年文史类录取分数分别为：528，507，497。理工类录取分数分别为：532，475，547。根据我们的经验，我校在贵省的理工类录取分数一般高出重点线20到30分左右，文史类一般高出重点线10分左右。另外，今年的录取分数主要取决于贵省一志愿报考我校的考生人数及今年考试的难易程度。欢迎报考，祝你好运！
咨询,qm*** (青海),2007-07-03 06:15,我是青海理科考生，分数高出录取线80分，请问老师，报考贵校有希望吗,[2007年我校在青海省的招生计划为55人，其中：文史类3人，理工类52人。2004——2006年理工类录取分数分别为：456，452，491。根据我们的经验，我校在贵省的理工类录取分数一般高出重点线30分左右。如果高出重点线80分，应该是很有希望的。另外，今年的录取分数主要取决于贵省一志愿报考我校的考生人数及今年考试的难易程度。欢迎报考，祝你好运！
提档,ba*** (内蒙古),2007-07-02 16:19,老师您好!请问贵校是1:1投档还是1:1.2投档?投档之后会被退回来吗?请问贵校有没有入学后换专业的政策?,我校的提档是在1：1.2以内。提档后按照计划人数来录取。我校有转专业的政策，在入学一年后，学习成绩在专业前3%可以申请转专业。
分数问题,ba*** (内蒙古),2007-07-02 14:07,老师您好!我是一名内蒙考生，一直很向往贵校.今年内蒙的理科一本线为559分.我的分数为585+10分民族分，请问被录取的希望大吗?谢谢老师!,[2007年我校在内蒙古的招生计划为75人，其中：文史类7人，理工类68人。2004——2006年文史类录取分数分别为：545，536，546。理工类录取分数分别为：592，583，566。根据我们的经验，我校在贵省的理工类录取分数一般高出重点线20分左右，文史类一般高出重点线10分左右。另外，今年的录取分数主要取决于贵省一志愿报考我校的考生人数及今年考试的难易程度。欢迎报考，祝你好运！
紧急咨询,ba*** (内蒙古),2007-07-02 14:03,老师您好!我是一名内蒙考生.请问贵校在分专业时，民族分有效吗?贵校的专业之间是否有专业级差?,分专业时按原始分录取，第一志愿至第三志愿之间，每两个志愿有3分级差，欢迎报考，祝你好运！
?,su***ig (福建),2007-06-29 14:56,贵校是否有预留二志愿高分考生的名额，二愿考生怎么录,我校没有预留二志愿高分考生的名额，而且我校优先录取一志愿考生，一般一志愿生源比较充足，所以建议一志愿报考。
湖南,ti*** (湖南),2007-06-29 13:07,湖南理科581分，任意选专业有把握吗？请问贵校的特色专业或者就业很好的专业是什么？,[2007年我校在湖南省的招生计划为60人，其中：文史类5人，理工类55人。2004——2006年文史类录取分数分别为：577，574，599。理工类录取分数分别为：553，559，553。根据我们的经验，我校在贵省的理工类录取分数一般高出重点线15分左右，文史类一般高出重点线10分以内。另外，今年的录取分数主要取决于贵省一志愿报考我校的考生人数及今年考试的难易程度。欢迎报考，祝你好运！各专业的录取分数请参考近年录取分数：http://202.206.208.40/zs/ShowClass2.asp?ClassID=2
咨询,an***n (湖北),2007-06-29 12:47,湖北理科考生607，报考贵校第二志愿可否录取?,你好，我校优先录取一志愿考生，在一志愿生源不足的情况下录取二志愿考生。
急急,hj*** (湖北),2007-06-29 11:22,老师好！湖北考生文科５３６分高一本线１１分，报贵校能否录取？,同学你好，2007年我校在湖北省招文史类6人，2004——2006年文史类录取分数分别为：538，507，545。根据我们的经验，我校在贵省的文史类一般高出重点线10分以内。另外，今年的录取分数主要取决于贵省一志愿报考我校的考生人数及今年考试的难易程度。欢迎报考，祝你好运！
请问一下,19*** (云南),2007-06-29 11:09,我是云南文科考生，成绩623，在全省排名725名左右，请问我报考贵校的希望有几成？,同学你好，2007年我校在云南省招生文史类5人，2004——2006年文史类录取分数分别为：531，544，570。根据我们的经验，我校在贵省的文史类一般高出重点线15分以内。另外，今年的录取分数主要取决于贵省一志愿报考我校的考生人数及今年考试的难易程度。欢迎报考，祝你好运！
