标题,来源,时间,问题,回答
专业,mo*** (福建),2006-06-26 20:56,请问贵校是否有双学位或者是双专业的计划?一般在福建要高出本一线多少分才有机会上贵校?福建理科591有希望吗,[　　我校实施了主、辅修制度，这是我校实行学校教学改革的重要举措，是对学生因材施教、培养复合型人才的重要途径。它有利于发挥学分制的灵活性，激发学生的学习积极性，拓宽知识面；有利于培养适应社会发展需求的复合型人才；有利于增强学生在就业中的竞争能力。凡学习努力，学有余力，成绩优良，累计平均学分绩原则上在75分及以上，对本专业以外的某一专业有特殊兴趣的学生均可申请。当申请人数超过辅修专业接纳能力时，学校择优录取。取得主修专业毕业证书，同时修满辅修专业或辅修学位课程学分并完成辅修学位毕业设计（论文）的，经学校审核合格后，发给辅修专业证书或辅修相应学位证书。　　我校03至05在福建省的理工类最低录取分数分别为：494/537/557，03、04年基本与重点线一致，05则高出重点线15分，所以每年的情况不大一致，具体录取分数得看报考我校考生总体情况。
能不能考上贵校,be***dan (吉林),2006-06-26 20:45,我是吉林靠生考了596分我门吉林重本分是570分能不能考上贵校啊？？？？,吉林考生你好：根据往年招生的分数，在吉林的录取分数一般要高出当地录取分数20分左右！请根据自己的成绩合理报考！衷心的祝你好运！
您好！谢谢。,sa*** (山东),2006-06-26 20:24,老师您好，请帮我看看报考贵校专科有希望吗？山东，理科，461分，谢谢老师！！,同学您好，我校今年的录取分数线还未划定．我校０３至０５年在山东省专科理工类最低录取分数分别为：553/600/572.至于今年的录取分数线还得看报考我校考生的总体情况，大家的分数都高那么录取分数就会高．
咨询,ye*** (山东),2006-06-26 20:00,请问贵校除了一本，是否有2本,华北电力大学招收一本，华北电力大学科技学院招收三本；我校不招二本。
请回答,ya***an (河北),2006-06-26 19:35,我河北考生理科522分，上你们专科行吗,同学您好，我校今年的录取分数线还未划定．我校去年在河北省的三本理工类最低录取分数为５０３，至于今年的录取分数线还得看报考我校考生的总体情况，大家的分数都高那么录取分数就会高．
请问,yo***e (山东),2006-06-26 19:35,我是山东艺术文考生专业名次77，文化课成绩400分，报考贵校工业设计专业，请问有多大希望？谢谢！,同学您好，我校今年的录取分数线还未划定．至于今年的录取分数线还得看报考我校艺术类考生的总体情况，大家的分数都高那么录取分数就会高．欢迎报考华北电力大学！
请问,lw*** (山东),2006-06-26 19:32,山东一本为583，606高出它23分，请问能否被贵校录取？,同学您好，我校今年的录取分数线还未划定．我校０３至０５年在山东省理工类最低录取分数分别为：532/627/597．而平均录取分数则高出重点３０分．至于今年的录取分数线还得看报考我校考生的总体情况，大家的分数都高那么录取分数就会高．欢迎报考华北电力大学！
艺术咨询`!!!,so*** (山东),2006-06-26 19:18,老师:您好，我是山东艺术文考生，请问我专业260分，文化课376分，报考贵校有多大希望呢>?请速回````,同学您好，我校今年的录取分数线还未划定．至于今年的录取分数线还得看报考我校艺术类考生的总体情况，大家的分数都高那么录取分数就会高．
贵校三本科分数线多少?,wu***si (山东),2006-06-26 18:48,我是山东考生，分数542，能否上?,我校去年在山东省的理工类最低录取分数为558（理工类），538（文史类），但每年的录取分数还得由当年报考我校的考生的总体高考成绩来定，大家的分数高则录取分数就高．
咨询，我是安徽考生！,za*** (安徽),2006-06-26 18:32,您好！我今年考了590分，今年安徽重点线是566分，我报考的是电气工程及其自动化专业，请问我的希望大吗？,有一定希望，但具体还得看今年报考我校考生的总体情况．我校０３至０５年在安徽省理工类平均录取分数分别为：510/596/566.平均高出重点线30分．
请问入学后，专业能否调剂？,sh***as (山东),2006-06-26 18:23,我是一山东考生，请问入学后专业能否调剂？,[为了进一步调动学生学习的积极性，给予学生较大的学习自主权和选择权，学校允许部分优秀本科学生有条件地重新选择专业。对于品德优良，成绩突出，一年级必修课累计平均学分绩在80分及以上、且专业排名在前3%以内的优秀学生，可以在校区范围内申请转专业（原则上不同学科门类之间不予互转，但根据课程设置实际情况，在国家政策允许的范围内，相近学科门类之间可以互转）。
老师好,he***6 (浙江),2006-06-26 18:04,贵校的毕业证书和学位证书是否和北京校区相同???,都颁发华北电力大学毕业证，华北电力大学学位证。
老师好,he***6 (浙江),2006-06-26 18:02,贵校的毕业证书和学位证书是否与北京校区相同?,华北电力大学毕业证，华北电力大学学位证。
咨询,dr*** (河北),2006-06-26 17:53,老师您好！请问贵校本科三批毕业生能否报考贵校研究生？每个专业都可报考吗？非常感谢！,可以，按国家研究生招考的照相关规定进行。
江苏考生高考为５８５分，本一线为５７２，能报考该校何专业,zq***6 (江苏),2006-06-26 17:27,江苏考生高考为５８５分，本一线为５７２，能报考该校何专业非常感谢,你可以参考往年的录取分数并结合今年高考得实际情况合理填报志愿。往年的录取分数你可以到以下网站查询：http://202.206.208.40/zs/luru.asp?nf=2004祝你好运！
请问老师（急）,02*** (山东),2006-06-26 17:21,贵校最好就业的专业是什么，在山东的录取分大概是多少,我校各专业的就业情况都良好，我校就业率近几年来都高达97%以上。
老师你好,bt*** (内蒙古),2006-06-26 17:19,内蒙古理科考分520.请问报贵校二本有希望吗?拜托了!!!,不好意思，我校没有二本专业。
我是山东理科考生，分数是616，报考贵校电气工程及自动化专业能否被录取？,75*** (山东),2006-06-26 17:15,我是山东理科考生，分数是616，报考贵校电气工程及自动化专业能否被录取？,录取与否还要看今年贵省的高考实际情况和报考人数。你可以参考往年的录取分数并结合今年高考得实际情况合理填报志愿。往年的录取分数你可以到以下网站查询：http://202.206.208.40/zs/luru.asp?nf=2004祝你好运！
嘿嘿..,ci***a12 (山东),2006-06-26 17:12,老实您好:)内容：我是山东艺术文考生，今年文化考了353，专业考了257，报考华北电力有希望么?华北电力对英语单科有要求么?急盼回答.回答：艺术考生内容：你好，你的分数根据往年经验有希望。那老师我得希望大不大呢?因为我只有一次提前批次报考机会，所以还麻烦老师耐心回答下.谢谢!^_^,录取与否还要看今年贵省的高考实际情况和报考人数。你可以参考往年的录取分数并结合今年高考得实际情况合理填报志愿。往年的录取分数你可以到以下网站查询：http://202.206.208.40/zs/detail.asp?id=226祝你好运！
请问？,nm*** (内蒙古),2006-06-26 16:44,老师好！我是内蒙理科考生，内蒙理科一本线557，我的分数511+10，有望考入贵校预科班吗？谢谢回答！,04、05年我校少数民族预科班在内蒙古的录取分数分别为：522、502。但是今年的录取分数还要看今年贵省的高考实际情况和报考人数。你可以参考往年的录取分数并结合今年高考得实际情况合理填报志愿。往年的录取分数你可以到以下网站查询：http://202.206.208.40/zs/luru.asp?nf=2004祝你好运！
你好,ca*** (江苏),2006-06-26 16:39,我是江苏一考生，600分填报贵校的计算机科学与技术有希望吗？,从你的成绩看，希望较大。但是录取与否还要看今年贵省的高考实际情况和报考人数。你可以参考往年的录取分数并结合今年高考得实际情况合理填报志愿。往年的录取分数你可以到以下网站查询：http://202.206.208.40/zs/luru.asp?nf=2004祝你好运！
科技学院,la*** (江苏),2006-06-26 16:37,贵校科技学院颁发的学位证和毕业证与国家统招有何区别，科技学院的毕业生就业是否和国家统招毕业生就业机会均等，用人单位是不是要区别看待，还有就是科技学院是否设有国家奖学金。谢谢老师答复！,[根据教育部有关文件的要求，独立学院学生的毕业文凭由独立学院颁发，即毕业证书全部以华北电力大学科技学院的名称加盖印章，单独发放。符合学位授予条件的，由华北电力大学颁发学位证书。就业时用人单位会不会区别看待这要看用人单位的规定。我校为了鼓励学生刻苦学习，奋发向上，表彰先进，树立榜样，促进学生德智体全面发展，对品学兼优的学生进行奖励，实行奖学金制度。综合奖项分设为：三好学生标兵、三好学生奖项。还设有思想道德表现优秀奖、学习优秀奖、科技创新能力优秀奖、社会工作优秀奖、文化活动优秀奖、体育活动优秀奖六个单项奖，总获奖面达60%以上。另外，还有日常各项活动的表彰和相应的奖励措施。
1,li***456 (安徽),2006-06-26 16:26,科技学院494是否可以填报?我是安徽的,录取与否还要看今年贵省的高考实际情况和报考人数。你可以参考往年的录取分数并结合今年高考得实际情况合理填报志愿。往年的录取分数你可以到以下网站查询：http://202.206.208.40/zs/luru.asp?nf=2004祝你好运！
重要,li***456 (安徽),2006-06-26 16:23,我是安徽的，我考了494，可以填报吗?,录取与否还要看今年贵省的高考实际情况和报考人数。你可以参考往年的录取分数并结合今年高考得实际情况合理填报志愿。往年的录取分数你可以到以下网站查询：http://202.206.208.40/zs/luru.asp?nf=2004祝你好运！
急,ya***an (河北),2006-06-26 11:02,你们有专科吗？我河北考生理科522。上你们专科可以吗？,你好：我校06年在河北招收的专科考生有会计学，火电厂集控运行，往年的录取分数请参照以下网址http://202.206.208.40/zs/luru.asp?nf=2004感谢你对我校的关注！
火电厂集控运行专业?,me***heng (河南),2006-06-26 10:59,老师，火电厂集控运行专业(专科)有前途吗?前景如何?能客观些吗?(我以朋友的身份向你请教!)非常感谢!!,你好：我校的火电厂继空运行所学习的知识是可以胜任电厂工作的，所以其就业前景也肯定是一片光明！感谢你对我校的关注！
您好,hu*** (吉林),2006-06-26 10:54,老师好，请问河北理科考生612+5分报考贵校电气工程与自动化录取的希望大吗？热能与动力工程呢？贵校电气工程与自动化的中英联合办学是怎么回事，怎样招生,[河北考生你好：针对我校历年的录取分数，一般要高出当地重点线20-30分左右，而今年各专业的录取分数还与专业报考人数有关，我校的电气工程，自动化，热能与动力工程是优势专业，录取的分数会相对高一些！所以，请针对自己的兴趣爱好，合理报考！我校在本科层次上先后在电气工程及其自动化专业与英国斯莱斯克莱德大学UniversityofStrathclyde合作办学，在热能与动力工程专业与法国格勒诺布尔理工大学合作办学。每个专业招生40人，学制为4年。电气工程及其自动化专业在北京和保定分别举办，第一、二学年在我校就读，达到英方录取要求且申请到留学签证后，第三学年和第四学年的上学期赴英方完成后续学业，第四学年的下学期回我校完成毕业论文（设计）。热能与动力工程专业在北京举办，学生在我校圆满完成前3年学业，达到法方录取要求且申请到留学签证后，第4年赴法方就读，在国内学习期间，将开设法语第二外语课程。参加以上国际合作办学项目的学生在完成各教学环节，通过各项考试且成绩合格者，由中外双方分别授予两校的学士学位。衷心的祝你好运！
我是四川的考生,xu***868 (四川),2006-06-26 10:51,我看了下贵校保定本部近三年在川的招生情况，03年省控488，贵校实录线488，04年省控544，贵校实录线547，05年省控线598，贵校613，而那05报考贵校的四川考生是贵校实际招生人数的3倍，而川内及附近的几所高校，如川大，电子科大，重庆大学都严重招生不足。如果依照这种情况来看，我今年分数582，省控线560，上贵校电气工程及其自动化的概率大不大呢？,四川考生你好：根据往年招生的分数，在当地的录取分数一般要高出当地录取分数10分左右！我校电气工程及其自动化是重点专业，所以会比一般的录取分数稍微高一些，具体的录取分数还与报考人数和试题的难易程度有关！请结合自身成绩和兴趣爱好，合理报考！欢迎报考我校！
咨询,mi*** (河北),2006-06-26 10:47,贵校今年招收专科生吗,同学，你好，我校今年仍招收专科生。
山东考生,17*** (山东),2006-06-26 10:45,山东考生理科562分一志愿能否被贵校录取可以的话我应该报哪些专业希望较大？谢谢,考生你好：根据我校在山东的往年录取分数，一般要高出当地重点线20分左右，所以清针对自己的成绩合理报考！我校的专业设置请参照以下网站：http://202.206.208.40/zs/aboutzhuanye.htm感谢你对我校的关注！
贵学校本三?,me***heng (河南),2006-06-26 10:41,本三是私人办学吗?也就是贵学校的二级学院?学费贵吗?,你好，科技学院是我校主办的二级学院。学费每年10000。
老师好,he***6 (浙江),2006-06-26 10:40,我是浙江考生，考分608，重点线570，省名次10300左右，报考贵校一些热门专业，有多少把握?,你好，你的分数有希望，选专业的余地较大。
速回,ta***ali (河北),2006-06-26 10:40,请问河北理科考生考了541分，报贵校“本三”有多大希望？速回,同学，你好，我校科技学院在贵省的录取分数线比较接近贵省的二本线，请根据你的实际情况考虑。
关于。。。,xu***868 (四川),2006-06-26 10:36,我是四川考生，请问贵校的电气工程及其自动化的各种方向是不是入校后确定？依照考生的什么来分该专业方向,同学，你好，我校电气工程及其自动化的各种方向在入学第二年根据学生在大一的成绩以及学生的兴趣确定。
专业,22*** (云南),2006-06-26 10:36,专业级差是多少,同学，你好，我校第一与第二志愿专业级差为3分。
接近重点分数不上别校，专科也要在贵校!!,me***heng (河南),2006-06-26 10:35,老师你好!我是河南的考生，分数580，不知道有没有希望上贵学校电气工程专业的专科!希望有多大?谢谢!!,你好，我们学校专科只有火电厂集控运行专业，你的分数上专科请考虑清楚。
有把握吗?,ja*** (广西),2006-06-26 10:29,我，广西人，今年566(理科)，第一志愿投贵校选电气工程及自动化，有把握吗?,广西考生你好：针对我校历年的录取分数，一般要高出当地重点线20分左右，而今年各专业的录取分数还与专业报考人数有关，所以，请针对自己的兴趣爱好，合理报考！衷心的祝你好运！
山东 理科604，报考贵校有希望吗,xi*** (山东),2006-06-26 10:24,山东理科604，报考贵校有希望吗，麻烦老师！,山东考生你好：针对我校历年的录取分数，一般要高出当地重点线10分左右，而今年各专业的录取分数还与专业报考人数有关，所以，请针对自己的兴趣爱好，合理报考！欢迎报考我校！
617,kj*** (山东),2006-06-26 10:24,山东理科617分，报考贵校电气信息类专业有多大把握？,山东考生你好：针对我校历年的录取分数，一般要高出当地重点线10分左右，而今年各专业的录取分数还与专业报考人数有关，所以，请针对自己的兴趣爱好，合理报考！欢迎报考我校！
在浙江,ya***25 (浙江),2006-06-26 14:41,贵校的重点专业有哪些?,我校有一个国家重点学科，十个省部级重点学科。具体情况请到我校网站查询：www.ncepubd.edu.cn
老师你好,ca*** (江苏),2006-06-26 14:15,我是江苏一考生600分可以报考贵校的保定校区吗？,录取与否还要看今年贵省的高考实际情况和报考人数。你可以参考往年的录取分数并结合今年高考得实际情况合理填报志愿。往年的录取分数你可以到以下网站查询：http://202.206.208.40/zs/luru.asp?nf=2004祝你好运！贵校电气工程及自动化有希望吗?
wen,li*** (湖北),2006-06-26 14:05,湖北理科第一批549，我的分数561不高，但我高中曾获全国英语竞赛二等奖，湖北化学奥赛荆门赛区三等奖，并发表文章多篇，请问贵校录取的可能性具体有多大，能录取到哪些专业,录取与否还要看今年贵省的高考实际情况和报考人数。你可以参考往年的录取分数并结合今年高考得实际情况合理填报志愿。往年的录取分数你可以到以下网站查询：http://202.206.208.40/zs/luru.asp?nf=2004祝你好运！
文542可不可以报考贵校,13***73 (河北),2006-06-26 14:01,文542可不可以报考贵校,你好，你的分数有希望。
苦恼,13*** (江苏),2006-06-26 14:00,江苏597分可以进贵校吗若可以专业可选信息与计算科学或电气工程及其自动化吗,电气工程及其自动化专业属于近几年来的热门专业，录取与否还要看今年贵省的高考实际情况和报考人数。你可以参考往年的录取分数并结合今年高考得实际情况合理填报志愿。往年的录取分数你可以到以下网站查询：http://202.206.208.40/zs/luru.asp?nf=2004祝你好运！
590,ji*** (浙江),2006-06-26 13:57,我是浙江考生，考分590，重点线570，省名次18000左右，报考贵校一些热门专业，有多少把握,有一定希望，但录取与否还要看今年贵省的高考实际情况和报考人数。你可以参考往年的录取分数并结合今年高考得实际情况合理填报志愿。往年的录取分数你可以到以下网站查询：http://202.206.208.40/zs/luru.asp?nf=2004祝你好运！
山东理科598分能否报贵校,ts*** (山东),2006-06-26 13:45,麻烦老师,录取与否还要看今年贵省的高考实际情况和报考人数。你可以参考往年的录取分数并结合今年高考得实际情况合理填报志愿。往年的录取分数你可以到以下网站查询：http://202.206.208.40/zs/luru.asp?nf=2004祝你好运！
急,ni*** (黑龙江),2006-06-26 13:44,我是黑龙江考生，570分是否可以报考贵校,录取与否还要看今年贵省的高考实际情况和报考人数。你可以参考往年的录取分数并结合今年高考得实际情况合理填报志愿。往年的录取分数你可以到以下网站查询：http://202.206.208.40/zs/luru.asp?nf=2004祝你好运！
浙江613,23*** (浙江),2006-06-26 13:38,你好613高43分8858名有希望上电气及其自动化吗,从往年的情况来看你被录取的希望较大，但是录取与否还要看今年贵省的高考实际情况和报考人数。你可以参考往年的录取分数并结合今年高考得实际情况合理填报志愿。往年的录取分数你可以到以下网站查询：http://202.206.208.40/zs/luru.asp?nf=2004祝你好运！
我是重庆考生，高考成绩474,xx*** (重庆),2006-06-26 13:36,尊敬的招生老师，您好！我是重庆考生，高考成绩474，想报考贵校三本科技学院的专业，不知道上的可能性大不?以下是我初步的志愿计划电气工程及其自动化\热能与动力工程\自动化\通信工程\机械工程及自动化\农业电气化与自动化，不知道这样填是否合适，能否考上贵校?针对我的情况，对我填报您校有何建议，谢谢!因这2天要填志愿，盼复!,[录取与否还要看今年贵省的高考实际情况和报考人数。你可以参考往年的录取分数并结合今年高考得实际情况合理填报志愿。电气工程及其自动化、热能与动力工程、自动化等专业是今几年来报考的热门，不推荐这样填报，专业志愿志愿之间应有一定的梯度。往年的录取分数你可以到以下网站查询：http://202.206.208.40/zs/luru.asp?nf=2004祝你好运！
579,ik*** (浙江),2006-06-26 13:31,你好，亲问理科579分，总分排名14990，报考贵校希望大不大？报什么专业希望较大？谢了,你好，你的分数有希望。专业请参考：http://202.206.208.40/zs/luru.asp?nf=2004
562有希望吗?,zh*** (新疆),2006-06-26 13:26,老师我的高考分数是562分，有希望被录取吗?,你好，请查看我校在贵省的历年录取分数线：http://202.206.208.40/zs/luru.asp?nf=2004
关于科技学院,05*** (安徽),2006-06-26 13:24,老师您好，我是安徽考生，我今年的考分509，刚过二本几分，我想报考华北电力大学科技学院（三本），华北电力大学与科技学院两者在教学上、毕业分配方面有何区别？谢谢！,[华北电力大学科技学院以华北贷能力大学为依托，共享教学资源。毕业后同样是双向选择。我校于2002年开始招生，今年已有第一届毕业生。我校毕业生就业情况良好，截止到今年4月份，已有80%以上的同学与用人单位签定就业协议或意向签定了就业协议，主要从事科研、管理、生产、教学和设计等工作。
能否上贵校,fl***e316 (山东),2006-06-26 13:08,老师您好，我是一山东考生，文科，高考分571分，比重点线高四分，想报贵校的会计专业，请问有希望吗？,你好，你的分数有希望，专业不一定。
咨询,li***e (河北),2006-06-26 13:04,您好！！我是河北考生，我的理科成绩是５９８+１０，报考贵校是否有希望？,你好，你的分数有希望。
问,st*** (河北),2006-06-25 16:10,河北理科622分报贵校有多大希望,有一定优势，但具体还得看今年报考我校考生总体情况．
咨询,ya***ng (内蒙古),2006-06-25 16:06,老师:我的成绩是626分(理科)，报考了贵校的电力系，不知有多大的把握?,我校０３至０５年在内蒙理工类最低录取分数分别为：478/592/583．平均高出重点线30分，但每年的录取分数还得由当年报考我校的考生的总体高考成绩来定，大家的分数高则录取分数就高．
内蒙考生,ya***ng (内蒙古),2006-06-25 16:04,请问老师:我今年的高考成绩是626分，报考了贵校电力系，有多大的把握?,我校０３至０５年在内蒙理工类最低录取分数分别为：478/592/583．平均高出重点线30分，但每年的录取分数还得由当年报考我校的考生的总体高考成绩来定，大家的分数高则录取分数就高．
急！,xi***aonian (广西),2006-06-25 16:01,请问老师贵校录取专业时承认民族照顾分吗？,对于取得各类加分、减分录取优惠的考生，我校执行各省招办对考生加、减分录取的规定．
急！,xi***aonian (广西),2006-06-25 16:00,请问老师贵校录取专业是承认民族照顾分吗？谢谢！,对于取得各类加分、减分录取优惠的考生，我校执行各省招办对考生加、减分录取的规定．
谢谢！,xi***aonian (广西),2006-06-25 15:59,老师你好我是广西理科考生我今年是561+20（照顾分），广西今年高考重点线是538，请问老师我想报考贵校的通信工程把握大吗？谢谢！,我校历年在广西的一本理工类最低录取分数平均高出重点线15分，以你这个分数报考我校有一定优势，但具体还得看今年报考我校考生总体情况．欢迎报考华北电力大学！
???,ja***987 (河北),2006-06-25 15:46,关于本二A类在河北的招生情况？本二A类的校址？,考生你好：我校今年没有本二A类的招生计划！感谢你对我校的关注！
报考人数,ou***988 (广东),2006-06-25 15:37,请问广东省第一志愿报考贵校的人数是多少？,考生你好：我校尚未对今年报考我校的人数进行统计感谢你对我校的关注！
咨询,ya*** (浙江),2006-06-25 15:15,浙江文科５９３（一批分数线５８３），省排名４４２２，报考贵校希望大吗？,考生你好：根据往年招生的分数，在浙江的录取分数一般要高出当地录取分数10分左右，具体的录取分数还与报考人数和试题的难易程度有关！请结合自身成绩和兴趣爱好，合理报考！
