标题,来源,时间,问题,回答
咨询,xi***93 (河北),2011-06-26 10:00,我是河北考生，高考631分，且已通过贵校的自主招生，请问上贵校的电气工程及其自动化有多大把握。,您好，根据往年录取分数来看，电气工程及其自动化专业一般超出重点线60分左右，是否报考，请务必详细查看往年录取分数并进行分析后决定，录取分数查询网址http://202.206.208.40/zs/ShowClass2.asp?ClassID=2
理科录取,wa*** (山东),2011-06-26 09:57,老师您好我是山东理科考生，今年考620分，想报贵校的工程造价，不知行不行？,您好，根据往年录取分数来看，2008、2009、2010年工程造价专业最低录取分分别高出一本线34、39、51分，您的分数超一本线53分，报考造价专业比较有希望。是否报考，请务必详细查看往年录取分数并进行分析后决定，录取分数查询网址http://202.206.208.40/zs/ShowClass2.asp?ClassID=2
咨询,86*** (河北),2011-06-26 09:55,你好，我是河北理科考生，今年分数是650，想报贵校电气工程及自动化专业，请问录取希望大吗？,您好，根据往年录取分数来看，电气工程及其自动化专业一般超出重点线60分左右，您的分数超一本线69分，报考该专业比较有希望。是否报考，请务必详细查看往年录取分数并进行分析后决定，录取分数查询网址http://202.206.208.40/zs/ShowClass2.asp?ClassID=2
录取+就业,74*** (安徽),2011-06-12 12:34,您好，我是安徽理科考生，请问高出一本多少能上贵校？贵校就业如何？有哪些名企在贵校招人才？希望老师能给一个准确的回答，以便我好定位，谢谢老师了！,[你好，2007-2010年我校在安徽的录取最低分分别高出一本线26分、10分、40分、49分，请参考安徽当地本一线合理报考。详细的分专业分数可登录http://202.206.208.40/zs/ShowClass2.asp?ClassID=2查看。学校与电力行业联系紧密。国家电网公司、中国南方电网有限责任公司、中国华能集团公司、中国大唐集团公司、中国华电集团公司、中国国电集团公司、中国电力投资集团公司七家特大型电力企业集团是学校理事会单位，每年都会来校招聘。具体就业单位情况可登录就业指导中心网站http://202.206.208.40/job2/default.aspx查看
咨询专业,lz*** (河南),2011-06-12 09:24,请介绍一下贵校的优势学科和特色专业.请问智能电网信息工程市场需求大吗？可以预测一下专业录取分数会比一般专业高吗？就业前景如何？,你好，保定校区不设智能电网专业，请咨询北京校区010-51963538。
录取,pi***1 (黑龙江),2011-06-11 16:17,您好！我是黑龙江文科考生，预估530分，报考贵校是否有希望？请您给我一些参考意见。（已阅贵校10年在我省提档线）,你好，今年招生录取工作尚未开始，无法预估今年情况，请登录华电招生网http://202.206.208.40/zs/ShowClass2.asp?ClassID=2参考往年分数报考。
咨询,88***eng (山西),2011-06-11 15:03,山西考生报考贵校，专业间有无级差,你好，我校不设专业级差。
自主招生志愿填报,04*** (河北),2011-06-11 14:54,您好，老师，我阅读了贵校的招生章程，有些疑问请教，在志愿填报时参加了贵校的自主招生，且通过，志愿填报时是不是只要填本一特殊类型批志愿即可，本科一批A志愿是不是不需要填写华电！,[取得我校自主选拔考试入选资格的考生，必须同时具备以下4个条件：（1）必须参加全国统一高考，并且必须在自主选拔录取批次第一志愿和一本批次第一志愿填报我校；实行平行志愿的省区，必须将我校填报为平行志愿的第一顺序学校；（2）在考生所在省（市、区）公布的我校招生专业计划范围内填报专业志愿；（3）在高考成绩不满足所填报专业志愿时服从专业调剂。（4）在规定的时间内将志愿填报信息通过华北电力大学北京校部或保定校区招生信息网进行确认。不在第一志愿填报我校、不在平行志愿的第一顺序学校填报我校、高考填报专业志愿不服从专业调剂、不在规定的时间内将志愿填报信息通过我校招生网进行确认的，均按放弃自主选拔入选资格处理。
山东 自主招生批,pp*** (山东),2011-06-11 14:02,老师您好！我是来自山东省的一名考生，已获贵校2011年自主招生资格。今年山东省共有6个招生批次：提前批，自主招生批，本科一批，本科二批，专科一批，专科二批。您能向我介绍一下贵校在山东省自主招生批的招生办法吗？,[录取办法1、填报志愿取得我校自主选拔考试入选资格的考生，必须同时具备以下4个条件：（1）必须参加全国统一高考，并且必须在自主选拔录取批次第一志愿和一本批次第一志愿填报我校；实行平行志愿的省区，必须将我校填报为平行志愿的第一顺序学校；（2）在考生所在省（市、区）公布的我校招生专业计划范围内填报专业志愿；（3）在高考成绩不满足所填报专业志愿时服从专业调剂。（4）在规定的时间内将志愿填报信息通过华北电力大学北京校部或保定校区招生信息网进行确认。不在第一志愿填报我校、不在平行志愿的第一顺序学校填报我校、高考填报专业志愿不服从专业调剂、不在规定的时间内将志愿填报信息通过我校招生网进行确认的，均按放弃自主选拔入选资格处理。2、投档要求取得我校自主选拔考试入选资格的考生高考投档分数达到我校在当地1：1投档线下20分（以满分750分为标准）以内（但不低于当地本科一批控制分数线），身体符合所报考专业要求，经所在省级招办批准予以投档。实行平行志愿的省份或自主选拔录取提前投档的省份，投档线按照我校在相关省(区、市)公布的本科一本招生数和1:1调档比例所形成的投档线测算值执行。3、专业安排：符合录取条件的考生，按照考生在其高考投档成绩基础上（以满分750分为标准）加20分与普通高考考生一起按照我校2011年《招生章程》“录取原则”进行专业分配并审查、录取。
咨询,jt***56 (四川),2011-06-11 11:09,请问老师：四川2011年理科估分550能上贵校吗（保定校区），谢谢,你好，关于录取分数线，详情请参考我校招生信息中的历年分省分专业录取分数线http://202.206.208.40/zs/ShowClass2.asp?ClassID=2
二本,92*** (山西),2011-06-11 10:28,老师您好！请问贵校今年在山西招收二本学生吗？谢谢！,我校只招收高考分数达到该省一本线以上学生，华北电力大学科技学院招收高考分数达到当年该省三本及以上线的学生。
咨询,54*** (山东),2011-06-11 09:57,请问贵校今年在山东是否有定向就业生计划，如果有的话是什么专业？怎样报考？对考生有什么要求？谢谢,你好，我校在山东没有定向就业生计划。
毕业证？？,88***d (吉林),2011-06-10 15:34,毕业证上是否注明保定校区还是北京校区？,我校颁发的都是华北电力大学毕业证书、华北电力大学学位证书。
咨询,ya*** (新疆),2011-06-10 15:05,你好，我是新疆考生，我今年的估分是580分，请问能够上贵校吗,你好，关于录取分数线，详情请参考我校招生信息中的历年分省分专业录取分数线http://202.206.208.40/zs/ShowClass2.asp?ClassID=2
联合办学,zh***ing2011 (黑龙江),2011-06-10 14:47,老师好迫切想了解贵校今年招联合办学吗都什么专业在几表招啊谢谢,[经教育部批准立项，我校与英、美、澳等国名校开展了国际合作交流项目。包括：华北电力大学—英国曼彻斯特大学、斯莱斯克莱德大学电气工程及其自动化专业联合培养“双学士”项目；华北电力大学—英国巴斯大学、卡迪夫大学、爱丁堡大学，美国密苏里大学哥伦比亚分校、伊利诺伊理工大学、普渡大学克莱默校区电气工程及其自动化专业转学分项目；华北电力大学—澳大利亚昆士兰大学、美国威斯康星大学密尔沃基分校及普渡大学克莱默分校会计学专业转学分项目。具体申请规则请以公布的国际合作办学招生章程为准。2011年华北电力大学电气工程及其自动化专业国际合作办学及转学分项目招生简章http://202.206.208.40/zs/ShowArticle.asp?ArticleID=18552011年华北电力大学会计学专业转学分项目招生简章http://202.206.208.40/zs/ShowArticle.asp?ArticleID=1854
志愿,sx*** (山西),2011-06-10 13:45,你好！我是山西考生，估分605，山西预估一本分数线570分（超一本线30分没问题），能进入你校吗？,你好，关于录取分数线，详情请参考我校招生信息中的历年分省分专业录取分数线http://202.206.208.40/zs/ShowClass2.asp?ClassID=2
志愿填报,sx*** (山西),2011-06-10 12:30,你好，山西2011年重点线差30分，能否被你校录取？,你好，关于录取分数线，详情请参考我校招生信息中的历年分省分专业录取分数线http://202.206.208.40/zs/ShowClass2.asp?ClassID=2
录取,ra*** (山西),2011-06-10 12:11,贵校录取分数计划最高分最低分为多少谢了,你好，关于录取分数线，详情请参考我校招生信息中的历年分省分专业录取分数线http://202.206.208.40/zs/ShowClass2.asp?ClassID=2
录取,97*** (内蒙古),2011-06-25 10:15,我是内蒙考生，543分，能否考取贵校?能考取什么专业？,您好，根据往年录取分数来看，2008、2009、2010年理科分别高出一本线42、35、47分，您的分数超一本线61分，报考我校比较有希望。是否报考及报考什么专业，请务必详细查看往年各专业录取分数并进行分析后决定，录取分数查询网址http://202.206.208.40/zs/ShowClass2.asp?ClassID=2
咨询,wa*** (湖南),2011-06-25 09:55,河南理科类考生今年603分，是否能被贵校录取,您好，根据往年录取分数来看，2008、2009、2010年我校理科录取最低分分别高出一本线5、11、33分。是否报考，请务必详细查看往年录取分数并进行分析后决定，录取分数查询网址http://202.206.208.40/zs/ShowClass2.asp?ClassID=2
成绩咨询,ze*** (山东),2011-06-25 09:27,您好！我是山东临沂莒南的理科考生，618分报考贵校的理学、工学、经济学的不受限制的专业有多大的把握？另外，我的视力不太好（两眼眼镜均700度左右接近800），而且体重超重（比较严重的超重……），看到体检要求上有不宜报考的专业，但是很喜欢相关专业，请问能不能报考相关专业，报考后会不会因为视力问题作退档或者入学后退学等处分。,[我校招收考生体检按教育部、卫生部、中国残疾人联合会印发的《普通高等学校招生体检指导意见》要求执行。电气工程及其自动化、热能与动力工程、自动化、测控技术与仪器、应用化学、能源化学工程、农业电气化与自动化等专业不适宜辩色能力异常（色盲、色弱）考生报考。不宜报考的专业对近视程度无特殊要求。
咨询 江苏的理科排名多少能否上？,60*** (江苏),2011-06-25 09:07,江苏的理科排名多少能否上？,您好，根据往年录取分数来看，2008、2009、2010年我校理科录取最低分分别高出一本线7、16、6分。是否报考，请务必详细查看往年录取分数并进行分析后决定，录取分数查询网址http://202.206.208.40/zs/ShowClass2.asp?ClassID=2
咨询,3w***y (天津),2011-06-25 09:06,老师您好，贵校今年在天津招生要高出分数线多少的?586分理科考生希望大吗?,您好，根据往年录取分数来看，2008、2009、2010年理科最低录取分分别高出一本线43、61、53分，您的分数超一本线71分，报考我校比较有希望。是否报考，请务必详细查看往年录取分数并进行分析后决定，录取分数查询网址http://202.206.208.40/zs/ShowClass2.asp?ClassID=2
能否被录取,sx*** (浙江),2011-06-25 09:03,我是浙江理科考生，今年分数超一本线53，请问能被贵校录取的可能有多大？,您好，根据往年录取分数来看，2008、2009、2010年我校理科录取最低分分别高出一本线28、47、55分，您的分数超一本线53分，报考我校有希望但也存在一定的风险。是否报考，请务必详细查看往年录取分数并进行分析后决定，录取分数查询网址http://202.206.208.40/zs/ShowClass2.asp?ClassID=2
咨询,20*** (河北),2011-06-13 13:50,1、请问贵校2011年在河北省招收国防生吗？2、如果招收国防生，河北考生；2011年；理科580分，报国防生有希望吗？,你好，我校2011年不招收国防生。
610分,zh***456 (内蒙古),2011-06-13 13:26,老师您好，河北保定考生610可以冲一冲华电么,你好，关于我校的录取分数线，详情请参考我校招生信息中的历年分省分专业录取分数线http://202.206.208.40/zs/ShowClass2.asp?ClassID=2
能否被录取,20*** (河北),2011-06-13 13:20,2011河北考生，理科，580分。能否被贵校一本、二本或国防生录取？,你好，关于我校录取分数线，详情请参考我校招生信息中的历年分省分专业录取分数线http://202.206.208.40/zs/ShowClass2.asp?ClassID=2
报专业,wo*** (新疆),2011-06-13 12:09,色弱不能报电气工程及其自动化、热能与动力工程等工程吗？谢了,你好，我校招收考生体检按教育部、卫生部、中国残疾人联合会印发的《普通高等学校招生体检指导意见》要求执行。电气工程及其自动化、热能与动力工程、自动化、测控技术与仪器、应用化学、能源化学工程、农业电气化与自动化等专业不适宜辩色能力异常（色盲、色弱）考生报考。
女生,13***33 (黑龙江),2011-06-13 10:51,老师你好：女生就读电气工程及自动化专业适合吗？就业时受限制吗？,你好，选择专业主要应根据个人兴趣爱好和能力特点。近年来我校本科毕业生一次就业率持续保持在96%以上，是全国就业率最高的院校之一。
咨询,co*** (黑龙江),2011-06-13 10:49,老师我想询问一下，你们学校保定和北京分校有什么区别，录取分数线和课程的差异,[你好，华北电力大学是教育部直属的国家“211工程”重点建设高校，是教育部与由国家电网公司等七家特大型电力企业集团组成的校理事会共同建设的全国重点大学。学校创建于1958年，原名北京电力学院，1969年迁至河北，后更名为华北电力学院。1978年经国务院批准为全国重点大学。1995年5月，经原国家教委批准，华北电力学院和北京动力经济学院合并组建华北电力大学。学校校本部设在北京，分设保定校区，两地实行一体化管理。关于录取分数线和课程安排，详情请参考我校招生信息网中的录取分数线和课程安排。北京校区http://goto.ncepu.edu.cn/，保定校区http://202.206.208.40/zs/index.asp
咨询,yu*** (四川),2011-06-13 10:18,老师您好！华北电力大学保定校区与北京校区有区别吗？是只是同一学校的校区不同还是因为所属不同？,[你好，华北电力大学是教育部直属的国家“211工程”重点建设高校，是教育部与由国家电网公司等七家特大型电力企业集团组成的校理事会共同建设的全国重点大学。学校创建于1958年，原名北京电力学院，1969年迁至河北，后更名为华北电力学院。1978年经国务院批准为全国重点大学。1995年5月，经原国家教委批准，华北电力学院和北京动力经济学院合并组建华北电力大学。学校校本部设在北京，分设保定校区，两地实行一体化管理。
2011录取,xb*** (黑龙江),2011-06-13 10:03,您好，我是黑龙江理科生，今年估了550分左右，能否进入贵校学习，谢谢。,你好，关于录取分数线，详情请参考我校招生信息中的历年分省分专业录取分数线http://202.206.208.40/zs/ShowClass2.asp?ClassID=2
2+2,fe***n667812 (辽宁),2011-06-12 16:42,被2+2专业录取后，只转专业不出国可以吗,你好，我校国际合作办学不单独招生，成为我校2011年录取新生后方可申请。如果申请成功，则进入国际合作班学习，两年之后如果因个人原因不能出国，原则上回2011年录取专业就读。
咨询,lu*** (河北),2011-06-25 16:41,你好，我是河北理科考生，考分622报考贵校有希望吗。志愿顺序应用物理学、工业工程、工程造价、测控技术、建筑环境与设备工程，顺序可否，谢谢,[您好，根据往年录取分数来看，2006、2007、2008、2009、2010年我校理科录取最低分分别高出一本线28、34、41、44、47分，您的分数超一本线41分，报考我校有一定的风险。是否报考，请务必详细查看往年录取分数并进行分析后决定，录取分数查询网址http://202.206.208.40/zs/ShowClass2.asp?ClassID=2
专业,su***23 (天津),2011-06-25 16:23,公共事业管理专业主要学什么？毕业后的就业方向是什么？,[公共事业管理（文史类）本专业2000年开始招生，目前已经形成以公共管理理论知识为基础、电力特色为依托、人文精神和科学精神兼备的办学体系。本专业授予管理学学士学位。本专业培养具有公共管理的理论素养，掌握现代管理理论、技术与方法的，文理兼融的高级复合型公共事务管理人才。能够胜任政府部门和城市供电、供水、供气、邮电、公交、文卫、环保、社会保险等公共部门，以及相关企业单位的管理工作和相关的研究与咨询工作。本专业主要学习课程有：公共管理学、管理学原理、公共事业管理、人力资源管理、社会学、管理心理学、公共财政、管理经济学、公共关系学、市政学、物业管理、非营利组织管理、管理定量分析、应用统计、管理文秘、管理信息系统、信息技术基础、应用文写作、办公自动化、专业英语、社会保障与社会福利、社会问题与社会政策、社区文化与社会政策等。本专业学生就业去向主要有：1、在各级政府机关从事领导、组织、协调等管理工作和事务性工作；2、在社区从事社区管理、物业管理等工作；3、在供电、供水、供气、邮电、公交、文卫、环保、社会保险等公用事业部门及其它非营利组织（中介机构、公益团体和社会福利部门等）从事公共事务管理、咨询等工作；4、在电力企业及其他企业中从事行政管理、人力资源管理等工作。
能否录取,de*** (河南),2011-06-25 16:21,我是河南考生，今年613分（理），能否进贵校,您好，根据往年录取分数来看，2008、2009、2010年分别高出一本线5、11、33分，您的分数超一本线31分，报考我校比较有希望但也有风险。是否报考，请务必详细查看往年录取分数并进行分析后决定，录取分数查询网址http://202.206.208.40/zs/ShowClass2.asp?ClassID=2
咨询,37*** (山东),2011-06-25 16:09,您好，我是山东济南考生，成绩633，报考贵校电气、热动、自动化专业的希望大吗？谢谢,您好，根据往年录取分数来看，2008、2009、2010年热动专业最低录取分分别高出一本线41、44、58分，自动化专业最低录取分分别高出一本线38、47、57，电气专业录取最低分分别高出一本线46、38、62。.
自主招生填报志愿,qu***01 (河北),2011-06-25 16:07,同一专业在特殊类型批和本科一批中的专业代码不同，我应如何填报志愿,你好，按照省招办提供的同一批次代码填写即可。
报考咨询,le*** (山东),2011-06-25 15:56,我是山东考生今年考了611分报考本校情况如何（倾向于本校的信息安全专业）,您好，根据往年录取分数来看，2008、2009、2010年我校理科录取最低分分别高出一本线16、34、48分，您的分数超一本线44分，报考我校有希望也有较大的风险。是否报考，请务必详细查看往年各专业录取分数并进行分析后决定，录取分数查询网址http://202.206.208.40/zs/ShowClass2.asp?ClassID=2
报考,ty*** (河北),2011-06-25 15:46,老师您好，我是河北理科考生，今年620分是否有希望报告贵校，专业是否有选择的余地，调剂是否有什么原则呢？谢谢回答！,您好，根据往年录取分数来看，2006、2007、2008、2009、2010年分别高出一本线28、34、41、44、47分，您的分数超一本线39分，报考我校有希望但风险较大。是否报考，请务必详细查看往年录取分数并进行分析后决定，录取分数查询网址http://202.206.208.40/zs/ShowClass2.asp?ClassID=2
自主招生考生填报志愿,qu***01 (河北),2011-06-25 15:35,我是河北考生，已通过贵校的自主招生，请问专业录取是如何进行的，是否与普通考生一起排名，在不占用招生计划的前提下，各专业准备增加多少名自主招生考生？期待您的回答！,您好，你的问题较多，请在上班时间拨打0312-7523164咨询。
录取,dz*** (山东),2011-06-25 15:33,我是山东理科考生。分数超一本线39分。报考贵校被录取的可能性大吗？在专业选择上有优势吗？谢谢。,[您好，根据往年录取分数来看，2008、2009、2010年我校理科录取最低分分别高出一本线16、34、48分，您的分数超一本线39分，报考我校有希望也有比较大的风险。报考什么专业，请务必详细查看往年各专业录取分数并进行分析后决定，录取分数查询网址http://202.206.208.40/zs/ShowClass2.asp?ClassID=2
你好！,15***19 (山西),2011-06-25 15:32,我是山西电力职工，很想让孩子报咱们学校，但她认为她估的分不够报电气专业的，也不想报别的，最后选择了厦门大学，第二志愿报了咱学校。请问第二志愿录取的可能性有多少？,您好，2008、2009、2010年理科最低录取分分别高出一本线27、12、33分。
咨询,lu*** (河北),2011-06-25 15:25,老师您好，我是河北理科考生，622分，报考贵校有希望么？志愿顺序应用物理学、工业谢谢,[您好，根据往年录取分数来看，2006、2007、2008、2009、2010年我校理科录取最低分分别高出一本线28、34、41、44、47分，您的分数超一本线41分，报考我校有一定的风险。是否报考，请务必详细查看往年录取分数并进行分析后决定，录取分数查询网址http://202.206.208.40/zs/ShowClass2.asp?ClassID=2
专业录取,qu***01 (河北),2011-06-25 15:23,请问贵校专业录取是如何进行的？同一专业两位考生填报顺序不同，是否录取顺序靠前的考生？,你好，我校将按照分数从高到低和报考专业的顺序进行录取。不设专业级差。
录取几率,10***2 (江西),2011-06-25 15:16,江西理工类考生分数578排名5737请问能有多大几率录取贵校,根据往年录取分数来看，2008、2009、2010年我校理科录取最低分分别高出一本线34、44、53分，是否报考，请务必详细查看往年录取分数并进行分析后决定，录取分数查询网址http://202.206.208.40/zs/ShowClass2.asp?ClassID=2
求学,zh***una (河北),2011-06-25 15:14,老师您好，我是今年河北理科考生，我的成绩是537分，过二本线2分，请问有希望进入贵校吗？对专业无需求，谢谢老师,您好，华北电力大学科技学院去年的录取分数高出二本线2分，根据往年情况您报考科技学院比较有希望但也有风险。是否报考，请务必详细查看往年录取分数并进行分析后决定，录取分数查询网址http://202.206.208.40/zs/ShowClass2.asp?ClassID=2
咨询,rc*** (山东),2011-06-25 15:14,你好，我是山东考生，今年考分是614，高出一本线47分，能报考你们学校吗？,您好，根据往年录取分数来看，2008、2009、2010年我校理科录取最低分分别高出一本线16、34、48分，您的分数超一本线47分，报考我校有希望也有一定的风险。是否报考，请务必详细查看往年各专业录取分数并进行分析后决定，录取分数查询网址http://202.206.208.40/zs/ShowClass2.asp?ClassID=2
级差,zh*** (山东),2011-06-26 09:24,请问填报贵校有无专业级差?,您好，我校专业不设级差。
咨询,re***ng (河北),2011-06-26 09:20,华北电力大学今年招委培生?有什么条件？怎么报名？委培生与普通生有什么区别？,您好，今年我校不招收委培生。
咨询,52*** (江苏),2011-06-26 09:17,我是江苏理科生，总分355，物理A+，化学A，希望报考贵校，请问能有多大希望？,您好，根据往年录取分数来看，2008、2009、2010年分别高出一本线7、16、6分，您的分数超一本线10分，报考我校有希望但也存在风险。是否报考，请务必详细查看往年录取分数并进行分析后决定，录取分数查询网址http://202.206.208.40/zs/ShowClass2.asp?ClassID=2
