标题,来源,时间,问题,回答
关于报名时的个人信息简介,mi***3hy (浙江),2015-03-04 13:34,网上报名表要求一定要填写，然后下面又说要手写到底要怎么弄啊、,手写的是个人陈述
自主招生,12*** (云南),2015-03-04 13:25,你好，我是云南的某县应届考生，但是之前没机会参加过任何比赛，所以没有任何证书！但觉得自己动手能力不错，兴趣广泛，从小喜欢各种机械电子，会组装电脑，修理简单的电器问题，改装机械。爱好些小发明，创造！初二时曾有机会获得发明专利，但没有把握好申请机会，与之失之交臂！证明材料也就很少，但我也特别喜欢贵校，想进入贵校学习！我成绩在校中上等，1100名学生中处于60-160名之间！我能否有资格报名贵校自主招生？,只要符合2015年高考报名条件的考生均可申请报考，我校会组织专家组对申报材料进行统一审核。
资格问题,be***u (江苏),2015-03-04 12:49,您好，您校是说省市级作文比赛获奖可以参报，市级作文比赛获奖是符合的吗？,只要符合2015年高考报名条件的考生均可申请报考，我校会组织专家组对申报材料进行统一审核。获奖类别请对照招生简章自行填报专业
自招材料,31*** (四川),2015-03-04 12:46,老师您好，贵校自荐信是否一定要A4纸书写？成绩汇总是需要具体成绩还是只要排名就好了？,自荐信协手写即好，没具体限定；具体成绩
有特殊特长和竞赛省一，但课内一般，咨询一下,gr*** (江苏),2015-03-04 12:40,您好，我是江苏考生，有化学竞赛省级赛区一等奖（中国化学会的），我想报贵校特种能源技术与工程专业（化工学院的，简单说主要研究火炸药），我在火炸药方面有兴趣和特长，自学过一些高校教材，自己合成过十几种炸药，制作过简易起爆器材。但是课内成绩一般，之前因为竞赛没到本一，最近模考过了本一线14分，我想问下报贵校有希望降本一吗，毕竟说只能报一所，谢谢了。,降一本希望不大。
资格,ha*** (内蒙古),2015-03-04 10:15,全国创新英语大赛华北地区三等奖全国中学生英语能力竞赛自治区一等奖请问符合条件A吗,只要符合2015年高考报名条件的考生均可申请报考，我校会组织专家组对申报材料进行统一审核，对审查合格的会组织笔试及面试。
关于自主报名资格问题,qi*** (江苏),2015-03-04 10:14,老师您好，孩子获得江苏省奥数第三名，不知能否参加贵校的自主招生，谢谢！,只要符合2015年高考报名条件的考生均可申请报考，我校会组织专家组对申报材料进行统一审核，对审查合格的会组织笔试及面试。
报名条件,wq***2521252 (江苏),2015-03-03 16:42,老师好，江苏重点高中考生，获得过信息学市级奖是否有机会报考贵校？,只要符合2015年高考报名条件的考生均可申请报考，我校会组织专家组对申报材料进行统一审核。
是否有资格,ji***789 (浙江),2015-03-03 16:24,您好，请问一下取得“睿达杯”省高中数理化一等奖，符合贵校的自主招生条件吗,只要符合2015年高考报名条件的考生均可申请报考，我校会组织专家组对申报材料进行统一审核。
于自招报名资格问题,96*** (辽宁),2015-03-03 16:13,老师，我是沈阳市铁路实验中学考生，从小喜欢兵器，对有关兵器方面的（特别是枪）游戏、书籍、电影、画册等特别感兴趣，贵校兵器专业是我从小的梦想，想报考贵校的兵器类专业，但是我没有获奖证书，我的学习成绩一模572分，在沈阳市排名大约1500名左右，报考贵校初审通过把握大吗,只要符合2015年高考报名条件的考生均可申请报考，我校会组织专家组对申报材料进行统一审核。
关于自主招生资格问题,hi*** (黑龙江),2015-03-03 16:03,我是一名理科生，高中阶段获得全国英语能力竞赛决赛全国一等奖，想报考贵校电子信息类专业的自主招生，可以报名吗？,只要符合2015年高考报名条件的考生均可申请报考，我校会组织专家组对申报材料进行统一审核。
报名资格和选拨程序,ly*** (江苏),2015-03-03 15:55,请问材料初审合格考生约定多少人，占贵校招生计划的总数的百分之几？,材料初审没有限定具体人数，自主招生最终录取人数不超过我校2015年本科招生计划总数的5%
请问笔试和面试的分数？比例是多少？,sd*** (山东),2015-03-03 15:24,老师好，在贵校的自招考试中，笔试和面试的分数各是多少？各占多大比例？,你好，招生简章上有明确说明：我校本科生招生工作领导小组根据考生笔试与面试成绩之和，按“报考条件+申请类别+专业（类）”分别拟定取得自主招生资格考生名单
换专业,pz*** (江苏),2015-03-06 14:57,请问自招进入高校后可以换专业吗？谢谢！,具体调整专业政策进入高校后参考具体当年调整专业政策
自招初审,10***6 (安徽),2015-03-06 14:56,初审会不会更偏向于拥有省级奖项的学生？,报名结束后，会有专家组对报名材料进行统一审核
问能否有资格报考,xu***96 (江苏),2015-03-06 14:14,老师好，我是江苏考生，获得全国中学生生物学联赛三等奖（盖章：全国中学生生物学竞赛委员会，中国动物学会，中国植物学会）、34届世界头脑奥林匹克中国区决赛二等奖（盖章：中国上海头脑奥林匹克协会）、江苏省生物奥林匹克竞赛一等奖（盖章：江苏省中学生学科奥林匹克竞赛委员会）、第25届江苏省青少年科技创新大赛一等奖。请问能否有资格报考贵校的自主招生？,符合2015年全国普通高考报名的考生都可以报名，根据个人获奖证书类别报名相关专业。
报名资格,52*** (山东),2015-03-06 11:54,老师您好，我有实用新型专利，没有竞赛证书，但是对计算机科学与技术专业和物联网工程十分感兴趣，在校成绩也比较好，也三年一直担任班长和学生会副主席，1、可不可以报名？2、初审希望大不大？希望老师能明确告诉我，谢谢。,支撑材料必须与所申请类别学科特点相关，报名结束之后，会有专家组对报名材料统一进行审核。
学科特长咨询,su*** (河北),2015-03-06 11:10,老师您好！关于贵校招生条件中提到的“B、其他具有学科特长、创新潜质和特殊才能并能提供相关证明材料。2、机械材料电子信息类：理科考生可报考，专业可申请机械类、电子信息类、计算机类、材料类、建筑环境与能源应用工程、新能源科学与工程、电气工程及其自动化、自动化之一。;”我想问一下，学科特长的要求是什么？我是河北省级重点中学的学生，没有参加过任何竞赛，也就没有奖项，我理综比较好，喜欢数学，物理，化学，生物，尤其是物理、化学，生物在高二尤其是高三历次学校的月考、期中、期末、市里组织的质检一、质检二考试中成绩能列入年级的10%--15%，像我这种情况能报考贵校吗？谢谢老师！,所报专业需要的理科特长，请根据自身学科优势进行报名，并提供相关材料。
申请资格,ya***1 (吉林),2015-03-06 10:56,老师您好，我是吉林市第一中学考生家长。我孩子高中阶段全国中学生英语能力竞赛省级三等奖。钢琴业余十级，参加过市级比赛并获奖。他可以申报贵校的自主招生吗？,符合2015年普通高考报名条件的考生均可以报名，报名结束后我校会成立专家组对报名材料进行统一审核。
能否有资格报考贵校的自主招生,xu***96 (江苏),2015-03-06 10:17,老师好，我是江苏考生，获得全国中学生生物学联赛三等奖（盖章：全国中学生生物学竞赛委员会，中国动物学会，中国植物学会）、34届世界头脑奥林匹克中国区决赛二等奖（盖章：中国上海头脑奥林匹克协会）、江苏省生物奥林匹克竞赛一等奖（盖章：江苏省中学生学科奥林匹克竞赛委员会）、第25届江苏省青少年科技创新大赛一等奖。请问能否有资格报考贵校的自主招生？,符合2015年普通高考报名条件的考生均可以报名，报名结束后我校会成立专家组对报名材料进行统一审核。
报名咨询,ga***n777 (北京),2015-03-06 10:07,河南省实验中学电视台台长，荣获首届“CRI杯全球中学生多语种数字化故事大赛”优胜奖，制作感动校园人物专访视频；制作校园歌手大赛专题片；荣获河南省中学生优秀支教先进者。学生具有较深的新闻专业特长和能力，数学、英语成绩优秀能否报名,符合2015年普通高考报名条件的考生均可以报名，报名结束后我校会成立专家组对报名材料进行统一审核。
请教老师：我孩子围棋业余5段，省赛女子个人第2名，想申报贵校,fz*** (辽宁),2015-03-06 09:37,请教老师：我孩子围棋业余5段，省赛女子个人第2名，想申报贵校自主招生，可以吗？,符合2015年普通高考报名条件的考生均可以报名，报名结束后我校会成立专家组对报名材料进行统一审核。获奖类别必须与所报专业相关。
贵校自主招生可以报考金融学或会计学专业吗？,sh***g (江苏),2015-03-05 16:40,贵校自主招生可以报考金融学或会计学专业吗？,自主招生专业在我校自主招生简章上有明确说明，请参考我校本科生招生网http://zsb.njust.edu.cn/zszn.aspx?TitleName=南京理工大学2015年自主招生简章
是否符合报名标准,ha*** (黑龙江),2015-03-05 16:16,本人理科生，曾多次获得省级机器人比赛证书，诗歌《我的梦·中国梦》于2013年荣获中国语文教育教学研究会主办的“新人杯”全国中小学校园文学大赛一等奖，化学单科学年排名稳定在前5%，生物曾获得期末考试学年第一，是否符合报名标准，可以报考什么专业？,符合2015年全国普通高考报名的考生都可以报名，根据个人获奖证书类别报名相关专业。
申报资格,ji***sheng01 (辽宁),2015-03-05 14:31,我女儿在高中阶段获得——实用新型专利证书，是否可以申报贵校？如可以，能报那类专业？,符合2015年全国普通高考报名的考生都可以报名，根据个人获奖证书类别报名相关专业。
录取分数是多少？,77*** (四川),2015-03-05 13:46,老师您好，请问贵校2014在四川理科录取分数是多少？,请参考我校本科生招生信息网（zsb.njust.edu.cn）招生指南-往年信息查看详情
自招条件,75*** (安徽),2015-03-05 13:05,您好：我是安徽考生，有FLL机器人竞赛华东二等奖，安徽科学论坛三等奖，符合贵校机械类报名条件吗？通过初审可能性大吗？,符合2015年全国普通高考报名的考生都可以报名，报名结束之后，我校会成立专家组对报名材料进行统一审核。
自招材料,31*** (四川),2015-03-05 13:01,老师好，获奖证书也需要加盖学校公章么？,招生简章上有明确说明。请参考http://zsb.njust.edu.cn/zszn.aspx?TitleName=南京理工大学2015年自主招生简章
能否录取,60*** (湖北),2015-06-24 10:43,我是湖北理科考生，2015年分数497，能否被贵校录取,请登录南京理工大学本科生招生网，点击查看招生指南-往年信息，参考我校往年在湖北的录取分数线。
尊敬的老师您好,46*** (广西),2015-06-24 10:14,尊敬的老师您好；我是广西理科考生，超过一本85分，我很想填报贵校，现有几个问题急需了解，恳请老师尽快好吗，谢谢您了老师！一贵校是否承诺进档不退二省招办加入投挡照顾分，贵校在分专业时是否承认照顾分三可否转专业四是否可以辅修双学位，双学位是否单独发毕业证，学位证，学信网是否可查？五分专业是分数优先还是志愿优先，级差为多少？六服从调剂是广西区内调剂还是校内调剂？七贵校近三年在广西预科的分数,[我校承诺见档不退；承认各省的加分政策；新生入校学习一年后，学生可以在全校范围内申请调整专业；学生进入二年级后，可以申请副修专业和副修双学位学习，成绩合格者，颁发副修专业证书或双学位证书；专业之间按分数级差录取，对前三个专业志愿之间设不超过3分的级差，第三专业志愿以后无级差；报考我校并且专业服从调剂是指在校内调剂；预科往年录取分数请登录南京理工大学本科生招生网http://zsb.njust.edu.cn，查看招生指南-往年信息栏目
本科预科班,qw***888 (吉林),2015-06-24 09:33,你好，我想报考本科预科班，想问一下预科班学生在毕业后与其他本科毕业生是否有区别，毕业证是否有区别,一样的，预科班第一年组织集中学习，第二年根据第一年学习情况分专业，毕业证是一样的
您好，请问下贵校转专业政策及2014年自动化招生人数,wy*** (辽宁),2015-06-23 10:54,您好，请问下贵校转专业政策及2014年自动化招生人数,您好，新生入学后一年，符合条件的可以申请调整专业，只要通过转专业考试，全校所有专业都可以调整。2014年招生情况详见南京理工大学本科生招生网往年招生简章。
按类录取后，能否申请转换专业？,lh***9 (新疆),2015-06-23 09:09,我是新疆理科类考生，报考贵校被按类录取后，大二后是否只能在被录取的大类中挑选专业，是否能跨大类转换专业？,新生入学后一年，符合条件的可以申请调整专业，只要通过转专业考试，全校所有专业都可以进行调整。
报考咨询,18***79 (黑龙江),2015-06-12 15:02,南京理工大学的老师您们好：我是黑龙江理科考生，请问2015年高考招生在黑龙江省招多少学生？大概省排位在多少名能被您们学校录取？如果被您们学校提档了，服从专业调剂退不退当？有没有专业级差？,招生计划请参考我校本科生招生网；录取问题请参考本科生招生网往年信息；进档之后，服从调剂且无其他特殊情况，见档不退；原则上无级差，如果设级差，前三志愿不超过3分，后面志愿无极差。
报考咨询,18***79 (黑龙江),2015-06-12 14:58,我是黑龙江省理科生想报考贵校，咨询一下贵校在黑龙江今年招收多少人，有无专业级差，服从调剂退不退档，都少分能报贵校，贵校预估投档线是多少，在省多少排名能报贵校谢谢,[您好，今年我校在黑龙江的招生情况，您可以登录南京理工大学本科生招生网查看今年的招生计划；我校在录取时前三专业设不超过3分的极差（一般不设极差），后面几个专业不设极差；达到我校录取分数线的考生，专业服从调剂，见档不退；具体志愿填报，您可以参考我校往年录取分数线进行志愿填报。
专业志愿,an*** (黑龙江),2015-06-12 12:15,1、专业志愿录取是志愿优先还是分数优先？2、服从调剂且符合条件是不是提档后不退档？3、各专业志愿之间的级差能否给一个确切数字？,您好，我校在录取过程中，分数优先录取；专业之间按分数级差录取，对前三个专业志愿之间设不超过3分的级差，第三专业志愿以后无级差；符合条件且服从调剂的考生，见档不退。
是否能录取,lj*** (重庆),2015-06-12 09:26,老师你好我是重庆的一名理科生请问下590能上嘛能选什么专业,您好，您可以参考我校往年的录取分数线进行志愿填报，专业的填报可结合自身兴趣，欢迎报考南京理工大学。
兵器类专业,su***ng (甘肃),2015-06-12 09:19,我是一名甘肃考生，请问能否介绍贵校去年在国家贫困专项中兵器类专业录取情况，谢谢。,具体详见我校本科生招生网往年信息。
是否符合专业条件？,q7***4 (贵州),2015-06-10 10:31,请问贵校的武器类专业必须是国防生才能选择吗，如果不是那对身体如视力上有什么要求？,您好，我校武器类专业没有国防生限制，具体各专业体检标准参考南京理工大学本科生招生网专业体检受限对照表。
能报南京理工自主招生吗,wj*** (山西),2015-03-06 15:32,我是太原市的高三生，我去年参加山西省化学竞赛预赛拿了太原市一等奖并进入复赛，而且我比较擅长数学和物理，且成绩较突出，我预计能超高考山西省1本线50分左右，请问我能报南京理工大学自主招生吗？,符合2015年全国普通高考报名的考生都可以报名，根据个人获奖证书类别报名相关专业。
青少年科技创新大赛获奖能报贵校的工商管理类吗？,wy*** (广东),2015-03-06 15:21,青少年科技创新大赛获奖能报贵校的工商管理类吗？,符合2015年全国普通高考报名的考生都可以报名，根据个人获奖证书类别报名相关专业。
分数线,qc*** (黑龙江),2015-03-06 15:10,老师你好！请问去年电子信息专业的录取分数线在黑龙江是多少？,请参考我校本科生招生网zsb.njust.edu.cn招生指南-往年信息
你好！青少年科技创新大赛获省二等奖，能报贵校吗?,wy*** (广东),2015-03-06 15:06,你好！青少年科技创新大赛获省二等奖，能报贵校吗?,符合2015年高考报名条件的考生均可报名，报名结束后会有专家组对报名材料进行统一审核，请根据个人获奖类别填报相关专业
报考,ji*** (江苏),2014-06-26 16:20,我是江苏考生总分364，双B+，报考你校可以吗？,我校选测科目要求物理必须是A另一门是B
贵校有二本招生吗,20***ng (江苏),2014-06-26 16:20,您好！我是江苏理科考生，318分2B。贵校是否对本二招生，是否有望报贵校,我校只招收本一批次考生
浙江理科考生7500名电子信息类和机械类哪个有把握,ti***67 (浙江),2014-06-26 16:16,浙江理科考生7500名电子信息类和机械类哪个有把握,希望很大，欢迎报考
中外合作办学,ji*** (江苏),2014-06-26 16:14,贵校机械类中外合作办学要到国外就读吗？学费多少？,是的。境内学费：根据江苏省物价部门核准的标准，收取学费18000元/年；境外学费：执行英国非欧学生的教育收费标准，学费约为10000镑/年详情请查看我校本科生招生网http://zsb.njust.edu.cn/zsznOne.aspx?id=245
黑龙江理科,10***8 (黑龙江),2014-06-26 15:57,多少名有希望进贵校的武器研究,580分左右有希望
黑龙江理科,10***8 (黑龙江),2014-06-26 15:56,老师您好我考了599分高一本线70报贵校武器研究有希望吗?,希望很大，欢迎报考！
安徽理科574分,zy*** (安徽),2014-06-26 15:52,请问老师，安徽理科考生574分，超一本线85，全省排名6000，报考贵校，希望大吗，谢谢,希望很大，欢迎报考
山西考生,sa*** (山西),2014-06-26 15:49,山西多少名左右有希望？？,6800名左右有希望录取。
江西考生,lu*** (江西),2014-06-26 15:48,老师，您好，我是江西考生，高考成绩587分排名5146名，可以报考贵校吗？,希望较大，欢迎报考。
报考咨询,vi*** (黑龙江),2014-06-26 15:47,老师您好，我是黑龙江省理科考生，高考成绩631分，如果填报电气工程及其自动化、计算机科学与技术专业这四个专业，录取概率多大？或者是不是有很大几率被专业调剂。谢谢！还有贵校在黑龙江提档分数线大约多少？,录取我校希望很大。具体的专业录取请参考我校往年的分省分专业录取分数线。在我校招生网-招生指南-往年信息栏目可以查看。http://zsb.njust.edu.cn/index.aspx。
山西理科５９３　　位次６０００多,rf***6718 (山西),2014-06-26 15:42,老师您好，我是山西理科５９３，有希望报考贵校吗？专业选择的余地有多大？,有希望，欢迎报考，专业可根据个人兴趣爱好填写。
辽宁考生,35*** (辽宁),2014-06-26 15:37,老师您好，贵校的专业高有三分级差是怎么设置的？第一专业和第二专业几分？第二专业和第三业几分？,前三专业设不超过3分的级差（一般不设级差），后面几个专业没有级差。我们会尽最大的努力满足考生的专业志愿，让每一个考生到自己喜欢的专业就读。
山东,qd***y (山东),2014-06-26 14:59,您好，山东理科生，超过一本线72分，报考贵校有希望吗？,很有希望录取我校
咨询,25*** (贵州),2014-06-26 14:57,您好，我是贵州考生，考564，，排名6688，能考贵校吗？,有希望录取我校。
专业询问,sa*** (山西),2014-06-26 13:52,我想知道各专业2013年分数排名,参考我校往年信息http://zsb.njust.edu.cn/zsznList.aspx?id=15
关于自主报名资格问题,13***96 (浙江),2015-03-03 15:18,高中时获得过希望杯全国数学邀请赛全国三等奖，有无资格参加贵校的自主招生,只要符合2015年高考报名条件的考生均可申请报考，我校会组织专家组对申报材料进行统一审核。
农村贫困地区定向招生专项计划,zh***6 (河南),2015-03-03 15:15,老师您好，请问今年贵校还有《农村贫困地区定向招生专项计划》吗？,目前还不确定，请关注我校本科生招生网zsb.njust.edu.cn
双学位咨询,ta*** (辽宁),2015-03-03 14:41,老师您好，贵校是否实行宽专业培养，大几分专业？是否有双学位，计算机类学生可修哪些其他学位？谢谢,大类专业的考生进入学校1-2年后进行分专业。有双学位。
报名条件,52*** (山东),2015-03-03 14:12,高中阶段获得国家实用新型专利权证书可以报考贵校自主招生吗？报考你校还能报考其他院校吗？,只要符合2015年高考报名条件的考生均可申请报考，我校会组织专家组对申报材料进行统一审核；不能
贵校限报1所的含义,ta*** (辽宁),2015-03-03 14:07,老师您好，贵校限报1所是否是只能第一报贵校，是否系统就限制去报其他学校，毕竟只是报名阶段，还不知道能否通过初审。,填报我校的考生不能填报其他院校。
专业资格咨询,ta*** (辽宁),2015-03-03 13:57,老师您好，我是辽宁考生，我获得了中国化学会颁发的《第28届中国化学奥林匹克（初赛）二等奖》和中国物理学会全国中学生物理竞赛委员会颁发的《第31届全国中学生物理竞赛二等奖》能否报贵校的第2类机械材料电子信息类-计算机类的计算机科学与技术专业，自主招生可以选报几个专业？,只要符合2015年高考报名条件的考生均可申请报考，我校会组织专家组对申报材料进行统一审核。专业可根据个人相关获奖，对照招生简章及个人兴趣爱好进行选择。
资格审查,qu*** (江苏),2015-03-03 13:24,奥赛物理一等奖、化学二等奖，偏科，语文英语成绩不理想，影响资格审查吗？,只要符合2015年高考报名条件的考生均可申请报考，我校会组织专家组对申报材料进行统一审核，对审查合格的会组织笔试及面试。
请问贵校自主招生限报几所学校,ta*** (辽宁),2015-03-03 13:22,老师您好，问题如题。,三所院校
自主招生咨询,wa***70301 (江苏),2015-03-03 12:30,我是南京市的考生，在物理奥赛中两次获得市二等奖，符合贵校的自主招生条件吗,只要符合2015年高考报名条件的考生均可申请报考，我校会组织专家组对申报材料进行统一审核。
是否有资格,19***224 (山东),2015-03-03 12:28,您好。我是山东的一名考生、获得的奖项是山东省数学竞赛二等奖。落款是山东省数学竞赛委员会以及山东省数学会。请问可以报考贵校的自主招生吗？,只要符合2015年高考报名条件的考生均可申请报考，我校会组织专家组对申报材料进行统一审核。
安徽考生，成绩优秀，没有证书，可报贵校？,jn***8 (安徽),2015-03-03 10:59,您好：贵校报名条件5.具有招生专业学科特长、创新潜质，有相关书面材料可以证明的学生。我是安徽一所省级重点中学考生，英语成绩突出，有各学期该科成绩排名和老师推荐信，能否能报考贵校的语言专业？,可以报名，报名截止后，我校成立专家组对申报者进行资格审核（对材料未按要求准备者不予审核）。
关于填报专业,yp*** (江苏),2015-03-03 10:53,老师您好！请问我高中时得过全国高中化学竞赛省二等奖，如报贵校的自主招生，选专业可以选电气自动化专业等需考数理的专业吗？,建议填报所获奖项相近专业，报名截止后，我校成立专家组对申报者进行资格审核（对材料未按要求准备者不予审核）。
报名条件,52*** (河北),2015-03-03 10:28,老师，您好。我获得第八届abc全国青少年英语口语大赛河北赛区决赛高中组一等奖，不知道这个奖项是不是属于竞赛奖项，是否符合报名条件？,可以报名，报名截止后，我校成立专家组对申报者进行资格审核（对材料未按要求准备者不予审核）。
