标题,来源,时间,问题,回答
咨询,js*** (江苏),2016-06-28 09:57,我是江苏文科考生，381分双A，1197名，请问有希望进入贵校吗？能选什么专业？,你好，你这个分数来我们学校没问题，具体情况请咨询我们学校在你们当地进行招生宣传的负责老师，老师的联系方式在我校招生网站http://zsb.njust.edu.cn上面可以查到，欢迎报考！！
大类招生,84*** (河南),2016-06-28 09:46,老师你好，请问贵校的大类招生的专业入学后怎么分专业？,你好，一年之后，结合成绩学生自己选择。
进档服从专业调剂，是否还有退档风险,00*** (辽宁),2016-06-28 09:05,老师好！我是辽宁理科考生，609分全省位次6449，高出一本线111分，想报考贵校电子信息类专业是否有把握？进档服从专业调剂是否还会有退档的风险？谢谢！,你好，我校去年录取最低分排名7664名，今年600分左右有希望，您这个分数很有希望，欢迎报考！具体专业请结合自己兴趣与往年兴趣进行填报，分数达到我校投档线，专业志愿服从调剂，无其他特殊情况者，保证录取（保证不退档）。
高校自主招生计划,85*** (重庆),2016-06-27 16:25,老师，您好，我是重庆的一名理科考生，我想问关于高考专项计划的事，过了审核，可以报考，但是不知道学院高考专项计划代码，报考指南上也没有，求帮助，急，谢谢老师,你好，具体以你们省里的政策为准，可以去你们省里的考试院了解一下高校专项计划的填报细则。
内蒙古理科考生,nm*** (内蒙古),2016-06-27 16:24,老师您好！我是内蒙古理科考生，总分580，省内排名5816，报考贵校录取的可能性大吗？,你好，我校去年录取最低分排名7606名，今年560分左右有希望，您这个分数有很大希望，欢迎报考！
报考是否有希望,20*** (新疆),2016-06-27 16:18,我是新疆考生，高考566高一本102排名3200，是否有希望被贵校录取？,你好，我校去年录取最低分排名3181名，您这个分数有希望，可以冲一冲！
广东理科考生,hh*** (广东),2016-06-27 15:55,老师您好！我是广东的理科学生，高考成绩574，高出一本线66分，排位14800名，请问报考贵学校有希望吗？,你好，我校去年录取最低分排名15600名，您这个分数有希望，可以冲一冲！
报考,wa***7 (山东),2016-06-27 15:44,老师您好我是山东考生645分位次5985报考贵校有希望么哪个专业较保险,你好，我校去年录取最低分排名10235名，今年633分左右有希望，您这个分数有很大希望，欢迎报考！
福建文科,le***nghuahun (福建),2016-06-27 15:42,老师您好，分数541排名2625服从专业调剂报考贵校有希望吗,你好，你这个分数还是有希望的，可登录南京理工大学本科生招生网http://zsb.njust.edu.cn，查看招生指南-往年信息，参考我校往年的录取分数线。
录取规则是？,yo***dr (四川),2016-06-27 15:23,请问贵校的录取规则是专业优先，分数优先，还是专业极差？,你好，分数优先，没有级差。
四川文科,wi***8 (四川),2016-06-27 15:23,请问学校的新闻学专业怎么样就业率好吗,你好，具体专业介绍可以参考我校招生网站http://zsb.njust.edu.cn上面有详细的专业介绍，可以阅读一下。我校就业率高达99%，升学率将近50%，是就业50强高校，欢迎报考！
江苏考生,ji*** (江苏),2016-06-27 14:14,老师您好！我是江苏考生，386分，等级A+A，请问可以录取机械工程专业吗？另外色盲近视限报机械工程专业吗？谢谢！,你好，请具体联系我们学校在你们当地招生的负责老师，进行详细咨询。我校招网站http://zsb.njust.edu.cn上面有老师们的联系方式。
山西考生,hr*** (山西),2016-06-27 14:09,老师您好，请问山西理科599分，排名4100左右，有希望报考贵校吗.,你好，我校去年在山西的录取名次为5624，你这个成绩还是很有希望录取我校的，欢迎报考！
报名咨询,13***81 (江苏),2016-06-26 16:29,我是江苏省老考生，366物理A+化学A省名次19780左右报贵校机会大吗,你好，我校去年录取最低分排名5145名，今年385分左右有希望，您这个分数有一定风险
关于贵校中外合作办学,18***91 (江苏),2016-06-26 16:00,您好，我是江苏省的理科考生.贵校中外合作办学是与哪所国外名校合作？毕业证书与贵校普通毕业生一样么？大概分数线是多少？谢谢,你好，工业设计是英国考文垂大学，中国工程师学院与法国梅斯国立工程学院。具体专业介绍可以参考我校招生网站http://zsb.njust.edu.cn院系速览上面有详细的专业介绍，可以阅读一下。
在那里查看高校计划确定的专业,zy*** (河南),2016-06-26 15:43,我想知道贵校跟河南省分配确定的高校计划专业，在那里看,你好，省里会公布的，计划报上都会有的
甘肃考生,jy*** (甘肃),2016-06-26 15:29,你好：我是甘肃理科考生，高出一本线40分，全省排名12000名。并可享受国家贫困专项，请问我被贵校录取的几率大吗？,你好，贫困专项浮动较大，不好预测，可登录南京理工大学本科生招生网http://zsb.njust.edu.cn，查看招生指南-往年信息，参考我校往年的录取分数线。
江西,fe*** (江西),2016-06-26 15:25,江西理科考生总分599，排名5710，请问报考贵校有希望么？谢谢,你好，我校去年录取最低分排名6137名，今年598分左右有希望，您这个分数有希望。
咨询,mh*** (陕西),2016-06-26 15:19,我高考560分，能报上贵校吗，那些专业可能性大些专？,你好，我校去年录取最低分排名8681名，今年588分左右有希望，您这个分数有风险。
录取几率,we***10115 (河南),2016-06-26 15:07,老师您好我是河南理科考生总分615超线92排名9145请问能考上贵校么？,你好，我校去年录取最低分排名9894名，今年615分左右有希望，您这个分数有希望
山东理科考生,xi***80419 (山东),2016-06-26 15:02,老师您好，我是山东理科考生，高考分数637分，全省排名8344名，报考贵校电气和自动化专业有希望吗？谢谢,你好，我校去年录取最低分排名10235名，今年633分左右有希望，您这个分数很有希望。
是否录取,zi***u (辽宁),2016-06-26 15:01,老师好！我是辽宁的考生，612分，5980名次能报考贵校计算机类专业/,你好，我校去年录取最低分排名7664名，今年600分左右有希望，您这个分数很有把握。
报考咨询,57*** (重庆),2016-06-26 14:58,请问贵校在重庆设有专业级差吗？,你好，没有级差，分数优先。
河南理科,13***04 (河南),2016-06-26 14:31,河南理科考生605分，希望大吗,你好，有点风险，可以冲一冲，具体可登录南京理工大学本科生招生网http://zsb.njust.edu.cn，查看招生指南-往年信息，参考我校往年的录取分数线。
录取,ad*** (甘肃),2016-06-26 14:25,老师您好，我是甘肃理工考生，成绩555，可以报考贵校计算机类专业吗？,你好，还是有希望录取我校的，具体可登录南京理工大学本科生招生网http://zsb.njust.edu.cn，查看招生指南-往年信息，参考我校往年的录取分数线。
陕西理科,qw***8 (陕西),2016-06-26 13:58,您好，我您年省排9459，能报贵校吗？,你好，还是有一定希望的，可以冲一冲，具体可登录南京理工大学本科生招生网http://zsb.njust.edu.cn，查看招生指南-往年信息，参考我校往年的录取分数线。
报考,as*** (河北),2016-06-26 13:27,今年河北理科636是否可以报考电气工程及自动化,有希望录取我校，可登录南京理工大学本科生招生网http://zsb.njust.edu.cn，查看招生指南-往年信息，参考我校往年的录取分数线。
山东理科626,la***yao (山东),2016-06-26 13:23,我是山东考生，626，省排名12323。请问报考贵校有希望吗？,你好，有一定的风险，可登录南京理工大学本科生招生网http://zsb.njust.edu.cn，查看招生指南-往年信息，参考我校往年的录取分数线。
山东文科,yj*** (山东),2016-06-28 13:50,老师您好！我是山东文科考生，高考分578（一本线530），省排名3503，想报考咱学校广播电视学专业，有希望吗？,你好，我校去年录取最低分排名3653名，您这个分数有希望，具体专业分数请在我校招生网站http://zsb.njust.edu.cn上查看往年信息。
报考贵校,ki***n (贵州),2016-06-28 13:05,老师您好，我是贵州理科考生，分数是573，排名7083，高出分数线100分，请问能被贵校录取吗？如果能，请问可以报考哪些专业？,你好，我校去年录取最低分排名5658名，您这个分数还是有点希望的，可以冲一冲！
录取希望,cl*** (河南),2016-06-28 12:39,您好！我是河南考生。高考成绩609，省排名11152.报考贵校有希望吗？,你好，我校去年录取最低分排名9894名，您这个分数有点风险，可以冲一冲。
农村专项,qs*** (山东),2016-06-28 12:07,老师您好，我是山东考生已经通过农村专项审核，我想问什么样的位次可以报考农村专项并通过？谢谢。,你好，贫困专项波动较大，具体请参考我校本科生招生网http://zsb.njust.edu.cn查看招生指南-往年信息，参考我校往年的录取分数线。
关于专业调剂和退档问题,sh***e (广西),2016-06-28 11:59,老师您好，我是广西理科考生。580分全省位次6336，高出一本线78分。请问报考经济学或工商管理是否有把握？若是专业调剂是会随机调剂还是会调剂到相关专业？若是服从调剂会有退档风险吗？谢谢老师。,你好，我校去年录取最低分排名6000名，您这个分数有希望，分数达到我校投档线，专业志愿服从调剂，无其他特殊情况者，保证录取（保证不退档），可登录南京理工大学本科生招生网http://zsb.njust.edu.cn，查看招生指南-往年信息，参考我校往年的分专业录取分数线。
XX专业不宜就读，退档？,18***61 (福建),2016-06-28 11:53,老师您好。志愿填报指南里说近视800度以上不宜就读“电子信息科学类”，这指的是“电子信息类”吗，在贵校包括哪些专业？我现在视力刚好800度，可以报这些专业吗？体检复查是开学后进行的吗？若查出视力不达标，是直接退学还是调到其他专业？如果退学了那还能去其他大学吗？,你好，我校招生网站上http://zsb.njust.edu.cn上有具体体检标准，请进行查看。
电子信息专业,13***08 (山东),2016-06-28 11:49,老师你好，我是山东理科考生，前阵子去贵校参加自主招生电子信息专业笔试没通过，非常惋惜，这次高考成绩634分，全省排名9200，但我还是想再次报考南京理工大学电子信息专业，请问，有把握录取吗？,你好，我校去年录取最低分排名10235名，今年633分左右有希望，您这个分数有很希望录取我校，欢迎报考，具体专业的分数可以参考我校招生网站上往年信息。
谢谢,85*** (河南),2016-06-28 11:48,贵校什么学科在全国排名较高大体就业方向如何,你好，具体专业介绍可以参考我校招生网站http://zsb.njust.edu.cn上面有详细的专业介绍，可以阅读一下。欢迎报考！
河南,85*** (河南),2016-06-28 11:40,河南考生618分8200名想上兵器系可以吗,你好，我校去年录取最低分排名是9894，今年理科615左右有希望，您的分数很有希望。具体专业的分数无法预估，需根据考生填报情况录取，可至南理工本科招生网了解往年情况。
河南理科,85*** (河南),2016-06-28 11:25,河南理科考生618分排名8200左右想考贵校专业还有的选吗,你好，我校去年录取最低分排名9894名，今年615分左右有希望，您这个分数很有希望，欢迎报考，具体专业可登录南京理工大学本科生招生网http://zsb.njust.edu.cn，查看招生指南-往年信息，参考我校往年的分专业录取分数线，结合自己兴趣进行填报。
老师您好！,mi*** (青海),2016-06-28 11:04,我是青海应届考生，今年考了490，高出一本线70多分，在全省排名2300，录取希望大吗？专业选择方面怎么样？,你好，您这个分数有希望，欢迎报考，具体专业可登录南京理工大学本科生招生网http://zsb.njust.edu.cn，查看招生指南-往年信息，参考我校往年的分专业录取分数线，结合自己兴趣进行填报。
江西考生,17***00 (江西),2016-06-28 10:38,老师，你好！我是江西考生，理科高考成绩596分超一本线67分省排名6262名，报考你校有录取希望吗？调整专业困难吗？谢谢！,你好，我校去年录取最低分排名6173名，您这个分数有希望，欢迎报考，新生入学后一年，符合条件的可以申请调整专业（包括文、理科专业互转），不收取费用，只要通过转专业考试，全校所有专业都可以调整。
咨询，急！谢谢！,na***29 (北京),2016-06-28 10:30,您好：我是北京考生，607分，排名7492（含全国及地方加分），请问高考贵校有希望吗？,你好，我校去年录取最低分排名8000名，今年603分左右有希望，您这个分数很有希望，欢迎报考！
山西考生,ap*** (山西),2016-06-28 10:23,您好，我是山西理科生，分数580，全省排名7357，有希望被贵校录取吗？报第一志愿,你好，今年580分左右有希望，您这个分数有希望，可以冲一冲，欢迎报考！
咨询,20***n (新疆),2016-06-28 10:18,您好，新疆高三考生580分，位次2430，报考贵校是否可行？,你好，我校去年录取最低分排名3181名，您这个分数有希望，欢迎报考！
甘肃理科,nn*** (甘肃),2017-06-23 14:54,老师你好，我是甘肃理科考生，分数547，排名5425，分差87，报考贵校有希望被录取吗？,有一定希望，理科在4500名之前希望较大
报考,18***75 (甘肃),2017-06-23 10:14,您好，我是甘肃理科考生，549分，排名5281，能上贵校吗？,有希望，理科4500名之前希望较大
中发合作,13***96 (陕西),2017-06-22 15:33,麻烦老师简要说明一下中法合作班的简要情况以及毕业后的就业情况，谢谢,你好，具体专业介绍可以参考我校招生网站http://zsb.njust.edu.cn院系速览上面有详细的专业介绍，可以阅读一下。
专业级差,13***66 (山东),2017-06-22 15:27,老师你好，请问贵校有专业级差吗？是多少分呢？,你好，我们学校不设置专业级差。
名次,st*** (黑龙江),2017-06-22 14:02,黑龙江考生理科名次在什么范围可以报考贵校？,全省排名4800名之前希望较大。
关于中外合作专业,da***ascome (山东),2017-06-22 13:29,1.中外合作有哪些专业今年在山东录取？2.中外合作都是跟哪些国家合作？3.中外合作的外国语言需要学习几年？学习到什么程度？4.上课地址在无锡吗？5.对于以后升学，所发毕业证和普通专业有何不同？6.将来就业方向？谢谢老师,[你好，1.材料类的材料科学与工程，机械类的机械工程。2.以上俩个专业都是和法国合作的。4.不在，在南京本校。5.专业学制4年，毕业后颁发南京理工大学本科毕业证书、学士学位证书。毕业后符合要求的，可本硕贯通，继续攻读研究生，颁发南京理工大学硕士研究生毕业证书、硕士学位证书、以及经CTI认证的法国工程师文凭。具体专业介绍可以参考我校招生网站http://zsb.njust.edu.cn院系速览上面有详细的专业介绍，可以阅读一下。
专业调剂和退档问题,hy*** (四川),2017-06-22 11:54,老师您好，请问若是服从专业调剂，是否会保证不退档？,分数达到我校投档线，专业志愿服从调剂，无其他特殊情况者，保证录取（保证不退档）
浙江考生，620能不能上你们学校,zs*** (浙江),2017-06-22 09:34,如题,全省排名9000名左右希望较大，今年高考改革第一年，不好预估，仅供参考
报考咨询,11***6 (新疆),2016-06-28 16:48,您好，我是新疆理科考生，分数571，省内排名2955，有希望被贵校录取吗？2015年在新疆录取的大致排名是多少？,你好，我校去年录取最低分排名3181名，您这个分数有希望。
北京,13***07 (北京),2016-06-28 16:37,老师您好，我是北京考生理工608分，排名7339，想报考贵校数学与应用数学专业，不知这个分数能否被录取？谢谢,你好，我校去年录取最低分排名7941名，今年603分左右有希望，您这个分数很有希望
江西考生,tu*** (江西),2016-06-28 16:16,您好，江西理科597，排名6057请问可以报考吗,你好，我校去年录取最低分排名6137名，您这个分数有希望
西藏文科考生,gk*** (西藏),2016-06-28 16:16,老师您好，我是2016年西藏文科考生，分数超出一本线119分，请问有希望报考贵校吗,你好，您这个分数有希望，欢迎填报！
河南理科生608,de*** (河南),2016-06-28 16:13,老师，你好，河南考生理科608分，超一本85分，省排名11526，若同意专业调剂的话，有希望补贵校录取吗？,你好，我校去年录取最低分排名10235名，您这个分数有点风险。
农村专项,15***88 (山东),2016-06-28 15:38,老师您好，我是山东的考生，我的农村专项已过，但没有具体的专业列表，请问可报考的专业有什么,你好，具体以你们那省里公布的招生计划计划为准。
安徽考生,cx*** (安徽),2016-06-28 14:00,安徽理工科608分，全省排名7801名，省控一本线为518分，可以报考贵校吗,你好，我校去年录取最低分排名6272名，您这个分数有一定的风险，可以冲一冲。
重庆考生,18***61 (重庆),2016-06-26 12:43,老师您好！我是重庆考生，成绩为612分，另有少数民族加分10分，加分后全市排5405，名请问报考贵校录取的可能性大吗？,可登录南京理工大学本科生招生网http://zsb.njust.edu.cn，查看招生指南-往年信息，参考我校往年的录取分数线。
专业录取原则,zl*** (吉林),2016-06-26 12:35,"你好，我是吉林省考生，咨询下贵校专业录取原则，是分数优先，无专业极差吗？我看招生简章说""对于所有进档考生按投档成绩分科类排队，从高分到低分按照各专业招生计划数顺序录取。""其中提到分科类排队，我不清楚含义？那我第一专业未被录取的话，第二专业是不是即使分高也不一定被录取，因为可能我报的第二专业已录取完毕（录取了那些第一志愿报该专业的人）。还是第二专业录取时依旧是按分数优先？急盼！谢谢！",你好，分数优先。
湖北理科考生607,13***08 (湖北),2016-06-26 12:29,湖北理科607，线差95，排名10700能报贵校吗？,你好，有希望录取我校，可登录南京理工大学本科生招生网http://zsb.njust.edu.cn，查看招生指南-往年信息，参考我校往年的录取分数线。
是否录取,sh***gchen (河北),2016-06-26 12:19,老师，您好，我是河北考生，今年理工类高考636分，8196名，有希望被贵校录取吗？谢谢,你好，有希望录取我校，可登录南京理工大学本科生招生网http://zsb.njust.edu.cn，查看招生指南-往年信息，参考我校往年的录取分数线。
分数相同时，看哪科单科成绩。,sh***gchen (河北),2016-06-26 12:12,老师你好，我是河北考生，报考贵校，当分数相同时，优先看哪科单科成绩？谢谢！,一般根据贵省的辅助排序分来决定录取顺序，具体情况以生源情况而定
报考,zx*** (湖北),2016-06-26 11:59,老师您好！我是湖北理科女生596分，想报考贵校工商管理类（财务管理或会计学），可能录取大么？,你好，还是有点风险的，可以冲一冲，可登录南京理工大学本科生招生网http://zsb.njust.edu.cn，查看招生指南-往年信息，参考我校往年的录取分数线。
专业级差,31*** (浙江),2016-06-26 11:54,老师您好，浙江文科3451名想争取一下贵校。请问贵校有专业级差设置吗？如果有的话，我们服从调剂，投档线还受级差的影响吗？谢谢,你好，没有专业级差，欢迎填报！
山东文科,ha***30 (山东),2016-06-26 11:25,老师，您好！山东文科571分，超一本线41分，省内排名4712，报考贵校有希望吗？,你好，文科分数线很难预估，我校去年在山东招收文科生的最低分排名是3653名，超一本线33分，仅供参考。欢迎报考！
山东理科,13***13 (山东),2016-06-26 11:09,您好！我是山东考生，分数653分，省排名4135名，报考贵校录取机会多大？谢谢。,你好，我校去年录取最低分排名10235名，今年633分左右有希望，您这个分数有很大把握，欢迎填报！
报考咨询,lh*** (福建),2016-06-26 10:35,您好，我是福建省的文科考生，分数550，排名2035，专业服从调剂，有希望被该校录取吗？几率有多大？,你好，文科分数线很难预估，每年情况不同，您可以参考一下我校往年在福建的招生分数线。
老师您好，我是福建省文史类考生,35***803100833 (福建),2016-06-26 10:31,我考了549分，高本一线48分，位次2093，我想填报贵校的英语专业或日语专业并服从调剂，请问我有希望录取吗？,你好，文科分数线很难预估，每年情况不同，您可以参考一下我校往年在福建的招生情况。
录取,99*** (重庆),2016-06-26 09:54,老师您好，我是重庆理科考生，考分623，名次5250，报考贵校有希望录取吗？服从专业调剂，是否是进档不退档？,你好，我校去年录取最低分排名8377名，今年602分左右有希望，您这个分数有较大把握。如没有特殊情况，一般是进档不退的。
录取问题,12***6 (安徽),2016-06-26 09:43,我是2016年安徽理科考生，高考成绩618，全省排名5480，有多大几率录取贵校？填什么专业录取可能性较大？谢谢,你好，我校去年录取最低分排名6272名，今年615分左右有希望，您这个分数有很大希望。具体专业请至南理工本科招生网了解。
报考咨询,ha***er (天津),2016-06-26 09:30,我是天津考生，今年高一本62，若服从分派的话，能进贵校吗？,你好，我校去年录取最低分排名4500名，今年590分左右有希望，您这个分数有一定风险。
陕西理科录取,be***1998 (陕西),2016-06-26 09:21,您好请问陕西理科考生今年高考596分省排名6900有没有机会被录取到计算机类或者电子信息工程创新实践班？,你好，我校去年录取最低分排名8681名，今年588分左右有希望，您这个分数有较大把握。具体专业分数无法预估，请自行了解。
咨询,re***ie (辽宁),2016-06-12 10:19,辽宁理科考生，预计高出一本线70分，报考贵校有希望吗，谢谢,你好，具体可以在我校网站参考一下我们学校往年在辽宁的分数线，http://zsb.njust.edu.cn/index.aspx
关于进档后的退档问题,sz*** (广东),2016-06-12 10:16,老师您好！我想咨询一下，今年在广东省实行平行志愿，如果服从专业分配，且体检合格，投档后，是否可以保证录取不退档？谢谢！,你好，专业服从调剂，无特殊情况，我校是见档不退的，欢迎报考。
您好！贵校如果填专业服从，退档吗？,ya*** (辽宁),2016-06-12 09:41,您好！贵校如果填专业服从，退档吗？,你好，专业服从调剂，无特殊情况，我校是见档不退的，欢迎报考。
录取问题,da*** (广西),2015-06-26 16:57,老师你好，我是广西考生，总分574（含加分20分），区排名4425，一本线480分，报考贵校有多大把握被录取？,你很有希望被我校录取，欢迎报考我校。
咨询,41***705079586 (河南),2015-06-26 16:41,你好，河南文科考生，531分，报考你校有希望吗,我校在河南没有文科的招生计划，抱歉。
我是刚刚提问的学生,as*** (黑龙江),2015-06-26 16:33,啊，谢谢老师，抱歉打扰了,不客气的。
安徽文科,yw*** (安徽),2015-06-26 16:31,一本超30分可以报考贵校吗？投档比例多少？服从专业调剂是否退档？,你的成绩有希望被我校录取。我校根据考生报考情况确定投档比例，一般不超过110%。我校向考生承诺见档不退。
重庆理科考生,lc***1 (重庆),2015-06-26 16:30,老师您好，我是重庆理科考生，今年高考成绩625分，高于一本线52分，全市排名大概8400左右，请问是否有希望报考贵校？希望大吗？,你的成绩很有希望被我校录取，欢迎报考我校。
申报资格,qr*** (重庆),2015-06-26 16:28,老师您好，投档后（体检受限代码为25）的考生会被退档吗？,我校向考生承诺见档不退。
黑龙江理科考生,as*** (黑龙江),2015-06-26 16:21,老师您好，贵校在本二B段的专业定向招生是属于中外合作办学么？今年高考390分，能报考贵校吗？,我校是本一院校，谢谢。
能录取吗？,he***123 (江西),2015-06-26 16:08,我江西考生，高考成绩592，排名7110，报考贵校，请问能进去吗？几率多大？,您好，有一定风险，可以冲刺。
