标题,来源,时间,问题,回答
sdks,38*** (山东),2014-06-10 15:29,1贵校比较好的专业有哪些？2最好的专业是什么？3哪些专业山东省报考人数多？4贵校2013年理科一本录取线差的平均分数是多少？5贵校2014年投档比例和录取比例是多少？6专业之间录取有没有极差？7服从志愿调剂的都没录取吗？,[同学你好：1、专业本身没有好坏之分，且专业的冷热每年情况不同。填报志愿时可以根据自己的兴趣和爱好，结合自己的分数进行填报。2、我校所有专业面向全国招生，各省报考各专业人数每年情况不同。3、各年录取线差可登陆南理工本科招生网查询（http://zsb.njust.edu.cn/zszn.aspx?id=15&type=%e5%be%80%e5%b9%b4%e4%bf%a1%e6%81%af）4、我校根据考生报考情况确定投档比例，一般不超过110%。5、前三个专业设不超过3分的级差（一般不设级差），后面几个专业没有级差。6、专业服从调剂，体检不受限专业，见档不退
辽宁考生,gx*** (辽宁),2014-06-10 14:44,老师您好！我是一名辽宁考生，一本线上50分报考贵校有希望录取吗？服从专业，如果进档能被退档吗？,同学你好。你可以登陆南理工本科招生网，在往年信息中查询历年各省分数统计作为你报考的参考。如果你的档案已经进档，并且体检合格，专业服从调剂，保证不退档。
河南理科,xi***9 (河南),2014-06-10 10:32,贵校在河南有三本招生计划吗？与一本、二本在同一个校区吗？收费标准？,具体招生计划以贵省公布的招生计划为准。我校三本院校为泰州科技学院和紫金学院，与一本不在一个校区。三本学院独立招生，收费请咨询独立院校。
退档问题,me***g (四川),2014-05-10 14:03,您好。请问，我是四川考生。服从调剂且身体合格者，提档会被退档么？贵校专业录取方式是什么？专业间设级差么？再问下贵校优势的工科专业，请推荐。谢谢,[分数达到我校投档线，专业志愿服从调剂，无其他特殊情况者，保证不退档。分数优先录取。前三个专业设不超过3分的级差（一般不设级差），后面几个专业没有级差。我们会尽最大的努力满足考生的专业志愿，让每一个考生到自己喜欢的专业就读。专业本身没有好坏之分。专业相关详情见南京理工大学本科招生信息网。
文科专业,hu***n (四川),2014-05-10 09:45,老师您好！请问报考贵校各专业有级差吗？选专业是分数优先还是自愿优先？如果志愿填服从调剂，被录取到贵校孩子不太中意的专业，那么孩子在校学习期间可以转专业吗？转专业的比例是多少？有什么条件？或可以補修一本其他专业吗？贵校和国外的哪些学校有交换生的指标吗？和国外的哪些学校有2+2或3+1的培养模式吗？贵校保研比例？主要保研方向？谢谢,[前三个专业设不超过3分的级差（一般不设级差），后面几个专业没有级差。我们会尽最大的努力满足考生的专业志愿，让每一个考生到自己喜欢的专业就读。分数优先新生入学一年之后，学习成绩在学院前30％的可以申请调整专业（报考文，理科专业互转），不收取费用，只要通过转专业考试，全校所有专业都可以调整。在本专业成绩优秀的前提下，可辅修一本其他专业。交换生及对外交流问题见南京理工大学本科招生信息网。保研比例具体情况根据各学院不同情况而定，一般为学习成绩在学院前10％。保研方向基本为本专业。
男女生比例,74*** (河北),2014-05-09 16:01,1男女生录取比例？2哪些专业适合女生学？3若有科目考试不及格影响毕业证发放吗？,录取不分性别，所有专业都对男女生开放，考试不及格拿不到毕业证书！
山东理科考生，啥条件可以上实验班？,le***14 (山东),2014-05-09 15:57,你好，1、啥条件可以上实验班?是报志愿时报还是入学后有条件的报？2、机械类（优才计划实验班）学习的内容属于工学还是理学？3、贵校的机械类专业在本校上课，有分校区吗？4、住宿条件如何？几人一宿舍，有空调吗？4、中外合作班是啥专业的？有机械类的吗？外方是哪些学校？,以当地考试院公布为准，看2014年在山东省是否有实验班、中外合作班的招生计划，机械类（优才计划实验班）属于工科，我校只有一个独立校区，宿舍为四人一间，有空调！
河南理科考生,60*** (河南),2014-05-09 15:46,请问在河南排在多少名有望考取贵校？贵校的理工科有哪些优势王牌专业？谢谢！,请参照我校本科招生信息网历年录取信息！工科专业都很强！
湖北理科,li***oxf (湖北),2014-05-09 15:03,你好！请提供下2013年贵校在湖北招理科生的专业分数线！谢谢！,请查看我校本科生招生信息网往年信息南京理工大学2013年分省分专业录取分数线！
福建考生,ll*** (福建),2013-06-27 15:23,补充，是国防生。,这边的界面不能显示你的上一个问题==
咨询,ha*** (云南),2013-06-27 15:22,老师好，我是云南考生，今年考分是597，理科，报你们学校能否被录取？,您的情况被我校提档的可能性挺大的，但具体专业请参考我校往年录取信息http://zsb.njust.edu.cn/zszn.aspx，欢迎报考南京理工大学。O(∩_∩)O~
安徽考生,sh***ng (安徽),2013-06-27 15:20,今年557，排名9878.不知报考南京理工大学有无希望,根据往年情况，安徽考生排名6000名以内有希望被我校提档。
zx,sx*** (陕西),2013-06-27 15:08,陕西理科考生今年考试成绩为531超出一本线46分排名21491请问如果报考贵校录取的可能性有多大,根据往年情况，陕西考生超本一线60分左右有希望被我校提档，具体请参考我校往年录取信息http://zsb.njust.edu.cn/zszn.aspx
咨询,s1*** (云南),2013-06-27 14:52,您好，我是云南的一名理科考生，高考分数是592，高出理科一本线97，全省排名3424，请问我能否被贵校录取，还有我适合报考什么专业。注：我是女生，偏爱于研究,您的情况被我校提档的可能性挺大的，但具体专业请参考我校往年录取信息http://zsb.njust.edu.cn/zszn.aspx，欢迎报考南京理工大学。O(∩_∩)O~
*,11***9 (河南),2013-06-27 14:50,贵校部分专业2013录取计划数上显示“*”是什么原因？,这个问题请咨询贵省教育考试院==
浙江文科,hu*** (浙江),2013-06-27 14:41,您好，我是浙江文科生，高考成绩超一本线27分，排名3000左右，如报考贵校工业设计，有希望被录取么？,根据往年，浙江文科排名3000内有希望，您的情况建议填涂服从调剂。
贵校提档后能保证录取吗？,fi***earth (山东),2013-06-27 14:28,我是山东理科考生总分626，全省排名9201，想学贵校电气工程及自动化专业，我会选择专业服从调剂，如果过了投档线能保证不退档吗？,您的情况被我校提档是有希望的，但具体专业请参考我校往年录取信息http://zsb.njust.edu.cn/zszn.aspx，另，如服从调剂，且无政审、体检等问题，则见档不退。欢迎报考南京理工大学。O(∩_∩)O~
联系方式,25***1 (山东),2013-06-27 14:27,老师您好，请问负责在山东招生的老师的联系方式是什么？谢谢,各省咨询老师及联系方式已在我校招生信息网站公布http://zsb.njust.edu.cn/lgsh.aspx?id=8
四川理科生611报贵校有希望吗？若进档后服从调剂会退档吗,sc*** (四川),2013-06-27 14:21,四川理科生611报贵校有希望吗？若进档后服从调剂会退档吗,您的情况被我校提档的可能性挺大的，如服从调剂，且无政审、体检等问题，则见档不退。
咨询,11***4 (河南),2013-06-27 14:19,老师你好，我是河南考生，今年585分，高一本80分，能上贵校的光电信息工程专业吗？请答复，谢谢,您的情况被我校提档的可能性挺大的，但具体专业请参考我校往年录取信息http://zsb.njust.edu.cn/zszn.aspx，欢迎报考南京理工大学。O(∩_∩)O~
咨询,10***2 (山东),2013-06-27 14:12,你好，我是今年山东理科考生，成绩604，过一本50分，全省排名20133，报考你们学校热门专业，有希望吗，如果专业可调剂呢？,根据往年情况，山东考生超本一线50分以上有希望被我校提档，具体请参考我校往年录取信息http://zsb.njust.edu.cn/zszn.aspx，欢迎报考南京理工大学。O(∩_∩)O~
咨询,ev*** (内蒙古),2013-06-27 14:11,老师您好。我是内蒙古理科女生，今年过内蒙古一本线41分，请问有希望进贵校吗？,根据往年情况，内蒙古考生超本一线30分以上有希望被我校提档，具体请参考我校往年录取信息http://zsb.njust.edu.cn/zszn.aspx，您的情况建议服从调剂。欢迎报考南京理工大学。O(∩_∩)O~
河北咨询,kn*** (河北),2013-06-27 13:52,老师，我河北考生，587分，省排名10917，想报考贵校机械类，有可能被提档吗？,根据往年情况，河北考生超本一线55分左右有希望被我校提档，具体专业请参考我校往年录取信息http://zsb.njust.edu.cn/zszn.aspx，欢迎报考南京理工大学。O(∩_∩)O~
报考,fe***0 (广东),2013-06-27 13:15,请问广东学生想报考要高一本多少...?,根据往年情况，广东理科考生超本一线30分左右有希望被我校提档，具体请参考我校往年录取信息http://zsb.njust.edu.cn/zszn.aspx，欢迎报考南京理工大学。O(∩_∩)O~
咨询,yi*** (安徽),2013-06-28 11:10,老师好：我是安徽理科考生，579分，报贵校，录取的可能性有多大？有什么优势专业？,安徽考生排名6000名以内有希望被我校提档。但具体专业请参考我校往年录取信息http://zsb.njust.edu.cn/zszn.aspx，欢迎报考南京理工大学。O(∩_∩)O~
福建考生,li***ansheng (福建),2013-06-28 10:57,你好，我是今年的福建理科考生，572分，录取分数线为501，排名为9205，请问去贵校的希望大吗？能去什么好的专业吗？,有一定风险，建议志愿服从调剂，BC志愿院校填稳妥
报考咨询,zy*** (福建),2013-06-28 10:55,您好！我是一名福建文科考生，我想请问一下我总分543，排名3772，超出本一线30分，报考贵校希望有多大？适合什么专业？,有希望，欢迎报考，志愿可根据个人兴趣爱好填报
咨询,ni*** (山东),2013-06-28 10:50,老师您好，请问山东理科考生今年最低分多少可以被录取？谢谢,根据往年情况，得610分左右有希望
河南理科考生,pd*** (河南),2013-06-28 10:45,老师您好，河南理科考生，超一本线59分，省排名11000左右，报考贵校有希望么？,有希望，欢迎报考。
咨询,zj*** (河南),2013-06-28 10:31,老师您好！河南考生今年高一本45分，省排名17000可以报考吗？谢谢,有一定风险，建议BC志愿填稳妥
陕西理工考生咨询,li***222 (陕西),2013-06-28 10:28,老师您好，我是一名陕西考生，理工类，今年的分数是586分，位次5737，报考贵校的能源动力，电气工程及自动化，通信工程，计算机类，电子信息工程，机械设计制造及其自动化这几门学科录取的几率有多大；如果选报其他专业，报考贵校的哪个专业被录取的可能性大点？,希望较大，欢迎报考
咨询,77*** (山东),2013-06-28 10:27,老师您好，请问报考贵校，服从调剂，能调剂到什么专业,尽可能调剂到相近专业
录取问题,al*** (安徽),2013-06-28 10:25,老师您好请问最低多少分可以被录取？,根据往年情况，570分左右
山东考生,za*** (山东),2013-06-28 10:23,文科，607分，能否报考贵校？谢谢。,有希望，欢迎报考。
报考咨询,yo***4 (江苏),2013-06-28 10:00,江苏考生，理科367分，选课A+、A，全省排名6845，能报考贵校吗？,我校今年在江苏的提档线大概在370左右，您的情况可以填涂服从调剂作为冲刺。欢迎报考南京理工大学。
山东理科考生,me***3 (山东),2013-06-28 09:58,老师您好，我是山东考生，高考成绩623分，超一本69分，想咨询您一下这个分数能否进入贵校学习呢？,有希望，欢迎报考！
加分咨询,74*** (四川),2013-06-28 09:52,请问贵校是按照加分后的分数排名吗？服从调配，是否一定投档不退档,凡省里承认的加分我校都承认。如服从调剂，且无政审、体检等问题，则见档不退。
江苏,x0*** (北京),2013-06-28 09:42,364A+A若报考贵校有希望么？可以报考好一些的的专业么？,我校近年在江苏的提档线估计在370左右，您的情况有点危险……
山西考生,wa***x (山西),2013-06-28 09:41,山西理科考生今年考试成绩为553超出一本线60分排名4483请问如果报考贵校计算机类专业录取的可能性有多大,您的情况被我校提档是挺有希望的，但具体专业请参考我校往年录取信息http://zsb.njust.edu.cn/zszn.aspx，欢迎报考南京理工大学。O(∩_∩)O~
报考,12*** (山东),2013-06-27 09:44,请问，山东考生613分，报考贵校，有希望录取吗？录取专业有专业级差吗？能转专业吗？,从往年情况看，有希望。前三专业设不超过3分的级差（一般不设级差），后面几个专业没有级差。新生入学后一年，学习成绩在学院前30％的可以申请调整专业（报考文、理科专业互转），不收取费用，只要通过转专业考试，全校所有专业都可以调整。
录取,12***8 (山西),2013-06-27 09:43,我高考成绩546，高出一本线53，省排名5600左右，有希望被贵校录取吗,有希望。欢迎报考
报考,lw*** (山东),2013-06-27 09:43,老师您好，我是山东的考生，今年高考过一本线65分，请问一下能否被贵校录取？,希望较大。欢迎报考
咨询,qi***o (陕西),2013-06-27 09:39,老师您好，我是陕西理科考生，成绩546分，高出一本线60分，能被电子类、通讯类或者更好的专业录取？,有希望，欢迎报考
录取,zh*** (浙江),2013-06-27 09:36,您好，我是浙江考生。今年高考成绩686，高出重点线69分，省排名4200左右，请问报考贵校的希望大吗？如果能录取，能进什么专业？,希望较大，欢迎报考。专业可根据自己兴趣爱好选择
录取可能性,hy***41 (山西),2013-06-27 09:12,您好！我是山西的一名考生，没有自主资格。今年的高考成绩是562，高于一本线69分，省排名3076，请问有没有可能被贵校录取？有没有机会选择较好的专业？,从往年情况看，希望较大。专业选择建议根据自己的兴趣爱好填报。
报考,sm*** (江苏),2013-06-27 09:07,您好，江苏理科368分，全省排名6302，报考贵校是否有希望？,从往年看，可能有些风险。
专业的分差,li***497 (陕西),2013-06-27 09:04,老师您好，请问贵校的专业间是否有分差？！分差大概有多少？！,前三专业设不超过3分的级差（一般不设级差），后面几个专业没有级差。我们会尽最大的努力满足考生的专业志愿，让每一个考生到自己喜欢的专业就读。
报志愿,sx*** (山西),2013-06-26 16:59,老师，您好，我是山西理科考生，成绩525分超32分报贵校希望大不大,根据往年情况，山西考生超本一线50分左右有希望被我校提档，具体请参考我校往年录取信息http://zsb.njust.edu.cn/zszn.aspx
老师好,yu*** (山东),2013-06-26 16:57,今年高考576有希望被贵校录取吗,根据往年情况，山东理科考生超本一线50分左右有希望被我校提档，具体请参考我校往年录取信息http://zsb.njust.edu.cn/zszn.aspx，欢迎报考南京理工大学。
志愿咨询,ts*** (河南),2013-06-26 16:55,老师您好！我是河南理科生，超一本线46分，排名16680请问报贵校把握有多大，能否进比较好的专业？,根据往年情况，河南理科考生超本一线55分左右有希望被我校提档，具体请参考我校往年录取信息http://zsb.njust.edu.cn/zszn.aspx
录取,yi*** (黑龙江),2013-06-26 16:52,您好，黑龙江考生高一本线39分，把贵校作为A志愿冲刺有希望吗？专业第一志愿填车辆工程把握大吗？谢谢！,根据往年情况，黑龙江考生超本一线40、50分左右有希望被我校提档，具体专业请参考我校往年录取信息http://zsb.njust.edu.cn/zszn.aspx，您的情况建议填涂服从调剂。
福建理科,92*** (福建),2013-06-26 16:49,老师，您好，我是福建理科考生，584分，位次6420名，报考贵校有多大把握?(我是色弱),根据往年情况，福建理科考生排名前7000左右有希望被我校提档，具体请参考我校往年录取信息http://zsb.njust.edu.cn/zszn.aspx，另，体检首先对照表已在我校招生信息网公布zsb.njust.edu.cn。欢迎报考南京理工大学。O(∩_∩)O~
提档,qa***654 (河北),2013-06-26 16:49,您好，我是河北考生，请问报考贵校填了5个专业，贵校是根据什么提档？是全部学生根据一个统一的分数卡，高于该分数的全部提走，还是看我报考的5个专业是否录满，若不录满再提走我的档案？还有就是提档比例是多少？有多大比例会被退档？谢谢..,是根据考生分数从高往低依次检录。我校提档比例不超过1:1.1。如服从调剂，且无政审、体检等问题，则见档不退。
山东文科583,ta***n (山东),2013-06-26 16:35,超一本13分，报考贵校有希望吗,根据往年情况，山东考生超本一线50分左右有希望被我校提档，具体请参考我校往年录取信息http://zsb.njust.edu.cn/zszn.aspx，欢迎报考南京理工大学。O(∩_∩)O~
录取,58***z (黑龙江),2013-06-26 16:33,贵校可同时修第二专业吗,可辅修第二专业。
报考咨询,ha***an (云南),2013-06-26 16:29,老师：你好！我是云南考生，理科556分，过一本线60分，想报考贵校计算机科学与技术专业，给有被录取的希望？,根据往年情况，云南考生超本一线50分以上有希望被我校提档，具体专业请参考我校往年录取信息http://zsb.njust.edu.cn/zszn.aspx，欢迎报考南京理工大学。O(∩_∩)O~
咨询,22*** (江苏),2013-06-26 16:25,江苏，367.双A+，排名6845，能报该校吗,您的情况建议填涂服从调剂，将我校填在第一志愿作为冲刺。
咨询,13***91 (四川),2013-06-26 16:19,老师你好，四川理科超一本34分，服从调剂，有可能被贵校录取吗？,您的情况是有6、7成希望被我校提档的，如服从调剂，且无政审、体检等问题，则见档不退。欢迎报考南京理工大学。
录取咨询,76*** (云南),2013-06-26 16:14,老师您好，我是云南省理科考生，我的成绩高一本线55分，在全省9130名，请问一下有多大几率被贵校电气工程及其自动化专业录取？,根据往年情况，云南考生超本一线50分左右有希望被我校提档，具体专用请参考我校往年录取信息http://zsb.njust.edu.cn/zszn.aspx，您的情况建议填涂服从调剂。欢迎报考南京理工大学。O(∩_∩)O~
山东理科587分,hy*** (山东),2013-06-26 16:07,老师你好，我是山东理科考生587分，超一本线33分，能报考贵校吗？,根据往年情况，山东考生超本一线50分以上有希望被我校提档，具体请参考我校往年录取信息http://zsb.njust.edu.cn/zszn.aspx
江苏理科,sh***ingdang (江苏),2013-06-26 16:06,您好，江苏理科369分，选修A+A，全省排名5805，报考贵校是否有希望？,您的情况建议填涂服从调剂。将我校放在第一志愿作为一个冲刺，那么是有一定希望的。欢迎报考南京理工大学。
录取咨询,76*** (云南),2013-06-26 16:03,老师您好，我是云南省理科考生，我的成绩高一本线55分，在全省9130名，请问一下有多大几率被贵校的电气工程及其自动化专业录取？,根据往年情况，云南考生超本一线50分左右有希望被我校提档，具体请参考我校往年录取信息http://zsb.njust.edu.cn/zszn.aspx，您的情况建议填涂服从调剂。欢迎报考南京理工大学。O(∩_∩)O~
山东考生,pi***o (山东),2013-06-26 15:53,我是山东9800名625分请问报考贵校有希望吗？专业怎么样呢？专业录取有极差吗？,您的情况被我校提档的可能性挺大的，但具体专业请参考我校往年录取信息http://zsb.njust.edu.cn/zszn.aspx，另，前三个专业设不超过3分的极差（一般不设极差），之后的专业不设极差。欢迎报考南京理工大学。O(∩_∩)O~
..,qa***654 (河北),2013-06-26 15:51,您好，我是河北理科考生，分数608，超出一本线70分，全省排名5005请问，贵校信息对抗技术、光电信息工程、武器系统与发射工程专业能否直接录取,您的情况被我校提档的可能性挺大的，但具体专业请参考我校往年录取信息http://zsb.njust.edu.cn/zszn.aspx，欢迎报考南京理工大学。O(∩_∩)O~
如何提档,ka***ian (河南),2013-06-26 15:45,在河南招生是否优先选取第一志愿,我校不招收第二志愿的学生（PS.平行志愿B志愿不是第二志愿~）
山东理科,we***5 (山东),2013-06-26 15:44,老师好，高出一本72分，报考贵校有把握吗，提档后如服从专业调剂，是否不退档，报考哪些专业几率大一些,您的情况被我校提档的可能性挺大的，但具体专业请参考我校往年录取信息http://zsb.njust.edu.cn/zszn.aspx，如服从调剂，且无政审、体检等问题，则见档不退。欢迎报考南京理工大学。O(∩_∩)O~
山西理科考生,by*** (山西),2013-06-26 15:40,老师您好，我是一名山西理科考生，2013年高考547分超一本线54分，请问报考贵校有希望被录取么？谢谢老师,您的情况被我校提档的可能性挺大的，但具体专业请参考我校往年录取信息http://zsb.njust.edu.cn/zszn.aspx，欢迎报考南京理工大学。O(∩_∩)O~
山西考生，理科，分数533,ga*** (山西),2013-06-26 15:39,高出一本线40分，报贵校把握有多大,您的情况被我校提档的可能性挺大的，但具体请参考我校往年录取信息http://zsb.njust.edu.cn/zszn.aspx，欢迎报考南京理工大学。O(∩_∩)O~
咨询几个问题,dy*** (山西),2013-06-26 15:30,1我是山西考生，558分，位次3630名，报考贵校有没有分数优势，能被自动化专业录取吗？2贵校优势专业是什么,您的情况被我校提档的可能性挺大的，但具体专业请参考我校往年录取信息http://zsb.njust.edu.cn/zszn.aspx，欢迎报考南京理工大学。O(∩_∩)O~
山西考生,wy*** (山西),2013-06-27 11:03,招办各位老师您们好，我是山西考生，理科，547分，超一本线54分，报考贵校有希望被录取吗？谢谢！！,有希望，欢迎报考
报考咨询,98*** (山东),2013-06-27 10:58,老师您好，我是山东理科考生，638分，高出一本线84分，5539名，报考贵校有希望吗？专业选择空间大不大？谢谢。,希望较大，欢迎报考，专业可根据个人兴趣爱好填报
山东考生,sy*** (山东),2013-06-27 10:58,您好，我是山东理科考生，分数629分，排名8200，报考贵校希望大吗？谢谢！,希望较大，欢迎报考
咨询,sr*** (河南),2013-06-27 10:55,河南理科高一本39分能进贵校吗》？,有一定风险
志愿咨询,ji***ming86 (山东),2013-06-27 10:52,我是山东理科考生625分全省9850名报考贵校被录取把握大嘛？被土木工程专业录取的把握有多大？谢谢解答,希望较大，欢迎报考
山西理科考生,ww*** (山西),2013-06-27 10:41,老师您好，我是山西理科考生，高于一本线34分，被贵校录取的可能性有多大？,风险较大。
回民加分？,12*** (河南),2013-06-27 10:38,您好，我是河南理科考生536（高一本31分），请问贵校投档线是文化分+民族分吗？还是只看文化课分数？,河南省招办承认的加分我校都承认，并加入到计算中。
河南理科考生536（高一本31分），问有希望报贵校吗？,12*** (河南),2013-06-27 10:32,河南理科考生536（高一本31分），问有希望报贵校吗？,有风险
录取分数线,25***1 (山东),2013-06-27 10:23,老师，您好。我是山东理科考生，今年考了614分，超一本线60分，有希望报考贵校吗？几率大吗？谢谢,从往年情况看，有一定希望。
第一志愿,ck*** (广东),2013-06-27 10:15,老师您好，我是广东考生，只考了606分，排位13700名，不知能否报考贵校，能否报电气工程及自动化，机械工程及自动化计算机科学与技术等等专业...==谢谢,有希望，欢迎填报
录取和提档问题,li***1119 (广西),2013-06-27 10:12,我是广西考生，理科545分贵校可能录取吗，服从调剂，是怎样调呢？是在广西招生计划专业里调，还是在贵校的其他专业调剂呢？,有一定风险，尽可能调剂到相近专业，在广西计划中调剂
提前批次,55*** (陕西),2013-06-27 10:09,老师您好，请问贵校招录的提前批次专业中，被录取的学生毕业后就业又什么限制吗？,只有国防生有限制，国防生毕业后，将根据岗位需要分配到军队工作，任命副连级或专业技术十三级军官。
