标题,来源,时间,问题,回答
天津理科,ai*** (天津),2007-06-13 13:42,你好，我是天津理科考生，估了二本线的分数，第一志愿报考宁夏大学，可以被录取吗，有没有降分录取的政策，专业服从调剂是指在所有专业中调剂还是在天津招生计划中的专业进行调剂,能否录取完全取决于今年天津报考我校的考生的情况，所以现在我们还不知道你能否被录取。专业服从调剂是指在天津招生计划的专业进行调剂
服从调剂,ai*** (天津),2007-06-13 12:32,服从调剂是指在所有专业内调剂，还是指在我们天津所招的专业中调剂,指的是在天津所招的专业中调剂
询问老师,xu***4 (山东),2008-06-25 11:23,老师您好，我是山东聊城理科考生，我们这里军检线557分。我考了560分，如报考贵校，有多大可能被录取？谢谢。,达到二本线就可以报考，但能否录取要看今年考生的总体情况。
咨询,hu***iaju0927 (宁夏),2008-06-25 11:11,您好！非常感谢您的答复！请问去年高职会计电算化专业的录取分数线是多少？对本地考生有没有优惠政策？以我妹妹的360分报贵校高职的会计电算化专业被录取的机会多大？,360分报考会计电算话应该是可以的。
急切,qi*** (甘肃),2008-06-24 16:05,你好，我是甘肃的理科考生，今年考了512，二本线是507，能考上贵校的土木工程专业吗？该专业最近三年在甘的最低线是多少？谢谢,上二本线就可以报考，但能否录取要看今年的总体情况了。近三年的分数请登陆zs.nxu.edu.cn查看
老师好,wo*** (河北),2008-06-24 15:46,老师好我是河北考生贵校需高二本线多少分有希被录取，理工534分有希望吗,应该是可以的，这要看今年报考我校的河北理科考生的总体分数情况。
可转专业吗？,cz*** (宁夏),2008-06-24 11:45,可转专业吗？,原则上是可以的，但必须符合一定的条件。
457分能录取在非师范专业里吗？,cz*** (宁夏),2008-06-24 11:44,457分能录取在非师范专业里吗？,文科还是理科？？如果是理科最有把握的就是农业科学类和动物科学与动物医学类。
吉林考生文科,li*** (吉林),2008-06-24 11:33,我考了510分能去贵校吗,这要看今年吉林省的二本线是多少了，达到二本线后按照报考我校的考生情况择优录取。
咨询,hu***iaju0927 (宁夏),2008-06-24 10:42,您好！我的妹妹是宁夏今年的回族考生，高考考了340分，民族分20分，共360分。请问报贵校专科可以被录取吗？她是文科生，有什么专业供选？,我校现在没有专科，只有高职，高职的专业有：酒店管理、会计电算化。
预科,zh*** (甘肃),2008-06-24 10:38,请问老师:贵校08年在甘肃是否招收少数民族预科生?招收人数是多少?07年少数民族预科生最低分数是多少?盼答复!!!,我校少数民族预科班只在本省招生。
舞蹈,wo***23 (河北),2008-06-24 10:36,我是今年的河北舞蹈考生我过了本校在河北的舞蹈考试河北第12名文化分也过了河北的线请问如果我第一志愿报本校能被录取吗,一般情况下是没有什么问题了，不过我校可能会在河北控制线的基础上重新划一条线，然后按照专业排名录取。
33433(天津),wr*** (河北),2008-06-24 09:53,我是天津一高考生估分470分..可以被贵校录取吗?????,如果能达到天津的二本线就可以报考，能否录取取决于今年报考我校的天津考生的总体情况。
录取咨询,ca*** (安徽),2008-06-23 16:03,我是安徽的一名文科考生，今年估分在５４６－５３４之间，不知能否被贵校录取,这要看今年安徽省的二本线是多少了上二本线就有资格报考
宁夏考上第二志愿的问题,xb*** (宁夏),2008-06-23 12:11,老师，您好，我想问您两个问题1.第二志愿报考宁夏大学有没有可能被录取？2.是否承认山区八县的加分政策？,如果一志愿录取不满的情况下会考虑二志愿考生。承认山区八县的加分政策。
宁夏大学07年分专业录取分数,dr***106 (宁夏),2008-06-23 12:09,主要是在宁夏内的,只有文理科的录取分数，没有统计各专业的录取分数
线下考生,dr***106 (宁夏),2008-06-23 11:52,听说有的学校后面会补录，那么二本线以下的考生现在填报志愿有没有意义,补录是不可能了，最多看农林类的可能会降分。
等待您的回音~,ba*** (江苏),2008-06-27 10:47,292+27物B+化A有希望上贵校吗?,应该是可以的。这要看今年江苏省报考我校的考生的情况了。
艺术招考,zh***1 (宁夏),2008-06-27 10:40,老师你好:我是宁夏艺术(理)科考生，文化科425分，区专业统考218分，报考你校美术学和艺术设计专业，第二志愿，如第一志愿院校落档，被你校能录取吗?,如果是二志愿基本上就没有希望了。
我是一名山东艺术生,lc*** (山东),2008-06-27 10:12,我是一名山东艺术生，艺术文美术专业，文化分471，只过了聊城大学一个学校，不过希望很渺茫。贵校如果美术专业招不够，能否考虑录取我，谢谢！联系方式：0635—8576216。13475719446。住址：山东省聊城市东昌府区凤凰办事处碱厂李村李成振。,你如果没有通过我校的专业测试就不能被我校录取。
英语,li***n (广西),2008-06-26 15:58,你好，我是广西考生，超2本线10分外加民族分20分，如果填报贵校，录取的希望大不大?,应该说希望还是非常大的。
体育生,ba*** (广西),2008-06-26 15:04,我的分数是333\86，我被录取的机会有多大，我很希望能到贵校就读，但又很担心抱贵校的考生太多而没有机会.你有解决的办法吗?,录取的几率我也估计不来，这要取决于其他广西体育考生的分数情况了。
招生情况,ww*** (安徽),2008-06-26 14:43,贵校在安徽哪些专业限制色盲考生,这要依据普通高等学校招生体检工作指导意见，你可以查看2008年普通高等学校招生体检工作指导意见，看哪些专业受限。
咨询,lu***7 (湖南),2008-06-26 14:43,请问理科480左右报考贵校有否希望,如果能达到湖南省的二本线就可以报考，能否录取就取决于其他报考我校的湖南考生的分数情况了。
咨询,yt*** (天津),2008-06-26 14:38,老师您好，天津理科463分，天津分数线466分，第二志愿报考，能录取吗.,如果一志愿生源足的情况下就不考虑二志愿，如果一志愿生源不足就会考虑二志愿。
体育生,ba*** (广西),2008-06-26 13:13,你好，请问贵校去年在广西招的体育生人数及投档人数.另外，贵校会录取第二志愿的吗?再有，贵校是否承认加分.,今年第一年在广西省招体育考生。如果一志愿生源不足的情况下，会考虑二志愿。如果广西省招办承认，我们就认可加分。
咨询,ga*** (贵州),2008-06-26 11:46,我是贵州考生，分数是528，能考上你们学校吗?如果能，专业选择余地大不大?,可以报考，应该说专业选择的余地还比较。
山东考生,bi*** (山东),2008-06-26 11:18,老师您好，我是山东济宁的考生，理科558分，有多大的希望被贵校录取？谢谢您！,这取决于今年山东省考生报考我校的总体情况。
你辛苦了,63*** (山东),2008-06-25 16:30,老师你好，我是山东理科生，分数582（一本线582）请问：可以报考贵校吗？报什么专业希望大？谢谢！,可以报考，应该是报考什么专业都可以。
问问,sh***0712 (云南),2008-06-25 16:27,云南469能被你校什么专业录取的希望最大?谢谢!,今年云南省的二本线是475，如果没有达到二本线就不能报考
咨询,zh*** (陕西),2008-06-25 13:09,考了480分，能否有希望被贵校录取？,没有达到二本线就不能报考。
少数民族考生,24*** (甘肃),2008-06-25 11:36,老师：你好，我是甘肃的少数民族文科考生，我的成绩是515甘肃二本线是501，我在加分后可否录取,上二本线就可以报考，能否录取要看今年报考我校的甘肃省文科考生的总体分数情况了。
成绩,13***54 (河北),2007-06-22 15:32,我是音乐特长生，请问贵校外语成绩要多少才能报考您校?以及贵校音乐学专业学费最高多少,我校外语成绩一般会在50——60分，但也要根据具体情况。学费6500年/年
我很希望上宁大的外语系,sp*** (宁夏),2007-06-22 13:04,我是文科生宁夏考生今年考了524分外语考了129分很想上宁夏大学外语系不知道可以不？,根据去年我校外国语学院的录取情况，一般在高出本科线20分，今年的情况要根据考生报考情况。外国语学院录取要综合考虑你的总分，单科分和口试成绩。
求助,19*** (宁夏),2007-06-22 11:04,老师您好：　　我是宁夏理科考生，我的术科成绩合格，文化课成绩是３４８分．提前录取志愿填贵校，能否被录取．,我校艺术类的录取原则是：文化课上线，按照专业排名录取。你的文化课可能能上线，但不知道你的专业排名怎么样
宁夏体育类,19*** (宁夏),2007-06-22 10:56,老师您好：　　我是宁夏考生，我的术科成绩合格，文化课成绩是３４８分．提前录取填贵校能否被录取．,我校艺术类的录取原则是：文化课上线，按照专业排名录取。所以要看你的专业排名怎么样了
志愿填报咨询,xj*** (宁夏),2007-06-21 16:22,老师您好!我是宁夏固原市07年的考生.高考成绩472，请问一下我填报贵校的农学类专业，录取的几率有多大?,根据去年的情况录取可能能录取，但今年的情况还不清楚，能否被录取只能看考生报考的情况了
预科,53*** (宁夏),2007-06-20 16:28,去年不是二本线下50内，加回民分吗,加照顾分
宁夏大学预科生,53*** (宁夏),2007-06-20 15:01,请问宁夏大学预科生的控制分数线是多少,预科是根据报考情况从高到低录取满计划为止，今年还不清楚一般都在二本线下30分左右
预科,53*** (宁夏),2007-06-20 14:49,请问今年宁夏大学的预科分数是多少？,一般情况下在二本线下30分左右吧今年情况还不太清楚
宁夏文科生,ww***u (宁夏),2007-06-20 11:34,老是您好！我今年考了507分，能上宁大的外语系马？,宁夏今年的文科二本线是：503分所以507分估计上外语系有点难度
预科,li***ng2007 (广西),2007-06-19 16:29,您好:老师，我是广西回族的应届毕业生，但不是农业户口可以报考您们学校预科班吗?麻烦您说得具体点，不太清楚.谢谢.,我校预科生不在外省招生
咨询,qi***1 (四川),2007-06-18 16:55,请问贵校招收少数民族预科不？如果招收请问今年招收四川少数民族预科生不？谢谢！,我校少数民族预科班不在外省招生。请谅解！
-美术生-,fo***ar (甘肃),2007-06-18 10:10,我是甘肃文科考生，专业课175，文化课估了330左右，报考宁夏大学能否被录取?盼复~~~~~~,我校艺术类的录取原则：文化课上线，按照专业排名录取。首先你考虑自己文化课能否上线，然后根据自己在甘肃省的排名考虑
问？？,li***123 (河北),2007-06-15 16:15,河北考生美术187分，文化300能否报考该校？,我校去年河北省美术文化课最低录取分数：339专业课最低录取分数：281今年的录取原则：文化课上线，按照专业排名录取你要考虑自己今年文化课能否达到河北省的文化课控制线，然后按照你自己在河北省的专业排名考虑
辽宁体育类,da*** (辽宁),2007-06-15 12:42,我是辽宁体育类的考生。体育85分，文化307分。能不能报考贵校？06年贵校在辽宁的体育类最低分数线是多少？,2006年我校在辽宁省体育类的录取分数线是：文化课最低321专业最低68分今年什么情况还不清楚，所以要你自己考虑
国防生,ga*** (宁夏),2007-06-15 12:32,宁夏考生470能否报考国防生？,能不能被录取要看今年的具体分数线，还要看今年报考的情况。
报考咨询,ga***sheng2009 (天津),2009-06-12 11:51,老师您好：我是理科生，估分在400左右，报考贵校有希望吗？,如果达到天津市的一本线，报考应该希望比较大。
体育生,hu*** (河南),2009-06-12 10:42,河南体育理科，体育79，估分380.希望大吗,我校去年在河南省录取的文化课最低分338分，专业最低是68分，至于你的分数今年希望有多大取决于今年报考我校的河南体育考生的情况
咨询,as*** (宁夏),2009-06-12 09:36,今年录取后，宁夏考生上完4年毕业后，拿的是重点的毕业证还是普通的,毕业证没有重点和普通之说。所有学校的毕业证都是一样的，只不过重点大学毕业的学生在社会上认可就是重点大学毕业的学生。
救命！！！,pl***xz (陕西),2009-06-11 16:05,贵校在陕西招收国防生文科分数为多少？,你们陕西省报考专刊上面我校国防生在一批提前那就必须上一本线，如果在二本提前就必须达到二本线才可报考。
谢谢老师！,ww*** (河南),2009-06-11 14:54,老师我高考考了400都410分左右，能报考你们学校吗？能的话能报考什么专业？谢谢老师！,如果达到河南省的一本线就可以报考。
谢谢老师！,ww*** (河南),2009-06-11 14:38,老师我高考考了400到410分左右，能报考你们学校吗？能的能的话能报考什么专业？谢谢老师！,如果达到河南省的一本线就可以报考。
贵校在宁录取线,as*** (宁夏),2009-06-11 10:49,是按一本还是二本？对外呢？今年的、的招生计划具体是什么？,我校今年在外省都是按照一本录取。宁夏是部分专业按照一本录取，部分专业按照二本录取。招生计划请登陆招生网zs.nxu.edu.cn查看。
河南体育考生,sh***ng (河南),2009-06-11 10:15,老师您好，辛苦了，我是河南的理科考生，我喜欢体育，对宁夏大学也很渴望，老师我想了解一下，我今年体育专业成绩为73，文化课340~350，到贵校希望大吗？谢谢老师！,去年河南省体育类录取的文化课最低分是338分，专业最低68。今年要看今年报考我校的河南体育考生的情况了
关于在贵校外语学院举行的口语考试,12***234 (宁夏),2009-06-10 12:14,请问口试有小语种吗？我高考考的是普通英语，可以报考小语种口试吗？考试内容是什么？谢谢,口试没有小语种，只有英语。
thanks,re***g88 (四川),2008-06-27 16:43,请问四川非灾区文科考生562能上贵校二本几率大不大？四川文科二本线548谢谢,应该是可以的，这取决于今年四川省其他考生的分数情况。
报贵校咨询,bb*** (山东),2008-06-27 15:47,我是山东淄博一中文科558分，淄博市市属线557分。因为今年参加艺术特长生测试，我考了清华、人大、农大、交大、地质（大提琴）等学校，均获得一级证书并签约了几个学校，教育部阳光平台进行了公示，但是没有过重本线，无法报考一批院校。现在报贵校二本非艺术专业，报第一志愿，专业服从调剂，贵校是否参考特长情况，录取的可能性大吗？,因为你现在是普通批次考生，不属于艺术考生，所以我们现在只能是按照分数录取。能否录取就取决于今年山东省报考我校的其他考生的总体情况了。
咨询,yt*** (天津),2008-06-27 14:55,老师您好，天津理科463分，二本线466分，第二志愿报考贵校，能录取吗?谢谢.,没有达到二本线机会应该是特别小了。
咨询,ga*** (陕西),2008-06-27 14:13,你好，陕西文科生433可以报你校的三本吗,报考我校的三本你打电话咨询宁夏大学新华学院：2062063
我湖南文科531报考贵校有希望吗？？,ma*** (湖南),2008-06-27 12:07,我湖南文科531报考贵校有希望吗？？离2本线差了6分贵校有降分的可能吗？,如果没有达到二本线就没有希望，一般情况下没有降分录取的可能。
山东,sh***2 (山东),2008-06-27 11:31,您好，我是山东理科考生，579报考贵校的通讯工程专业被录取的几率有多大？（我省一本分数线为582）,达到二本线就可以报考，能否录取要看今年报考我校的其他考生的分数情况了。
录取及专业,27*** (陕西),2008-06-12 14:57,我是陕西一理工考生，欲二本二志愿报考贵校，我估的分数是518{重点线估计515}，请问录取的可能性有多大？贵校的名牌专业有哪些？我可以报哪些专业？,我认为你要是打算报考我校，最好是二本第一志愿，因为我校近几年一般一志愿就录取满了，就不考虑第二志愿了。理工类专业都不错，就看你喜欢上什么专业了。仅看就业可能机械和土木的专业好一点吧。
咨询,ku*** (陕西),2008-06-12 14:14,请问贵学校今年录取分数能高出二本线多少,这要取决于今年报考我校的陕西省考生的总体水平。
咨询,zh*** (陕西),2008-06-12 11:39,请问今年估分４８０分，能否被贵校录取！,这要取决于今年陕西省的二本线是多少了。
录取,ch***oxue (陕西),2008-06-11 16:34,我是陕西理工类考生，今年估分520，报考贵校的信息管理专业有希望吗?,这要看今年陕西理工类的二本线是多少了，达到二本线就可以报考，但能否被录取还要取决于今年报考我校的陕西理工类考生的总体分数情况。
请教,me*** (山西),2008-06-11 15:41,山西考生，第一志愿报考贵校一本A，以往年情况，一般需要高出我省重点线多少分报考机会大些,我校今年还是以二本分数线录取。
陕西考生咨询,ga***8 (陕西),2008-06-11 15:27,去年最第分数线是多少,文史类最低分551分，理工类最低分490分。
关于贵学录取的相关咨询,ym*** (陕西),2008-06-11 11:49,我是一名陕西应届考生，我估了490分左右不知能考入贵校???等待回答谢谢,这要看今年陕西的二本线是多少以及其他报考我校的陕西考生的成绩。
体育,yo***103 (河南),2008-06-10 12:20,老师，您辛苦了！专业72文化400能走么？,能不能录取现在还说不上，只要看今年河南体育考生的总体情况。
土木工程,cz*** (宁夏),2008-06-10 11:43,贵校土木工程专业就业的前景怎样？,近几年我校土木工程专业就业应该是最好的。
特招问题,ji*** (江苏),2008-06-04 12:40,您好，我是江苏高中生。我参加过国际上一些著名的开源项目，如GNOME，Fedora等，在sourceforge.net上也有自己开发并维护的项目，编程经验丰富。在企业级应用，计算机原理等方面也有所涉猎，能够熟练运用C/C++/C#/PHP等语言，其它一些语言，如TCL/Lua/F#等基本可以看懂，修改并编写简单的程序。我对类Unix操作系统，如Fedora和FreeBSD比较熟悉，有过实际维护相关服务器的经验，这是一般计算机系大学毕业生也达不到的。不知道这样的条件，贵校是否可以考虑特招呢？,我们学校不接受特招生。
艺术考生,19*** (河南),2008-05-14 11:06,请问贵校今年在河南录取原则？美术录取最高最低？我今年专业考231（满分300）文化440分左右，录取把握多大？谢谢！,我校今年在河南省没有艺术类计划
咨询,sn*** (河南),2008-05-13 09:35,请问贵校在05\06\07年在河南的录取分数线，理科,登陆我校招生网：http://zs.nxu.edu.cn，参考信息栏目里有05-07年各省的录取分数线。
美术,xi***56 (河南),2008-05-12 15:04,老师好，我是河南考生，美术专业考215分（满分300），能报贵校吗？根据往年情况我文化课大概需要多少分？,我校今年在河南省没有艺术类计划。
批次,jx*** (浙江),2008-05-12 10:38,贵校今年的招生批次?,文理类二批
提档线,he*** (宁夏),2007-06-29 16:47,请问今年宁大提档分数线是多少,这要看今年的具体情况最低的提档线应该是二本线
宁夏考生咨询,la***0 (宁夏),2007-06-26 09:25,宁大在宁夏是否有高职或者专科计划，都有那些？在你们网站上我查不到谢谢,宁夏大学今年有高职的计划具体的你可以打电话5063786找宁夏大学高职学院咨询
山东烟台考生,wa***ong (山东),2007-06-25 16:36,我是山东烟台考生，我的高考分数是467分（语文65分，数学131分，英语70分，理综150分，基本能力48分，我的理科成绩较好，今年主要是英语和理综科目发挥失常，平时我英语成绩在100左右，理综在190左右），我在烟台市高中生中计算机属于顶尖水平，曾经在高二，高三获得两届全国中学生信息学联赛二等奖（其实我两年都是一等奖，是被人为因素排挤下来的，因为一等奖有保送资格等诸多因素，烟台二中刘昊洋分数本来不够一等奖，结果他的分数由于人为因素达到了一等奖，保送到中国人民大学）。我知道我的分数未达到贵校分数线，贵校是否能破格录取我到计算机科学与技术系？我的电话是0535-4981915（小灵通）,我校没有这种破格录取的资格，只能是按照分数录取，所以没办法录取你！
2006预科班分数线,50*** (宁夏),2007-06-25 12:40,我想询问一下去年宁夏大学文科预科班的录取的最低分数是多少,文科预科班一般都在二本分数线下30分左右吧
2007文科预科班最低分数线,50*** (宁夏),2007-06-25 12:38,我是宁夏文科考生（满族），今年考了469分想上宁夏大学预科班，想询问一下能被录取吗？,469分是你的实际考分？照顾分应该是20分还是10分？能否录取现在还说不上
下午就报志愿了，急！！！！！,fa*** (河北),2007-06-25 12:36,我是河北文科考生，今年554分，请问报考贵校希望有多大谢谢河北2本538,能否录取要看今年河北考生报考我校的情况
紧急啊,fa*** (河北),2007-06-25 12:29,我是河北文科考生，今年554分，请问报考贵校希望有多大谢谢2本538,能否录取要看今年报考我校的河北考生的分数情况了
急啊,fa*** (河北),2007-06-25 12:08,我是河北文科考生，今年554分，请问报考贵校希望有多大谢谢,这要看今年河北省考生报考我校的分数情况，肯定是从高分到低分的录取
咨询,bl*** (河北),2007-06-25 11:19,您好：河北考生理584分进入贵校几率？是否可转专业？,应该是没有什么问题的转专业原则上是可以的，但你必须达到可转专业的条件
答案,wa*** (宁夏),2007-06-25 10:43,老师您好：您很忙吗？我刚才请教的问题怎么还没有答案？我要填报志愿，请速告诉我,你什么问题？
艺术类考生,wa*** (宁夏),2007-06-25 10:22,老师您好：我是宁夏的一名音乐专业考生，专业分77分、英语67分、总分320分，请问贵校的录取分数线是多少，我能否填报贵校,应该是可以填报的去年是290分，今年的文化课分数线是多少，只能是录取的时候才知道的
wen,li***123 (河北),2007-06-24 13:00,我是河北考生，美术排名33，文化324能被录取吗？,能否被录取要看今年河北省报考我校的艺术类考生的分数情况
报宁夏大学预科,wa***ng (宁夏),2007-06-24 10:13,银川文科考生，考分443＋20＝463，报宁夏大学预科有无希望。,估计希望不太大
咨询,du***n (内蒙古),2007-06-24 09:48,我是内蒙古考生，高考分数是538分，请问是否有被贵校录取的希望。,首先要看内蒙古的二本线是多少其次要看今年报考我校的内蒙古考生的分数情况
xiexie,13***54 (河北),2007-06-22 16:44,老师您能不能回答我的问题啊?我很急谢谢了,可以阿你的问题是什么？
zixun,ch*** (四川),2007-06-22 16:13,贵校的优势专业有哪些？不知道贵校的电气工程及自动化专业如何？就业率是多少？一般要高出四川省重点线多少分才有希望报考贵校？,优势专业挺多的，但在四川有招生计划的专业就那么几个。今年我校在四川没有电气工程及自动化专业的计划。
咨询,71*** (安徽),2007-06-29 16:45,请问贵校去年在福建省文科是否在第一志愿就招满？？是否有招到第二第三志愿的学生，谢谢!,去年福建省全部为第一志愿，一志愿就录满
山东考生,sd*** (山东),2007-06-28 09:17,我是山东理科考生，高考成绩559分，报考贵校机械设计制造及其自动化专业能有多大把握被录取?,被录取的几率现在还不知道，这要看今年山东省考生报考的情况
救命呀,ti***ku (河南),2007-06-28 09:06,我是个体育生专业分71理科成绩356能上你的大学不我真的很希望上这个学校支持西北大开发,你的体育文化课好像没有上河南省的体育类二本线，所以你估计不能报考我校
急呀,41*** (河南),2007-06-27 16:22,584能不能被贵校录取呀？,应该是可以了
