标题,来源,时间,问题,回答
咨询,ya***gaokao3 (河南),2011-06-26 09:12,我是河南考生，今年高考575分，有望上贵校吗？,如果达到河南省一本线应该有希望。
咨询,ha*** (陕西),2011-06-26 09:09,你好，我是陕西理科考生，总分551，能否报考贵校一本专业，可以报考哪些专业？,如果达到陕西理科一本线就可以报考
陕西考生,wy*** (陕西),2011-06-25 16:48,我是2011念陕西文科生。我考了548.是否有可能在贵校被录取？,如果达到陕西省文史类一本线应该有希望被录取
录取,zh***hen (河北),2011-06-25 15:49,请问贵校的电子信息工程一般会超过河北的提档线多少分？谢谢,这要看今年的报考情况了，不一定
咨询,zh***u123 (山西),2011-06-25 14:02,您好！我是山西理科考生，今年考了564分，我在第一志愿报考了贵校，且服从调剂，不知能否被录取？,"如果达到山西理科一本线应该有希望被录取,haishi"
咨询,ma***1314 (河南),2011-06-25 11:34,老师好。我是河南考生。高考572，高一本10分，上贵校希望大吗？,从前几年录取情况看，应该可以被录取。
咨询,li***11691 (山东),2011-06-25 11:01,老师您好！我是山东文科考生，超一本线13分，报考贵校希望多大？适合哪些专业？应用心理学是否可以？谢谢！,从前两年的录取情况看，应该所有的专业都可以报考。
体育生,ta*** (河南),2011-06-25 10:46,去年我们的录取分数是多少？体育62，文化课335能否上？,去年的文化课最低316分，体育最低61分。今年你的分数能否被录取，要看其他报考我校的考生的情况了。
报考学校,44*** (宁夏),2011-06-25 10:23,老师您好，高考成绩343分，请老师指点，是否可以报考贵校，或者报考其他的专业，如何来选择专业及学校，谢谢~！,如果时普通类考生，只能报考我校的高职。专业要根据你的个人爱好了。
咨询,85***aaa (内蒙古),2011-06-25 09:40,1、贵校体育专业是按文化课还是按体育成绩接受投档？二者按哪个录取？我文化课是390.体育是92分。2、贵校体育教育是否招文科生？,投档按文化课投档，录取按照体育成绩录取。
咨询,85***aaa (内蒙古),2011-06-25 09:40,1、贵校体育专业是按文化课还是按体育成绩接受投档？二者按哪个录取？我文化课是390.体育是92分。2、贵校体育教育是否招文科生？,已回答
内蒙古考生,85***aaa (内蒙古),2011-06-24 10:25,老师你好体育教育专业在内蒙古招生是文理兼收吗/?,我们做计划时体育教育在内蒙是找理科生，文科生能否报考你要咨询贵区的招生考试中心。
老师您好，体育生提前录取的问题,93*** (内蒙古),2011-06-24 10:21,我是内蒙古的考生，请问贵校今年是否文理兼报，是根据我们内蒙本地还是校方规定啊，我是文科生，今年能够报考宁夏大学吗？,文科生是否可以报考要咨询内蒙古招生考试中心
关于体育教育,85***aaa (内蒙古),2011-06-24 10:11,贵校在内蒙古招生体育教育专业是文理兼收吗？,做计划时是体育理计划，体育文考生能否报考要咨询内蒙古招生考试中心
咨询,zh***hen (河北),2011-06-24 09:29,我是河北的考生，今年考了592，可以走贵校地生物技术或材料化学或土木工程专业吗？,如果达到河北省一本线应该有希望。
宁夏考生,nx*** (宁夏),2011-06-23 11:15,你好请问贵校2010年在宁夏艺术音乐类（文）录取的最高和最低分各是多少文化科和专业都要谢谢！！,文化课最低320专业课最低70
体育生,h4***3 (陕西),2011-06-22 13:42,我是陕西的考生，请问贵校在2011年在陕西体育招生规则，大概专业要多少分？,已投档至我校考生按体育成绩排名录取
体育生,cu*** (河南),2011-06-22 09:15,请问体育成绩69，文化课要多少分才能上？我平时文化课在330左右！~谢谢！~,文化课最低要达到河南省体育控制线
咨询,12***gliang (河北),2011-06-21 10:49,宁夏的大学在河北的录取分数线大约多少？,达到河北省一本线应该就没问题
录取规则咨询,ch*** (陕西),2011-06-13 16:34,老师好！我是西安的往届文科考生，想咨询一下：（1）在录取往届生时贵校有什么政策？（2）在服从调剂的情况下，已投档的是否会退档？（3）录取专业如果不喜欢，以后能否转专业？如能，比例多大？难度多大？谢谢,录取往届生没有什么政策，和应届生一样。对于实行平行志愿投档的省份，如果服从专业调剂，如果没有特殊情况（如不符合体检要求等），一般不会退档。进校一年后如果成绩优秀可以转专业
按分数选专业和大学,55*** (重庆),2011-06-13 15:32,老师：请咨询重庆女生文科550分报贵省什么专业和哪所大学最好？一本二本还是三本，谢谢,如果你达到重庆文史类一本线就可以选择报考我校。
咨询,cy*** (浙江),2011-06-12 16:13,你好请问贵校2010年在浙江省录取的最高和最低分各是多少文科和理科都要谢谢,文史类最高分592.8分，最低分590.8分理工类最高分593.9分，最低分556.7分
陕西考生,46*** (陕西),2011-06-12 11:16,老师您好，我的身高是1.42米，今年高考估了550左右，不知道适合学贵校的什么专业，谢谢。,文史类还是理工类学生？
录取,pi***1 (黑龙江),2011-06-11 16:29,您好！我是黑龙江文科考生，预估530分，报考贵校是否有希望？请您给我一些参考意见。（已阅贵校10年在我省提档线）,根据以往录取情况，如果能达到黑龙江省文史类一本线应该可以。
请问贵校今年预科有没有招生计划？,37*** (宁夏),2011-06-09 10:47,请问贵校今年预科有没有招生计划？,有
体育生？,37*** (宁夏),2011-05-18 09:05,你好，请问宁夏本地的体育生，要多少分才能录取？,首先文化课要达到宁夏教育考试院划定的体育类文化课分数控制线，然后按专业成绩从高到低录取。
咨询,19*** (北京),2010-06-29 10:42,请问老师云南考生505（高一本线10分）能上贵校么,从去年看如果服从专业调剂应该可以，但要看今年云南省文科考生报考我校的总体情况。
报考,ze*** (河南),2010-06-28 16:57,河南，理科，563，一本552，报考贵校有希望吗？谢谢,有希望，去年我校在河南省理科录取最低分就是河南一本线。
诚意咨询,81*** (河南),2010-06-28 09:55,河南理科577分，超本省一本线25分，不知能否被贵校录取？可以报考什么专业？,应该可以录取。去年我校在河南理科录取最低分就是河南一本线。报考专业可以选择自己喜欢的专业，然后服从专业调剂。
理科496 河南。回族,yu***8 (河南),2010-06-28 09:39,预科是在提前批次报考么、你们学校预科可以学哪些专业呢理496分报你们学校可以上二本么多谢,我校少数民族预科班只在本省招生。我校在河南省只有一本招生。
咨询,15***53 (宁夏),2017-06-24 15:17,高职307分可以报艺术设计吗？银川考生,我校只招本科生
请问贵校文史类历史学提前批是属于师范类专业吗？,bx*** (福建),2017-06-22 14:32,预计全省6200名有机会上吗,属于师范专业
福建理科,wo*** (福建),2011-06-29 15:22,我是福建理科考生，考了594分报考贵校能否录取？盼回答！谢谢！福建省理科本一切线是573，我的排名是17700,应该可以录取。
咨询,al*** (河南),2011-06-29 11:48,您好，我是河南一理科考生，我想咨询一个问题：对于档案已经投到你们学校的考生来说，平行志愿下所报考的各个专业录取的规则能否详细介绍一下，谢谢！,我校分配专业有专业级差1分
咨询,ma***ao (安徽),2011-06-29 09:47,老师您好，我是安徽2011年理科考生，女，今年我省一本分数线为534，我考了540，请问进贵校有希望吗？能否上什么好的专业？进贵校是志愿优先还是分数优先？你们对于第一志愿还是第二，三，四志愿填报你校有什么要求吗？你校有什么特色专业？进校后可以转专业吗？谢谢！,安徽不是实行平行志愿嘛，如果是平行志愿就是分数优先。如果达到一本线应该有希望被我校录取。特色专业你还是上我校网站浏览。进校一年后可以申请转专业。
报考,wa***9921016 (河南),2011-06-29 09:22,请问今年考了598分高出一本线了16分进入贵校的可能性大不大，一本专业，理科,应该可以被录取。
专业代码,05***9 (陕西),2011-06-28 14:26,学校代码..和体育教育专业代码是多少,这要根据你们省招办公布的代码
咨询,ya***gaokao3 (河南),2011-06-28 10:57,老师好！我是河南文科考生，今年575分，高一本13分，想报考贵校的小学教育，有希望么？,应该有希望。
考生咨询,bi*** (山东),2011-06-28 10:45,我是一名山东体育类考生我文化课考了490分，体育考了68分，老师您看我有希望能去贵校吗？谢谢...,这要看其他考生的情况，我校是按照体育成绩从高到低录取。
补充,wa***9921016 (河南),2011-06-28 10:26,能否自选专业,什么意思？你报志愿不就是自选专业嘛
报考,wa***9921016 (河南),2011-06-28 10:25,请问今年考了598分高出一本线了16分进入贵校的可能性大不大，理科,应该比较大
咨询,35*** (福建),2011-06-28 09:54,我福建考生今年高考文科类考生成绩568高出省一本线四分请问能被贵校录取吗请问在贵校读什么专业,根据以往的录取情况，应该有希望被录取。
体育,31*** (河南),2011-06-27 17:25,体育68文化课459【理】身高171能报你们学校吗？录取几率多大？【平行志愿】谢谢哦,根据去年的录取情况有希望被录取
咨询,zh***hen (河北),2011-06-27 15:57,河北理科招生计划上的材料化学能源材料是哪方面的材料？,咨询专业方面的请拨打我校化学化工学院09512062889
咨询,lw*** (福建),2011-06-27 15:43,您好！我是福建省11届理工科考生，高考成绩是604，排名13590，欲报考贵校，不知是否有录取希望？万望，谢谢！,达到福建省理工类一本线应该可以被录取
广东,17***12 (广东),2018-06-28 16:07,贵校今年在广东有招生计划吗？,没有，
谢谢老师！！,18***73 (河南),2018-06-28 15:22,老师你好，河南考生理科想要报你们学校的电气自动化专业，大概需要多少分？？谢谢老师回答！！,请登陆我校招生网“http://zs.nxu.edu.cn/”后点击“信息查询”，查看我校2015-2017年在贵省录取情况，进行分析判断。
报考,18***08 (河南),2018-06-28 14:56,河南470分137269名是否可以填报贵校二本专业贵校二本哪些专业我可以填报概率大吗,请登陆我校招生网“http://zs.nxu.edu.cn/”后点击“信息查询”，查看我校2015-2017年在贵省录取情况，进行分析判断。
山东考生,15***72 (山东),2018-06-28 14:13,2018年文科552.报考贵校有希望吗,请登陆我校招生网“http://zs.nxu.edu.cn/”后点击“信息查询”，查看我校2015-2017年在贵省录取情况，进行分析判断。
湖南考生报考咨询,18***17 (湖南),2018-06-28 14:01,请教老师，湖南理科考生，498分，（今年湖南一本线513，二本线450）报考贵校有希望吗？盼指点迷津，谢谢，祝老师工作顺利！,请登陆我校招生网“http://zs.nxu.edu.cn/”后点击“信息查询”，查看我校2015-2017年在贵省录取情况，进行分析判断。
山东理科,13***09 (山东),2017-06-28 10:56,老师您好！请问贵校今年还有没有二本专业？,请查看贵省的报考指南。
山东文报考急急，谢谢,sh***981012 (山东),2017-06-28 10:41,老师您好，文科526分，位次24856，孩子基础很好，只是文综发挥失常直接挂了，报考贵校有希望吗？请老师多多指教，谢谢。如幸运进入贵校，可以通过自己的努力调整专业的机会吗？,请进入我校招生网（http://zs.nxu.edu.cn/），查看往年在贵省录取情况。大一学年结束后可申请调整专业。
山东考生,13***7 (山东),2017-06-28 09:43,本人高考509分高于本科线76分，有希望报考贵校二本专业吗？二本才山东有计划吗,请进入我校招生网（http://zs.nxu.edu.cn/），查看往年在贵省录取情况。二本专业请查看贵省的报考指南。
山东理科,jo***12 (山东),2017-06-27 16:08,"513分-高二本线433分80分，无一本线，自招线51分-请问报考“会计学”或""计算机科学与技术""或“通信工程”的几率分别有多少？",请进入我校招生网（http://zs.nxu.edu.cn/），查看往年在贵省录取情况。
报考志愿,fd***fdg (山西),2017-06-27 15:26,您好，我是山西理科考生，502分高于一本线21分，请问报考贵校希望大吗？报什么专业比较有把握（我近视800以上）？谢谢！,请进入我校招生网（http://zs.nxu.edu.cn/），查看往年在贵省录取情况。
贵校今年在山东有二本专业吗,13***53 (山东),2017-06-27 12:15,如果有的话，都有哪些，二本预估线是多少，发的学位证一样吗？万分感谢,请看贵省的报考指南。
贵校今年在山东有二本专业吗,13***53 (山东),2017-06-27 12:12,如果有的话，二本预估线是多少，有哪些二本专业？发的学位证一样吗?,是否有二本专业，请看贵省教育考试院的报考指南。
山西考生理科500，一本线481有希望被录取吗,ww*** (山西),2017-06-27 10:32,山西考生理科500，一本线481有希望被录取吗,请进入我校招生网（http://zs.nxu.edu.cn/），查看往年在贵省录取情况。
来自宁夏考生,fx*** (宁夏),2017-06-26 16:07,老师您好，我的体检单上写的不能准确在显示器上识别红、黄、绿、兰、紫各颜色中任何一种颜色的数码、字母，但又写着对单色识别无障碍，无色盲色弱，我总分487位次5038报贵校的计算机专业能都被录取呢，谢谢老师。。,请查看教育部有关体检对专业限报的相关要求。
报考,sh***981012 (山东),2017-06-26 16:02,老师，您好，526分，位次24586，报考贵校有把握吗？专业选什么最稳妥？谢谢~今年考试成绩差的有点出乎意料，拜托老师能多给些指导。万分感谢。,请进入我校招生网，查看往年在贵省录取情况。
咨询,zs***aodaxue (山东),2017-06-26 14:56,老师您好，我是山东地区的考生，高考成绩535分，我想报考贵校的交通工程，请问老师可能性大吗？,请进入我校招生网，查看往年在贵省录取情况。
来自宁夏少数民族,fx*** (宁夏),2017-06-26 10:21,老师您好，我理科生487高出一本线48分，位次5038，报贵校计算机科学与技术能否被录取呢？谢谢老师的答复.,请进入我校招生网，查看往年录取情况。
报考,tr*** (湖北),2017-06-25 16:10,老师你好，我是湖北理科考生，今年分数542，超一本线58分，可以报考宁夏大学教育学专业吗？,可以。
2017年河南考生,gz*** (河南),2017-06-25 15:04,老师您好，我是一名2017年河南考生，总分考了517分，比一本分数线仅多一分，请问我如果报考贵校二本专业，有无被录取的可能？,请进入我校招生网，查看往年在贵省录取情况。
山东理科生,37***911160822 (山东),2017-06-25 12:06,老师你好，我是山东的一名理科生，今年我的分数是591，位次是21655，报考贵校有无风险？,超本省一本线30分以上比较稳妥
zixun,bi***iang (陕西),2010-06-27 14:59,我是陕西理工科考生，544分，离一本差12分，可以报考贵校什么专业？,报考我校需达到陕西省理科一本线。
陕西考生,56*** (陕西),2010-06-27 14:28,我是陕西理科考生，考分540分，报考你校土木工程专业有几成把握？请及时解答，谢谢！,如果未达到陕西省理科一本线就不能报考我校。
文科,87*** (河南),2010-06-27 14:25,河南文科493分，高出二本线4分，报考贵校有把握么？？,我校在河南省按一本招生，必须达到河南省一本线才可报考。
咨询,wa***0 (山东),2010-06-27 12:23,你好我是山东理科考生超过一本线6分报贵校能被录取吗？,应该可以录取，就看今年的报考情况了。
咨询,li***i123566741 (陕西),2010-06-27 11:37,老师，我陕西理科考生考了575，请问报考贵校有希望吗？若可以，都有哪些专业可以选择？,你的分数超出一本线19分，应该可以被录取。根据你的兴趣爱好选择我校在陕西有计划的专业，应该都有机会被录取。
报考,cx*** (福建),2010-06-27 10:23,我是福建文科考生，高考成绩比本一线高2分，且我愿意服从专业调剂，请问我有录取希望吗？贵校是否有转系的可能？,应该可以被录取。按照我校转专业规定，一年后成绩达到转专业规定就有机会转专业。
河北考生,91*** (河北),2010-06-27 09:42,我在贵校艺术（舞蹈）加试是84，排名第12，请问有希望被录取吗？,如果文化课能够达线，录取的可能性应该较大。
山东理科,as*** (山东),2010-06-27 09:15,高考理科591分有希望报考贵校吗？,达到山东理科一本线就有希望，你如果服从专业调剂录取的希望应该还非常大。
山东体育生,w3***1 (山东),2010-06-26 16:30,文化424体育75可以报贵校吗？,按去年的录取分数看应该可以，今年能否录取要看其他报考我校的考生的情况。
河南,ck*** (河南),2010-06-26 16:28,我理科考了553分，过一本线1分，报考你学校能录取吗？你学校退档吗？,根据去年录取分数，如果服从专业调剂应该可以被录取，但也要看今年河南省报考我校的其他考生的成绩。
国防生,li***a409 (陕西),2010-06-26 16:14,请问贵校今年在陕西招国防生的计划，女生计划有多少？在那儿能查到，年龄是1990，04，09的，是不是大了三个多月，有没有可能录取，控制线按二本还是一本,我校2010年国防生计划只招男生。
山东考生,sh*** (山东),2010-06-26 15:27,我是山东艺术文，未校考，能否填报贵校？,如果没有参加我校组织的校考就不能报考。
咨询,40*** (河南),2010-06-26 15:04,我考了564分理科的我省一本线552我想知道如果报考贵校被录取的几率如何,从去年的录取情况看录取的几率应该非常大。今年我估计如果服从专业调剂录取的几率也比较大，但还要看今年河南省理科其他考生的成绩。
咨询,12***35452525 (天津),2010-06-26 14:51,色盲患者能报什么专业,你查看一下《普通高等学校招生体检工作指导意见》，上面可以查到色盲患者不宜就读的专业。
广西,31***1 (广西),2010-06-26 11:08,广西理科428分能上贵校吗？,如果没有达到广西省一本线就不能报考我校。
咨询,ch***n (河北),2009-06-23 15:51,老师您好，我是河北一理科考生，今年的高考分数是553，能否报考贵校,如果达到河北省的一本线就可以报考
招生,12*** (浙江),2009-06-23 10:34,第一批时，你们会录取文科生么,有文科计划就会录取文科考生啊
咨询,kx*** (宁夏),2009-06-23 10:10,那么我填软件工程或者网络工程能否被录取？谢谢老师！,如果达到二本线，就有希望，不知道你考了多少分？？
关于贵校提档分数控制线？,88*** (吉林),2009-06-23 09:33,贵校一本吉林招生，提档时执行重点本科分数线，还是普通本科分数线？现在我们这里报志愿已经开始啦，十万火急，请准确地回答一下。谢谢,重点分数线。
咨询~谢谢老师！,kx*** (宁夏),2009-06-23 09:24,我是宁夏考生，考了447，能否填报贵校的土木工程或者应用心理学等其他重点专业！,如果没有达到一本线就不能报考一本专业。
提前批,60*** (湖北),2009-06-22 10:53,我想问下贵校的提前批的机械工程及自动化管理是属于几本？还有什么时候录取？,你查一下机械工程与自动化是在二本提前还是一本提前，如果在二本提前就是二本线，一本提前就按照一本线录取。
甘肃招生,38*** (甘肃),2009-06-22 10:21,贵校今年在成为211工程院校之后，在甘肃首次在一批招生，会降分录取不到一本线的考生吗?,应该不会，除非甘肃招办在没有录取满额的情况下同意降分征集志愿。
招生,yu***6660 (宁夏),2009-06-22 10:06,您好，我市一名宁夏考生，今年考了491，报考本校有希望吗，今年贵校为何一本二本都设了，有何区别,一本的专业和二本的专业不同啊。如果你是文科考生就只能报考二本专业。
招生,dr*** (湖南),2009-06-20 10:47,老师好，请问贵校是否有在湖南二本的招生计划?,没有
咨询,ds*** (山西),2009-06-15 15:37,山西考生在一本线以上5分以内，考上的可能性大么？,"我校今年第一年按照一本招生,估计达到一本线报考希望还是比较大的"
您好,10***14 (黑龙江),2009-06-15 14:11,我是黑龙江文史考生520左右，报考贵校有望吗?,如果达到黑龙江省的二本线就可以报考
体育考生,we*** (内蒙古),2009-06-15 12:28,你好老师：我是一名内蒙体育考生，我想了解贵校去年在内蒙古找生文化课和转也的分数线，谢谢~~,去年我校在内蒙古招生体育生文化课最低300分，专业最低88分。
咨询,ya*** (湖北),2009-06-14 10:36,贵校的国防专业收不收往届的啊？另外国防专业对视力的要求是多少？,国防生不招收往届生。
宁夏艺术考生文科,ti***2 (新疆),2009-06-14 09:14,统考210分，文化估分380，能报贵校的艺术类吗？,根据去年的录取情况，你的专业课成绩有点低，去年我们美术类专业最低分是229分。
河南理科体育,xu***987 (河南),2009-06-13 16:46,老师您好，我弟是体育特长生。今年文化分估了340分左右。体育分时61分。想报考贵校，请问，能被录取的希望有多大？非常感谢。,我校去年在河南省体育的录取线：文化最低338分，体育术科最低68分。今年什么情况我也说不上，要看今年的报考情况了。
录取,ac*** (河南),2011-06-27 14:38,老师您好：我是河南考生。高考590，高一本8分，我想报考贵校的优势专业能被录取吗？谢谢。,最好是服从专业调剂
咨询,93*** (陕西),2011-06-27 12:31,我是陕西理科考生，考了569.一本线是540，能否冲击贵校的最好专业，有没有风险,好一点的专业应该可以录取，风险应该不大
5,05***9 (陕西),2011-06-27 11:34,我陕西的体育生..体育81.文化课267能被录吗？帮我参考下.有外省学校可以报吗/xiexie,能否被录取要看其他体育生的分数情况，我校按专业排名录取。
录取,dr*** (陕西),2011-06-27 11:31,我是陕西文科考生，550分，高出一本线7分，有希望被贵校录取吗？,参照去年的录取情况，应该可以被录取。
f,05***9 (陕西),2011-06-27 11:16,我陕西的体育生..体育81.文化课267能被录吗,已回答
报考,he*** (河南),2011-06-27 10:37,我是河南考生，超出一本线2分，欲报考贵校，请问有希望吗？如果有，那应该报什么专业呢？,有希望，你可以选择服从专业调剂
咨询,ch*** (山东),2011-06-27 10:18,我山东理科今年580能被贵校一批录取吗？？如果能可以选择什么专业把握大一点？？、,应该可以。根据个人喜好报专业，最后选择服从专业调剂
咨询,ga***henhan (甘肃),2011-06-27 10:11,你好，甘肃文科507分，贵校录取的把握大吗,参照去年录取情况，如果服从专业调剂应该有希望被录取
咨询,wy*** (陕西),2011-06-26 16:13,您好，我是陕西文科考生。考了548.1.请问我进入贵校的可能性有多大？2.贵校对于体检有无特殊要求？3.如果报的人多，有无扩招的可能？,如果达到陕西省文史类一本线录取的可能性应该比较大。文史类专业对体检基本上没有什么特殊要求。如果报考的人数多，有可能增加几个计划。
加分政策,yq*** (贵州),2011-06-26 13:27,老师，您好，我想问一下，贵校提档时承认加分政策，那在分专业时是否承认加分政策？,只要是贵省考试院认可的加分，我校在在投档和分配专业时都认可。
省招生办出档的时候，是按照文化分出档，还是按照体育分出档？,zh***ei (河南),2011-06-26 11:57,根据贵校“招生章程”第十四条第四款“体育类考生录取”规定，其中的“按照生源所在省级招办规定的出档比例调档，我校按术科成绩从高到低择优录取，同时综合考虑考生的身体条件和专项水平。”请问老师：1、我省招生办出档的时候，是按照文化分出档，还是按照体育分出档？2、贵校是如何“综合考虑考生的身体条件和专项水平”的？我的体育术科成绩64分（满分100分），其中体育专项23.4分（满分25分）。,去年出档是按照文化分出档。同等条件下考虑身体条件和专项水平高的。
咨询,y0*** (陕西),2011-06-26 10:36,你好，陕西理工类考生今年540分能否报考贵校？,如果达到陕西理工类一本线应该可以。
录取率,wu*** (山东),2011-06-26 10:24,一本一志愿的完成计划率往年能有多少？,95%吧
