标题,来源,时间,问题,回答
分数线,el*** (新疆),2011-05-12 16:42,考上300分能考上这项专业吗？,哪个专业?
我想问,sa*** (新疆),2011-05-12 16:41,请问；总分320的话能考上什么样的大学？,你想去什么样的大学？
分数线,el*** (新疆),2011-05-12 16:38,我考上350分能考上这个工作吗？,什么工作?
关于高考,gu*** (新疆),2011-05-12 16:36,如果这次高考得350分的话，那么可以进入那个大学?,哪所大学?
分数？,je*** (新疆),2011-05-12 16:35,您好！色盲考生能选（经济学），（金融学）职业吗？,参考国家高考体检指导意见
1,hu*** (新疆),2011-05-12 16:34,我那320分可以考新疆大学么？,"先知道是哪种考生类型,参考近三年的情况."
我想问,sa*** (新疆),2011-05-12 16:31,请问：总分320的话能考上什么样的大学？,你想上什么样的大学?
新大,ma*** (新疆),2011-05-12 16:00,分数线？,6月30日公布
提问,81*** (新疆),2011-05-12 15:53,请问您们这次第一批分数线是多少？,自治区定.
专业,zx*** (新疆),2011-05-12 09:34,请问，一批次和二批次同一大学专业有区别吗？可以填报同一专业吗？在哪里可以查到专业代码。,"同一大学一批次和二批次专业当然有区别,不能混报."
报考新疆大学,no***23 (河南),2010-06-29 10:39,我是河南的考生没过一本线，是不是被贵校录取的机会不大？,必须过一本线
咨询,xj*** (新疆),2010-06-28 16:51,比二本线还差29分，是否还有机会被贵校二本的一些冷门专业录取？比三本线高6分，能进贵校的三本吗,"二本线还差29分不能被录取,三本请咨询新疆大学科学技术学院"
怎么样,xj*** (新疆),2010-06-28 14:50,我是乌鲁木齐市考生，理科，成绩489，一本第一志愿报的新大（广告、新闻类）能否录取？,有可能，还要看考生报考情况
理496分  河南 回族,yu***8 (河南),2010-06-28 09:45,你们学校预科可以学哪些专业呢服从调剂可以上二本么谢谢,我校在河南只有一本，没有预科
咨询,wa***0 (山东),2010-06-27 12:11,你好我是山东理科考生超过一本线6分报贵校能被录取吗？,有可能
甘肃,lz*** (甘肃),2008-06-26 16:09,我是一名甘肃省理科考生，今年考了560分，不知道是否有希望报考贵校..{甘肃今年一本线为558分},"按以往录取情况看,过分数线一志愿报就有希望."
咨询,yy*** (贵州),2008-06-26 13:09,今年547能否上贵校,过一本分数线即可
咨询,ga*** (贵州),2008-06-26 10:27,我是贵州考生，分数是528，能考上你们学校吗?如果能，专业选择余地大不大?,"分数是528,如果是理科(分数线521)还是有很大希望，专业可调就有余地。"
您好！,pe***n (湖南),2008-06-25 16:49,各位教授下午好！！请问：贵校在湖南是否有招生计划？往年录取分数是多少？是否招专科？能否专升本！！谢谢（我们明天就出成绩了，可否快点，衷心感谢教授）,"在湖南有招生计划,不招专科,往年录取分数请参考我校信息."
你辛苦了,63*** (山东),2008-06-25 16:26,老师你好我是山东理科生分数582(一本线582）请问：若报贵校，被录取的希望有多大？,"我校这几年在山东理科招生基本上在一本线附近,若报我校，还是有被录取的希望."
咨询,ma***16 (陕西),2008-06-25 15:08,您好：我想咨询下陕西理科，高考成绩406分请问要是报贵校的大专录取的几率大不大？谢谢了,我校在陕西不招专科
十万火急,28*** (陕西),2008-06-25 13:38,我是陕西文科考生我今年考分397分请问我报考贵校有希望被录取吗如果被录取又能上哪些专业这些专业的前景又杂样,需过陕西文科一本分数线
急急急,ba***21 (山东),2008-06-25 09:47,您好！我是山东理科考生，请问589分报考贵校，录取的希望大吗》,"山东理科考生按以往情况,超过分数线,一志愿报考有希望,要注意专业."
我能被录取吗？,he***ybaby (河北),2008-06-24 16:11,我是一名河北考生（理科），今年考了509分，能报考贵校吗？,河北考生请参考河北的一批本科理科分数线。
新疆人读新大,al***3 (新疆),2008-06-24 12:00,您好!我估了510，但在平行志愿中报有该校，请问如果我第一志愿被撞车了，那我会被新大录取吗?而在平行志愿中，新大会比其他学校优先录取吗?,"我校在一志愿录取未满的情况下录取平行志愿,在平行志愿中,是按照分数优先原则，新大与其他学校一样没有区别，不具有优先权。"
ji,si*** (天津),2008-06-12 15:30,我是08年考生，理科的。天津的。近年估了420-430能否报考你们学校？？？？？？？,参考2007年分数线和今年天津地区考生考试情况
咨询,br***l (新疆),2008-06-12 13:05,老师您好?请问近三年民考汉的高考(全国范围)分数线多少?,全国范围分数线参考阳光高考平台http://gaokao.chsi.cn/
新疆考生,31***7 (新疆),2008-06-12 11:00,贵校五家渠校区的建设和设施怎样周围具体环境如和,我校没有五家渠校区
咨询,sh***ui123 (新疆),2008-06-11 16:56,请问下去年疆内美术类专业也是按专业过线文化课派名录取么？去年文化最低多少？,"去年疆内美术类专业也是按专业过线文化课排名录取,2007年文化课最低339分."
国防生,bj*** (河南),2008-06-11 16:25,请问贵校国防生录取时，对于第一自愿进档考生，在专业安排上是执行分数优先还是专业清（专业自愿优先）的原则？,采取专业级差，1-2专业10分，2-3专业5分。
平行志愿,fm*** (新疆),2010-06-27 11:14,请问老师新疆考生过一本线志愿可调的平行志愿是否一定会被录取,平行志愿录取人数要看一志愿录取完成情况，平行志愿只能是有可能录取。
咨询,10***0 (陕西),2010-06-26 14:49,老师您好我是陕西考生，考了564报贵校被录取的机会有多大？另外，能发下贵校在陕西往届录取各专业分吗？谢谢！,要过一本线
报考,05*** (河南),2010-06-26 13:23,老师您好，我是河南考生，今年高考成绩483分，想报考贵校，请问有希望吗？？谢谢诶,要过一本线
咨询,zh*** (江苏),2010-06-26 11:35,你好，我是江苏理科考生，高考成绩是371分，本一线为355分，想知道报考贵校有没有希望？,希望很大
咨询,hm*** (新疆),2010-06-26 11:16,400分，理科，报贵校的急需人才计划能否录取？,要过自治区投档线
咨询,41***003068388 (河南),2010-06-26 11:07,565可以报该校哪些专业？该校的特色专业是哪些？,过河南一本分数线，特色专业请查阅新疆大学网站。
1,li***gyihao (山东),2010-06-25 14:18,山东的587分能报贵校吗,要过山东一本分数线
二志愿,51*** (山东),2010-06-25 13:25,近三年在山东是否招过二志愿考生，若有，有无志愿级差,"招过二志愿考生,无志愿级差"
录取,14***0 (新疆),2010-06-13 15:46,我是新疆考生，今年估分520，如果我一志愿的平行志愿填写新疆大学，一定能被录取吗？还有请问老师，一志愿的平行志愿先后分顺序吗？谢谢,平行志愿填写新疆大学不一定被录取，还要看报考专业可调否。平行志愿没有顺序
安全,gu***n (山西),2010-06-12 16:21,您好！我是山西考生，去贵校上学是否安全？是否有歧视问题？,我校校园环境非常好，不用担心
河南理科多少分能上较好的专业吗？贵校重点学科都有什么？,ys*** (河南),2010-06-12 16:05,河南理科多少分能上较好的专业吗？贵校重点学科都有什么？,要过一本线，重点学科请看学校介绍
新疆考生考新大,xw*** (新疆),2010-06-12 14:59,老师您好，咱新大拳头专业有哪些，我的分不算太高，可能将将一本线，您说几率大吗，往年有没有人数录不满，给调剂的？,过一本线即可录取，近三年没有均录满，新疆也没有院校调剂一说。
咨询,yu***ng (新疆),2010-06-12 09:14,老师您好，请问：1、贵校高于重点线多少分有把握；2、第一自愿和平行自愿的关系。谢谢,达到重点线即可，如果报考好专业，要高出分数线15-20分第一志愿录不满是会录取平行志愿的考生
问题,a4***5 (新疆),2010-06-11 15:31,请问进入贵校学习能够换专业吗？换了专业后还能拿到学位证书么？,换专业要根据学校学籍规定办理
民考汉,10***5 (新疆),2010-06-11 15:06,我是一名民考汉学生，我想要报汉语言计划，请问是否承认民族加分？,民考汉可以报考汉语言计划，民考汉照顾加分直接加到总分。
咨询,ji*** (天津),2009-06-12 16:23,考得不是很理想。天津理科高考生在估分430分左右是否有希望被贵校录取？？？谢谢,如能达到天津市本科一批次分数线，有希望被录取。
新疆大学，我是新疆考生是一名理科生，我估了470分，,33*** (新疆),2009-06-12 15:06,我是新疆考生是一名理科女生，我估了470分，请问今年贵校对新疆的录取分数线是多少？我的这个成绩能在贵校上什么专业？我想学石油化工方面的，可以吗？,分数线于6月28日左右由自治区招生委员会办公室来划定。考生能达到今年新疆本科一批次录取分数线，有希望被录取。
紧缺人才,cj*** (新疆),2009-06-12 11:56,我是新疆考生，想报考您校的“紧缺人才”专业，想知道报该类专业是否要定向？定向地区、单位是哪里？谢谢！,报“紧缺人才”专业不需要定向。学生入校后，如有定向单位来签约，学生自愿与定向单位签约定向协议。
新疆的专科线是多少？,64*** (新疆),2009-06-11 15:15,新疆的专科线是多少？（最多--最少）,分数线于6月28日左右由自治区招生委员会办公室来划定。
河南理科548分,18***27 (河南),2018-06-28 16:06,能被贵校数学专业录取吗，好就业吗？,河南2017年理科最低录取分数是484，数学专业就业前景较好
湖南考生报考咨询,18***17 (湖南),2018-06-28 14:02,请教老师，湖南理科考生，498分，（今年湖南一本线513，二本线450）报考贵校有希望吗？盼指点迷津，谢谢，祝老师工作顺利！,湖南理科2017年最低录取分数为505，可以填报
录取咨询,13***30 (河南),2018-06-28 13:49,你好我是河南文科考生572分比河南一本线547多25分，能被录取吗？可能性大吗学校宿舍是4人间？是上床下柜？WiFi覆盖吗？,2017年河南文科录取最低分数531，宿舍是6人间，wifi覆盖
山东文科咨询,18***58 (山东),2018-06-28 13:22,我是山东2018年考生（女），文史类，成绩568分，位次15601，想报考英语专业或者会计专业，请给个建议，谢谢！,新疆大学现没有会计专业，英语专业有英语单科成绩要求，详情请参考招生章程
河南考生理科540有望上贵校吗,18***16 (河南),2018-06-28 12:00,能上好专业吗,2017年河南省理科最低录取分数为484
录取咨询,13***30 (河南),2018-06-28 11:36,你好我是河南文科考生572分比河南一本547多25分，能被录取吗？可能性大吗学校宿舍是4人间？是上床下柜？WiFi覆盖吗？,2017年河南文科录取最低分数531，宿舍是6人间，wifi覆盖
湖南考生,13***78 (湖南),2018-06-28 10:37,您好，今年湖南理科532报考贵校录取概率大吗？,2017年湖南省理科录取最低分数505
青海理科考生,18***01 (青海),2018-06-28 10:19,您好我是青海的一名理科考生466分全省1772名报考贵校的软件工程和环境工程希望大吗,2017年山东省理科最低录取分数446，考生可以根据自身意愿选择专业，注意专业级差，详情请参照招生章程
盼回复，谢谢。,13***22 (河南),2018-06-28 09:54,老师你好，请问河南理科考生534分，用国家专项报贵校有希望吗？,新疆大学在河南省没有国家专项计划
安徽文科,18***34 (安徽),2018-06-28 09:44,老师您好！我考了576分，排名9262，若专业不服从调剂可有档风险?,2017年安徽省文科最低录取分数529，不服从专业调剂又被退档的风险
福建录取,13***71 (福建),2018-06-27 16:48,老师您好，我是福建文科考生，总分579，排名3710，能被贵校录取吗？,2017年福建文科最低录取分数495
咨询,18***72 (河南),2018-06-27 16:33,2018年设有专升本专业吗？若设有专升本专业分别是什么专业？谢谢,没有
安徽理科排名25000，能够被贵校计算机或者软件类专业录取吗,15***47 (安徽),2018-06-27 16:33,安徽理科排名25000，能够被贵校计算机或者软件类专业录取吗,新疆大学最低投档线是生源地的一本线，专业考生和家长根据意愿从前至后依次填报
河南理科510分，报贵校有把握吗？,13***70 (河南),2018-06-27 15:09,您好！河南理科510分，报贵校有把握吗？谢谢！,2017年河南省理科录取最低分数484
河南理科生,10***4@qq.com (河南),2018-06-27 14:03,今年533分，能到您们学校学习吗？,2017年河南省理科最低录取分数484
河南理科,15***19 (河南),2018-06-27 11:12,老师，想问一下533.高一本34.希望大不大,2017年河南省理科最低录取分数484
报考,13***@qq.com (新疆),2018-06-27 10:56,老师您好，我是新疆考生，理科467分，位次16464，能否报考贵校？,新疆大学最低投档线是生源地的一本线，过了一本线的学生都可以选择填报
山东理科考生,13***38 (山东),2018-06-27 10:00,老师您好，理科分数448报考贵校建筑学被录取希望大吗？,2017年山东省理科录取最低分数446分
河南理科考生报考咨询,15***33 (河南),2018-06-27 09:37,老师您好，我是今年的河南理科考生，分数高出一本线约20分，请问报考贵校是否有希望被录取？,2017年河南省理科录取最低分数484
咨询,13***04 (新疆),2018-06-26 16:55,新疆文科考生录取分数大概要多少分，有独生子女加分，6156位次服从调剂有希望吗,新疆大学最低投档线是生源地的一本线，过了一本线的考生都可以选择填报
河南理科,13***92 (河南),2018-06-26 15:58,我是今年河南理科生，高考成绩546，高一本线47分，省排名5万多。报考贵校哪些专业可能性大呢？鉴于贵校是双一流，今年分数线会有涨幅多少呢？,2017年河南省理科最低录取分数484
提档,ws***63.com (四川),2018-06-26 15:43,四川理科考生报考你校本科一批，如被提档且服从专业调剂是否能确定不退档？,考生专业服从调剂，体检政审通过的情况下，投档至我校后不会退档
河南理科510分，报贵校软件工程有把握吗?,13***70 (河南),2018-06-26 15:25,您好！河南理科510分，报贵校软件工程有把握吗?谢谢您！,2017年河南省理科最低录取分数484
河南文科,15***42 (河南),2018-06-26 15:17,您好，我是文科生，低于一本分数线三分，全省累计位次23311，想报考贵校请问录取的可能大吗,新疆大学最低投档线是生源地的一本线
河南文科,15***42 (河南),2018-06-26 15:14,您好，我是文科生，低于一本分数线三分，想报考贵校请问录取的可能大吗,新疆大学最低投档线是生源地的一本线
山东女生 理科 546,18***69 (山东),2018-06-25 15:13,请问，报考贵校计算机科学与技术有把握吗？谢谢！,2017年山东省理科最低录取分数446
2018年重庆考生理科女生,15***74 (重庆),2018-06-25 11:56,超过重庆重本13分有机会被贵校的法学或金融学或电气自动化专业录取吗？,2017年重庆理科最低录取分数502
报考咨询,13***20 (河南),2018-06-25 11:09,河南18年考生561分过一本线14分位次15292请问老师报考贵校可能性多少,2017年河南省理科录取最低分数484
浙江考生,18***67 (浙江),2018-06-24 14:34,请问贵校的法学如何？,法学是我校法学院的本科专业，师资教学设备配备齐全
14年招国防生吗？,wa***n (新疆),2014-05-08 14:22,贵校14年招收国防生吗？分数线大概多少？,答：考生，您好。今年我校国防生没有计划。您可以报考我校其他计划。
咨询,so***o (贵州),2009-06-26 09:46,我是贵州理科考生，分数在二本463，请问可不可以报考贵学校，有没有什么专业可报,我校从贵州省一本招生。你过一本线，可以报考我校。现有74个本科专业，涵盖文、理、工、法、经、管、史、哲八大学科门类；
我是黑龙江考生，我分数是512，我能否被录取呢,sx*** (黑龙江),2009-06-25 16:29,我是黑龙江考生，我高考分数是512，我能否被贵校录取呢,如过黑龙江省公布的一本线，才有希望。
如何对待优惠加分?,79*** (重庆),2009-06-25 15:28,请问，贵校在录取专业时，是否以高考实际考分加上优惠加分后的总分为依据?,是。
问题,xc*** (四川),2009-06-25 10:14,新疆大学的特色专业或者是国家级重点专业有哪些？,现有2个国家重点学科（应用数学，中国少数民族语言文学)
zixun,zj*** (甘肃),2009-06-25 10:00,贵校对英语成绩是否有要求?英语不及格是否录取?,报考我校英语和俄语专业高考英语单科成绩汉语言考生必须在100分以上（含100分），民考汉考生必须在90分以上（含90分）。
广西考生449理科,sw***36 (广西),2009-06-23 15:56,我能否被贵校录取,我校从广西一本线录取，你的成绩没有达到一本线。
09年应届考生,xi*** (吉林),2009-06-22 09:35,您好，请问贵校在吉林省招生情况。分数线是多少？341能上吗？,今年我校从吉林省招10名考生，考生分数要过一本线有望录取。
咨询,ga*** (贵州),2008-07-02 16:17,我已经填贵校，请问现在能该专业志愿吗?,志愿填报后不能修改
有自考专业么,fu***9 (新疆),2008-07-01 16:39,你们学校有自考专业么,自考咨询0991-8582934
我能被录取吗,xj*** (新疆),2008-06-30 15:04,老师我想问一下我今年考了514和重本线差一分报的是土模工程请问我被录取的可能性大么,只有在录取时根据生源情况才能知道.
thanks,re***g88 (四川),2008-06-27 16:45,请问四川非灾区文科考生562能上贵校二本几率大不大？四川文科二本线548谢谢,我校不招二本
help,zh*** (湖北),2008-06-27 10:14,我是湖北襄樊考生，理科550，今年湖北理科一本线为548，请问：1、上贵校希望多大？2、能选专业吗？,上我校还是有希望，专业可能的调剂了。
我是一名山东艺术,lc*** (山东),2008-06-27 10:13,我是一名山东艺术生，艺术文美术专业，文化分471，只过了聊城大学一个学校，不过希望很渺茫。贵校如果美术专业招不够，能否考虑录取我，谢谢！联系方式：0635—8576216。13475719446。住址：山东省聊城市东昌府区凤凰办事处碱厂李村李成振。,我校美术专业只在新疆招生
通天塔,as*** (吉林),2008-06-27 09:52,我是内蒙理科考生，624分（一本548），报贵校希望能大不大？可报哪些热门专业？,我校在内蒙只招蒙语言考生.
专业调剂,we***e (河南),2008-06-27 09:15,我今年报了贵校生物工程专业作为第一专业，分数刚跨线，请问有希望没？专业我填了同意调剂，请问调剂是怎回事呢？这两天心急如焚，望明示。,"分数过线就有希望,调剂是指你所报专业已满,是否同意调剂到其他专业."
远方的佳音,nu***i (安徽),2010-06-11 14:15,您要像亲人一样，我将以亲人的姿态聆听！我，理科，女生，生性活泼、思维敏捷、口齿伶俐，智商还行，就是烦坐冷板凳！请给推荐一些理工科中偏文的专业，适当介绍一些专业情况更好。再问，您校的特色专业有哪些？您的经验最丰富，往往能一语中的。尽量不要给我一个网址，让我去瞎摸，指个兔子让我去撵啊！您和我的时间真的都很宝贵呀！就把我当成您的亲人吧！诚心感谢您！,感谢你对新疆大学厚爱，我校在安徽没有文科招生计划。
贵校今年要招文科生多少,we*** (新疆),2010-06-11 12:22,我是一名文科生，今年高考估分375左右，若想进入贵校报几本比较保险?,我校在一本录取，分数达到一本线上才能录取
山东考生,wr*** (河南),2010-06-10 16:41,我是山东考生，估分630，不知能不能报考贵校，还有贵校在我省的招生计划，谢谢。,山东考生报考我校，一志愿考分超过山东一本线就希望很大，招生计划请参考山东公布的计划
专科生,lo*** (新疆),2010-06-10 14:45,老师你好：我是库尔勒的一名应届生，今年的高考分数太低，估了320分左右。平时模考都是4百多，自己也不想在复读，想问一下在我的这个分数能在贵校的高职生专业录取吗?谢谢,我校只有理科有专科，且只有一个专业“现代纺织技术”，2009年最低录取370分
一本、二本录取分数大概是多少？？,ii*** (新疆),2010-06-10 13:44,一本、二本录取分数大概是多少？？,一本、二本录取分数为自治区公布的分数线
艺术类文化课今年达到多少,vi*** (新疆),2010-06-10 11:20,我是新疆本地的考生，我是学艺术的。我想报考新疆大学，文化课成绩最少要达到多少？,我校艺术类录取是将文化课成绩和美术统考成绩直接相加，总分从高到低录取，去年最低录到610分。
紧缺人才计划,zz*** (北京),2010-06-10 10:58,教师好：二批次的“紧缺人才计划”怎样填报？,二批次的“紧缺人才计划”只有采矿工程和纺织工程，理科，直接在汉语言二批次志愿表里填报即可
关于贵校调档比例的情况？,wl*** (北京),2010-06-10 10:29,老师您好！我在最好的高考博克里看了相关政策，决定报贵校，但不知道贵校情况，能否介绍一下：http://blog.sina.com.cn/s/blog_6598a8380100hjpm.html,省级招生部门对调档比例没有特殊要求的按照120%，新疆就是120%，有些省是100%或105%
志愿填报,zh***in (新疆),2010-06-09 14:44,老师您好，我是新疆理科考生，估分505分左右，请问能不能录到新大法律专业。,理科考生，估分505分左右，如果今年分数线和去年差别不大，报法学应该没有问题
口試問題,li*** (新疆),2010-06-09 12:48,貴校招收的外語專業考生需要口試嗎？如果口試，在什麽時間？什麽地點？,我校外语专业不口试
汉语言,30*** (新疆),2010-06-09 09:13,我是新疆考生预估499-505分报贵校有希望吗,请根据中学估计的分数线，如果过了分数线希望很大。文理科是不同的。
国防生女生录取规则,65*** (新疆),2010-05-12 16:59,我是新疆一名少数民族考生，饮食无特殊要求，按照自治区（省级）招生委员会的规定，考生父母一方是少数民族的加10分、双方均为少数民族的加50分投档，请问贵校在“国防生女生”专业录取时，是否以投档分为准。谢谢。,我校2010年国防生不招收女生
贵校今年有无国防生招生计划,xj***wl (新疆),2010-05-10 11:22,贵校往年国防生招生录取数据？如何报考？,"由于国防生招生的特殊性,往年录取分数波动较大,不具有参考性,所以未公布。但就一般来讲，理科在一本线上20分，文科在一本线上40分左右。"
咨询,sx*** (山东),2009-06-26 12:54,您好，请问山东文科考生622分报考贵校把握大不大？谢谢,希望较大
zixun,zj*** (甘肃),2009-06-26 10:41,贵校是否招生英语不及格者?,报考我校英语和俄语专业高考英语单科成绩汉语言考生必须在100分以上（含100分），民考汉考生必须在90分以上（含90分）。
新疆大学的重点专业是啥,sx*** (新疆),2014-05-08 12:07,请问新疆大学的重点专业是啥。我是新疆伊宁市文科生，2014年三次乌市模考都是485分，请问有希望上新大吗？这个分数在新疆排名第几？谢谢！,[答：考生，您好。新疆大学有10个国家特色专业，分别是：化学工程与工艺（石油天然气）、中国少数民族语言、资源勘查工程、数学与应用数学、电气工程及其自动化、土木工程、机械设计制造及其自动化、自动化、电子信息工程、纺织工程。19个自治区紧缺人才专业，分别是：资源勘查工程、勘查技术与工程、采矿工程、建筑学、土木工程、电气工程及其自动化、能源与动力工程、纺织工程、俄语、过程装备与控制工程、能源化学工程、信息安全、测绘工程、城市规划、交通工程、机械工程、自动化、旅游管理、软件工程等。您的模考成绩，超过了2013年新疆本科一批次最低控制线，也达到了2013年我校的录取线。如果今年高考发挥正常的话，报考我校有希望。请继续加油。欢迎报考新疆大学。
报考咨询,12*** (新疆),2013-06-17 13:33,老师您好，我是新疆理科考生，这次估了500分，约高本地一本线45分左右，是否有希望报考贵校酒店管理专业。,酒店管理是我校今年新开设的专业，没有去年的参考分数线，针对你的估分来说，录取的可能性比较大。
咨询,so***99 (新疆),2013-06-14 11:15,我是文科女生，想报考新大的国防生，估分是553，能否有希望录取，往年的国防生分数是多少?对女生有什么身体上的限制？,你好，我校今年没有国防生计划。
