标题,来源,时间,问题,回答
2013年招国防生,so***99 (新疆),2013-06-13 12:49,老师，你好，我是文科女生，想问一下，13年是否招国防生，有多少名额，高考估分553，是否有希望录取。对女生的身体条件上有什么限制,你好，我校今年没有国防生计划。
求解答求解答求解答求解答求解答求解答求解答求解答求解答求解答,lu*** (辽宁),2013-06-13 12:31,我在新疆考试成绩是430左右想考天津，北京，河北，的二本学校请问我能考上哪个？,请参考新疆招生网二本院校往年的录取分数线，http://124.117.250.21/。
按分数选专业和学校,55*** (重庆),2011-06-13 15:31,老师：请咨询重庆女生文科550分报贵省什么专业和哪所大学最好？一本二本还是三本，谢谢,"哪所大学好,请参考排名,专业好坏看学校而定."
2011报考,hr*** (新疆),2011-06-13 13:29,我是新疆考生，估分估了480.能上什么专业？,文科还是理科?
咨询下,ye*** (新疆),2011-06-12 12:06,我今年民考汉估分460分想上新大的金融学或者法学，能被录取吗,那你估计的分数应该有很大希望
咨询,ch***anxia (新疆),2011-06-12 09:55,我是新疆一考生，今年高考估分在460左右，能否到贵校就读？,"先知道是哪种考生类型,参考近三年的情况."
新疆考生估450分。能否报新疆大学,wa***o (河南),2011-06-11 15:33,新疆考生。估450分。报新疆大学有没有把握,"先知道是哪种考生类型,参考近三年的情况."
西安,mk***9 (新疆),2011-06-11 13:02,我是新疆艺术类考生，西安有没有承认新疆联考成绩的学校。,咨询西安高校
新疆大学咨询,mk***9 (新疆),2011-06-11 12:56,我是新疆考生，我的联考成绩225。文化课估分在250分左右。能不能上？,联考成绩加文化课从高分到低分录取
请问,ap***e (新疆),2011-06-10 10:34,我估分估了370分，能不能上一本,"先知道是哪种考生类型,参考近三年的情况."
请问最低分数线,ja*** (新疆),2011-05-12 17:00,请问最低分数线,咨询自治区
关于高考,gu*** (新疆),2011-05-12 16:42,如果这次高考得350分的话，那么可以进入那个大学?,你想去哪所大学?
咨询,sh***ui123 (新疆),2008-06-11 16:05,请问艺术类今年怎么招生？是专业家文化课么？去年综合分数最高最低是多少？谢谢？,艺术类专业考试合格，文化课从高分到低分录取。
录取,xi***1 (陕西),2008-06-11 15:53,我是陕西理工类考生，故了520，报考你校如何？希望大吗？谢谢,参考2007年分数线
新大招收平行志愿的考生吗？,sh*** (新疆),2008-06-11 11:04,你好，我想问：我想问把新大列为平行支援的学校，你们会招吗？注：我是民考汉考生，是新疆大学子女,根据文化课成绩录取
关于对外汉语,xi*** (新疆),2008-06-11 10:13,对外汉语专业的外语为何语种,英语
提问,ch***0806 (山西),2008-06-10 16:21,505山西文科可报考贵校否,参考2007年分数线
我490分想报贵校俄语行吗？,90*** (新疆),2008-06-10 12:06,贵校俄语专业历年调档线是多少？今年预计是多少？,汉语言2007年俄语专业文科最低556分，理科560分。
录取分数线还没出来吗？,wa*** (新疆),2008-06-10 10:13,我想问以今年新大的录取分数大概是多少？,录取分数咨询中学老师估计的一本线
专业,yx*** (新疆),2008-06-10 10:12,若报考贵校为第二志愿，本人被录取进入贵校法学专业的几率是多少？,第二志愿录取依照分数录取。
我能被录取吗？,wa*** (新疆),2008-06-10 10:09,我是一名少数民族考生，是新疆沙湾县的。我想问一下我能否有资格被贵校录取？在2008年荣获了“塔城地区三好生”，还在一些国家级文学大赛中荣获过一二等奖：分别是在全球华人散文网络大赛中荣获一等奖，第二届并新文学作品大赛中荣获铜奖，被华语作家网评为“2007年度优秀作家”称号，“我的作文我做主”大赛中荣获二等奖。联系方式：09936023680，姓名：瓦力俄拉。叶买，准考证号：2507350105，望贵校能录取我。,根据文化课成绩录取
专业,xj*** (新疆),2008-05-15 13:40,我模考成绩为450分左右，能否报贵校?为女生提供有哪些专业?,请参考我校历年录取分数线，没有单独的女生计划，一般专业不分性别。
咨询,cy*** (天津),2008-05-14 10:28,如报贵校第一专业志愿未录，转入贵校另一专业，比该专业第一志愿的考生考分高，将肯定能被录取吗？　贵校特色专业有那些？　　今年在天津共招多少人？　　去年在天津的录取分数线怎样？,这是一个专业志愿级差问题，我校一专业和二专业级差10分，二专业和三专业及差5分。贵校特色专业请查看学校介绍，2008年在天津招8人
2008高考少数民族加分情况,sl*** (新疆),2008-05-14 09:12,请问土家族在2008年高考中是否加分,少数民族照顾政策按生源地政策执行。
定向生,13***65 (新疆),2008-05-12 12:39,请问2008年是否招本科定向生,"招本科定向生,详情查看招生简章"
专业,ya*** (新疆),2008-05-12 11:04,重点专业是？二志愿能有好专业吗？谢谢！,二志愿一般没有好专业了
新疆考生考新大国防生要多少分？,sl*** (新疆),2007-07-02 14:53,今年新疆的考生报考贵校的国防生需要多少分？,新大国防生估计接近一本分数线。
报考新大,ld***08 (新疆),2007-07-02 09:45,老师好，我是新疆的考生，文科考了518分，第一批第一志愿报考的新疆大学，同意调剂，请问被录取的可能性有多大？大概什么时候能知道结果？谢谢,文科518分，差分数线520分2分，如果生源不足，降分有一定可能，7月13日左右联系。
招生,sb***9 (湖北),2007-06-28 12:22,请问贵校在湖北的招生情况,湖北的招生情况上我校网站察看。
分数线问题,li*** (新疆),2007-06-27 16:23,贵校一本录取分是多少?当地一本线是多少?,分数线上网查
民考汉       急!!!!!!!!!!!!!!!!!!!,nu***n (新疆),2007-06-27 13:06,我的志愿改了第一志愿报的贵校但我只考了456分我是民考汉有希望上么!!,参考分数线
关于录取,sh*** (新疆),2007-06-27 11:13,我今年分数536分，报了贵校国防生和一本的第三志愿，二本报的内地学校，请问如果国防生未被录取的话，是先录一本的第三志愿还是二本的一志愿，还有如果我的一本第三志愿被录取，但我想上二本的内地学校还能行吗？谢谢老师,先录一本的第三志愿，再录二本的一志愿，一本第三志愿被录取就不能投二本了。
我知道老师们很繁忙！也希望老师能够理解一下我的心情！,cq*** (重庆),2007-06-26 15:18,你好，我是一名考生！我想索要一份贵校的报考指南。目的有两个：第一是我很喜欢新大，假如没有考上就作为一个纪念，第二假如考上了也是一种纪念！可以满足我这个小小的愿望吗？我知道老师们很繁忙！也希望老师能够理解一下我的心情！我的地址：重庆市渝中区临华路小区25号13－7户袁宏仁收邮编:400013,后面联系
新大专科,60*** (贵州),2007-06-26 11:22,请问贵校去年分数线是多少？每一年的录取分数线是否与每个省划定的专科分数线一致？,新大不招专科
山东烟台考生,wa***ong (山东),2007-06-25 16:41,我是山东烟台考生，我的高考分数是467分（语文65分，数学131分，英语70分，理综150分，基本能力48分，我的理科成绩较好，今年主要是英语和理综科目发挥失常，平时我英语成绩在100左右，理综在190左右），我在烟台市高中生中计算机属于顶尖水平，曾经在高二，高三获得两届全国中学生信息学联赛二等奖（其实我两年都是一等奖，是被人为因素排挤下来的，因为一等奖有保送资格等诸多因素，烟台二中刘昊洋分数本来不够一等奖，结果他的分数由于人为因素达到了一等奖，保送到中国人民大学）。我知道我的分数未达到贵校分数线，贵校是否能破格录取我到计算机科学与技术系？我的电话是0535-4981915（小灵通）,必须过一本线
国防生，请速回复,ja*** (河北),2007-06-25 10:59,请问河北理科考生577分，二本线549，目前根据咨询情况，有希望成为贵校的国防生吗?,有希望
zixun,ch*** (四川),2007-06-22 16:14,贵校的优势专业有哪些？不知道贵校的电气工程及自动化专业如何？就业率是多少？一般要高出四川省重点线多少分才有希望报考贵校？,查阅网站
救命,ya***i007 (宁夏),2007-06-22 09:23,我是宁夏考生连二本都没上贵校我有希望吗????????????,没有希望
zixun,qi***1 (四川),2007-06-18 16:55,请问贵校招收少数民族预科不？如果招收请问今年招收四川少数民族预科生不？谢谢！,我校招收新疆民语言考生少数民族需预科，新疆民考汉不需要预科。外省考生均不需要预科。
专科的学校好吗？有那些是好的专科学校？,ta***5 (新疆),2007-06-18 12:03,我想找找那些是还的专科学校啊，找一个好的专业啊，我是一名理科生？,可以查询填报志愿手册
请教！山东,li*** (山东),2007-06-15 14:56,请问老师，贵校前三年在我省理科录取的平均分是多少？谢谢！,上网查询http://www.xsc.xju.edu.cn/zsxx/bkzn/lqfsx.htm
高考问题,ch*** (新疆),2007-06-15 10:30,是否招收一批次第3志愿？（我是本市考生),我校招收一批次第3志愿，即平行志愿。
咨询,li*** (甘肃),2007-06-11 10:08,您好!请问该校今年高考分数线是多少?,政府公布
咨询!,vi*** (新疆),2007-06-11 09:45,我是新疆本区考生(文科)我想问，贵校能否录取一批次2志愿考生?,录取一批次2志愿考生
询问,mu***gde (新疆),2007-06-11 09:30,请问贵校的专业级差是怎样安排的?,1-2为10分，2-3为5分
询问,mu***gde (新疆),2007-06-11 09:16,请问贵校的专业级差是怎样安排的?----谢谢,专业级差1-2为10分，2-3为5分
疑问,ya***20 (甘肃),2007-06-10 16:54,为什么今年新疆大学在甘肃没有招生指标？？,在甘肃招生！
2006年各专业录取分数线,kt*** (新疆),2007-06-10 16:34,请告知2006年各专业录取分数线.,专业录取分数线http://www.xsc.xju.edu.cn/zsxx/bkzn/lqfsx.htm
新疆学子,nu***n (新疆),2007-06-10 16:01,问下民考汉去年的第一志愿录满没。谢谢老师拉,第一志愿录满了
有没有专科,12***8 (新疆),2007-06-10 14:24,新疆大学今年没有专科吗?,新疆大学没有专科
福建文科考生490 能上吗？,ss***9 (福建),2006-06-29 16:31,福建文科考生490能上吗？,没有希望，你必须要达到今年福建省招办公布的重本分数线。
老师好！,wo***ei (北京),2006-06-29 15:28,贵校在河南录取多少人？录取分数线和结果何时能出来？,我校今年在河南的文理招生计划为50人，录取分数线已经公布。
新疆考生,su*** (新疆),2006-06-29 10:18,请问521分能走贵校吗我是新疆考生,你的分数已达到重本线，有希望，具体情况还要看你的志愿信息和我校的生源情况，录取时择优录取。
511,su*** (新疆),2006-06-29 10:14,请问贵校是否有可能降分招生我考了511,我校在招生录取时，在个别专业生源不足的情况下，经自治区招生委员会同意，进行适当的调分。
626,fu*** (浙江),2006-06-28 16:46,浙江理科626，希望多大？,浙江分数线570，626应该没有问题。
600,fu*** (浙江),2006-06-28 16:42,浙江理科600，希望风险孰大？,浙江理科分数线570，应该没有问题。
山东考生,li***871127 (山东),2006-06-28 15:03,我今年考了601分，比重点线高出18分，二志愿报考贵校能被录取吗?,"比重点线高出18分,二志愿报考有可能录取，要看一志愿完成情况。"
请教！山东,li*** (山东),2007-06-15 09:24,请问老师，贵校前三年在我省理科录取的平均分是多少？谢谢！,上网查询http://www.xsc.xju.edu.cn/zsxx/bkzn/lqfsx.htm
美术,r1*** (河北),2007-06-14 10:00,招河北美术生吗？看美术联考成绩吗？,我校不在河北招美术生
估了570,we*** (河南),2007-06-14 09:28,老师您好我是河南文科考生，估分为570，请问报考贵校历史专业，希望大吗？考入贵校后，如果对专业不满意，可以申请转专业吗？,如果你估分超过河南省文科一本分数线，报考历史专业应该希望很大。
国防生,sh*** (新疆),2007-06-13 14:10,请问贵校近年来的国防生录取分数线和录取人数如何,国防生以往是按一本线录取，今年按二本线录取。
新大志愿差,75*** (新疆),2007-06-13 13:04,新大志愿级差是多少？谢谢,我校不设院校志愿级差，专业级差1-2为10分，2-3为5分。
咨询,75*** (新疆),2007-06-13 12:49,新大有那些重点专业？谢谢,了解新大重点专业，可以查看学校介绍。
请问,xx*** (新疆),2007-06-13 12:22,估分510以上，二志愿可以录取吗？,要看今年分数线。
咨询,wa***66 (河南),2007-06-13 11:48,请提供贵校历年提档分数谢谢我估590多分上贵校有希望吗,历年提档分数查看http://www.xsc.xju.edu.cn/zsxx/bkzn/lqfsx.htm
新大,we***ng (河南),2007-06-13 10:07,我是河南理科考生，估份在590，能上新大吗？,要看今年分数线高低。
咨询,39*** (新疆),2007-06-12 14:42,您好老师，请问新疆大学历年录取专业分数是多少~,上网查询http://www.xsc.xju.edu.cn/zsxx/bkzn/lqfsx.htm
请问..,sh***i110 (新疆),2007-06-12 14:27,老师您好:请问贵校有专科吗去年的专科分数线是多少谢谢~,我校今年起不招专科。
关于国防生,sh*** (新疆),2007-06-12 13:32,请问国防生历年的录取线是多少？我今年估分520分。有希望吗,今年国防生录取线按二本线，但肯定会比二本高。
急！,ta***an (新疆),2007-06-12 13:08,第一志愿报考贵校是否能降分录取？是否收第2志愿和平行志愿的考生？,降分录取要看生源情况。
新疆考生,pp*** (新疆),2007-06-12 12:57,新疆理科今年480-500可能被录取吗?,等分数线出来看
山西考生咨询,zh*** (山西),2007-06-12 11:11,我是山西理科考生，估分570是否能被贵校电气工程及其自动化专业录取，山西一本线估计550左右，如果不够我还有希望转别的专业吗?我能被录取吗谢谢老师!!!,过一本线就很有希望。
分,17*** (浙江),2007-06-12 09:34,浙江的本科划线是多少分,浙江省招办公布
帮助,li*** (北京),2007-06-12 09:27,我是新疆考生，估500能不能报新疆大学，是不是新疆大学只要上线就能录取，还有能不能告诉我新疆大学的录取规则,新疆考生，新疆大学基本上上线就可以录取。
第二志愿,li***appy (新疆),2007-06-12 09:07,我是新疆的文科考生，估分５３７，请问报考新大第二志愿可以被录取吗？能否进行专业选择？谢谢老师！！,二志愿很有可能。
我要提问,li***appy (新疆),2007-06-11 16:57,我是新疆的文科考生，估分537，请问该校是否录取第二志愿的考生?,过分数线第二志愿很有可能。
请问...,xj*** (新疆),2007-06-11 16:33,老师你好:我是一名民考汉考生，想知道今年380(加了民族分以后)能不能上贵校?谢谢,参考新疆分数线，以往高出分数线30分左右。
提问,hq*** (贵州),2007-06-11 15:16,请问在贵州招不？招多少５２０可以取？该校在化学方面的情况这样,我校在贵州招生
????,pa*** (新疆),2007-06-11 14:39,这次文科数学分数线可能多少啊?,月底政府公布
您好，请问估530分的理课生有可能被贵校录取吗？,ya***960 (陕西),2007-06-11 13:17,您好，请问估530分的理课生有可能被贵校录取吗？若能录取请问是哪个专业呀？,要过一本分数线才行。
我是新疆理科考生,wi***g (新疆),2007-06-11 13:07,我在一本线（本校估的）位置，能报你校吗？报考什么专业比较好？另外，新大，什么专业招的分高些，什么低些？,一本线（本校估的）位置，如果一志愿报考，大多数专业都可以报。
我是新疆理科考生,wi***g (新疆),2007-06-11 12:41,我在一本线（本校估的）位置，能报你校吗？报考什么专业比较好？为什么今年没有信息工程专业啊？,一本线（本校估的）位置，如果一志愿报考，大多数专业都可以报。
请问该校是否设有专科/高职？,39*** (新疆),2007-06-11 12:39,请问该校是否设有专科/高职？若设有，有哪些专业？？,我校今年起不招专科。
咨询,ka*** (河南),2007-06-11 11:45,高考590分，能报贵校吗?,参考一本线，过线基本就可以。
你好,hh*** (新疆),2007-06-11 11:17,请问今年新大有大专班吗?谢谢!!,我校今年起没有大专
一本有没有降分的可能?,88*** (新疆),2007-06-11 10:57,我是新疆考生，想报贵校一本，又担心分数不够，想问一下，如果一本招不够，会不会降分录取，大概能降多少?,看生源情况，以往不超过10分。
报考该校,hu*** (新疆),2007-06-11 10:23,理科490分，报考该校旅游管理专业有把握吗？,参考一本线
理科661,yu*** (山东),2006-06-26 09:21,理科661分，报考贵校行吗?,你必须达到今年山东省招办公布的分数线才有希望。
重庆一理科考生,la***n (重庆),2006-06-25 16:48,重庆市一理科考生，成绩535分（重庆市重点最低控制线531分），三峡库区移民加分5分是540，贵校承认吗！报贵校电子信息工程、电气工程与自动化、机械设计制造及其自动化等，专业服从分配。有希望吗！！急急急！！！,对于三峡库区移民加分，我校依照重庆市的政策办理，重庆市统一认可，我校就认可，按照专业情况，录取你报考的专业有些困难，但专业可调，我们会考虑相近专业的，录取还是有希望的。
560,99***777 (四川),2006-06-25 16:05,我刚刚560，有希望吗?,有希望，还要看录取时的情况而定。
招生计划及备注,wo***uren (湖南),2006-06-25 15:16,请问贵校的今年的招生计划？另外小生是一名色盲，请提供备注有色盲受限专业的招生计划。若提供网址请超具体。再烦请老师提供一些色盲需注意的意见！拜谢！,相关计划及要求请登陆：www.xsc.xju.edu.cn
降分,ap***g (浙江),2006-06-25 15:13,我是浙江理科考生，请问贵校在近几年中有无出现过降分的情况，有无录取了分数为重点线下一点的考生,我校在进行录取工作时，若个别专业生源不足，经自治区招生委员会同意后，会对个别的专业进行适当的调分，但只是针对新疆维吾尔自治区的考生。
浙江请问贵校有降分政策吗??????,ya*** (浙江),2006-06-25 14:03,请问贵校有降分政策吗??????请问贵校有降分政策吗??????,没有我校在进行录取工作时，若个别专业生源不足，经自治区招生委员会同意后，会个别的专业进行适当的调分，但只是针对新疆维吾尔自治区的考生。
四川考生,ho*** (四川),2006-06-25 13:38,我考了573分（重点560)上贵校可以吗？,有希望，但也要看今年我校在四川生招生的生源情况以及你的志愿填报信息。
581浙江理科,g1*** (浙江),2006-06-25 13:37,581浙江理科能否被录取?希望大吗,你必须达到今年浙江省招办公布的分数线才有希望
咨询,13***10 (新疆),2006-06-25 13:14,新疆今年的理科录取一批次分数线是多少？,自治区招生委员会将会在6月28号左右公布投档控制分数线。
咨询,32*** (山东),2006-06-25 09:18,老师好，我今年考了515(山东理)，问上贵校专一有把握吗,你必须达到今年山东省招办公布的分数线，才有希望。
请问：新疆医科大学是否并入新疆大学？,fu*** (河北),2006-06-24 16:44,请问：1.新疆医科大学是否并入新疆大学？2.河北理科582分能否报考新疆医科大学？,没有，是两所不同的大学。
你好，我想知道新疆医大2006年的分数线,a1*** (山西),2006-06-24 14:36,你好，我想知道新疆医大2006年的分数线,你可以与新疆医科大学联系，进行咨询。
谢谢,nj*** (云南),2006-06-24 13:43,老师您好：我是云南考生，请问５３０分能上你们大学吗？,你必须达到今年云南省招办公布的分数线才有希望。
急!!!急!!!!!!!,86*** (新疆),2006-06-24 13:08,老师您好，如果一批2志愿报考贵校，是否设志愿级差?贵校收费情况高吗?宿舍情况如何?,"一批2志愿报考我校,没有志愿级差，学费3100-3500元"
问,wl*** (河北),2006-06-24 12:30,老师您好，我是一河北理科考生，我考了578，只高出本一线（577）1分，但我十分想到贵校学习。若我第一志愿报考贵校，报什么专业比较有希望被贵校录取呢？,你可以添专业可调，就有希望。
一志愿,q1***40 (海南),2006-06-28 14:04,老师我是理科生考了579比1本线高10分我一志愿报贵校机会多大？,1本线高10分一志愿报应该问题不大，因为我校计划少，报考考生也很少，一般一志愿上线就希望就很大。
新大,ch***141 (新疆),2006-06-28 12:59,我是新疆考生！考了523！报新大能稳走吗？,报新大，还要看专业填报情况。
有没有志愿级差,da***ir (山东),2006-06-28 09:56,山东考生第二志愿报贵校有没有志愿级差?有的话大概多少?,没有志愿级差
有无志愿级差,da***ir (山东),2006-06-28 09:50,第二志愿报贵校有没有志愿级差?是多少?,第二志愿报没有志愿级差
请问,do***ngling (新疆),2006-06-28 09:47,贵校的专科为什么实际录取往往比较高?录取规则是怎样的?如果考的分数够专科分数线而且第一志愿填的又是贵校，是否能被贵校录取?,专科实际录取较高主要由于报考考生多计划少。
请问,do***ngling (新疆),2006-06-28 09:42,我专科第一志愿报的是贵校，分数是335，请问被贵校录取的希望大吗?,按以往录取情况看，有些困难，我校专科录取分较高，一般在380左右。
专科咨询,ya***8724 (广西),2006-06-28 09:33,你们学校在过线生源不足是怎么录取？,过线生源不足，我校会录取二志愿考生，各志愿批次均不足，我校会调整计划。
福建招生,ke***70790 (福建),2006-06-27 16:30,请问是否在福建招生?????,我校在福建招生。
老师急，打扰了,ch***i (甘肃),2006-06-27 15:48,我是甘肃考生考了565分，我一本的第二志愿报考你校，录取的可能性有多少?,过了一本分数线，一本第二志愿报考有一定希望，还要看一志愿生源情况。
咨询<四川>!,31*** (四川),2006-06-27 15:22,老师，我，四川理科考生，成绩576，请问第一志愿报考贵校，希望大不大?急盼!不甚感谢!!,依照你的成绩第一志愿报考我校希望会很大。
询问,46*** (山东),2006-06-27 14:48,山东考生文科541理科551报贵校是否有希望,分数没有达到山东今年一本分数线，可能没有希望。
重庆的考生589分行不(2志愿),xi*** (重庆),2006-06-27 13:57,你们学校有志愿级差吗?是志愿级差哦,我校处理考生专业志愿时设置专业志愿级差，其标准为：1-2专业志愿级差为10分，2-3专业志愿级差为5分，其他专业志愿级差为0分。
2531,25*** (河南),2006-06-27 13:45,老师好，请问贵校在河南招收大专吗?若有510--520上贵校有几成把握.谢谢,我校的专科招生计划只针对新疆考生，不对全国招生。
咨询,fo*** (湖北),2006-06-27 13:29,贵校新生入学后1年的转专业要求是什么如果我报考贵校549+10（民族分）=559并服从专业调剂，被录取的希望大吗,新生入学后1年的转专业要求请查阅我校学籍管理规定，加分后总成绩要达到湖北的一本线。
咨询,fo*** (湖北),2006-06-27 13:25,贵校的转专业政策是怎样的,我校转专业政策原则新生入校时不允许调整专业，一个学期后，根据学籍管理规定可以到教务处申请转专业。
咨询,fo*** (湖北),2006-06-27 12:40,我是湖北文科考生分数为549还有10分民族分总共为559分（湖北文科一批线为545分）报考贵校有希望吗,要看湖北省今年报考生源情况，你的成绩相对分数线来看，还是很有希望的，尽量避免专业撞车。
咨询,fo*** (湖北),2006-06-27 11:01,我是湖北文科考生总分549还有10分民族分报考贵校有希望吗,你必须达到今年湖北省公布的重本分数线才有希望。
关于国防生`~~急~~~,33*** (湖北),2006-06-27 09:58,老师，我是湖北的考生，今年我省一类重点线546二本（一）515我考了542分请问录取您校国防生，还有希望吗？,我校在录取国防生时，是按重本线进行录取的。你须达到今年胡北省招办公布的重本分数线才有希望。
分数、视力及专业,zr*** (四川),2006-06-27 09:49,四川理科考生581分，近视900度。一本第二志愿报考贵校软件工程、电气自动化、机械设计及自动化、路桥工程专业，该分数被录取有把握吗？该视力会受限制吗？谢谢！,按照国家体检指导意见，视力一般专业不作要求（受限专业请查看体检标准），只要你的文化课成绩过线，就问题不大。
