标题,来源,时间,问题,回答
浙江考生,fo*** (浙江),2006-06-27 09:15,浙江考生理科564，重点线570。报考第一志愿希望大吗？,你需达到今年浙江省招办公布的重本线才有希望
招收二志愿考生吗？,da***ir (山东),2006-06-27 09:06,我是山东考生，请问贵校招收二志愿考生吗？对二志愿考生是否减分录取？如果减分，级差分是多少？理科590分报贵校有多大希望？,我校录取工作在处理考生专业志愿时设置专业级差，标准：1-2专业志愿级差为10分，2-3专业志愿级差为5分，其他专业志愿级差为0分。
咨询,vi***er (河南),2006-06-26 16:40,我是山东东营的一名理科考生，我考了512分，请问报考贵校的3批是否有希望。山东3批资格线是490。,我校的三批是独立学院新疆大学科学技术学院单独进行招生的。相关事宜请拨打电话：0991-8588083
wen,du*** (江苏),2006-06-26 15:57,我是江苏考生，今年考了521分，江苏的本二线是542分.我知道报考贵校希望比较小，但我还是想试试看，请问老师觉得还有没有那么点希望呢?如果有那么小一点希望的话，基本可以填什么专业?不晓得如果降分的话，有没有被录取的希望?麻烦老师了.,新疆大学只招收重点一批次本科，并且按照各省的一批次分数线录取。你是江苏考生，即按江苏省的一批次分数线录取。我校在进行录取工作时，若个别专业生源不足，经自治区招生委员会同意后，会个别的专业进行适当的调分，但只是针对新疆维吾尔自治区的考生。
xiexielaoshi,qi***anke (天津),2006-06-26 15:35,我是天津文科考生，428分，另外我还有二级运动员最多20分的降分提档的政策优惠.．我第一志愿报的是贵校且服从调剂..请老师一定给我一个明确的回答我能被录取的概率有多大???谢谢~!!!!!!!!!!!!!!!!,新疆大学高水平运动员的招生对象是新疆疆内的的考生，不对全国招生。你必须达到今年天津市招办公布的分数线，才有希望。
降分录取,dj*** (山东),2006-06-26 12:58,若本科生源不足，可否降分录取.,新疆维吾尔自治区招生委员会会根据今年的具体情况安排
云南理科590有希望吗?(二志愿),ci*** (云南),2006-06-26 12:05,云南理科590有希望吗?(二志愿),你需要达到你们云南省今年的重本分数线，才有希望，在此基础上还要看我们的计划完成情况。
咨询,gw*** (新疆),2006-06-26 10:13,老师，如果学校对报考专业有分数要求，而我的分数不够专业分，那录取时怎么录取?,你必须达到今年自治区招生委员会公布的分数线，才有希望。每个专业都有自己的实录线，热专业实录线较高。
请问,do***ngling (新疆),2006-06-26 09:46,贵校往年的专科录取分数是多少?(2003.2004.2005)谢谢!!!,新疆大学专科计划比较少，实际录取线往往比较高，去年参考分数线文科290，理科270分。
河北考生问题,ok*** (河北),2006-06-26 09:32,该校的生物工程，通信工程，电子信息工程，电子信息科学与技术，电气工程及自动化，生态学，过程装备与控制工程中哪个专业还好就业，前景更好谢谢！,相关就业问题请拨打电话：0991-8582972
专业问题,ok*** (河北),2006-06-26 09:26,贵校什么专业是龙头专业？我是河北的今年考了579能上贵校的可能性有多大？,[新疆大学的学科中2个国家级重点建设学科（应用数学、中国少数民族语言文学），7个自治区级重点建设学科（机械制造及其自动化、生态学、动物学、人口资源与环境经济学、专门史、物理化学、矿产普查与勘探），6个“211工程”重点建设学科群（少数民族语言文学与民俗学、中国新疆与中亚经济文化研究、新疆资源生态环境与生物技术、信息技术与应用、应用化学与材料、应用数学与系统工程）你必须达到今年的河北省今年的重本分数线，才有希望。
咨询,qi***uan (福建),2006-06-13 11:22,请问贵校有医学专业吗???贵校今年在福建招多少人??,我校没有开设医学专业，今年我校从福建省共招8名考生，均为理科考生。
定向生,ma***ai (甘肃),2006-06-13 11:02,是否在甘肃招定向生？,没有
河南考生,wa***ilai (河南),2006-06-13 10:11,河南理科考生588分能否被你校录取呢？,你要达到河南省招办公布的重点本科分数线，才有希望。
师好!我是一名艺术生(美术)，专业考了290分文化刻大概是400分，不知道上贵校怎么样!可以吗? 应该报什么专业. 还有上年收的学生文化课最低是多少.谢谢!,li*** (河南),2006-06-13 09:49,师好!我是一名艺术生(美术)，专业考了290分文化刻大概是400分，不知道上贵校怎么样!可以吗?应该报什么专业.还有上年收的学生文化课最低是多少.谢谢!,我校今年只从新疆招收艺术类考生，给外省没有投放艺术类计划，新疆考生必须要到达自治区招办划定的艺术类分数线，我校结合文化成绩和专业成绩从高分到低分择优录取。
咨询,qi***uan (福建),2006-06-13 09:29,你好请问贵学校有医学专业吗???,我校没有开设医学专业。
560能上吗?,as*** (河南),2006-06-12 16:25,我是河南理科考生.谢谢.,你要达到今年河南省招办公布的理科重点本科分数线，才有希望。
为什么没人提啊那我来,mo***d (浙江),2006-06-12 16:17,请问您学校有关于艺术这方面的专业吗　？要是有那是看统考的专业吗？那合成分怎么算呢？,新疆大学下设有艺术设计学院，但其招生对象是新疆维吾尔自治区的考生，不是面向全国招生的。
理538报考贵学院成吗？,47*** (河南),2006-06-12 15:07,同上,你要达到你所在省招办公布的重点本科分数线，才有希望。
老师请回答,36*** (甘肃),2006-06-12 14:47,我是甘肃考生！我想报考贵校想了解下贵校专业情况我估考了487我想知道能被录取吗?你校可专升本吗？,你要达到甘肃省招办公布的重点本科分数线，才有希望。按找国家教育部相关文件规定，我校不再接受专升本学生。
没死人吧，怎么说话没人理我？,ni*** (新疆),2006-06-12 14:34,摆脱大姐：给个理由先，为什么不回答问题？,由于近期工作原因，未能及时答复广大考生的疑惑，请考生谅解。
贵校的重点专业是什么？,ni*** (新疆),2006-06-12 14:28,老师您好：贵校的重点专业是什么？谢谢！！！！！！！！！！！！！！！！！！！！！！！！！！！！！！！！！！！！！！！！！！！！！！！！！！！！！！！！！！！！！！！！！！,[新疆大学现有本科专业涵盖文、理、工、法、经、管、史、哲、艺术等学科门类。现有19个学院、1个直属系、8个研究所、3个教学研究部、3个教学实践中心。学校现有73个本科专业，64个硕士学位授权点、5个工程硕士授权领域、拥有MPA（公共管理硕士）专业学位授予权并可在8个专业招收高校教师在职攻读硕士学位，5个博士点，3个博士后科研流动站，2个国家级重点学科（应用数学、中国少数民族语言文学），7个自治区级重点学科（机械制造及其自动化、生态学、动物学、人口资源与环境经济学、专门史、物理化学、矿产普查与勘探），6个“211工程”重点建设学科群（少数民族语言文学与民俗学、中国新疆与中亚经济文化研究、新疆资源生态环境与生物技术、信息技术与应用、应用化学与材料、应用数学与系统工程），2个国家省部共建重点实验室培育基地，1个国家级人文社会科学研究基地。学校已形成专科、本科、硕士、博士等多层次较为完整的高等教育体系。
河南艺术,fa*** (河南),2006-06-12 14:13,请问贵校是否采用我省艺术统考成绩,我校今年只从新疆招收艺术类考生，给外省没有投放艺术类计划，我校自行组织艺术类专业加试。
您好,87*** (新疆),2006-06-12 12:36,我是民考汉理科生，估分480，有希望报大吗？,你要达到今年自治区招办公布的民考汉理科重点本科分数线，才有希望。2005年我校从新疆招生民考汉理科最高分521分，最低分385分，平均分423分
老师您好忙啊~~~~~别累坏了！！,zx***9 (新疆),2006-06-12 10:52,请您在忙中抽出时间解答一下我的问题谢谢！！！！！！！！！！！！！！！,多谢这位学生可以体谅我们的工作，我们会尽可能地为广大考生解答疑惑。
录取情况,re***ou (新疆),2006-06-12 10:52,尊敬的老师您好，我是一名理科考生，今年估分为428分，三本一志愿报贵校的俄语专业是否能顺利录取？谢谢！,三本是新疆大学科学与技术学院录取批次，他们是独立招生，请与新疆大学科学与技术学院联系。
咨询,sh*** (新疆),2006-06-14 15:18,你校今年的录取分数线大概是多少？我估了460分，报考你校是否有希望？,录取分数线由自治区招生委员会于六月底公布你可以参照新疆大学近两年的录取分数线慎重填报
线,ja***97 (贵州),2006-06-14 15:00,我只考了400分左右，你学校是否有我可以读的专业？或者。你给我推荐个你们那里我可以读的学校,你可参照我校在贵州省近两年的录取分线慎重填报，新疆农业大学、新疆财经学院可供选择。
老师我要问,gw*** (新疆),2006-06-14 11:53,老师，如果我的分数线到了某所大学的分数线，但我不服从专业调剂，是不是就不录取了?谢谢.,这要看你是否达到你所报专业的实际录取线，如果达到也可能被录取。
河南理科580,he*** (河南),2006-06-14 11:51,哦，对了，河南今年估的一本线在580分左右。,你要达到河南省招办公布的重点本科分数线，才有希望。
河南理科580,he*** (河南),2006-06-14 11:47,我查看了贵校近几年在河南的录取情况，发现最低录取分数接近一本线，如过所报专业为不太热门的怎么样？,一般分数过一本线都有被我校录取的可能
电子信息工程,li*** (贵州),2006-06-14 11:21,电子信息工程学的是什么,请你拨打我校信息科学与工程学院的办公电话咨询0991-8585451
录取分数,13***41 (西藏),2006-06-14 11:15,老师：你好我是一名西臧汉族考生，估分430分（文科）。是否能报考贵校。,你要达到西藏招办公布的重点本科分数线，才有希望。2005年我校录取的文科最高分525，最低分448，平均分469
河南理科580,he*** (河南),2006-06-14 10:00,你好，我是河南的一名理科考生，580分被贵校录取可能大吗？贵校的就业情况如何？谢谢！,你要达到河南省招办公布的重点本科分数线，才有希望。我校近几年就业情况较好，一次性就业率达到85%以上。
甘肃理科584分，报贵校录取的可能性大吗？,ch*** (甘肃),2006-06-13 16:14,老师，您好，我是甘肃理科考生，估分584分，第一志愿报贵校，能被录取的可能性大吗？,你要达到今年甘肃省招办公布的理科重点本科分数线，才有希望。2005年我校从甘肃招生理科最高分600分，最低分558分，平均分575分
急！！！！！！！！！！！！,zo*** (山西),2006-06-13 15:59,我是山西理科考生，今年估了520不知能否上贵校一本。谢谢。。,你要达到今年山西省招办公布的理科重点本科分数线，才有希望。
录取分数线,zh***ia (安徽),2006-06-13 15:52,黑龙江理科考生480左右能否考入贵校,你要达到今年黑龙江省招办公布的理科重点本科分数线，才有希望。2005年我校从黑龙江招生理科最高分607分，最低分589分，平均分597分
求问......,so*** (北京),2006-06-13 15:08,贵校的理科三本和大专录取线分别是多少，，谢谢了,我校三本是由我校独立学院新疆大学科学技术学院进行录取请拨打电话：0991-8588083咨询。
新疆,wa*** (新疆),2006-06-13 12:34,请问新疆文科估分在490分能否上贵学校,你要达到今年自治区招办公布的文科重点本科分数线，才有希望。2005年我校从新疆招生文科最高分578分，最低分516分，平均分529分
实验班,ui*** (新疆),2006-06-13 12:21,我对电脑非常感兴趣也跟电脑接触5年多了。。在这5年的休假时间，在好几个的电脑公司里打工，作过设计师，打字员，摄像师，编辑人，维修员，销售员，网管。。所以今后的日子里，像你们这样好的大学里发展自己这方面的兴趣，继续开拓自己的潜能。。。希望你们给我一个机会，好好考虑我。。我也在第一个志愿中填你们的学校。。我对网络很感兴趣。。。我自己建立了一个网站。。你们参考参考：http://www.akram.kkqk.com希望快点回答可以吗？尽量6月13号下午前艾克热木新疆哈密,不知道这位考生是民考民，还是民考汉?欢迎这位考生到新疆大学求学。你要达到今年自治区招办公布的你的语种对应的理科重点本科分数线，才有希望。2005年我校从新疆招生民考汉理科最高分521分，最低分385分，平均分423分2005年我校从新疆招生民考民理科最高分616分，最低分367分，平均分397分
您好！！！,tu*** (河南),2006-06-13 11:43,500分有可能被您校录取吗？？？,你要达到你所在省招办公布的今年理科重点本科分数线，才有希望。
河北一考生,wa***un (河北),2006-06-24 11:53,请问文史404分报贵校有希望吗？,你必须达到今年河北省招办公布的分数线才有希望。
老师您好,me*** (新疆),2006-06-23 16:46,我是新疆的民考汉考生，我估了403分，报贵校不知能否被录取。谢谢,你必须达到今年自治区招办公布的分数线才有希望。自治区照办将于6月28日左右公布各批次录取最低投档控制分数线。
老师您好！,li*** (河北),2006-06-23 14:58,我是河北理科考生，今年分数590，报贵校有希望吗？谢谢。,你必须达到今年河北省招办公布的分数线才有希望。
老师您好！,li*** (河北),2006-06-23 14:53,我是河北理科考生，今年分数590，报贵校有希望吗？谢谢。,你必须达到今年河北省招办公布的分数线才有希望。
急,qi***anke (天津),2006-06-23 11:13,我是天津文科考生，估432分，另外我还有二级运动员最多20分的降分提档的政策优惠.我第一志愿报的是贵校且服从调剂.天津重点中学估分二本线在480-485.请老师一定给我一个明确的回答我能被录取的概率有多大???谢谢~!!!!!!!!!!!!!!!!,新疆大学高水平运动员的招生对象是新疆疆内的的考生，不对全国招生。你必须达到今年天津市招办公布的重本分数线才有希望。
关于专升本,yj*** (浙江),2006-06-23 10:25,能不能特许外校学生升专升本？我今年刚刚专科毕业，但是文凭可能要到下半年才能拿到，我已经让我的母校开了张专科学历证明？这样可以吗？我想把身份证和专科学历证明寄过来让你们看看行吗？我很想就读贵校。都有哪些专业，怎样才能报名？,按照教育部规定，“211”工程院校不允许办普通类的专升本，你可以考虑我校的成人专升本。
您好,qi***anke (天津),2006-06-23 09:59,我是天津文科考生，估432分，另外我还有二级运动员最多20分的降分提档的政策优惠.我第一志愿报的是贵校且服从调剂.天津重点中学估分一本线在480-485.请老师一定给我一个明确的回答我能被录取的概率有多大???谢谢~!!!!!!!!!!!!!!!!,你必须达到今年天津市招办公布的分数线才有希望。新疆大学高水平运动员的招生对象是新疆疆内的的考生，不对全国招生。
物理学,wa***21 (山东),2006-06-23 09:45,请问贵校物理学的情况？在山东该专业多少分有把握？,报考物理学专业，过当地一本线就有希望。
咨询,hz*** (浙江),2006-06-23 09:36,浙江考生551分有希望录取吗？,你必须达到今年浙江省招办公布的分数线才有希望。
浙江,06***51879 (浙江),2006-06-23 09:17,请问贵校对浙江考生有优惠政策吗？？请问贵校的2本要多少分？？,没有新疆大学录取批次按照招生计划类别分为本科零批次、本科一批次和高职批次。
咨询,ru***ying (浙江),2006-06-22 14:13,我是今年浙江的文科考生分数是521第28495名请问贵校可否有适合我分数的三本专业期待您的答复,我校的三批次的录取工作是由独立学院新疆大学科学技术学院负责的，咨询电话：0991-8588083或0991-8588088
堵在成功路上的一面墙,wo***uren (湖南),2006-06-22 14:13,老师您好，我仅是一名即将进入高三的省重点中学的理科生。本应全力冲刺以备来年一战，却有一事挂心上。因我是一名色盲，于是来年报考专业时的限制给了我莫大的担忧！于是我想了解一下有关色盲受限的问题。可有几大难题我无力解决：1.我不知贵校对色盲考生的具体限制专业。请老师帮我查找一下或告诉我具体网址/资料名称。2.这些资料明年是否会变动，我可以把握哪些不变的专业限制情况？3.好像贵校每年的专业招生计划会不同，那么我能报考的专业也会有变动。我是否能够对明年能报考的专业有一个大体的把握？恳请老师帮我分析一下，告诉我一些我现在能把握的专业限制情况，以让我明确我的奋斗目标。老师辛苦了！,对于体检你一定要仔细查看教育部体检指导意见，不要报考体检受限专业，体检标准一般不会变。你可以查询我校网址，www.xsc.xju.edu.cn
请老师答复,01*** (新疆),2006-06-22 12:07,请问：乙肝表面阳性，但肝功能正常能上本校吗？,乙肝表面阳性属专业受限，不要报考受限专业，其他专业都可以报。
数学,51*** (河南),2006-06-15 13:46,去年数学系录取分数？,数学系录取分数我校没有单独统计，但一般略高一些。
录取分数？,pl*** (贵州),2006-06-14 15:21,我是一名贵州的理科生，请问本校近三年在贵州的各专业招生分数情况，及今年的计划如何？,你必须达到你所在省的重本分数线。招生计划请登陆新疆大学学生处网站查询www.xsc.xju.edu.cn
我是真的真的动了心,05***3 (河南),2006-06-12 10:49,你好！~！`我是河南的一名考生，今年的估分是500！~！请问能否上贵校临床呢？谢谢~！~,我校没有开设医学专业。
请问,21*** (新疆),2006-06-12 10:39,报考你校英语专业可以向哪儿就业,新疆大学毕业生没有就业地点限制。
急电：：：本校的工业设计是否为重点专业？,zx***9 (新疆),2006-06-12 10:38,老师您好：本校的工业设计是否为重点专业？,[新疆大学重点学科学校现有哲学、经济学、法学、文学、历史学、理学、工学、管理学等八大学科门类，涵盖了高级专门人才培养和科学研究的主要领域。有中国少数民族语言文学、应用数学2个国家级重点学科，有人口资源与环境经济学、专门史、物理化学、动物学、生态学、矿产普查与勘探、机械制造及其自动化7个自治区级重点学科，有1个国家级人文社会科学重点研究基地，有新疆生物资源基因工程、新疆绿洲生态、石油天然气精细化工3个省部共建重点实验室，有2个自治区级重点实验室。哲学、中国语言文学、历史学、数学、物理学、化学、生物学、矿产普查与勘探等学科具有悠久的办学历史，基础扎实，某些方面形成了特色和优势。少数民族语言文学、应用数学与系统工程2个“211工程”重点建设学科群在国内具有一定影响力。新疆大学现有文、理、法、经、工、管、史、哲、艺术等学科门类，74个本科专业，82个硕士学位授权点（含6个一级学科硕士点）、工程硕士、公共管理硕士（MPA）专业学位点2个，12个博士点，3个博士后科研流动站，2个国家级重点学科（应用数学、中国少数民族语言文学），7个自治区级重点学科（机械制造及其自动化、生态学、动物学、人口资源与环境经济学、专门史、物理化学、矿产普查与勘探），6个“211工程”重点建设学科群（少数民族语言文学与民俗学、中国新疆与中亚经济文化研究、新疆资源生态环境与生物技术、信息技术与应用、应用化学与材料、应用数学与系统工程），1个国家级哲学社会科学重点研究基地，1个干旱半干旱区可持续发展国际研究中心，3个国家省部共建重点实验室（新疆生物资源基因工程重点实验室、绿洲生态教育部重点实验室、石油天然气精细化学品省部共建教育部重点实验室）。
问专业,be***sy (新疆),2006-06-12 10:37,贵校的公共管理类都学些什么，四年后就业方向是哪方面的?,请你拨打新疆大学政治与公共管理学院办公电话进行咨询。0991-8588185
请老师回答问题！！！,gw*** (新疆),2006-06-12 09:55,今天就要交表了，请老师速回答我前面的问题，考生很急！！！！！,对不能及时的问题，请广大考生给予谅解。
你好，我是河南考生，今年估分５４０，不知能上贵校么？我非常喜欢贵校．,a3*** (河南),2006-06-12 09:54,你好，我是河南考生，今年估分５４０，不知能上贵校么？我非常喜欢贵校．,你要达到今年河南省招办公布的重点本科分数线，才有希望。
关于第二志愿,ho*** (陕西),2006-06-12 09:50,请问贵校是否考虑第二志愿的考生?谢谢~~,如果我校录取计划在第1志愿就完成，我校不开二志愿。如果录取计划在第1志愿完成不了，再看二志愿。
咨询!!!!!!!!!!,gw*** (新疆),2006-06-12 09:45,老师，我是新疆文科考生，估分为530，请问老师，我要报考贵校，希望大吗？,你要达到今年自治区招办公布的文科重点本科分数线，才有希望。
我要报新大，怕分不够,ov*** (新疆),2006-06-12 09:26,如果分差十几分，我有办法上新大吗?我在乌鲁木齐市外国语学校12中特色班，会考成绩都很优秀，我这次数学考的很不好，我估分和去年分数线相比差一点，我能不能上新大?,你要达到今年自治区招办公布的重点本科分数线，才有希望。
老师您好,zh***nann (河北),2006-06-12 09:22,我是一名河北理科考生，请问高出一本分多少有希望报考贵校?,你要达到今年河北省招办公布的理科重点本科分数线，才有希望。
今年高考,ss*** (新疆),2006-06-11 17:00,2006年1本2本3本一定按分数线录取吗，是否能降低分数录取,你要达到自治区招办公布的重点本科分数线，才有希望。新疆大学录取批次按招生计划类别分为本科零批次（高水平运动员、艺术类专业和国防生）、本科一批次和高职（专科）批次。新疆大学不在上述以外的其他批次录取新生。
到底添新疆还是内地?,er*** (新疆),2006-06-11 17:00,我是新疆的一个少数民族学生，上双语实验班.古分380.今年新疆本地大学基本上录取民靠民，录取双语实验班的人数太少，但是内地大学分数线太高，我害怕不能录取.所以各位老师指导我到底添那里大学录取的可能性高?,请根据你想报考大学的近几年实际录取情况慎重填报
你好,fe***8 (甘肃),2006-06-11 16:46,我是甘肃文科考生，我的估分为550分左右，一志愿报考贵学校，录取希望有多大,你要达到今年甘肃省招办公布的文科重点本科分数线，一志愿报考我校，才有希望。
平行志愿新大收不?,al*** (新疆),2006-06-11 16:27,估了580...新大填三志愿平行栏里了...不知道是不是最后的希望啊,如果我校录取计划在第1志愿和第2志愿没有完成，我校再看平行志愿，但不能保证你所报的专业，如果你填专业不可调的话，有可能录取不上。
我若报新疆大学为第2志愿，贵校是否招收？,zx*** (新疆),2006-06-11 16:20,老师您好：我若报新疆大学为第2志愿，贵校是否招收？`.`╭★`╭┛/`╰═┛,如果我校录取计划在第1志愿就完成，我校不开二志愿。
咨询,19*** (陕西),2005-06-11 15:58,陕西理科考生，请问该校特色优势专业有哪些？非第一志愿填报分数级差是多少？,优势专业有：数学、外语、新闻、化工、机械等专业。我校不设志愿级差。
分数差,19*** (陕西),2005-06-11 15:48,理科非第一志愿报考，分数级差大概是多少,我校不设志愿级差
咨询,19*** (陕西),2005-06-11 15:46,我是陕西理科考生，报考该校，请问优势专业有哪些？,已作回答，请参考前一问题。
zixun,ds*** (新疆),2005-06-11 15:45,430分文科考生被录取的几率大不大,专科可能被录取，请参照往年录取线。
谢谢,lh***5 (新疆),2005-06-11 15:17,估份470，能上你们学校嘛,是汉语言考生吗？请参照往年录取线。
谢谢,lh***5 (新疆),2005-06-11 15:16,估份470，能上你们学校嘛,请参照往年录取线。
谢谢,lh***5 (新疆),2005-06-11 14:51,估份470，能上你们学校嘛,请参照上一问题。
