标题,来源,时间,问题,回答
麻烦老师了,xi***ng216 (陕西),2009-06-12 16:01,那我现在报的是艺术设计专业，是不是只要达到要求就会分到这个专业？美术专业会不会根据分数的排名，分数低的就会分到不太好的专业，如美术学里？,我们录取原则是文化课成绩划线，按照专业课成绩从高到低录取，所以只要分数达到要求，就会满足专业志愿。分数低不代表专业不好，只能说是报考热度相对冷一些而已。
585,zj***674 (陕西),2009-06-12 15:55,陕西理工考生，估分585，能上贵校地质学基地班吗,请您参照我校基地班前两年招生的分数线，结合中学老师预估的一本分数线综合考虑
您好，我是郑州14中美术组的老师，咨询下去年美术类的录取分数,re*** (河南),2012-05-09 11:44,您好，我是郑州十四中美术教研组的老师，我这里今年有三个学生想要报考贵校的美术类专业，想咨询下2011年该专业在河南的录取的最低分数，以及这个专业今年还在河南招收美术生吗？还望招办老师百忙之中答复，谢谢您。,您好：去年美术类在河南的录取最高分和最低分为美术学274261动画271262艺术设计271262谢谢您的关注，欢迎报考西北大学！
再次请教,ya***tc (陕西),2010-06-13 10:03,陕西文科生：贵校经济学、历史学基地班专业在陕提前批次招生的分数是不是比一本高？设置这个专业有几年了？,同学，你好。我校经济学、历史学专业历史悠久，学术积淀深厚。在陕提前批次招生，近年来录取分数相对较高。近年来录取分数，可登录http://mainpage.nwu.edu.cn/zhaosheng/bkweb/查询。
文科提前批次,ya***tc (陕西),2010-06-13 09:30,我是本省文科生估分约590左右能报提前批次的基地班吗？还有哪些专业适合？谢啦！,同学，你好。我校经济学、历史学，2个基地班专业在陕提前批次招生。请参考学校历年录取分数综合考虑，可登录http://mainpage.nwu.edu.cn/zhaosheng/bkweb/网站查询。
入校后在专业调整上有和规定,ls*** (江西),2010-06-13 09:16,能否选修其他专业，并或双学位,[同学，你好。实施弹性学制。为鼓励优异学生脱颖而出，学校实行弹性学籍管理办法，在规定学制时间内，对学有余力的优秀学生，提前修满规定学分者可提前毕业；对未达到毕业要求者，可申请自费延长1-2年的学习时间。4实行校内转专业制度、主辅修制和双学位制。为了尊重学生个性发展，体现因材施教的原则，对成绩优秀或确有专长的学生，进校一年可以申请在校内转换专业。学校鼓励学有余力的优秀学生，在学好本专业的前提下，利用在校期间的课余时间，同时修读另一专业，成绩合格者发主修辅修两个专业的毕业证，修满相应的学分并通过论文答辩者，可授予双学士学位。
应届与往届,we*** (陕西),2010-06-13 09:10,老师你好我是陕西文科考生今年复读估分580想报考贵校分手够吗？请问与应届生政策上有区别吗？,同学，你好。我校对考生应届与往届没有政策上的区别。学校网站http://mainpage.nwu.edu.cn/zhaosheng/bkweb/公布了近年来在陕录取分数，可参考并综合考虑。
热门专业-理,mi***ng (山西),2010-06-12 16:55,贵校的热门专业有哪些？冷门专业有哪些？冷门专业的就业情况如何？,同学，你好。近年来，我校就业情况良好。学校专业没有冷热之分，西北大学71个本科专业，经过百年的发展，学校各专业都形成了自己的专业特色，并在个自的专业领域取得了显著的成绩。
如何转专业,mi***ng (山西),2010-06-12 16:53,如果被录取了但是却是自己不太喜欢的专业，能不能转专业？有什么条件和要求？转后，还是按一本发毕业证吗？,[同学，你好。我校实施弹性学制。为鼓励优异学生脱颖而出，学校实行弹性学籍管理办法，在规定学制时间内，对学有余力的优秀学生，提前修满规定学分者可提前毕业；对未达到毕业要求者，可申请自费延长1-2年的学习时间。实行校内转专业制度、主辅修制和双学位制。为了尊重学生个性发展，体现因材施教的原则，对成绩优秀或确有专长的学生，进校一年可以申请在校内转换专业。学校鼓励学有余力的优秀学生，在学好本专业的前提下，利用在校期间的课余时间，同时修读另一专业，成绩合格者发主修辅修两个专业的毕业证，修满相应的学分并通过论文答辩者，可授予双学士学位。
基地班,ya***tc (陕西),2010-06-12 14:25,请问贵校基地班有什么特色，录取分数会不会比较高？580-600左右能否被录取？谢谢。,[同学，你好。基地专业在陕实行提前单独录取，往年录取分数请登录http://mainpage.nwu.edu.cn/zhaosheng/bkweb/index.php网站查询。为使学生能安心学习、积极进取，学校对其学费、奖学金实行倾斜政策。凡第一志愿报考基地专业并被录取者，本科段学费减半收取，70％以上可获得奖学金。学生入学后实行滚动制管理模式。基地班在教学和学籍管理上，在保持本科、研究生各自为独立层次和不变现行学制的原则下，在本科四年级上学期末经考核选拔品行兼优的学生直接进入硕士研究生阶段学习，在硕士研究生教育二年后，选拔品学兼优者提前攻博，实行“本科生—硕士生—博士生分流培养”。
报考,wu***9 (陕西),2010-06-12 14:15,由于学校现在没有《招生报》，能否告知贵校和贵校文物保护技术专业的代码.,同学，你好。请随后按照省招办《招生报》上公布的信息查询专业代码。
高考咨询会,20*** (陕西),2010-06-12 11:59,老师，请问贵校的2010高考咨询会在什么时候开？地点是？我是西安本地的学生,同学，你好。我校将于6月26，在北校区举办西北大学“校园开放日”活动，欢迎届时参加。详情可查看http://mainpage.nwu.edu.cn/zhaosheng/bkweb/article.php?articleid=10171
贵校那个文科专业就业较好？,lu***izhaohua (陕西),2010-06-11 16:35,贵校那个文科专业就业较好？,同学，你好。近年来，我校专业就业情况良好。2010年，我校有近20个文科类专业招生。专业选择方面，请结合高考分数及兴趣爱好来考虑。学校招生计划请登陆http://mainpage.nwu.edu.cn/zhaosheng/bkweb/查询。
报考,mu*** (陕西),2010-06-10 15:51,我是本省文科生估分约570左右能录上吗？有哪些专业适合？另外今年招提前批吗？谢,[同学，你好。按往年情况来看，是比较有希望的。我校在陕西提前批次招生的专业主要有：基地班专业、艺术类、国防生。文史、理工在一批本科招生。选择专业方面，请结合自己的分数和兴趣爱好，综合考虑。可登陆我校网站，参考一下往年各专业录取分数情况。http://mainpage.nwu.edu.cn/zhaosheng/bkweb/index.php
咨询专业,hu***6688 (辽宁),2010-06-10 15:30,老师您好：1、请介绍一下贵校经济、金融专业方面水准及就业情况。2、贵校有注册会计师、国际注册会计师方向的专业吗？,[同学，你好。我校经济类方面的专业教学、师资力量雄厚。多年来，我校经济管理学院培养博士300多名，各类硕士4000多名，本科生10000余名，其中涌现出一批在国内外有一定影响的中青年经济学家、企业家和高级优秀党政领导干部。《人民日报》、《光明日报》、《新华每日电讯》等多家新闻媒体对学院在人才培养方面的成绩作了报道。在科学研究方面，学院面向国民经济建设主战场，紧密结合中国经济改革和西部经济发展中出现的新问题和实践需要，进行了深入的理论探索研究，取得了丰硕的成果。多年来共出版专著200余部，发表论文3000余篇，完成国家及省部厅局级课题300多项，获得省部厅局级奖200余项。学院正在成为西部经济发展的研究中心、学术交流中心以及地方政府决策咨询中心。我校没有注册会计师、国际注册会计师方向的专业。
分数线,lx*** (湖南),2010-06-10 14:43,老师:我是湖南艺术生，想咨询贵校最近三年在湖南的录取分数线(文化及专业)及今年艺术生的录取方式，贵校是认可湖南省美术联考成绩的对吗?联考成绩214分，文化估分400分，有希望吗?,[同学，你好。请登录我校网站http://mainpage.nwu.edu.cn/zhaosheng/bkweb/查询近年来学校录取分数。2010年，我校在湖南招收的美术类专业，专业成绩使用湖南省美术统考成绩。录取原则为：美术类专业考生需参加省级专业统考，并符合考生户口所在省（自治区、直辖市）艺术类专业录取条件，按照专业课考试成绩从高到低，择优录取。
报考,po***123456789 (陕西),2010-06-10 14:23,陕西理科550，能报贵校吗？专业如何？谢谢,同学，你好。按往年录取情况来说，是有希望的。选择专业方面，请结合自己的分数和兴趣爱好，综合考虑。可登陆我校网站，参考一下往年各专业录取分数情况。http://mainpage.nwu.edu.cn/zhaosheng/bkweb/index.php
请教,ca*** (陕西),2010-06-10 14:17,我是西安市的一名学生，今年高考成绩估计在555左右，请问我能否报考贵校。贵校的录取分大概在多少？我能够报考哪些专业？非常感谢！,同学，你好。你是文科考生，还是理科考生？
分数线,hn***60708win (河南),2010-05-12 16:36,请问河南考生一般要高出一本线多少分能上贵校？谢谢。,同学，你好。2010年录取情况无法预测。可参考学校往年录取分数综合考虑：http://mainpage.nwu.edu.cn/zhaosheng/bkweb/index.php。
高考报考,wa***9910808 (河北),2010-05-12 15:26,色盲单色能变得考生哪些专业线报,同学，你好。请阅读教育部《普通高等学校招生体检工作指导意见》，学校专业录取工作执行此指导意见。
北京考生2志愿可有辅修英语,so***g (北京),2010-05-12 14:58,老师您好！北京理科考生，4次考试成绩高出一本线60-80分，2志愿欲报贵校，是否有风险？重点专业有哪些？有无电气工程与自动化专业？电气类可有辅修英语？进校后金额否调换专业？住宿条件如何？期待您的！谢谢,[同学，你好。我校在一志原生源不足的情况下，接收非一志愿的考生。学校没有电气工程与自动化专业。我校实施弹性学制。为鼓励优异学生脱颖而出，学校实行弹性学籍管理办法，在规定学制时间内，对学有余力的优秀学生，提前修满规定学分者可提前毕业；对未达到毕业要求者，可申请自费延长1-2年的学习时间。实行校内转专业制度、主辅修制和双学位制。为了尊重学生个性发展，体现因材施教的原则，对成绩优秀或确有专长的学生，进校一年可以申请在校内转换专业。学校鼓励学有余力的优秀学生，在学好本专业的前提下，利用在校期间的课余时间，同时修读另一专业，成绩合格者发主修辅修两个专业的毕业证，修满相应的学分并通过论文答辩者，可授予双学士学位。我校现有校舍建筑面积81万余平方米；图书馆总面积1.5万平方米，藏书量达260余万册。各主要教学大楼的教室晚上全部开放，供全校学生进行晚自修。学校设有调频电台，播放各种外语教学节目，普通调频收音机即可收听。学校实行学生寝室规范化管理，寝室配有直拨电话、电视机、校园通信网络、暖气和电风扇。
高考政策咨询,wy*** (河北),2010-05-12 13:51,贵校领导：今有高考政策问题咨询，请明示：河北农村独生子女政策高考加十分，省招办按原实考文化分加十分后之和为总成绩。1、按总成绩投档贵校时，贵校是否按总成绩排序录取？2、是否继续认可按总成绩分专业？3、是否有专业级差？专业级差是多少?4、分专业时，按分数优先还是专业优先？您的答复是对我们最好的帮助。谢谢,[你好。我校按照“公平竞争、公正选拔、公开程序，德智体全面考核、综合评价、择优录取”的原则进行录取，并作如下规定：1、调档比例控制在120％以内，实行远程网上录取。2、实行按志愿录取，在一本线上第一志愿生源不足的情况下，西北大学接收非第一志愿的考生。第一志愿报考我校的考生，实行分数优先的原则，依据考生的高考成绩及所填专业志愿顺序从高分到低分录取，不设置专业级差。在高考成绩相同的情况下，将参考相关科目成绩，确定录取专业。3、符合各省（自治区、直辖市）招生委员会规定的加分条件的考生，按加分后的成绩调档及参与专业选择。
2010招生计划,ch***ia (北京),2010-05-11 14:58,网上没有2010本科招生计划？更新太慢,同学，你好。请登录网站http://mainpage.nwu.edu.cn/zhaosheng/bkweb/查看。
二志愿问题,sd*** (山东),2010-05-11 09:40,我是山东文科考生，请问贵校是否会预留计划或临时调整计划在山东录取二志愿高分考生？需要在全省排名多少才可能被录取？,[同学，你好。学校实行按志愿录取，在一本线上第一志愿生源不足的情况下，西北大学接收非第一志愿的考生。第一志愿报考我校的考生，实行分数优先的原则，依据考生的高考成绩及所填专业志愿顺序从高分到低分录取，不设置专业级差。在高考成绩相同的情况下，将参考相关科目成绩，确定录取专业。2010年录取情况无法预测。请参考学校往年录取分数综合考虑http://mainpage.nwu.edu.cn/zhaosheng/bkweb/index.php。
天津理科考生,wa***35 (天津),2010-05-10 13:11,老师您好，我是天津理科考生，超出一本线多少分能有把握的报考贵校，贵校是否招收第二志愿？若服从专业调剂，是否会被退档？谢谢！,[同学，你好。我校实行按志愿录取，在一本线上第一志愿生源不足的情况下，西北大学接收非第一志愿的考生。第一志愿报考我校的考生，实行分数优先的原则，依据考生的高考成绩及所填专业志愿顺序从高分到低分录取，不设置专业级差。在高考成绩相同的情况下，将参考相关科目成绩，确定录取专业。服从专业调剂只能增加你被学校录取的机率。
专业报考,qi*** (河南),2010-05-10 10:36,老师，您好，请问，理科考生如果眼睛色弱，可以报考贵校的哪几个专业而不受限制？麻烦老师详细回答一下可报的专业名称，万分感谢。,同学，你好。我校录取工作严格执行国家《普通高等学校招生体检工作指导意见》，请详细阅读该指导意见，认真选报专业。
是否在山东省招生？,sd*** (山东),2010-05-10 10:31,贵校的2010年招生简章我已经看了，非常想报考您校。不知道是否在山东省招生？如果招生，招哪些专业？,同学，你好。2010年，我校计划在山东招收本科生58名，详细招生计划、往年录取分数情况请登录网站http://mainpage.nwu.edu.cn/zhaosheng/bkweb/index.php查询。
经济学基地班招生,yu*** (福建),2010-05-10 10:28,经济学基地班2010年是否在安徽招生？招几名？,同学，你好。2010年，我校经济学基地班专业在安徽没有招生计划。
你校势力怎样？在首页怎么找不到校名,sx*** (陕西),2010-05-10 09:56,在首页怎么找不到校名,"[同学，你好。西北大学地处古都西安,领略秦汉雄风,弘扬盛唐文明,是一所学科门类齐全,教学与科研并重的全国重点综合大学、国家“211工程”重点建设院校、国家西部地区“一省一校”计划重点建设院校，教育部和陕西省共建高校。学校肇始于1902年的陕西大学堂,1912年始称西北大学,1923年8月改称国立西北大学。建国初期，学校为中央教育部直属的全国14所综合大学之一，1958年归属陕西省政府主管，1978年被确定为全国重点大学。历经百年风雨沧桑，学校现已发展成为一所在国内外有较大影响和良好声誉的文、史、哲、经、管、法、理、工、医等多学科协调发展的全国重点综合大学。学校现设21个学院（系）、71个本科专业。现有10个博士学位授权一级学科，15个博士后科研流动站，85个博士学位授权点，20个硕士学位授权一级学科，153个硕士学位授权点，6个专业硕士学位授权点及高等学校教师在职攻读硕士学位授权点，7个国家级人才培养基地，并设有国家大学生文化素质教育基地。学校现有教职工2363人，其中专任教师1227人，教授291人，中科院院士2人，双聘院士6人。学校一贯重视本科教学工作，把人才培养作为学校的中心工作常抓不懈，形成了“加强基础、强化应用、提高素质、注重创新、激励个性、体现特色”的人才培养思路。近年来（2001年以来），学校共荣获省级教学成果奖52项，国家级教学成果奖16项，现有陕西省精品课程50门，国家级精品课程14门，陕西省教学名师15人，国家级教学名师4人，国家级教学团队4个，国家级人才培养模式创新实验区2个，省级人才培养模式创新实验区8个，全国百篇优秀博士学位论文5篇，国家基础学科人才培养基地优秀基地2个。学校人才培养工作成绩斐然，现有各类在校生24000余人，其中在校各类研究生6600余人，外国留学生700余人。学校具有良好的教学、科研支撑条件。现有3个校区，占地面积2360余亩，校舍建筑面积81万余平方米，教学科研仪器设备总值3.5亿元。由香港著名爱国人士邵逸夫先生赠建的西北大学图书馆，建筑面积1.5万平方米，图书资料260余万册，是我国西北地区规模最大的综合性图书馆。"
550分能被考古学专业录取吗？,ya*** (陕西),2010-05-10 09:27,谢谢,同学，你好。2010年情况目前无法预测，请参考我校往年录取分数，综合考虑http://mainpage.nwu.edu.cn/zhaosheng/bkweb/
考古学专业毕业授予什么学位？,ya*** (陕西),2010-05-10 09:25,谢,同学，你好。考古学专业将授予历史学学位。
贵校考古专业2010年招生人数？就业情况？,ya*** (陕西),2010-05-10 09:13,谢谢,同学，你好。2010年，我校考古学专业计划招收本科生50名。详细招生计划请登录http://mainpage.nwu.edu.cn/zhaosheng/bkweb/查看。近年来，考古学专业就业良好。
问题,50*** (陕西),2009-06-10 09:19,450可以报吗,您提供的信息不完全。
咨询,zh***g (河南),2009-06-10 09:14,老师您好！问美术文科，专业240分文化380分，报动画有多大可能被录取？,请说明省份
我是河南理科考生，估分610，能上贵校吗,19*** (河南),2009-06-10 09:07,我是河南理科考生，估分610，能上贵校吗？,08年河南普通理科最低分是563，07年是609。请登录我校网站本科招生栏目了解更多信息。
美术,31*** (陕西),2009-06-09 12:37,我今年美术联考256分，西北大学单考75分.文化课估计了409分.请问有可能考上贵校吗?,我校划定文化课分数线基本比省线高出一些，但不会太多，您的专业成绩大概在160名之前。
化学基地班,qi***0419 (陕西),2009-06-09 12:35,化学基地班属于工科还是理科，学习的主要内容是什么？报考后是否可以转专业？,属于理科，开设课程请登录我校网站化学系分网页了解情况。可以转专业，在入学一年之后，考试成绩在班内前三分之一，并参加我校安排的统一考试成绩优异者可以转专业，详细信息请登录我校网站查询。
超一本55分、近视,ly*** (河南),2009-05-13 16:53,请问：河南理科考生超过一本55分左右，眼睛近视750度左右，可否报贵校.若可，报贵校什么专业比较有把握。谢谢。,请登录我校网站本科招生栏目查询河南省往年成绩结合您的分数和兴趣进行选择，我校对近视没有特殊限制，严格执行国家规定。
第二志愿,jz*** (广东),2009-05-13 16:47,我是美术生，请问，贵校对第二志愿美术生怎样录取,在第一志愿录不满的情况下录第二志愿学生。
艺术生分数线,jz*** (广东),2009-05-13 15:59,请问，贵校08年环艺专业文化线和专业线是多少,我校没有该专业。
咨询,26*** (山东),2009-05-13 15:40,我是今年山东文科考生我的山东美术统考成绩160分，文化成绩估分大约在480-500之间。能否报考贵校的相关美术专业？多谢了,因为贵省统考是贵省教育厅统一组织的，相关信息我校不了解。文化课分数我校会划定一个分数线，只能初步估计比山东省艺术类重点线高一些，但不会高太多。
你校文科,wa***3 (陕西),2009-05-13 15:38,你校文科有二本吗？估计分数线是多少？,没有
录取专业,cg*** (陕西),2009-05-13 15:32,我有一点色弱，请问能录取到贵校的机械设计制造及自动化.电子信息科学与技术.电子信息工程.信息与计算科学.工业设计.电气工程及自动化.材料科学与工程专业吗?请在百忙之中给以答复,我校招生时严格执行国家有关规定和《普通高等学校招生体检工作指导意见》，对身体健康状况不做特殊规定。请查阅相关国家规定。
今年在四川理科招多少人？分数线大约多少？,13***72 (四川),2009-05-13 15:30,今年在四川理科招多少人？分数线大约多少？,我校2009年在四川普通理科招收49名，分数线请您参考历年分数进行估计，相关信息可从西北大学网站首页本科招生栏目查询。
招生人数,yu***n (陕西),2009-05-13 14:44,请问你校今年在本省文科招多少人？往年录取的平均分数是多少？谢谢。,2009年我校在陕文科招收580名，往年分专业录取分数请登录我校网站首页本科招生栏目查询。
咨询,lz*** (陕西),2009-05-13 14:24,您好：贵校的日语、德语系在陕西招收理科生吗？,日语系只招文科
艺考生咨询~~~,xi*** (山东),2009-05-13 13:56,老师你好，我是艺术生，艺考成绩140多分，文化课预计380分左右，考贵校录取的几率有多少？谢谢！,请说明省份
报考,19***048 (陕西),2009-06-11 09:24,您好，理科，估分在550分，能否报考贵校，文物保护技术如何？,建议专业服从调剂
报考,19***048 (陕西),2009-06-11 09:24,您好，理科，估分在550分，能否报考贵校，文物保护技术如何？,建议专业服从调剂。
河南美术,ja*** (河南),2009-06-11 09:21,老师，您好:我是今年河南的一名美术考生，请问贵校去年在河南的美术学、艺术设计和动画专业的录取最高分、最低分各是多少啊？我今年统考为251，请问报贵校的希望大吗？请尽快，谢谢！！！！！,我校对您的专业成绩不了解，因为统考是贵省招办统一安排的。由于今年我校录取原则变化较大，对往年分数没有统计。
你好,sh***1 (陕西),2009-06-11 09:18,陕西理科考生估分565，报贵校的化学工程与工艺怎么样？录取希望大不大？西北大那些专业强？,有希望被录取，但是建议您专业服从调剂。我校有七个国家人才培养基地，属于比较强的专业，具体信息请登录我校网站查询。
咨询,ji*** (陕西),2009-06-11 09:16,我是陕西文科考生，568分能否上西大的考古专业？,根据往年录取情况，考古专业在陕的录取最低分一般要超出陕西省重点线20分左右。您可以登录我们西北大学首页本科招生栏目，根据往年的成绩慎重考虑。
报西北大学的风险,ti***21 (陕西),2009-06-11 09:12,老师好我是陕西理科考生估分550分左右请问报西北大学风险大小？,请您登录西北大学网站首页本科招生栏目，可以查询到2006到2008年的在陕分专业录取分数。再参考中学老师对今年高考分数线的估计，慎重考虑。2008年普通理科西北大学录取最低分超陕西省重点线六分，2007年超陕西重点线十分。
贵校有无文科二本专业？,ew*** (陕西),2009-06-11 09:11,本人陕西考生，估了540分估计只能上个二本吧。。二本专业是在本校还是另有学院希望说明，谢谢！,我校是重点大学，不招收二本专业。
录取分数线是否较往年有所下降,19***048 (陕西),2009-06-11 09:06,您好，1、请问今年各系录取分数线有下降的可能性没？如果降能降几分？2、文物保护技术最低分会不会比往年高？,您可以参考西北大学往年录取分数，以及您所在省份的预估重点线推测一下。相关信息可以在西北大学网站查询。
新疆,fl*** (新疆),2009-06-10 16:38,老师好，今年我估分为570，问能否上你校金融志业.,请登录我校网站查询往年录取分数。
咨询,kk*** (陕西),2009-06-10 16:36,请问贵校招理工科的二本吗？,我校是国家重点大学，只招收一本。
艺术疑问,ha***518 (河南),2009-06-10 16:24,您好，我想问一下贵校上一年在河南录取的最高分和最低分？,文科最高分603，最低分579理科最高分611，最低分563
