标题,来源,时间,问题,回答
请问,13***35 (河南),2006-06-13 11:10,老师您好，我是河南文科考生，估分580，请问报考贵校对外汉语有无希望?,同学，你好。从往年在河南的招生来看，你的分数报考我校是有希望的。
请问贵校是否有二本专业?,47*** (陕西),2006-06-13 11:00,请问贵校是否有二本专业?如果有，是哪些专业?,同学你好。没有二本专业。
贵校文科热门专业,my*** (陕西),2006-06-13 10:56,贵校文科热门专业有哪些？,同学，你好。我校的文科热门专业主要集中在经济，金融和新闻等专业
专业,km*** (陕西),2006-06-13 10:43,请问贵校环境科学专业是否问热门专业?理工560到570之间报考该专业是否现实?,同学，你好。环境科学的近几年的分数中等，报考该专业有希望。
问,ey*** (河南),2006-06-13 10:40,我是一名艺术生，美术专业258，文化估分340。想问报贵校为专科一自愿可以被录取吗？谢谢你的回答！！,同学，你好。我校有专科生，但我们现在只负责一本招生。专科可以咨询88302744。
请问,hb*** (河北),2006-06-13 10:37,我是河北省文科考生，估分520，请问贵校在河北省召二本吗?如果召的话，我有没有希望被录取?二本可以学考古吗?,同学，你好。我校在河北只有一本招生计划。
急!!!,20*** (河南),2006-06-13 10:37,我美术专业考了298文化课估计370能报贵校的艺术设计专业吗有多大希望谢谢,同学，你好。你们的美术专业联考满分是多少。你这个文化课含数学不？
河南理科,ze***ww (河南),2006-06-13 10:32,六百零几分能报贵校吗？若能，什么专业合适？,同学，你好。从往年在河南的录取分数线来看，报考我校希望很大。欢迎报考西北大学。
急？？,fe***3 (陕西),2006-06-13 10:18,在贵学校的哲学专业就业如何？都学习什么专业？将来工作处什么领域？,同学，你好。哲学是基础学科。具体就业情况，你可以打电话咨询我校的毕分办88302007。
570,he***28 (陕西),2006-06-13 10:12,请问贵校接受二志愿的考生么?有什么限制?若报为第一志愿.陕西文科570敢报贵校么?如果专业服从调剂的化...谢谢老师.望速回，马上交志愿!,同学，你好。我校近几年在陕西第一志愿都能招满，故一般不考虑二志愿。从往年的录取情况来看，第一志愿报考我校是有希望的。
艺术考生,li*** (河南),2006-06-13 10:07,我是河南的考生我专业291文化430请问我报贵校艺术设计有多大把握？,同学，你好。从往年的情况来看，你若估分准确，报考我校希望比较大。
十万火急,ed***an (山西),2006-06-13 10:06,老师您好:我是山西艺术理考生!贵校艺术设计和动画专业在招生简章和报考志愿中没有指明招收文理!是否都招!我第一志愿报了动画专业，如果该专业不招收理科，那么第二志愿报了艺术设计专业影响录取吗?,同学，你好。我们在山西只招收艺文考生。
艺术类专科,wj*** (河南),2006-06-13 10:03,我是河南艺术类考生。已经取得河南省播音主持统考合格证，专业成绩311分，文化课估分290分。第一志愿报考你校专科播音主持专业，有希望吗？另该专业是按文化课从高到低录取还是按专业课从高到低录取？谢谢老师了，下午要交正式表了！！！,同学，你好。播音专业的专业课考试统一由我校组织，并发合格证。
老师您好，辛苦啦！,gu*** (山东),2006-06-13 10:01,老师您好，辛苦啦！我是04届的考生，当时的高考成绩是310，被一专科学校录取。因种种原因错过上学机会。请问贵校有没有我能上的比如插班生，自费生，国际部以类的班级？感谢老师！,同学，你好。我校没有你所说的上述班级。
咨询,52***3017a (陕西),2006-06-13 09:37,老师：贵校基地班的录取最低分大概是多少？在陕西呢？谢谢！,同学你好，我校文、理共有六个基地班，各专业之间分数也有不同。在陕西，一般来说高出重点线３０-５０分是有希望的。详情请登陆我校网站“http://www.nwu.edu.cn/”查看以往各基地班的录取分数情况。欢迎报考！
艺术,ka***ng (河南),2006-06-13 09:35,老师我是河南文科考生，专业考了２８９文化课３２０，报考贵校怎么样？谢谢，,同学，你好。从往年的情况看，你的分数报考我校有风险。
陕西考生，理科，估分550,ly*** (陕西),2006-06-13 09:29,老师你好，我是陕西考生，理科，估分550，想报考贵校，不知报什么专业能录取的希望大，请老师指点?,同学你好，只要你能上一本分数线报考我校还是有希望的，建议报考热门专业，服从专业调剂。
美术,zz*** (广西),2006-06-12 13:55,我是广西艺考生，请问文化和专业分的录取比例是多少？谢谢！！,同学你好，文化课占30%，专业分占70%，我校以综合分排队择优录取。欢迎报考！
专业,su*** (北京),2006-06-12 13:53,贵校金融学不招收理工科吗？,你好，金融学为文科专业，不招收理科考生
575,xi*** (陕西),2006-06-12 13:22,我报贵校数学专业被录取的可能性有多大？,同学你好，按照往年的经验，你报考我校的希望较大，关于该专业往年的录取情况，请登陆西北大学网站“http://www.nwu.edu.cn/”查询进行参考，欢迎报考西北大学！
老师好,ze***i (山西),2006-06-12 13:18,我是山西一名文科考生，估分成绩是560，请问如果我报考贵校，被录取的希望大吗?,同学你好，我校对贵省情况并不十分了解，一般来说只要过了一本线就有希望了。你可以登陆我校网站“http://www.nwu.edu.cn/”查看一下往年录取分数情况。欢迎报考！
我的问题,bo***kong (陕西),2006-06-12 13:13,你好，我是一名陕西考生，今年估了570-590分，能报贵校什么专业.谢谢.,同学你好，由于不清楚你是文科生还是理科生，所以难以预计。欢迎报考西北大学！
咨询~`急切盼望回复~,ww*** (河南),2006-06-12 13:05,我是河南美术艺术类考生.专业分251.文化课估分450.报考贵校有希望吗?贵校艺术类的录取原则是怎样的?,你好，你的成绩有风险，请谨慎填报
分数,10*** (陕西),2006-06-12 13:01,请问贵校2001-2005年在本省（陕西）的专科录取分数线最高分最低分别为多少?谢谢!!!,同学你好，由于我们进行的是一本招生咨询，所以对专科的招生情况不了解。欢迎报考西北大学！
我是新疆理工,hz***9 (新疆),2006-06-12 12:55,我530左右，考取你校希望大不大,同学你好，我校对贵省的情况并不十分了解，一般来说只要能上贵省的一本线就有希望了，你也可以登陆我校的网站“http://www.nwu.edu.cn/”查询历年录取分数进行参考。欢迎报考西北大学！
贵校文科计划招生在山东多少人？,ro*** (山东),2006-06-12 12:55,法学专业是不是优势专业？估计录取分数超过一本多少？,同学你好，我校的法学专业实力比较强，往年报考人数也较多。由于对贵省的情况不是十分了解，建议你登陆我校网站“http://www.nwu.edu.cn/”查看历年录取分数情况进行参考！
江西考生,sm*** (北京),2006-06-12 12:47,老师您好，请问江西考生估分530报考贵校是否有希望。另外贵校是否在江西接收重点线以下的考生。谢谢,同学你好，我校对贵省的情况并不十分了解，一般来说只要能上贵省的一本线就有希望了，你也可以登陆我校的网站“http://www.nwu.edu.cn/”查询历年录取分数进行参考。我校只招收一本考生。欢迎报考西北大学！
美术生,zh***5659 (湖北),2006-06-12 12:46,2005年贵校美术考生在湖北招生的文化最低分数线和专业最低分数线？2006年湖北考生专业已过省联考线，文化课达300分左右，是否有希望报考贵校，报考何专业为宜？,同学你好，今年我校承认贵省招办组织的联考成绩，往年的情况对今年报考没有参考价值；由于无法了解贵省的分数情况，故难以准确预计，建议向你们专业课老师或者办主任老师咨询，另外，我校要求英语单科成绩不低于４０分，只招文科生，欢迎报考西北大学！
我估分是545，想报贵校,in*** (新疆),2006-06-12 12:43,我是新疆文科考生，我今年估分是545，想报贵校，不知把握有多大？？？？？？？？？谢谢,同学你好，由于对贵省的情况不是很了解，一般来说只要能上贵省的一本线就有希望了。同时你可以登陆我校的网站“http://www.nwu.edu.cn/”查看历年录取分数进行参考！欢迎报考！
关于文科专业,hr*** (福建),2006-06-12 12:32,老师，您好。我是福建应届文科考生，估分在本二中下。请问贵校是否有合适的文科专业可以报考？,同学你好，你的意思比较含糊，不知你是不是指你估分是在二本中下水平？我校是不招收二本考生的。或者你稍后再咨询！谢谢！
急！！！！！！！！！,85*** (湖南),2006-06-12 12:32,请问在湖南招理科美术生吗，如果招，那么招多少人。去年的录取的分数线多少？,你好，我校在湖南只招收艺术文科生
关于2006艺术专业招生~!急~!,me*** (河北),2006-06-12 12:32,去年贵校招艺术考生也是按照文化30%+专业70%吗?对河北考生有什么要求?,同学你好，去年是文化课成绩占30％，专业课占70％，今年我校艺术专业在贵省只招收文科考生，文化课成绩加数学，英语单科成绩必须40分以上，欢迎报考西北大学！
在线急等!请速回复!谢谢!,ha*** (山西),2006-06-12 16:15,老师，您好.我是山西一名文科考生，估分约在550~575，报考贵校对外汉语专业有无希望?可否简介该专业情况?谢谢.,你好，一般高过所在省重点线10分以上就有希望报考我校，对外汉语是我校去年新增专业，去年在陕西分数较高，你可以登陆我校主页查询详细专业介绍
你好,tu***205 (陕西),2006-06-12 16:12,我是陕西文科考生我估了550到560第一志愿报本校希望大吗？什么专业希望更大,同学你好，按照往年的情况，你报考我校有希望，但是应该避开热门专业，服从专业调剂，欢迎报考西北大学！
美术,go***i (河南),2006-06-12 16:11,我是河南的一名美术考生，想咨询一下报该校艺术设计专科是否能升本？,你好，我校没有专升本
谢谢,su*** (黑龙江),2006-06-12 16:10,贵校光信息科学与技术专业在那个学院？就业率好不好？是否重点学科？谢谢,你好，是在物理系，该专业为陕西省名牌专业
咨询,su*** (黑龙江),2006-06-12 16:06,贵校对往届和应届生录取是否有区别？谢谢,你好，没有区别
你好,wo*** (陕西),2006-06-12 15:58,一本550我610可以吗？,同学你好，希望很大，欢迎报考西北大学！
多谢,di*** (山西),2006-06-12 15:53,山西文科考生，估了570多，有希望吗？是否有专业级差？,你好，一般高过所在省10分以上就有希望报考我校，我校的专业级差为2－5分
meishu,12*** (贵州),2006-06-12 15:45,您好！我是江西的美术考生请问2005年贵校的文化分数线是多少？,同学你好，今年我校承认贵省招办组织的专业课联考，所以去年的成绩对今年报考的参考价值不大，请登陆西北大学网站“http://www.nwu.edu.cn/”的“西大本专科招生”栏目查询去年的分数。欢迎报考！
你好,su*** (黑龙江),2006-06-12 15:41,请问贵校对往届生的录取和应届生是否有不同？我是黑龙江一理科考生，估分590，请问能否被贵校录取？是否应选择非热门专业才会稳定些？谢谢！,同学你好，我校招生工作完全遵照国家制定的政策执行，没有另行规定。按照往年的情况，你报考我校的希望较大，通常来讲，选择冷门专业会增加几率。欢迎报考西北大学！
文史类575分报贵校汉语言文学怎样,56*** (陕西),2006-06-12 15:37,文史类575分报贵校汉语言文学怎样,同学你好，按照往年的情况，你报考我校的希望比较大，关于该专业的录取分数情况，请登陆西北大学网站“http://www.nwu.edu.cn/”的“西大本专科招生”栏目查询进行参考，欢迎报考！
美术查询,12*** (贵州),2006-06-12 15:32,去年江西美术考生文化录取线是多少？,同学你好，我们现在没有这方面的详细资料。另外今年我校要求英语单科成绩不低于40分，欢迎报考！
请回答,54*** (河南),2006-06-12 15:25,我是河南的一位学文的考生。考390--410之间。不知上贵校的机率有多高？我想学管理，有可能吗？是不是对外省的分数线要比本省的高呢？,同学你好，按照往年的情况，只要上了贵省的一本线，报考我校就有希望。
咨询,ha***y (河南),2006-06-12 15:23,我是河南理科考生估分590本省重点估580请问报考贵校有无希望谢谢,同学你好，按照往年的情况，过了贵省的一本线，报考我校就有希望。05年我校在河南的录取最低分数：576，04年我校在贵省的最低录取分数：５９２，０３年是５８２。欢迎报考！
咨询,ha***y (河南),2006-06-12 15:22,我是河南理科考生估分585本省重点估580请问报考贵校有无希望谢谢,同学你好，按照往年的情况，只要过了贵省的一本线，报考我校就有希望，关于我校往年在贵省的录取分数情况，请登陆西北大学网站“http://www.nwu.edu.cn/”的“西大本专科招生”栏目查询进行参考，欢迎报考！
理工科,xu***8 (陕西),2006-06-12 15:21,估分597-610之间，能否考上贵校，现在所报专业，上学后有没有机会另选专业,同学你好，按照往年的情况，你报考我校的希望很大，大一学年结束时我校有转专业的相关政策，详情请登陆西北大学网站“http://www.nwu.edu.cn/”查询进行参考，欢迎报考西北大学！
着急的家长,li***i (陕西),2006-06-12 15:16,陕西理工考生570上贵校有希望没有麻烦老师给我个准确答复急啊谢谢老师,家长同志您好，按照往年的情况，您的孩子报考我校希望较大，建议报考时避开热门专业，服从专业调剂，欢迎报考！
一定要帮帮我,84*** (陕西),2006-06-12 15:15,请问陕西理科考580分，报贵校何专业比较保险,同学你好，按照往年的情况，你报考我校的希望较大，尽量不要报考太热门的专业，服从专业调剂，欢迎报考西北大学！
咨询周,zh***7115 (河南),2006-06-12 15:11,老师你好我是河南的美术考生我今年美术考了277。文化估了320分有希望上你们学校大专吗？,同学你好，请拨打专科招生咨询电话029－88302744。
多谢,di*** (山西),2006-06-12 15:10,我是山西文科考生，估了570多，有希望吗？是否有专业级差？招收第二志愿考生吗？,同学你好，我校对山西的情况并不十分了解。一般来说只要你能高出山西省的一本线就有希望了。我们在第一专业和第二专业之间设有2-5分的级差。在第一志愿没有录满的情况下会招收二志愿考生。欢迎报考！
咨询,wa***112 (山东),2006-06-12 14:49,今年艺术设计在山东招19人是吗你们网站的那个招生计划我看不懂麻烦您告诉我谢谢,同学你好，我校今年在山东是招收19名艺术设计学生，不谢！
美术,ya*** (江西),2006-06-12 14:48,贵校有英语分限制吗,同学你好，对于美术类的考生我们要求英语分数必须上40分。欢迎报考我校！
江西美术考生,ya*** (江西),2006-06-12 14:48,我联考成绩197分（总分250），排名435，文化估分315分`报考贵校希望大么？,同学你好，今年我校承认贵省招办组织的联考成绩，由于无法了解贵省的分数情况，故难以准确预计，建议向你们专业课老师或者办主任老师咨询，另外，我校要求英语单科成绩不低于４０分，只招文科生，欢迎报考西北大学！
老师好,iw*** (贵州),2006-06-12 14:33,贵州文科估分535到550报考贵校的国际经贸金融会计财务管理等希望有多大?具体的谢谢,同学你好，我校对贵省的情况并不十分了解，一般来说只要能上贵省的一本线被我校录取就有希望了。至于这几个专业的录取分数情况你也可以登陆我校的网站“http://www.nwu.edu.cn/”进行查询参考。欢迎报考西北大学！
我是陕西一考生,mu***eng (陕西),2006-06-12 14:27,估了575能否报考贵校,同学你好，由于不清楚你是文科生还是理科生，所以我们难以做出准确回答。欢迎报考西北大学！
请问,ha***se (天津),2006-06-12 14:25,老师：您好！我是天津文科考生，估分510左右能报考贵校吗？谢谢！,同学你好，我校对贵省的情况并不十分了解，一般来说只要能上贵省的一本线就有希望了，你也可以登陆我校的网站“http://www.nwu.edu.cn/”查询历年录取分数进行参考。欢迎报考西北大学！
谢谢 老师,iw*** (贵州),2006-06-12 14:24,我是贵州文科考生，估分540左右，请问报考贵校被录取的可能性有多大?,同学你好，我校对贵省的情况并不十分了解，一般来说只要能上贵省的一本线就有希望了，你也可以登陆我校的网站“http://www.nwu.edu.cn/”查询历年录取分数进行参考。欢迎报考西北大学！
专业,aa*** (陕西),2006-06-12 14:18,贵校的国际贸易，工商管理就业怎么样？,同学你好，我校毕业生就业率一直在90%以上，详情请拨打我校毕业分配办公室电话029-88302961进行咨询。欢迎报考！
老师好,si*** (陕西),2006-06-12 14:16,请问理科580在贵校有选择专业的余地没有？,同学你好，按照往年的经验，你报考我校比较有希望，但是尽量避开热门专业，服从专业调剂，欢迎报考！
分数,aa*** (陕西),2006-06-12 14:15,西安考生600分可以上国际经济贸易吗,同学你好，按照往年的经验，你报考我校希望很大，关于该专业往年的录取分数情况，请登陆西北大学网站“http://www.nwu.edu.cn/”查询进行参考，欢迎报考！
急救,51*** (广西),2006-06-12 14:03,请问老师贵校怎么录取加了民族分的考生？,你好，具体情况请你咨询所在省招办
美术,ha***0 (河南),2006-06-12 12:32,老师您好.我的文化２３０，艺术统考２９８.有希望上贵校吗??,同学你好，今年我校承认贵省招办组织的联考成绩，由于对贵省的分数情况不甚了解，故难以准确预计，建议向你们的专业课考试或者班主任老师咨询，我校在贵省只招收文科考生，并且要求英语单科40分以上，欢迎报考西北大学！
贵校在河南招美术生如何使用统考成绩？,fa*** (河南),2006-06-12 12:31,是用统考的总分还是用别的方法？会不会只用色彩和素描两门的？文化课呢？,同学你好，对于河南美术类考生专业课的成绩以你们本省的联考成绩为准。以专业课占70%，文化课30%的比例计算综合分排队从高到低择优录取。
你好！～请贵校老师不要敷衍回答,cq*** (重庆),2006-06-12 12:24,老师你好！我是重庆考生，将填报贵校！我真的想得到贵校06年的招生资料一份，作为纪念！我也知道网上有很多资料，但是书面的资料更有纪念意义。请问能够满足我这个小小的要求吗？请不要敷衍的回答我好吗？谢谢邮寄地址：重庆渝中区临华路25号13－7袁宏仁收邮编：400013,同学你好，我们会尽量帮您解决这个问题，谢谢你对西北大学的关注，欢迎报考西北大学！
陕西理科５８５把握大吗？,wu***6 (陕西),2006-06-12 12:18,陕西理科５８５把握大吗？今年预计贵校陕理会爆满吗？谢谢！,同学你好，按照往年的经验，你报考西北大学希望比较大，但是应尽量避免很热门的专业，且服从专业调剂，报考时注意专业之间拉开档次；关于今年西北大学的报考情况，目前仍难以预计。欢迎报考西北大学！
询问,zh***g (陕西),2006-06-12 12:14,老师您好，我是陕西的一名理科考生，估分560到570，看报贵校有多大希望.,同学你好，按照往年的情况，你报考西北大学有希望大，但是应尽量避免热门专业，且服从专业调剂，报考时注意专业之间拉开档次，欢迎报考西北大学！
zixun,ch*** (河南),2006-06-12 12:07,你们学校能不能专升本？比例如何？我是一名美术考生！文化350专业298报你们学校有希望么？,同学你好，所有的“211”院校从07年起都不再招收专升本学生。我校对贵省的情况并不十分了解，你也可以登陆我校的网站“http://www.nwu.edu.cn/”查询历年录取分数进行参考并多了解你们本省的情况。欢迎报考西北大学！
分数线,fa***i (陕西),2006-06-12 11:54,您好！请问，文史类的考生，若想报考贵校，成绩最少应高于重点线多少分比较有把握？谢谢！,同学你好，按照往年的经验，高出省一本线10分左右，报考我校就比较有希望，欢迎报考西北大学！
美术,ha***0 (河南),2006-06-12 11:53,老师您好.我的文化２３０，艺术统考２９８.有希望上贵校吗??希望大吗??,同学你好，今年我校承认贵省招办组织的联考成绩，由于对贵省的分数情况不甚了解，故难以准确预计，建议向你们的专业课考试或者班主任老师咨询，我校在贵省只招收文科考生，并且要求英语单科40分以上，欢迎报考西北大学！
咨询,zh***ng (陕西),2006-06-12 11:48,我是陕西的文史考生请问我的估分在584-610请问能否报考贵校的会计学或金融学,同学你好，按照往年的情况，你报考我校的希望很大，关于这两个专业往年的录取分数情况，请登陆西北大学网站“http://www.nwu.edu.cn/”的“西大本专科招生”查询进行参考，热烈欢迎报考西北大学！
咨询高职,hn*** (河南),2006-06-12 11:45,老师您好，我是河南美术类考生，专业成绩280分，文化成绩估分320分，报考西北大学职业技术学院艺术设计专业是否有希望？,同学你好，关于大专的问题请打电话到专科招办029-88302744咨询。
我估计高出一本线30分，能报贵校吗?,my*** (陕西),2006-06-12 11:39,我估计高出一本线30分，能报贵校吗?,同学你好，由于不清楚你是文科生还是理科生，所以难以做出准确预计！欢迎报考西北大学！
咨询,in*** (新疆),2006-06-12 11:37,我是新疆的文科考生，我今年估分是545。想报贵校的行政管理或公共事业或新闻学，不知把握有多大？,同学你好，我校对贵省的情况并不十分了解，一般来说只要能上贵省的一本线就有希望了，具体情况你也可以登陆我校的网站“http://www.nwu.edu.cn/”查询历年录取分数进行参考。欢迎报考西北大学！
紧急!!!!!!!!!!!,me*** (河北),2006-06-12 11:35,老师您好!我是河北一美术考生，我想问一下贵校去年招艺术考生也是根据我省联考成绩吗?我12号下午要报志愿，想了解一下贵校对河北考生有何要求?望您能尽早回答.因为我要马上报志愿了.谢谢~!,同学你好，美术类考生专业课成绩都是根据你们本省的联考成绩。对贵省的考生没有特殊要求。不谢！
谢谢!!,33*** (山西),2006-06-12 11:30,老师您好，我是山西的文科考生，预估比重点线高15--20分，报考贵校有希望吗?谢谢!,同学你好，我校对贵省的情况并不十分了解，一般来说只要能上贵省的一本线就有希望了，你也可以登陆我校的网站“http://www.nwu.edu.cn/”查询历年录取分数进行参考。欢迎报考西北大学！
美术考生 谢谢!,rc*** (河南),2006-06-12 11:28,我是河南美术考生省统考268文化课估410有希望上贵校大专吗?贵校专升本情况如何?,同学你好，请拨打专科招生咨询电话029－88302744。
咨询一下,pk*** (河南),2006-06-12 11:26,我想知道贵校在河南省美术类招生的文化课和专业课是怎样统计分数比例的!我明天就要报志愿了希望你们能快一些给我答复可以吗?,同学你好，我校按专业课占70%，文化课占30%的比例算综合分排队从高到低择优录取。
咨询,ll*** (陕西),2006-06-12 11:19,陕西文科考生，请问贵校提前批，历史基地班和经济基地班有无专业级差.怎样排队录取.,你好，在录取过程中历史基地班和经济学基地班同时开始录取一志愿考生，只有在一志愿未录满的情况下才会进行调剂，我校有专业级差一般为2－5分
志愿,mg*** (辽宁),2006-06-12 11:13,录取二志愿吗？级差？,同学你好，我校在一志愿没有录满的情况下会招收二志愿，没有学校之间的级差。欢迎报考西北大学！
